Title,Correlation Score
key error 0 sentiment analysis,0.03846153846153846
Pandas Dataframe column with numpy arrays to Dataframe columns,0.03846153846153846
Writing function to filter and rename multiple dataframe columns based on variable input,0.03846153846153846
Cleaning Dataframe in Python 3,0.03846153846153846
Convert a dict to three-column dataframe using ID/key/value,0.03846153846153846
Pandas Python UnicodeDecodeError,0.03846153846153846
How to group records with Pandas cut()?,0.03846153846153846
Appending to a dataframe cell with pandas?,0.03846153846153846
Create outliers column in pandas groupby DataFrame,0.03846153846153846
Substraction of rows in pandas dataframe,0.03846153846153846
Counting Maximum number of Rows After applying groupby(),0.03846153846153846
Append rows to groups in pandas,0.03846153846153846
Getting back data in a Pandas DataFrame after a groupby,0.03846153846153846
Unpack dictionary from Pandas Column,0.03846153846153846
Applying Groupby function to multiple column in python and calculation,0.03846153846153846
Selecting row based on a column variation,0.03846153846153846
pandas add() two dataframes with parcially overlapping indexes?,0.03846153846153846
Pandas to_sql Error: Invalid column name 'None',0.03846153846153846
Pandas append() error with two dataframes,0.03846153846153846
How to filter data from csv file based on certain conditions using pandas dataframe,0.03846153846153846
Count iterations of pandas dataframe apply function,0.03846153846153846
Shifting rows per index with a different value in a pandas dataframe,0.03846153846153846
Groupby and count() on dataframe having two categorical variables,0.03846153846153846
Pandas groupby quantile values,0.03846153846153846
MAPE calculation in python,0.03846153846153846
Pandas: Inventory recalculation given a final value,0.03846153846153846
Multi-Index Slicing Comparison,0.03846153846153846
pandas way to get list of indexes using iloc?,0.03846153846153846
Check if value from one dataframe exists in another dataframe,0.03846153846153846
"Multiple graphs sharing same X-axis, and group of yaxis",0.03846153846153846
Dataframe/Row Indexing for Pandas,0.03846153846153846
AttributeError: 'NoneType' object has no attribute 'shift',0.03846153846153846
Speeding up loop over dataframes,0.03846153846153846
Labeling a row in a dataframe according to a label in another dataframe with minimum distance - Python,0.03846153846153846
Combine only certain rows in dataframe effeciently,0.03846153846153846
Filtering the dataframe based on the column value of another dataframe,0.03846153846153846
"Pandas Module Error - No attribute Core, Module can not be found",0.03846153846153846
Groupby Pandas dataframe and drop values conditionally based on rank,0.03846153846153846
Iterate through multiple dataframes and perform calculation based on specific column,0.03846153846153846
Pandas: is 'pad' the same as 'ffill'?,0.03846153846153846
Unable to transform string column to categorical matrix using Keras and Sklearn,0.03846153846153846
How do I cache a python package Docker build for Alpine Linux?,0.03846153846153846
Calculating formula based on multiple columns in Pandas Dataframe - but without creating many intermediate columns,0.03846153846153846
Simple tsplot for timeseries,0.03846153846153846
R's seq_len equivalent in Python,0.03846153846153846
Transpose only few columns and rows from a dataframe,0.03846153846153846
Add rows in a dataframe using values from another list,0.03846153846153846
pandas dataframe won't reorder columns,0.03846153846153846
Set background color of QtTableWidget cell based on dataframe result condition,0.03846153846153846
Insert columns with constants in pandas,0.03846153846153846
Appending by name with python pandas multiindex dataframe,0.03846153846153846
Renaming pandas dataframe column on copy affects the original dataframe,0.03846153846153846
How to create new column from given data in pandas?,0.03846153846153846
Title to index column doesn't remain - Python Pandas DataFrame,0.03846153846153846
Insert rows in pandas where one column misses some value in groupby,0.03846153846153846
"TypeError: must be str, not int couldn't be solved",0.03846153846153846
Python: convert TimeObject [0:00:07] into seconds,0.03846153846153846
How to transform a column value of a dataframe with values of another dataframe columns,0.03846153846153846
Pandas: Join results from extractall,0.03846153846153846
Compute co-occurrence matrix by counting values in cells,0.03846153846153846
Select columns with nonzero values that share index in pandas with no loops,0.03846153846153846
Applying a function on to columns in dataframe and returning to values of two new columns Python,0.03846153846153846
Python Pandas Get a Cumulative Sum (cumsum) which excludes the current row,0.03846153846153846
Convert multiple column dataframe into series,0.03846153846153846
creating a pivot_table fails on a pandas dataframe,0.03846153846153846
Change Name of a sequence by adding a number for duplicate,0.03846153846153846
Column Names in Pandas (Python),0.03846153846153846
"Pandas Dataframe column search and replace char(34) "" and char(39) '",0.03846153846153846
Extract first 2 digits of a number using python,0.03846153846153846
Python Dataframe list unique values based on some criterias,0.03846153846153846
Pandas: nansum Series to each column of DataFrame,0.03846153846153846
Pandas compare rows to row with similar partial multi-index,0.03846153846153846
Bigquery (and pandas) - ensure data-insert consistency,0.03846153846153846
Selecting rows according to int and string criteria,0.03846153846153846
Creating a DataFrame from a list based on specific values in that list,0.03846153846153846
How to query a pandas column with tuples,0.03846153846153846
pandas - two dateframes into one column,0.03846153846153846
Converting Integers to Dates,0.03846153846153846
Losing records when converting DataFrame to dictionary,0.03846153846153846
Re-occurrence count,0.03846153846153846
Getting an error while writing dataframe into csv,0.03846153846153846
Django DateField gives validation errors,0.03846153846153846
How do I give a text key to a dataframe stored as a value in a dictionary?,0.03846153846153846
Multiplication of list of lists,0.03846153846153846
Creation of formatted DataFrame and then adding data line by line,0.03846153846153846
Pandas get_dummies in for loop,0.03846153846153846
how do i merge n .csv files(possibly 20-30 files) with 1 BIG .csv file horizontally(axis=1) using pandas?,0.03846153846153846
Can store and retrieve Object Django BinaryField in SQLite but not MySQL,0.03846153846153846
How to handle NaNs in pandas dataframe integer column to postgresql database,0.03846153846153846
"How to plot a Pandas df with index timestamp being over midnight, but same date",0.03846153846153846
Alternative to Pandas Group By to conditionally manipulate columns,0.03846153846153846
"How to get python to recognize ""YYYY W##"" as date time object and then fill add time objects less than a certain week",0.03846153846153846
Add new rows before and after each gsm_id,0.03846153846153846
one-to-many joining pandas dataframes as a JSON instead of a pandas dataframe,0.03846153846153846
How to use an index to recall a label of a dataframe pandas,0.03846153846153846
"When Data Group by, How can I cumsum milliseconds in pandas DataFrame?",0.03846153846153846
Optimizing Iteration over dataframe,0.03846153846153846
Convert Pandas dataframe to PyTorch tensor?,0.03846153846153846
Assign an int to a string value after opening a csv file in pandas,0.03846153846153846
Use pandas groupby with networkx add_path,0.03846153846153846
How to combine strings in dataframe to list and break up column?,0.03846153846153846
replace row values with row values from another column if conditions met,0.03846153846153846
AttributeError: 'tuple' object has no attribute 'lower',0.03846153846153846
Rolling sum windowed for every ID individually,0.03846153846153846
compare rows in dataframe to change values,0.03846153846153846
AttributeError: module 'numpy' has no attribute '__version__',0.03846153846153846
Pandas: combine dataframes of different shapes based on comparisons between dataframes,0.03846153846153846
"Fill matrix by data from pandas.DataFrame, skip NaN",0.03846153846153846
wanted to create flag for salary in python,0.03846153846153846
Python how to replace a column's values in dataframe,0.03846153846153846
Fill values in dataframe,0.03846153846153846
How to apply UDF to dataframe?,0.03846153846153846
Pandas: Combine two dataframe with the samse structure,0.03846153846153846
Padd missing dates in Pandas series,0.03846153846153846
Find first row with condition after each row satisfying another condition,0.03846153846153846
Using .loc in pandas slows down calculation,0.03846153846153846
pandas dataframe apply lambda if else erro,0.03846153846153846
pandas ffill based on condition in another column,0.03846153846153846
varchar values are getting stored as decimals,0.03846153846153846
unstacking a list of lists into a pandas dataframe,0.03846153846153846
Python Pandas: How to Insert one Missing Row?,0.03846153846153846
how to convert list of values of a coulmn and assign it 0 or 1,0.03846153846153846
Fill missing dates,0.03846153846153846
Pandas Create dataframe keeping only columns from another dataframe and appending,0.03846153846153846
how to convert a monthly period in a date?,0.03846153846153846
Pandas unable to reset index because name exist,0.03846153846153846
How to extract data from a JSON column from database directly to a pandas dataframe,0.03846153846153846
Sumifs in Pandas with two conditions,0.03846153846153846
modify dataframe taking index from first part of columns names,0.03846153846153846
PYTHON - PANDAS - Groupby update row value,0.03846153846153846
How to apply function to ALL columns of dataframe GROUPWISELY ? (In python pandas),0.03846153846153846
Pandas set values of multiple rows of a column,0.03846153846153846
Search a list of strings in pandas dataframe and add each search string to a new column,0.03846153846153846
How to compare two Pandas DataFrames on values?,0.03846153846153846
return rows with duplicate pairs across columns in python,0.03846153846153846
Selecting columns based on value given in other column using pandas in python,0.03846153846153846
changing NaN values in the DataFrame,0.03846153846153846
Merging two dataframes with different indexes,0.03846153846153846
to_excel 'ascii' codec can't decode byte 0xc3 in position 2: ordinal not in range(128),0.03846153846153846
Groupby Pandas dataframe and plot,0.03846153846153846
"map with named function vs identical lambda function providing different responses, pandas",0.03846153846153846
Creating new pandas dataframe from partial string match,0.03846153846153846
Multiple repeat error when searching for a string in a larger string in dataframe,0.03846153846153846
datetime to decimal hour and minutes in python3,0.03846153846153846
How to load large data into pandas efficiently?,0.03846153846153846
How to download dropbox csv file to pandas,0.03846153846153846
Red line when data is negative and green line when data is positive in Pandas,0.03846153846153846
Pandas: Reshape two columns into one row,0.03846153846153846
create a new column with adding current values,0.03846153846153846
Function in Pandas for reshape,0.03846153846153846
Getting max values from pandas multiindex dataframe,0.03846153846153846
JSON to CSV output using pandas,0.03846153846153846
Convert and Assign Pandas Series to a dataframe to create CSV,0.03846153846153846
Training a decision tree with K-Fold - Is this the correct approach?,0.03846153846153846
Matplotlib: How to skip a range of hours when plotting with a datetime axis?,0.03846153846153846
Quandl code is not working,0.03846153846153846
"Why does the data type of ""np.NaN"" belong to numpy.float64?",0.03846153846153846
Pandas dot product with Multiindex,0.03846153846153846
Pandas Datetime Object Differencing - Timedelta Bug?,0.03846153846153846
pandas: problem using diff with groupby when index is non-unique,0.03846153846153846
Pandas merge with multiple criteria,0.03846153846153846
apply lambda function after groupby based on values of another column in pandas,0.03846153846153846
read data to numpy array,0.03846153846153846
Get dataframe values by down instead of across?,0.03846153846153846
Normalize the frequency and extend multiple TimeSeries in a Dataframe to a given date,0.03846153846153846
pandas keep rows based on column values for repeated values,0.03846153846153846
Why does my data change into NaN in Task4?,0.03846153846153846
Pandas output null column,0.03846153846153846
Pandas filter vs. loc method,0.03846153846153846
Pandas groupby rollup,0.03846153846153846
Convert data types of a Pandas dataframe to match another,0.03846153846153846
Loop over one column and fill rows in fucntion Pandas Dataframe Python,0.03846153846153846
Using pandas in python I am trying to group data from price ranges,0.03846153846153846
Python - Getting Start and End Index of a Dataframe based on a condition,0.03846153846153846
Using datetime64[ns] with OLS for linear regression,0.03846153846153846
create Pandas Dataframe with unique index,0.03846153846153846
xlwings fails to open workbook with ambiguous error,0.03846153846153846
Pandas: nan->None,0.03846153846153846
large index values causing pandas KeyError,0.03846153846153846
Self-made Yahoo query for Finance data - error with pandas read_csv,0.03846153846153846
Pandas.read_csv: missing 1 required positional argument: 'x',0.03846153846153846
What is the best choice for data storage in Pandas for mixed type data?,0.03846153846153846
Set_index() on a Pandas DataFrame giving unexpected results,0.03846153846153846
pandas GroupBy level is much slower than GroupBy on column,0.03846153846153846
Multiple regex string replace on large text file using Python,0.03846153846153846
Removing index duplicates in pandas,0.03846153846153846
Python inverse/negative/non-present values in pandas dataframe column,0.03846153846153846
Python: Get DISTINCT column values from inside CASE function in pandasql,0.03846153846153846
pandas creates new columns based on the values of the other columns in the same row,0.03846153846153846
How can I compare two large CSV files using Dask,0.03846153846153846
How to get to last record of large dataframe in Spyder window?,0.03846153846153846
Python : Create a dataframe from existing pandas dataframe,0.03846153846153846
Add index weekday to pandas dataframe,0.03846153846153846
Python: How to Speed Up API Requests?,0.03846153846153846
Python pandas dataframe reshape,0.03846153846153846
Intersection on two keys python panda,0.03846153846153846
invalid column name error when writing pandas DataFrame to sql,0.03846153846153846
Pandas Index Filter is Slower than Non-Index Column Filter,0.03846153846153846
pandas dataframe get NaN when mapping,0.03846153846153846
find couple of objects from a dataframe,0.03846153846153846
How to delete rows containing Nan in Python 3.6.3,0.03846153846153846
Row wise calculations(Python),0.03846153846153846
Trying to Parse .txt file to get file in Desired form for further data analys,0.03846153846153846
pandas: return all matched keys for each strings value in a series,0.03846153846153846
Calculations with Groupby objects Pandas,0.03846153846153846
Creating a list of regex matches from a data frame in Python and then counting the number of matches,0.03846153846153846
populate a pandas column with the id from the min value of another pandas DF,0.03846153846153846
"How to open a .tsv file in Jupyter? Jupyter.Notebook tried suggestions, but it doesn't work",0.03846153846153846
Sklearn: how to get mean squared error on classifying training data,0.03846153846153846
How can i subtract a scalar value from a column in dataframe and pick only those rows which satisfy some condition,0.03846153846153846
pandas to change the colum value withoutchanging the format,0.03846153846153846
Setting cumulative values to constant after it reaches threshold and preserving first value,0.03846153846153846
Return a substring from a text that exists in a Data Frame,0.03846153846153846
Creating a dataframe with binary valued columns with pandas using values from an existing dataframe,0.03846153846153846
Obtaining the mean value of a DataFrame,0.03846153846153846
Is there better way to write such loops when I use dataframe?,0.03846153846153846
Pandas: Combine subsetting and filtering,0.03846153846153846
Change column details in pandas,0.03846153846153846
can't install pandas using docker-compose,0.03846153846153846
Combining similar dataframe rows,0.03846153846153846
data matching multiple columns with fuzzy matching criteria,0.03846153846153846
pandas groupby on a single column,0.03846153846153846
Collapse rows of python dataframe that share one column's value,0.03846153846153846
Using pyplot for dataframe wrong date (offset by one day),0.03846153846153846
Pandas misinterpreting date column in CSV file,0.03846153846153846
lookup from multiple columns pandas,0.03846153846153846
Create Spark DataFrame from Pandas Dataframe Error,0.03846153846153846
Computing row % for group of rows in a pandas dataframe,0.03846153846153846
String substitution in str.replace vs Pandas str.replace,0.03846153846153846
Python pandas compare 2 dataframe output new/delete/change values in new column,0.03846153846153846
Read csv from Google Cloud storage to pandas dataframe,0.03846153846153846
pandas IndexSlice does not accept integer list,0.03846153846153846
Technical analysis with python Pyti module - money flow index (MFI),0.03846153846153846
Pandas GroupBy with two columns but count on both fields / agg() output,0.03846153846153846
Pandas DataFrame apply or map dictionary valueassign column to function of MultiIndex value,0.03846153846153846
"How do you pop multiple columns off a Pandas dataframe, into a new dataframe?",0.03846153846153846
Random Sampling from a column several times in Python/Pandas,0.03846153846153846
Simulating online desicion making in Python,0.03846153846153846
Fill nulls until certain column value in Pandas,0.03846153846153846
Easier way to create pandas multi-column Dataframe?,0.03846153846153846
Cannot export csv with to_csv after reducing memory usage,0.03846153846153846
Dataframe transform by each hour,0.03846153846153846
Reshaping pandas dataframe with unstack(),0.03846153846153846
Correlation among multiple categorical variables (Pandas),0.03846153846153846
Pandas nunique got an expected,0.03846153846153846
How to use .agg method to calculate the column average in pandas,0.03846153846153846
Create a mapping based on a two dataframe Columns,0.03846153846153846
iloc Pandas Slice Difficulties,0.03846153846153846
Pandas - Combine Excel Rows on ID,0.03846153846153846
How do I sort a pandas data frame by date time,0.03846153846153846
Python heatmap: Change colour map and make asymmetrical,0.03846153846153846
replace the outlier value from multiple columns based on different condition using pandas?,0.03846153846153846
How can I have the matplotlib graph with pandas.plot() in the widget?,0.03846153846153846
How can i filter a dataframe's rows by specific bins,0.03846153846153846
r - Dplyr 'ungroup' function in pandas,0.03846153846153846
multiple conditions on dataframes,0.03846153846153846
Performance of iteration over list of Pandas' dataframes varying wildly,0.03846153846153846
Can't make pandas group by timeframe,0.03846153846153846
Multiply pandas data-frame to a fixed number of rows,0.03846153846153846
Access elements in Pandas Dataframe and sum up - elegant solution,0.03846153846153846
unsupported operand type(s) for -: 'datetime.time' and 'datetime.time',0.03846153846153846
How to change values in certain columns according to certain rule in pandas dataframe,0.03846153846153846
How to add a column which contains info aggregated over rows?,0.03846153846153846
How to use pd.cut to bin data in a natural way?,0.03846153846153846
Pandas - Rebasing values based on a specific column,0.03846153846153846
Python - Pandas - Search string in cell for keyword and look up value based on keyword,0.03846153846153846
Judge two columns of row to see equal or not. and create the Bool Column,0.03846153846153846
Matching intervals between pandas dataframe,0.03846153846153846
How to iterate ids from dataframe into API to use to make calls with?,0.03846153846153846
Python Pandas - how to convert string HH:MM:SS.mmm to float sss.ms?,0.03846153846153846
Repeating Counts in Pandas Data Frame,0.03846153846153846
Formatting Multiple Columns in a Pandas Dataframe,0.03846153846153846
"Adding Multiple .xls files to a Single .xls file, using the file name to name tabs",0.03846153846153846
Select string between two substrings to every row in dataframe in Python,0.03846153846153846
How to penalize decision tree for misclassifying a certain class?,0.03846153846153846
How to fill a pandas data frame when the columns are not known before,0.03846153846153846
Set value of a column based on other column with an condition,0.03846153846153846
Finding values in a Dataframe in Python that follow a trend,0.03846153846153846
Creating a matplotlib multi-series line plot with pandas,0.03846153846153846
pandas - How to extract a value(s) from a list stored in rows of a dataframe,0.03846153846153846
Rounding down datetime column by the hour,0.03846153846153846
Getting key error in python,0.03846153846153846
"Print dictionary to file using pandas DataFrame, but changing dataframe format",0.03846153846153846
Parsing text file with long strings into dataframe format,0.03846153846153846
Pandas create column from another dataframe if certain conditions match,0.03846153846153846
Creating a new column based on another without throwing warning,0.03846153846153846
Calculate TimeDelta within certain frequency in pandas DataFrame,0.03846153846153846
Want to replace a column in Python with certain values,0.03846153846153846
Python .sum adding random numbers,0.03846153846153846
Excluding a column after grouping by in pandas,0.03846153846153846
"python json to csv , code can only parse part of json data",0.03846153846153846
Pandas Dataframe - How to stack two column values into one list?,0.03846153846153846
Pandas alternative to apply - to create new column based on multiple columns,0.03846153846153846
Most efficient way to groupby a dataframe and then filter in pandas,0.03846153846153846
dataframe reshaping with new added columns,0.03846153846153846
"Python PANDAS: Merge Equivalent of ""<="" SQL Join",0.03846153846153846
Python Pandas splitting float series by date,0.03846153846153846
Cosine similarity of rows in pandas DataFrame,0.03846153846153846
Using to_pickle for very large dataframes,0.03846153846153846
Multiprocessing with Pandas,0.03846153846153846
How to sort dataframe columns using for loop,0.03846153846153846
How to use applymap in a DataFrame on condition that an element is greater than the one which is at the same column but last row?,0.03846153846153846
Custom ordering of mixed integer and strings in dataframe index,0.03846153846153846
Cannot 'merge' 'DataFrameGroupBy',0.03846153846153846
Skip first lines of CSV in Python - does not work? Why?,0.03846153846153846
How to find the duration of individual Chat log conversation using pandas python,0.03846153846153846
How can I concat Dataframe?,0.03846153846153846
Add values in certain rows to another row,0.03846153846153846
TypeError: dropna() got multiple values for argument 'axis',0.03846153846153846
Slice a Pandas dataframe with DatetimeIndex based on time interval,0.03846153846153846
scale axis subplots created with df.boxplot(by=),0.03846153846153846
Pandas dataframe column math when row conditions is met,0.03846153846153846
How do I read a XLSX if the filepath or filename has an apostrophe?,0.03846153846153846
Create list of duplicate values from list of lists,0.03846153846153846
pandas: Efficiently avoid 0s when taking log of cells in DataFrame,0.03846153846153846
pd.to_numeric converts entire series to NaN,0.03846153846153846
How to get dataframe of unique ids,0.03846153846153846
ReGex for surrounding numbers with whitespaces,0.03846153846153846
Replace nan values with the unique date (date in numpy array.),0.03846153846153846
Using Pandas for Multple Time-Varying Trials,0.03846153846153846
Split pandas dataframe with fixed size in MB,0.03846153846153846
Python Pandas Groupby Count Error,0.03846153846153846
"Pandas (key, value) data, move duplicate instance of key's value into a new column",0.03846153846153846
Color rows of pandas dataframe and convert to HTML table,0.03846153846153846
Pandas: grouping values by date-time index,0.03846153846153846
How do you inner merge two dataframes with a tolerance value?,0.03846153846153846
index value vs. flight (data range A row & E row ),0.03846153846153846
"How to delete certain cells in each row, using python pandas?",0.03846153846153846
Python Recursive Updating based on Condition,0.03846153846153846
export output in excel using python,0.03846153846153846
How to do hour wise calculation in a data frame using time stamp in python?,0.03846153846153846
Dataframe groupby - rows to columns,0.03846153846153846
Cannot get quandl to proceed after encountering BRK.B in retrieving ticker symbols from WIkipedia,0.03846153846153846
Pandas DataFrame - match rows within a group,0.03846153846153846
Missing data in Pandas Merge,0.03846153846153846
How I define a function in Python to convert object columns into floats?,0.03846153846153846
Pandas DataFrame KeyError,0.03846153846153846
