Title,Correlation Score
"How to get index level0 from multiindexed dataframe by specifing level1, level2, level3?",0.1096866096866096
How can I transform a level of index into new level in Multi level column (Pandas),0.09288824383164003
"Python ValueError: Duplicated level name: ""REPORTED_DATE"", assigned to level 1, is already used for level 0",0.09288824383164003
"Duplicated level name: ""Date"", assigned to level 1, is already used for level 0",0.09288824383164003
Rearranging Multidex in Pandas (second level of multidex to the second level of a single level column name),0.09288824383164003
two-level indexing in dataframes in pandas : count the number of second level index for each first level index,0.09288824383164003
Reduce multi-level columns into single level by deleting certain levels in a dataframe,0.09288824383164003
Pandas dataframes with multi-level columns:rename a specific level of column so that it's same as another level,0.09288824383164003
"Pandas: Duplicated level name: <Column Name>, assigned to level 1, is already used for level 0.""",0.09288824383164003
"Sorting Multi level dataframe index level0, based on value of index level1 at specific column",0.09116809116809113
"Pandas: Is there a way to use something like 'droplevel' and in process, rename the other level using the dropped level labels as prefix/suffix?",0.08911047799936683
Dropping list of rows from multi-level pandas dataframe where first two levels have duplicate indices,0.08869537171423961
Drop all rows of higher level multi-index if certain lower level index doesn't exist,0.08659893565553942
How to drop level of column in Pandas when the second level is in the first column,0.0845024995968392
How can I drop the first level from a multi level column by chaining?,0.0845024995968392
Pandas: drop a level from a multi-level column index?,0.082406063538139
drop elements of a level of a multi-level index pandas,0.08030962747943877
"How to aggregate data by counts of a level, setting each level's counts as its own column?",0.0754437869822485
Pandas turn level1 of index to level 0 of column,0.0754437869822485
Assignments on new MultiIndex columns given only level 0 column selectors and aligned level 1,0.0754437869822485
"Why head() returns IndexError: Too many levels: Index has only 1 level, not 2 in dask dataframe?",0.0754437869822485
How to select value from the cells of the largest second level index of every first level index?,0.0754437869822485
Count one level group by another level in pandas Multinidex,0.0754437869822485
groupby on a multiindex level and dropping the grouping level,0.0754437869822485
Merging single level DataFrame with 3-level DataFrame,0.0754437869822485
"Reduce multi-index/multi-level dataframe to single index, single level",0.0754437869822485
Finding the max value for a hierarchy level over another level,0.0754437869822485
pandas: Multi-level column dataframe - how to change the name for a specific level?,0.0754437869822485
Pandas concat multi level index dataframes and merge same name columns within same level,0.0754437869822485
Count level 1 size per level 0 in multi index and add new column,0.0754437869822485
python -- expand a household-level dataframe into a person-level dataframe and impute variables,0.0754437869822485
Summing for each first level index in last row of second level index in a specific column,0.0754437869822485
Add a column at sub-level based on position of another sub-level column,0.0754437869822485
Is there a way to sum over an index level in a dataframe while preserving index levels that are repeated?,0.0754437869822485
pandas reset_index of certain level removes entire level of multiindex,0.0754437869822485
How to remove level names in multi-index dataframe? How to create multi-level dataframe/csv which avoids merging columns everytime?,0.0754437869822485
loop through a python json object and count a NULL for level 3 if all the values in levels 4 and 5 are null,0.0754437869822485
Multi level indexed dataframe: count the level values,0.0754437869822485
How to check whether the two-level index of one dataframe is in the 4-level index of another dataframe,0.0754437869822485
"How to fix IndexError: Too many levels: Index has only 1 level, not 2 in Python",0.0754437869822485
Filter by either index level or column when I don't know whether my field is an index level or column,0.0754437869822485
Filtering a DataFrame by traversing level by level,0.0754437869822485
pandas - change values of second level index to display position within first level index,0.0754437869822485
How to change 2nd level index into 2nd level column in pandas DataFrame?,0.0754437869822485
Pandas: How to add a level to a multiindex from one multiindex level by splitting?,0.0754437869822485
Filtering top-level categories in hierarchical Pandas Dataframe using lower-level data,0.0754437869822485
Transform from 2-level MultiIndex to 3-level MultiIndex,0.0754437869822485
MultiIndex DataFrame - Getting only the possible values of a lower level index given an upper level index value,0.0754437869822485
Merge levels for categorical levels in pandas,0.0754437869822485
I have csv file - where the data set output in horizontal level how to get the out row level? Below is the sample of my dataset,0.0754437869822485
Adding a multi-level column to a single-level pandas dataframe,0.0754437869822485
Python Pandas slice multiindex by second level index (or any other level),0.0754437869822485
Why is there AssertionError when I change from 2 levels of keys to 1 level?,0.0754437869822485
"Fill gaps in DataFrame MultiIndex level 1, differently for each level 0",0.0754437869822485
filter pandas dataframe on one level of a multi level index,0.0754437869822485
Merging two Dataframes with different levels and move one level of hierarchical row index to columns,0.0754437869822485
Reset level 1 indexes individually for every level 0 index,0.0754437869822485
mulitiindexing in python: how to select level0-index based on multiple values in level1 rows,0.0754437869822485
New level in MultiIndex DataFrame based on existing column level values,0.0754437869822485
Python pandas: groupby one level of MultiIndex but remain other levels instead,0.0754437869822485
Reindex 2nd level in multi-level dataframe,0.0754437869822485
Pandas Dataframe MultiIndex transform one level of the multiindex to another axis while keeping the other level in the original axis,0.0754437869822485
Combine rows within level of multi-level dataframe,0.0754437869822485
How to convert DataFrame with 1-Level to 3-Level Index Hierarchy,0.0754437869822485
Reindex 3rd level of Multiindex DataFrame where second-level index is irregular,0.0754437869822485
"How do I insert a second level column and value into a Pandas DataFrame, whilst keeping it in line with the first level column?",0.0754437869822485
How to enforce 2nd level of pandas dataframe to add up to 1st level?,0.0754437869822485
Merging columns from lower level into a higher level in a single Pandas dataframe,0.0754437869822485
MySQL / Python Display the level of an user_id for each day the user had that level,0.0754437869822485
Select first level by value and second level by index on a MultiIndex DataFrame,0.0754437869822485
replace multi-index level column name based on condition of another level in python,0.0754437869822485
Converting Multi-level columns to single level in Pandas,0.0754437869822485
Group by a primary column level of a DataFrame and then applying a function on the each sub level,0.0754437869822485
Is possible concat one level and other multilevel dataframe and have in axis 1 one level and multilevel at the same time? (pandas),0.0754437869822485
Change Categorical Variable levels to What I provide/Combine levels two categorical variables,0.0754437869822485
"Pandas Dataframe MultiIndex groupby with 2 levels including ""all"" for both levels",0.0754437869822485
pandas MultiIndex on columns select columns from level 0 (outside) as well as level 1 (inside),0.0754437869822485
"Melt on first level of multiindex, keep second level as column",0.0754437869822485
How to group by level 0 and describe in a multi index and level dataframe (pandas)?,0.0754437869822485
single level to multi-level dataframe,0.0754437869822485
Replace singular value on second level of pandas dataframe multiindex when that index level has identical values,0.0754437869822485
pandas function to find sum of columns for different index level in multi level index table,0.0754437869822485
Swap level-one from index with column level (Pandas Multiindex Dataframe),0.0754437869822485
Group column by level and other column by other level pandas,0.0754437869822485
Find difference month on month between rows in a 3 level multiIndex where they match on 2 levels in pandas,0.07536907536907533
How to join Multi-level dataframe on values in single-level dataframe,0.07402031930333815
Sort index at a level and per partitioning by earlier levels,0.07402031930333815
How to fix ValueError: level > 0 or level < -1 only valid with MultiIndex when using pandas Groupby() method?,0.07402031930333815
Problem while merging a specific multi level pivot table back to the orignal (single level) dataframe,0.07402031930333815
Drop a level in pandas dataframe header,0.07402031930333815
Iterating through first groupby level to get second level dataframe,0.07402031930333815
Groupby on second level index that respects the previous level,0.07402031930333815
Custom sorting of the level 1 index of a multiindex Pandas DataFrame according to the level 0 index,0.07402031930333815
Pandas dataframe with multi-index columns - move columns from level 0 to level 1 (NOT swap or re-order),0.07402031930333815
How to sort a MultiIndex by one level without changing the order of the other levels,0.07402031930333815
How to export pandas dataframe with Multi-index columns to Excel with column name in one level unmerged and column name in another level merged?,0.07402031930333815
How to select a level and all sub levels(and items) in pandas?,0.07402031930333815
How to sort MultiIndex level by number of rows in the child level,0.07402031930333815
Join Single level table to a multi level table in Python,0.07402031930333815
Python Pandas Multi-index: keeping same length of level=1 with all level=0 indexes,0.07402031930333815
"In Pandas How to sort one level of a multi-index based on the values of a column, while maintaining the grouping of the other level",0.07402031930333815
How to get a nested JSON from a pandas dataframe which has multi-level index of 4 levels?,0.07402031930333815
Pandas: How to iterate over level one and randomly select from level 2 then add subselection to dataframe,0.07402031930333815
Pivoting first level of a multilevel index to be the first level of a multilevel column,0.07402031930333815
Realigning labels and levels in multi-level columns in Pandas DataFrame,0.07402031930333815
How to get all last rows at second level in MultiIndex DataFrame whose second level has variable length,0.07402031930333815
Changing second level multiindex label when first level condition is met,0.07402031930333815
How can I unpack a nested dictionary where not every top level key has all of the second level keys?,0.07402031930333815
Multi-level Python Dict to Pandas DataFrame only processes one level out of many,0.07402031930333815
"Accessing different level of multi-level index, then convert column for this index to an array, to then pass to function",0.07264957264957263
Flattening a multi-level dictionary into single level dictionary,0.07264957264957263
Pandas - Sort multi level data by column but preserve level group order,0.07264957264957263
Convert 4 level nested JSON file to 1 level nested with Python,0.07264957264957263
Python/Pandas : Accessing second level index labels limited to that of a particular label in first level?,0.07264957264957263
"change multiindex level: ""ValueError: On level 0, code max >= length of level""",0.0726495726495726
Drop duplicates based on first level column in MultiIndex DataFrame,0.07117028270874423
drop a level two column from multi index dataframe,0.07117028270874423
Dropping a multilevel index in columns to a single level,0.07117028270874423
How to drop unnecessary levels after using pivot_table?,0.07117028270874422
Method chaining solution to drop column level in pandas DataFrame,0.06982744718593772
Why pandas xs doesn't drop levels even if drop_level = True,0.0690335305719921
drop multiindex level but keep names of columns - pandas,0.0690335305719921
How to drop all columns under highest level of hierarchical index,0.06903353057199209
Filtering a multiindex dataframe based on column values dropping all rows inside level,0.06903353057199209
How can I drop data from multiindexed Dataframe without using all levels in .drop command?,0.06903353057199209
Pandas how to drop a level and column,0.06689677843523997
How can remove a column name/label from a pivot table and remaining column names drop to index name level?,0.06689677843523997
how to drop a pandas multi level dataframe column when all sub columns are completely blank,0.06689677843523997
Drop duplicates from level in hierarchical index pandas,0.06689677843523997
Pandas: How to drop list of indices of Level 2 in MultiIndex DataFrame,0.06689677843523997
What is going on behind the Pandas scenes that is causing a level in a MultiIndex not to be dropped?,0.06689677843523997
Pandas: drop column level & merge titles,0.06689677843523997
How to drop level 1 indices based on conditions for a MultiIndex DataFrame,0.06689677843523996
Drop largest element within level in Pandas,0.06689677843523996
Python Pandas: drop a column from a multi-level column index?,0.06689677843523996
How to drop 1st level index and then merge the remaining index values with custom logic for a pd DataFrame?,0.06689677843523996
Drop level from one specific column,0.06689677843523996
Drop top level header on selected columns and turn selected column names into column values,0.06563457506853732
"pandas dataframe.drop(col,axis=1) does not drop column from column.levels in multiindex dataframe",0.06476002629848784
Dropping list of rows from multi-level pandas dataframe without a loop,0.06476002629848784
How to drop the first columns in multi-index Dataframe under seconde level exclude some columns,0.06476002629848784
How to drop certain values within a multi-level index python pandas,0.06476002629848784
Drop a level from a single column in pandas multi index,0.06476002629848782
Drop level for index,0.06476002629848782
drop a column from a multi-level column index,0.06476002629848782
"Pandas - drop level in pivot table, keeping index as column name",0.06353813900983711
Drop duplicate values based on one specific colum having into account level 0 in multiindex dataframe,0.0626232741617357
Drop using several MultiIndex levels,0.06262327416173569
Pandas drop level of multindex columns keeping the first column of the second level,0.06262327416173569
Pandas dataframe drop level,0.06262327416173569
Dropping rows fast from a multi-indexed data frame conditional on the level 1 index,0.06236150680595125
How to update pandas DataFrame.drop() for Future Warning - all arguments of DataFrame.drop except for the argument 'labels' will be keyword-only,0.06236150680595123
How to drop an empty level in a multiindex dataframe,0.06144170295113691
pandas.drop() not dropping columns,0.06048652202498356
"How to find difference between rows in a pandas multiIndex, by level 1",0.06048652202498355
Difference between groupby level rolling and doing the rolling within a lambda function,0.06048652202498355
Pandas difference between timestamps per row on column level,0.06048652202498355
How do you update the levels of a pandas MultiIndex after slicing its DataFrame?,0.06048652202498355
How to compare two massive spark dataframes on row level and print the difference,0.06048652202498355
Pandas dropping columns by index drops all columns with same name,0.06048652202498355
difference between rows in a multi-level dataframe,0.06048652202498355
Difference of one multi index level,0.06048652202498355
Show differences at row level between columns of 2 dataframes Pandas,0.05934526689243669
"I do not understand the behavior of pandas.drop, since I get different results from dropna (too many rows are dropped)",0.05834976988823143
Pandas dropping duplicates doesn't drop last duplicate,0.05834976988823143
How to efficiently add level to pandas series index to create a multilevel?,0.05834976988823143
Update and concatenate DataFrame with hierarchy levels in a for loop,0.05834976988823141
update rows and drop few rows in grouped data based on conditions,0.05834976988823141
How to calculated the difference between levels values based in clusterization result?,0.05834976988823141
MultiIndex Pandas does not group first index level,0.05731523378582205
Replace pd.MultiIndex level 2 with counter,0.05731523378582205
Python pandas dataframe populate hieratical levels from parent child,0.05731523378582205
One-Hot-Encode two categorical variables with 3-levels each in sklearn,0.05731523378582205
How to get sub total according to index level in multi-index pandas dataframe,0.05731523378582205
How to make contour plot map and overcome no contour level were found?,0.05731523378582205
Add multiple index levels to existing pandas index,0.05731523378582205
dropping columns in panda if they are NaN before a certain date,0.05731523378582205
"Sum columns for each row of dataframe, and add new column in multi level index pandas dataframe",0.05731523378582205
Can we do dataframe level exception handling for pandas?,0.05731523378582205
Pandas Dataframe Mutli index sorting by level and column value,0.05731523378582205
Pandas: remove a level in multi index in one line,0.05731523378582205
Set relative position within one index level of pandas dataframe,0.05731523378582205
Pandas single level multiindex vs plain index,0.05731523378582205
Superhuman Level - Pandas DataFrame Reshaping because of Duplicates,0.05731523378582205
pandas 0.20: df with columns of multi-level indexes - How do I filter with condition on multiple columns?,0.05731523378582205
How to slice by string value on a pandas multiindex level,0.05731523378582205
Assigning columns to a hierarchical higher Multiindex level,0.05731523378582205
"How can I add a column which is the sum of a level of a Multi-index, while keeping the same dimensions, in Pandas?",0.05731523378582205
How can I get the last 10 rows of the second level of a multi-indexed dataframe?,0.05731523378582205
Pandas: How do I re-name a multi-level indexed column or create a new column?,0.05731523378582205
Pandas: get rid of timestamp in specific multiindex level,0.05731523378582205
How to filter by a condition on a given level in a Pandas Multiindex,0.05731523378582205
Adding level 2 index as a sum of other indexes with a condition,0.05731523378582205
Pandas add new second level column to column multiindex based on other columns,0.05731523378582205
Pandas: add columns to multiindex for any depht of index levels,0.05731523378582205
How to access multi-level index in pandas data frame?,0.05731523378582205
Adding a total per level-2 index in a multiindex pandas dataframe,0.05731523378582205
Selecting Pandas data by column levels/ axis 1 multi-index,0.05731523378582205
How do you rename all columns in multi level group by in pandas 0.20.1+,0.05731523378582205
Retrieving values of one level of a MultiIndex in pandas,0.05731523378582205
Creating a new variable containing several levels based on two columns of a dataframe in Python,0.05731523378582205
Pandas DataFrame MultiIndex column/index level entries remain after slicing. How to remove them?,0.05731523378582205
Pandas - subsetting dataframe - getting all values of the outermost index level,0.05731523378582205
Pandas: Merge dataframes based on multi-level first occurrences,0.05731523378582205
How to generate a list of contemporaneous loans from loan level data?,0.05731523378582205
Why won't groupby properly sum across level of index,0.05731523378582205
Merge MultiIndex columns together into 1 level,0.05731523378582205
Appending grandtotal and subtotal rows to two-level row and column index dataframe,0.05731523378582205
descriptive statistics of multi level categorical data in python,0.05731523378582205
Can I set the isolation level of modin's parallel read_sql function?,0.05731523378582205
How to calculate an expression based on names in the second level of a mult-index column,0.05731523378582205
Calculating and placing values into a second level column in a MultiIndex Pandas DataFrame,0.05731523378582205
Creating list in Pandas Dataframe at Index level using .apply() and Range function,0.05731523378582205
How to select a subset of values from a named column level in a DataFrame?,0.05731523378582205
Creating a new level for one index in a multiindex when using groupby and apply,0.05731523378582205
Filtering on index levels in a pandas.DataFrame,0.05731523378582205
Merge dataframes by higher level columns,0.05731523378582205
Adding the lower levels of two Pandas MultiIndex columns,0.05731523378582205
pandas multiindex - how to select second level when using columns?,0.05731523378582205
Pandas Profiling - KeyError: 'Requested level (var1) does not match index name (None)',0.05731523378582205
Groupby and take sum by levels for multi-categorical variable,0.05731523378582205
Python pandas filter data by groupby second level values,0.05731523378582205
Reindex Multiindex dataframe on a specific level based on other dataframe index,0.05731523378582205
Using unique values of column as higher level column pandas,0.05731523378582205
producing a scatter plot from multi-level dataframe [pandas],0.05731523378582205
How to select the the comlumn with the same name (in same level) in a pandas multilevel dataframe,0.05731523378582205
How do I sum on the outter most level of a multi index (row)?,0.05731523378582205
Inserting column into dataframe with multi-level index,0.05731523378582205
Second-level aggregation in pandas,0.05731523378582205
Set values in a multi-level pandas data frame python,0.05731523378582205
Pandas resampling level I data with conditions,0.05731523378582205
What are levels in a pandas DataFrame?,0.05731523378582205
Pandas (>=1.3.x) to_xml function (add tree levels),0.05731523378582205
Get group counts of level 1 after doing a group by on two columns,0.05731523378582205
What are the levels in multi index data frame called?,0.05731523378582205
Turn column levels inside-out,0.05731523378582205
Remove levels and set index 0 as columns names,0.05731523378582205
Consolidate entries on swap level Pandas,0.05731523378582205
"Filter non-duplicated records in Python-pandas, based on group-by column and row-level comparison",0.05731523378582205
Using Pandas Data Frame how to apply count to multi level grouped columns?,0.05731523378582205
How can I get sub_level indexes of a higher level index in Pandas DataFrame?,0.05731523378582205
How can multiple columns from different levels be selected?,0.05731523378582205
How do I turn a categorical column into the level 0 of a column multi-index,0.05731523378582205
pandas rename multi-level column having the same name,0.05731523378582205
Dropna By Column by levels in multiindex and swap for non-na values,0.05731523378582205
"reindex MultiIndex on a level with dates that are ""close""",0.05731523378582205
reduce dataframe -> obtaining last row for every level in column,0.05731523378582205
Spotify API: how to extract JSON information from different levels into one datFrame,0.05731523378582205
Selecting by subset of multiindex level,0.05731523378582205
How to add rows for all missing values of one multi-index's level?,0.05731523378582205
change pandas MultiIndex level by '+1',0.05731523378582205
"Pandas, assign and broadcast along one multi-index level",0.05731523378582205
How can I switch column MultiIndex in a Pandas DataFrame but group on the inner level?,0.05731523378582205
How to filter multi-index dataframe by column with multiple levels?,0.05731523378582205
not able to groupby by one level in My dataframe by pandas,0.05731523378582205
Pandas Group by Multiple Columns and Levels of Values and Append Results to the Original Data Frame,0.05731523378582205
change multi level index fonts with pandas style function,0.05731523378582205
How to transform a 2nd level category column with values to multiple columns,0.05731523378582205
Pandas Reindexing MultiIndex Relative to Arbitrary Level,0.05731523378582205
How to optimize pandas queries with non-integer multi-level interval index?,0.05731523378582205
Select a specific level from MultiIndex,0.05731523378582205
Multi-level grouping/manipulation in pandas,0.05731523378582205
levels option in pandas concat,0.05731523378582205
pandas select rows in a multi-level index dataframe,0.05731523378582205
pd.get_dummies() slow on large levels,0.05731523378582205
DataFrame of function call on a specific MultiIndex DataFrame level,0.05731523378582205
Pandas dataframe scatter plot with 2-level Multiindex as axes,0.05731523378582205
SciPy portfolio optimization with industry-level constraints,0.05731523378582205
Pandas: How to sum the largest 3 values with respect to a sub-level in multilevel DataFrame,0.05731523378582205
Rename level in multiindex/multilevel Pandas DataFrame,0.05731523378582205
pandas categories new levels,0.05731523378582205
How to give this pandas dataframe a third index level for repeats?,0.05731523378582205
Group by multi-level category and return sum of n-largest in each category (n is different for each category),0.05731523378582205
