Title,Correlation Score
Mapping Values of key in Dictionary present in dataframe columns,0.04860063683593097
Remove carriage return and newline feeds within a list of dictionaries - Python,0.04860063683593097
Getting rows from a PANDAS dataframe that fulfill (a dictionary?) of requirements,0.04860063683593097
Find column names and their respective value in a pandas data frame which matches a condition and store the result in a dictionary,0.04860063683593097
Update NaN values with dictionary of values nased on condition,0.04860063683593097
Pyspark: Replacing value in a column by searching a dictionary with <NA> values,0.04860063683593097
using a dictionary to modify the dfs values,0.04860063683593097
Dataframe to Dictionary including List of dictionaries,0.04860063683593097
Construct Pandas DataFrame from dictionary in form {index: list of row values},0.04860063683593097
"Pandas to_dict data structure, using column as dictionary index",0.04860063683593097
More efficient way of creating dictionaries or a dataframe?,0.04860063683593097
How to convert a list with dictionaries into new pandas columns?,0.04860063683593097
python pandas unnest data column containing a list of dictionaries,0.04860063683593097
Pandas DataFrame to List of Dictionaries,0.04860063683593097
Convert the date format from MM/DD/YYYY to YYYY-MM-DDT00:00:00.000Z in a list of dictionaries,0.04860063683593097
Write dataframe to text file as JSON-encoded dictionaries with Pandas,0.04860063683593097
add many rows to df from dictionary,0.04860063683593097
Pandas new column using a existing column and a dictionary,0.04860063683593097
Python pandas getting value of the dictionary in column,0.04860063683593097
Filter dataframe columns using multiple dictionaries,0.04860063683593097
"List of dictionaries, and a dictionary within a dictionary",0.04860063683593097
Reading the csv and formatting it to a dictionary with Pandas Python,0.04860063683593097
Convert a pandas dataframe into a dictionary of dictionaries,0.04860063683593097
Is there a way to input multiple dictionary values into a function?,0.04860063683593097
Appending thousands of columns of a dictionary to an existing dataframe,0.04860063683593097
Using dictionary of column names to decide how to multiply through an equation in python,0.04860063683593097
DataFrame with 3 columns to dictionary of dictionaries,0.04860063683593097
How plot every ten dataframes in a dictionary ? Python Pandas,0.04860063683593097
"Selecting in a dictionary (tuple, value) n, n+1 records/observations from pandas dataframe based on 2 columns",0.04860063683593097
Optimize intersection between list and really large dictionary keys,0.04860063683593097
How to access values from list of dictionaries in a dataframe?,0.04860063683593097
Urlencode list of dictionaries,0.04860063683593097
Python Dataframe to List of Dictionaries,0.04860063683593097
How to expand list which contains multiple dictionaries into a dataframe?,0.04860063683593097
Match values from dictionary to dataframe row values and add data to that row,0.04860063683593097
Best way to convert a defaultdict(list) dictionary with list of dictionaries to a csv,0.04860063683593097
"Python, structure for looking and extracting similarities. List. Dictionary or DataFrame?",0.04860063683593097
How to map a dataframe columns to dictionary of lists?,0.04860063683593097
Creating a dictionary from a csv file. I am taking the csv file as an input in an api endpoint in fastapi (file: UploadFile = File(...)),0.04860063683593097
Grouping a dataframe using dictionary,0.04860063683593097
From list of list of dictionaries to Pandas DataFrame,0.04860063683593097
Creating a dictionary from a pandas data frame. on column contains sets,0.04860063683593097
How to store a particular key value from a list of dictionaries in a data frame,0.04860063683593097
How to unnest elements of a list that are dictionaries into dataframe (using the first values of it as prefixes),0.04860063683593097
Transform column of dictionaries into a single pandas DataFrame,0.04860063683593097
Rearranging elements inside a superset of dictionaries,0.04860063683593097
Convert a Pandas DataFrame to a dictionary with values of same class together,0.04860063683593097
how to turn Csv data to dictionary,0.04860063683593097
Using a dictionary to produce a new column from existing,0.04860063683593097
parsing a dictionary in a pandas dataframe cell into new row cells (new columns),0.04860063683593097
How to take a column of lists of dictionary values and create new columns using their values (not keys),0.04860063683593097
Creating a new Pandas column based on a dictionary values,0.04860063683593097
Unable to create a dataframe from a list of dictionaries returned by a RPyC function,0.04860063683593097
Can I seperate the values of a dictionary into multiple columns and still be able to plot them?,0.04860063683593097
Match the values of two dataframes and return a dictionary,0.04860063683593097
How to replace specific data of one df with another df based on a dictionary having row and column info,0.04860063683593097
creating dataframe using list of dictionaries,0.04860063683593097
How to deal with parsing an arbitrary number of lists into a dictionary,0.04860063683593097
"Creating Dataframe from Dictionary of Lists, ignoring keys",0.04860063683593097
Pandas on Spark is throwing Assertion Error when list of dictionaries is being tried as to add as a column,0.04860063683593097
Combine Pandas Columns by Corresponding Dictionary Values,0.04860063683593097
How to merge large dictionaries in Python?,0.04860063683593097
Using a List or Dictionary of Strings to create a new column based on an existing column within a Data frame,0.04860063683593097
Access pandas masks in a dictionary,0.04860063683593097
Extract values from two columns of a dataframe to make a dictionary of keys and values,0.04860063683593097
"Taking dictionary/list, and mapping to dataframe with x number of matching columns",0.04860063683593097
Parse a structured dictionary of entries into a prettified Excel sheet,0.04860063683593097
Convert DataFrame into dictionary of key as index and values as other columns as list,0.04860063683593097
Add lists inside dictionary to DataFrame as new columns,0.04860063683593097
parsing a list of dictionaries in a pandas data frame rows,0.04860063683593097
Create a two-way table from dictionary of combinations,0.04860063683593097
Add two dictionaries into a json,0.04860063683593097
Pandas - How do I add all my dataframes to a dictionary,0.04860063683593097
Pandas convert list of dictionaries (GA output) into dataframe(s) that makes sense,0.04860063683593097
How to convert list of dictionaries to dataframe using pandas in python,0.04860063683593097
"Create a data frame from dictionaries, which are iteratively generated",0.04860063683593097
Creating python dictionary from pandas dataframe with only unique values,0.04860063683593097
Unpacking a pandas dataframe column that contains a list of dictionaries into new columns,0.04860063683593097
"Python, Pandas: Combining Dataframe with Dictionary (by Conditions)",0.04860063683593097
Pandas: how do you map a dictionary of dictionaries to 2 columns?,0.04860063683593097
rearranging a list of dictionaries to make columns in a dataframe python,0.04860063683593097
Python/pandas - Using DataFrame.apply with function returning dictionary,0.04860063683593097
Why is this dictionary comprehension so slow? Please suggest way to speed it up,0.04860063683593097
Python: using dictionary as input with bokeh library,0.04860063683593097
"Sort each dictionary in a list of dictionaries, separately by its values - Python",0.04860063683593097
Creating Dataframe from dictionary that has multiple values assigned to each key,0.04860063683593097
Python str.contains from two or more dictionaries,0.04860063683593097
More efficient to merge data-frames or merge dictionaries?,0.04860063683593097
Insert a row and delete rows in dataframes in a dictionary using pandas,0.04860063683593097
"Pandas, list of dictionaries where values are a list. Convert dictionary keys into column names. Convert each element in value list to a row",0.04860063683593097
Extract values from column of dictionaries using pandas,0.04860063683593097
Combine lists of dictionaries from rows and then extract strings from it to form a new row,0.04860063683593097
Concatenating multiple data dictionaries in python,0.04766600920447076
How to acesses dictionary elements within a pandas dataframe column and iterate over them too create new columns filled with their respective values?,0.04766600920447074
Replacing few zeros of a dataframe with difference between two previous columns,0.04766600920447073
How to concatenate text in different lines If they are next to each other,0.0464219875984582
python pandas: pivot table,0.0464219875984582
Why does function drop a wrong index off the matrix?,0.0464219875984582
How to get value in pivot table based on conditions,0.0464219875984582
Iterate sheets and count rows in Pandas/Python,0.0464219875984582
overruling data frame index when plotting with matplotlib,0.0464219875984582
unable to recreate catplot with matplotlib,0.0464219875984582
dropping dataframe rows based on values in other dataframe,0.0464219875984582
Calculating Average True Range (ATR) on OHLC data with Python,0.0464219875984582
Issues with adding keyword arguments to the 'apply' function when used in conjunction with a 'groupby' on a Pandas dataframe,0.0464219875984582
Pandas Plotting Y-Axis indexing issue,0.0464219875984582
Pandas : How to drop a row where column values match with a specific value (all value are list of value),0.0464219875984582
Python: drop duplicates by conditions,0.0464219875984582
dataframe pivot with pandas,0.0464219875984582
Pandas read nested json,0.0464219875984582
Pandas - access previous time data,0.0464219875984582
"Concatenating files in a directory, changing the format",0.0464219875984582
Pandas Dataframe Pivot and reindex n timeseries,0.0464219875984582
Issue with plotting markers in scattermapbox,0.0464219875984582
Issue with successful 1-to-many merge on primary key,0.0464219875984582
Complex Pivoting in Pandas involving multiple columns,0.0464219875984582
How to concatenate values from multiple pandas columns on the same row into a new column?,0.0464219875984582
Drop Duplicates and Add Values Pandas,0.0464219875984582
convert series index (matching on a pattern) to dataframe columns,0.0464219875984582
Python Pandas Remove Duplicate Cells issue,0.0464219875984582
"Drop all rows from DataFrame in which all values, except a specific one, is NaN",0.0464219875984582
"Pandas column filled with arrays, concatenate values inside arrays",0.0464219875984582
drop all rows in 2 columns if value in one column is beyond a certain value,0.0464219875984582
Labeling large set of paired training data,0.0464219875984582
"Dropping the sum column in pandas pivot table, but keeping the row",0.04424333836098544
Drop some of duplicate rows based on condition,0.04424333836098544
Plotly - Combining Multiple Subplots with Drop Down Menu Buttons,0.04424333836098544
Dropping column during for loop - Pandas,0.04424333836098544
Sparse matrices memory usage and concatenate/hstack Pandas vs Numpy vs Spicy,0.04424333836098543
Issue with Pandas DataFrame creating,0.04424333836098543
Drop columns from Pandas dataframe if they are not in specific list,0.04424333836098543
How to parse a json column embedded in a pandas dataframe python,0.03846153846153846
Compare two dataframes after group by in pandas,0.03846153846153846
CSV to SQL Server: bulk import nightmare (T-SQL and/or Pandas),0.03846153846153846
Converting from Unicode in Python,0.03846153846153846
Setting column to true/false based on comparison of two other columns in pandas?,0.03846153846153846
Can't convert dates to datetime64,0.03846153846153846
"Error 'Expected tuple, got str' in dataframes concatenation",0.03846153846153846
How to check all the columns of a dataframe are the same?,0.03846153846153846
Returning the row of an input value if it is within a range of two Columns in Pandas,0.03846153846153846
pandas: replicating an excel formula in pandas,0.03846153846153846
Find Anagram in Pandas DataFrame columns,0.03846153846153846
How can I add a new column to a DataFrame based on a common row with another DataFrame in pandas?,0.03846153846153846
Finding common values in Dataframe,0.03846153846153846
"Python/Pandas ??eplace NaN in a column with empty/blank, another column with 0. Is it possible to selectively replace Nan?",0.03846153846153846
Python How to combine two rows into one under multiple rules,0.03846153846153846
Time data doesn't match format specified error,0.03846153846153846
Strange repeated field error when uploading to BigQuery with Pandas or command line. All fields unique,0.03846153846153846
Pandas: collapse low values in a DataFrame adding into a new category,0.03846153846153846
How to filter out columns in pd using the value of rows selected by a specific index row?,0.03846153846153846
smoothing curve with pandas and interpolate not modifying data,0.03846153846153846
Dataframe rows and column calling,0.03846153846153846
map value from one dataframe to another dataframe,0.03846153846153846
Can I use if else condition to get column string which is matched the value of another column value?,0.03846153846153846
UndefinedVariableError when querying pandas DataFrame,0.03846153846153846
pandas to csv TypeError: get_handle() got an unexpected keyword argument 'errors',0.03846153846153846
New column with list of strings,0.03846153846153846
How can I replace NaN values based on multiple conditions?,0.03846153846153846
Identify Range levels OHLC in Python,0.03846153846153846
Calculating euclidean distance from a dataframe with several column features,0.03846153846153846
"How can I make a DataFrame containing half of the data from another DataFrame, distributed evenly across values in a column?",0.03846153846153846
pandas cut generating less bins that specified,0.03846153846153846
extracting information from rows in csv file,0.03846153846153846
Replacing the first column values according to the second column pattern,0.03846153846153846
Printing column/variable names after feature selection,0.03846153846153846
Using regex to map values in dataframe using python,0.03846153846153846
"plotly - remove or ignore ""Non-leaves rows"" for sunburst diagram",0.03846153846153846
Match DataFrames in Python and create a new column,0.03846153846153846
Removing excess tabs from .txt file after user-input-error,0.03846153846153846
Can I search for values to match results from another dataframe?,0.03846153846153846
how can I change a datetimeindex format index into a panda dataset with the contents of another column?,0.03846153846153846
Proper use of isinstance in python,0.03846153846153846
how to create an object from a python array,0.03846153846153846
Moving data from excel to sql server using Python script,0.03846153846153846
Train multiple classifiers and compare metrics,0.03846153846153846
Last Transaction of each day,0.03846153846153846
Create a new column in Pandas Dataframe based on the 'NaN' values in another column,0.03846153846153846
how to get ranking of columns for each row,0.03846153846153846
"How do I convert the output of a JSON Dump to a format where I can access the individual elements, and convert it to a datframe?",0.03846153846153846
Pandas groupby with unique values and cumulative sum,0.03846153846153846
How do I use Pandas to get the sum of 2 columns based on the value of another column in a dataframe,0.03846153846153846
Stacked Histogram using python and pandas,0.03846153846153846
Error while installing Pandas and same kind of error while installing Datapane,0.03846153846153846
Parent child relationship between two dataframes without pandas merge,0.03846153846153846
How to get the correct values from a DataFrame using Pandas?,0.03846153846153846
"Dataframe Groupby and Resample, with added missing rows per minute",0.03846153846153846
How to create a HTML table from a DataFrame,0.03846153846153846
geopandas looping with lambda function,0.03846153846153846
Apply on *staggered* groups of Pandas DataFrame,0.03846153846153846
How to auto increment counter by repeteaded values in a column,0.03846153846153846
Calculate and add up Data from a reference dataframe,0.03846153846153846
pandas groupby cummulative,0.03846153846153846
"Finding ""gaps"" in data using pandas",0.03846153846153846
Reading each column data of row from csv file and apply a formula based on column index,0.03846153846153846
Pandas rolling cumulative sum of across two dataframes,0.03846153846153846
"Pandas: how to use groupby, sum and multiply at the same time",0.03846153846153846
Python replace string in Pandas column dataframe replace vs lambda,0.03846153846153846
delete specific rows from a dataframe in python,0.03846153846153846
Creating new pandas dataframe from orginal one and naming using unique value in a column,0.03846153846153846
csv to pandas dataframe contains semicolon,0.03846153846153846
Python help to extract rows by column value,0.03846153846153846
Python Pandas to_pickle cannot pickle large dataframes,0.03846153846153846
precentage after groupby based on 0 or 1,0.03846153846153846
Duplicate columns in pandas,0.03846153846153846
Plotting low-pressure centers over time using xarray and CORDEX data,0.03846153846153846
Program in python doesn't work after packaging with pyinstaller,0.03846153846153846
Replace each element in pandas Series by how often it previously occured,0.03846153846153846
pandas groupby by different key and merge,0.03846153846153846
Python: How can I ensure module aliases used in functions are correct?,0.03846153846153846
Reading parts of ~13000 row CSV file with pandas read_csv and nrows,0.03846153846153846
How would I count all unique values of a dataframe in python without double counting?,0.03846153846153846
Combining multiple csv's by averaging each cell in python,0.03846153846153846
How to delete row in data frame based on value in set?,0.03846153846153846
plotting multiple histograms in grid,0.03846153846153846
Metric for calculating uniformity with penalty for lower values,0.03846153846153846
Add column skipping nan,0.03846153846153846
Why is a cell value coming as a series when you do dataframe[dataframe[ColumnName]==some_value]?,0.03846153846153846
pandas largest value per group with multi columns / why does it only work when flattening?,0.03846153846153846
stripping index values in pandas,0.03846153846153846
Turn Groups of Rows into One Row with Many Cols,0.03846153846153846
Checking one DataFrame's Column of Lists Against Another DataFrame's Column of Lists,0.03846153846153846
How do I group hourly data by day and count only values greater than a set amount in Pandas?,0.03846153846153846
Adding file names from list to dataframe - Python,0.03846153846153846
problems writing a pandas DataFrame into a unicode text file,0.03846153846153846
Consecutive Green Days,0.03846153846153846
Use string formatting in pandas DataFrame columns,0.03846153846153846
How to convert a two column csv file to a dictionary in python,0.03846153846153846
How to create a crosstab with concatenation on pandas dataframe?,0.03846153846153846
Pandas: how to index dataframe for certain value or string without knowing the column name,0.03846153846153846
Extract table from string python,0.03846153846153846
Share label encoder over multiple columns,0.03846153846153846
Pandas: How can I convert numbers written in a digit format to be written in text format?,0.03846153846153846
Appending dataframe to an existing excel file,0.03846153846153846
Converting DataFrame column data into array,0.03846153846153846
Why is Pandas Concatenation (pandas.concat) so Memory Inefficient?,0.03846153846153846
How to json_normalize a column with NaNs,0.03846153846153846
Find LTV of user with Cohort analysis,0.03846153846153846
"Pandas, Data Frame set_index & reindexing",0.03846153846153846
Extrapolate (and Interpolate) Pandas DataFrame,0.03846153846153846
How do I not write the first column to an Excel file using Python?,0.03846153846153846
Fill in elements of Pandas DataFrame element by element,0.03846153846153846
Pandas - Exploding data into multiple rows and creating a new DataFrame,0.03846153846153846
create combination of delimited strings by group in pandas,0.03846153846153846
Replace number in beginning and last python pandas data frame,0.03846153846153846
How to combine numbers into a single row,0.03846153846153846
Iterate over column to convert currency with the forex-python package,0.03846153846153846
How can I include a pandas data frame column as a parameter in an np.where function?,0.03846153846153846
Filter dataframe based on groupby and pandas series,0.03846153846153846
Disable rounding in mean function,0.03846153846153846
how to make python code accept any csv column name,0.03846153846153846
Python / Pandas Tables,0.03846153846153846
TypeError: 'float' object is not iterable in a Pandas Dataframe Python,0.03846153846153846
"df = pd.read_csv(""C:\Python\nycrime.csv"") is not working",0.03846153846153846
"Pandas cut dataframe to intervals, then get value if in interval",0.03846153846153846
How to convert a Scikit-learn load_digits to a Pandas dataset?,0.03846153846153846
Using Pandas groupby to calculate many slopes,0.03846153846153846
Create new column in Pandas DataFrame based on other columns,0.03846153846153846
Build a timeseries dataframe in pandas using a start date / end date,0.03846153846153846
python3:How to sum column value of each three of a column,0.03846153846153846
extract a list of tuples from pandas series stored as string,0.03846153846153846
read_excel or read_csv on pandas,0.03846153846153846
Parse Exception error while fetching data via pyspark,0.03846153846153846
Python Pandas apply function with series data as argument,0.03846153846153846
Pandas Dataframe Enlargement,0.03846153846153846
Pandas group all rows except selected,0.03846153846153846
Reading in SQL files into Pandas Table,0.03846153846153846
Pandas create multiple dataframe based on group from another dataframe,0.03846153846153846
Reproduce data based on sample data input,0.03846153846153846
Pandas: slow date conversion,0.03846153846153846
Selection errors with a Boolean,0.03846153846153846
More efficient way than iterrows,0.03846153846153846
How to describe entire matrix or Pandas dataframe,0.03846153846153846
find most recent date in pandas dataframe,0.03846153846153846
pandas Series: find column by value,0.03846153846153846
A value is trying to be set on a copy of a slice from a DataFrame-warning even after using .loc,0.03846153846153846
Create a DataFrame without NaN values from another DataFrame,0.03846153846153846
Pandas: How to extract a string from another string,0.03846153846153846
Simple Keras ML model for predicting multiplication isn't working,0.03846153846153846
Pandas: access data from dataframe by row and column number,0.03846153846153846
count disasters in dataframe at a certain point in time,0.03846153846153846
How to make a new column in pandas using existing columns?,0.03846153846153846
Combine AxesSubplot objects into one plot,0.03846153846153846
Are Pandas nullable Integer types bad for performance compared to float,0.03846153846153846
Python x days y hrs z mins to date,0.03846153846153846
"Flask ""Pick-List"" Widget",0.03846153846153846
"What kind of JSON structure is the Alpha Vantage API data, and how to convert it to a pandas dataframe?",0.03846153846153846
How can I unify a column with different time formats into one single format?,0.03846153846153846
Python: Change Step Loops Dynamically in Python,0.03846153846153846
How to add categorical variable to dataframe?,0.03846153846153846
Dataframe with predicted values from a classifier,0.03846153846153846
Count number of columns having zeros,0.03846153846153846
Calculate number of occurrence of common element in Pandas,0.03846153846153846
Accessing multi-index value in pivot table using pandas in python,0.03846153846153846
using describe function in pandas,0.03846153846153846
Pandas: match on one set of columns and populate with third value,0.03846153846153846
Merge and Sum Pandas Rows,0.03846153846153846
AttributeError: 'int' object has no attribute 'map',0.03846153846153846
"Python look up value in same week, different product",0.03846153846153846
Is Python function .eq() case sensitive?,0.03846153846153846
Python Existing connection forcibly closed by remote host Pandas read SQL and to sql functions different databases,0.03846153846153846
Padding a Pandas Dataframe with Entries Based on Date,0.03846153846153846
Getting UnboundLocalError while executing the program,0.03846153846153846
Is there a way to change a csv filename by its file type in python?,0.03846153846153846
Assert a pandas series contains only strings,0.03846153846153846
"Having trouble using rolling on a dataframe without using apply, which is slow",0.03846153846153846
Selecting minimum value between columns python,0.03846153846153846
Replace a column value for a select set of rows,0.03846153846153846
Filter a dataframe from a virtual column in Vaex,0.03846153846153846
Mapping interval using map function in python,0.03846153846153846
add a new dataframe based on multiple condition in pandas,0.03846153846153846
Rolling record of first time changes (& diffs) between two columns in a DF,0.03846153846153846
"Groupby, apply function and combine results in dataframe",0.03846153846153846
How to search data through indices in pandas Series without loops,0.03846153846153846
