Title,Correlation Score
convert list of strings to panda dataframe with types,0.03846153846153846
How to merge two dataframes without getting additional rows?,0.03846153846153846
Pandas CategoricalDtype causing IndexError when attempting to write to Excel file using openpyxl,0.03846153846153846
remove duplicate from dataframe base on some conditions,0.03846153846153846
Read data from txt file from a specific pattern in text,0.03846153846153846
BigQuery rounds decimals to zero when uploading CSV file,0.03846153846153846
pd.to_numeric fails on xarray time coordinate,0.03846153846153846
Pandas Multi-index set value based on three different condition,0.03846153846153846
Formatting Data Pulled from Yahoo Finance,0.03846153846153846
Group column value to sparse matrix in python,0.03846153846153846
Change numeric values in rows of CSV if string in same row has certain value,0.03846153846153846
Csv file not uploading on Jupyter getting error,0.03846153846153846
Pandas Dataframe remove rows depending on two columns with equal values,0.03846153846153846
multiply 2 columns in 2 dfs if they match the column name,0.03846153846153846
How can we handle dupes in a merged dataframe?,0.03846153846153846
"pandas dataframe from list of tuples [(column, row, value)]",0.03846153846153846
Problem with lstrip and backslash in python,0.03846153846153846
Matching two dataframe columns but only on subset of data based on criteria,0.03846153846153846
Getting Dummy Back to Categorical,0.03846153846153846
how to convert a set of matrices into a data frame in pandas?,0.03846153846153846
Splitting one column into multiple based on data or line break,0.03846153846153846
How to find duplicate values (not rows) in an entire pandas dataframe?,0.03846153846153846
Translate API JSON to Dataframe,0.03846153846153846
Need help in matching strings from phrases from multiple columns of a dataframe in python,0.03846153846153846
Parse error when trying to remove time and change date format?,0.03846153846153846
loop under df.loc in python dataframe,0.03846153846153846
percentage change relative to specific row for each group pandas,0.03846153846153846
dictionary with df inside as value and changing column names,0.03846153846153846
How to insert another column values in a column with their respective location?,0.03846153846153846
Creating a python desktop app to navigate and view S3 files without using aws credentials,0.03846153846153846
Line truncates when exporting pandas dataframe to csv,0.03846153846153846
How to replace part of string with pattern(regex) throw rows in dataframe,0.03846153846153846
how to specify start for a pandas time series with timedelta index?,0.03846153846153846
Error while trying to look for specific information on a CSV using python (it may be pandas related),0.03846153846153846
Unwanted blank lines in my Python function output,0.03846153846153846
How can I select rows except last row of one column?,0.03846153846153846
Pandas: How to automate creation of loop to make multiple contingency tables for different groups?,0.03846153846153846
Concatanate Lists in one DataFrame,0.03846153846153846
Extract substring from urls stored in a pandas column,0.03846153846153846
Cleaner way to selectively multiply pandas DataFrame values,0.03846153846153846
Keeps rows that aren't in list,0.03846153846153846
Using Lambda function and to continue despite Key Error,0.03846153846153846
Fill sequential date between start & end date from two different column of pandas data frame,0.03846153846153846
Getting date index value in a multi index pandas,0.03846153846153846
Convert Object to float in datadrame using pandas,0.03846153846153846
Retain rows with data that is more recent than specified time,0.03846153846153846
pandas count data in row with specific condition,0.03846153846153846
How to print a pandas dataframe after applying the style properties Object <pandas.io.formats.style.Styler>,0.03846153846153846
"Only valid with DatetimeIndex, TimedeltaIndex or PeriodIndex, but got an instance of 'RangeIndex'",0.03846153846153846
"Pandas read_csv, reading in one column twice",0.03846153846153846
Pandas Dataframe: move multiple rows with the same column values into new specific rows,0.03846153846153846
How To convert New Data set according to dummy variables for validation,0.03846153846153846
Python Pandas Compare 2 dataFrame,0.03846153846153846
python pandas avoiding dupulicated csv output,0.03846153846153846
Large Sampling with Replacement by index layer of a Pandas multiindexed Dataframe,0.03846153846153846
Creating multiple data frames using for loop with conditions,0.03846153846153846
Getting an error creating a button after a function,0.03846153846153846
What is the most efficient way to synchronize two time dataframes,0.03846153846153846
"Pandas dataframe col - efficient way to change ""__"" to ""_"" and ""_"" to "" ""?",0.03846153846153846
web scraping of top 10 odi player,0.03846153846153846
Pandas - Converting columns in percentage based on first columns value,0.03846153846153846
Keep non-numerical columns with resample,0.03846153846153846
How to filter out data in a column using pandas DF,0.03846153846153846
For loop for annotating multiple points?,0.03846153846153846
Python Dataframe conditionally add value to existing column,0.03846153846153846
"How to replace ""values with more than one decimal"" with ""nan"" in a given column",0.03846153846153846
Check missing row in specific column and then add it to the dataframe,0.03846153846153846
Extracting text after a phrase and in between spaces from Pandas Dataframe,0.03846153846153846
clean a UTF-16 text file using Pandas Dataframe / Python,0.03846153846153846
Data visulisation using ridge and scatter plot,0.03846153846153846
Create data frames in a for loop,0.03846153846153846
How to set a starting day in heatmap (python)?,0.03846153846153846
can someone explain me this python pipeline syntax,0.03846153846153846
Split a DataFrame column applying a function Python,0.03846153846153846
How to select multiple columns of the Multiindex of a Pandas dataframe?,0.03846153846153846
Preserve string when writing pandas data frame to csv,0.03846153846153846
Removing rows in dataframe based on multiple conditions,0.03846153846153846
Read most recent excel file from folder PYTHON,0.03846153846153846
Pandas find value corresponding to absolute minimum,0.03846153846153846
"Skipping line 150: Expected 5 fields in line 150, saw 11",0.03846153846153846
How to apply def function in full dataframe?,0.03846153846153846
Transform from wide to long with multiple columns and keep relationship in Python,0.03846153846153846
Label encoding several columns in DataFrame but only those who need it,0.03846153846153846
How to slice pandas data frame based on a categorical variable - ei Country,0.03846153846153846
"convert multiple dataframe columns int64 dtype to equivalent of NUMBER(20,3) datatype of oracle",0.03846153846153846
How to find maximum number of consecutive negative numbers in pandas DataFrame,0.03846153846153846
How can I rename the data of a pandas dataframe column?,0.03846153846153846
Find if multiple columns contain a string,0.03846153846153846
How do I create a new column based on a condition out of two columns with different datatypes?,0.03846153846153846
How to convert dates column in a pandas DataFrame to datetime index?,0.03846153846153846
How to set up two-weeks interval for datetime value,0.03846153846153846
Data Frame modification based on values in two columns in Python Pandas?,0.03846153846153846
Looping through dataframe values in columns and using them as a FROM clause using SQL,0.03846153846153846
"Why am i getting "" NameError: name 'df2' is not defined"" error?",0.03846153846153846
comparing two timeseries dataframes based on some conditions in pandas,0.03846153846153846
compare the two rows string for same id and get the unique string values in pandas,0.03846153846153846
Python Shift by trading date,0.03846153846153846
"Count the values that are repeated, even those that are absent",0.03846153846153846
How to assign numeric values to multile strings in a dataframe column using python?,0.03846153846153846
TypeError: expected string or bytes-like object on Pandas using Fuzzy matching,0.03846153846153846
How to skip coloring inf values?,0.03846153846153846
How can I add results of a for loop with an if statement to my dataframe?,0.03846153846153846
Pandas Implement Equation & Groupby 2 Conditions,0.03846153846153846
"add one more new column supplytypecheck, check if supply type IMPG that should be Y else N",0.03846153846153846
For Pandas DataFrame how can I access a row that has a specific value in one column?,0.03846153846153846
Create dynamic columns using information from existing columns using pandas,0.03846153846153846
calculating size of a given node based on an edgelist in pandas,0.03846153846153846
pandas dataframe makes a boolean column based on the date in the list,0.03846153846153846
Writing to Excel file in Python,0.03846153846153846
How can I optimize the code to make one df,0.03846153846153846
How to use list.append() in pandas loops?,0.03846153846153846
how to create a row for each datetime and each id?,0.03846153846153846
CSV: How to find a closest match/closest value from the list of lists (list that contains lists)?,0.03846153846153846
pandas - why the outputs of iloc and loc are different,0.03846153846153846
How can I assign a variable from column 2 when running a loop of values in column 1 (same ROW value),0.03846153846153846
Want to scrape all the specific href from the a tag,0.03846153846153846
I have pd.DataFrame with non-unique values in selected Column. How can i leave only rows with unique values ??f the selected column?,0.03846153846153846
Having trouble to sum values in a column that match a given condition,0.03846153846153846
Error occured during changing for loop to .apply(),0.03846153846153846
Python: pandas.replace doesn't work with np.nan,0.03846153846153846
hypothesis - How to generate a pandas dataframe with variable number of columns,0.03846153846153846
how to perform string formatting inside a dictionary?,0.03846153846153846
determine the range of a value using a look up table,0.03846153846153846
How to group datetime column in Pandas?,0.03846153846153846
Filter expected value from list in df column,0.03846153846153846
How to create a confusion matrix with pandas.crosstab when all the predicted values are 1?,0.03846153846153846
__getitem__ returning inherited dataframe accessor impeding arithmetic operator overloading,0.03846153846153846
Find the mode value of a column via a CSV file,0.03846153846153846
Using head/tail function on pandas dataframe with different number of n for each group,0.03846153846153846
Adding two dataframes together but the IDs continue. Replace duplicates?,0.03846153846153846
How should I merge two dataframes so that the resulting dataframe does not have NaN values for an entire column?,0.03846153846153846
I want to replace missing values based on some conditions in a pandas dataframe,0.03846153846153846
Python Pandas: How to add rows between two datetimes,0.03846153846153846
How to encode a string data for classification ML model in Python,0.03846153846153846
Replacing duplicate dataframe rows with the mean value in pandas,0.03846153846153846
return multiple objects from a recursive function using python,0.03846153846153846
removing columns from a file on my database,0.03846153846153846
python not reading data correctly,0.03846153846153846
Problem validating a string inside a pandas dataframe column,0.03846153846153846
How to add values to list based on value in pd.DataFrame in corresponding row?,0.03846153846153846
Key error in python pandas while trying to compare values,0.03846153846153846
Filling up an incomplete dataframe with values inside of it,0.03846153846153846
First and last value of grouped series,0.03846153846153846
when I export dataframe to excel I got just part of columns,0.03846153846153846
Filtering pandas dataframe rows based on boolean columns,0.03846153846153846
searching for value in Dataframe: set value for column like value of compared dataframe if exists,0.03846153846153846
How to compare two dataframes in pandas?,0.03846153846153846
How can I processing subgroup data Python,0.03846153846153846
Create a new column in a dataframe containing string values from different columns based on values in another column of a dataframe,0.03846153846153846
Make a calculation or function skip rows based on NaN values,0.03846153846153846
Adding rows to a pandas dataframe,0.03846153846153846
Best approach to return multiple objs from function,0.03846153846153846
Link Elements in Pandas DataFrame,0.03846153846153846
combining two dataframes giving NaN values,0.03846153846153846
Filtering pandas results using where clause but getting error,0.03846153846153846
Output to CSV changing datatype,0.03846153846153846
Fix scale botttom colour on 0 in altair,0.03846153846153846
pandas read_csv only works after opening csv and saving it again as csv,0.03846153846153846
Assigning same values to a specific cell in pandas,0.03846153846153846
Amount of rows copied into new DataFrame is limited by exisitng number of rows,0.03846153846153846
"Removing rows contaning value, Pandas DataFrame",0.03846153846153846
Long dates conversion to quarters (Capitalized with periods),0.03846153846153846
Groupby Pandas and compare multiple columns,0.03846153846153846
dataset with latitude and longitude is not formated properly - how to format properly with python?,0.03846153846153846
Read a local html table in Python Pandas as a dataframe,0.03846153846153846
python delete row where most columns are nans,0.03846153846153846
pandas dataframe rebuild based on cells,0.03846153846153846
how to select values in a list from pandas datetime in a dataframe?,0.03846153846153846
How to add values ??o a column of a dataframe by the column name and the list of indices without a loop,0.03846153846153846
Divide multiple columns in pandas,0.03846153846153846
Find missing dates between two datetime ranges,0.03846153846153846
Smart / pythonic way to find which columns contain / match another column,0.03846153846153846
Creating multiple panda strings,0.03846153846153846
How to check if any row is more than x and return name of column?,0.03846153846153846
Write Pandas Dataframe parquet metadata with partition columns,0.03846153846153846
Python Transpose Dataframe Rows as Column names and columns as rows,0.03846153846153846
sum of all columns in all sheets,0.03846153846153846
"""No such file or directory error"" while combining multiple excel sheets using python os and pandas",0.03846153846153846
Represent a 3 column data in a 2D matrix form with 2 columns as index and 3rd as value in python,0.03846153846153846
Apppend and Delete Rows to Grid with GridTableBase,0.03846153846153846
Python Pandas: reindex property deletes all previously existing values,0.03846153846153846
Is this a safe way to set values in a DataFrame? Why does this work?,0.03846153846153846
Pandas - pad groups up to max value,0.03846153846153846
Getting column names based on df.query condition,0.03846153846153846
How to create n copies of every row on dataframe based value in list Python,0.03846153846153846
For Loop CSV to FBProphet,0.03846153846153846
Apply a function to each column of groupby,0.03846153846153846
Expand Pandas Dataframe adding rows,0.03846153846153846
boolean indexing with loc returns NaN,0.03846153846153846
Substracting values from two different pandas dataframes based on same row values,0.03846153846153846
How I can get the same result in Python what I get by using Sumif in Excel?,0.03846153846153846
pandas after groupby and apply function to one of the group how to combine the result back,0.03846153846153846
How to bin age column for each category,0.03846153846153846
Python using Pandas to_sql: How do I add the data from Excel to MariaDB without writing the data to the ID and timestamp column?,0.03846153846153846
How to use multi threading on this for loop to decrease the execution time?,0.03846153846153846
Efficiently apply function to every row of a dataframe depending on another dataframe,0.03846153846153846
How to optimize Django interacting with database tables,0.03846153846153846
Remove trailing .0 from strings of entire DataFrame,0.03846153846153846
Coalesce Pandas DataFrame DOWN Columns,0.03846153846153846
Pandas organize merge information in a loop,0.03846153846153846
Equally distribute duplicate Timestamps in column,0.03846153846153846
column calculation based on a value,0.03846153846153846
Problem adding column to Pandas DataFrame,0.03846153846153846
How to make undersampling to have 25% of imput fo category 0 and does not changes in category 1 in Python?,0.03846153846153846
pd.date_range for 9am each day between two pd.Timestamp objects,0.03846153846153846
ARIMA model predicting seven days in the future,0.03846153846153846
Pandas extends intervals in timeseries,0.03846153846153846
Unable to fill missing values with column value across all columns,0.03846153846153846
Cumprod over mutliple sub-segments,0.03846153846153846
Fetch only particular key value from a json format in pandas dataframe column,0.03846153846153846
Normalization of samples based on the controls when we have several groups,0.03846153846153846
Python - Read Columns from CSV with Pandas,0.03846153846153846
How to move some value in a column to different column on the same row,0.03846153846153846
"Groupby, filter rows between specific strings in Pandas",0.03846153846153846
Determining columns which produce unique row for primary set keys,0.03846153846153846
pandas: group the continuous rows with same values into one group,0.03846153846153846
"ValueError: Input 0 of layer sequential is incompatible with the layer: expected min_ndim=3, found ndim=2. Full shape received: [None, 2]",0.03846153846153846
Fill na values with 0 if column is in a list python,0.03846153846153846
Pandas: Most resource efficient way to apply function,0.03846153846153846
Groupby and apply a specific function to certain columns and get first or last values of the df Pandas,0.03846153846153846
How to avoid barchart annotations overlapping with left y axis?,0.03846153846153846
Applying a regex to build 3 pandas columns,0.03846153846153846
convert non digits in one column to nan in pandas,0.03846153846153846
"Plotting with pandas groupby in python, multiple plots",0.03846153846153846
Is there a way to delete rows of a csv file after reading them?,0.03846153846153846
Converting list of datetimes to int,0.03846153846153846
Pandas: assign group id based on similar columns and (column)-list elements,0.03846153846153846
TypeError: '>=' not supported between instances of 'datetime.date' and 'str',0.03846153846153846
"'In' of a python for loop access series values, where as 'in' of an if statement access series index, Why the inconsistency?",0.03846153846153846
Trouble with Beautiful Soup Scraping,0.03846153846153846
Concat series in list,0.03846153846153846
Keep within groups rows with same value in columns,0.03846153846153846
Replacing every non zero value by their index in a dataframe,0.03846153846153846
DataFrame filtering: .loc vs not,0.03846153846153846
Filtering on dataframe of calculated values,0.03846153846153846
converting str to YYYYmmdd format in python,0.03846153846153846
Repeat rows in dataframe for n target columns by adding n-1 target columns,0.03846153846153846
Create a Status column based on the payment behavior of each account,0.03846153846153846
Pandas chaining only modifying one column in dataframe using apply or pipe,0.03846153846153846
If statement doesn't work with Pandas(csv) element,0.03846153846153846
How do I replace <NA> with NaN in a Pandas DataFrame?,0.03846153846153846
How to set to the column list with the number of elements equal to the number of elements in the list on another column,0.03846153846153846
Plotting Date with data with 2 y-axis and exporting graph from Jupyter Notebook,0.03846153846153846
Unable to create python executable to read spss file,0.03846153846153846
"""No such file or directory exist"", but it obviously does",0.03846153846153846
Trouble operating on my pandas dataframe in a loop?,0.03846153846153846
Pandas: Detect value change in string column with groupby; ignoring first entry,0.03846153846153846
How can I simplify code that runs the same calculation with different parameters into different output variables?,0.03846153846153846
Extract part of a 3 D dataframe,0.03846153846153846
"Resample Dataframe, calculate min, max and first and last of different columns within an interval",0.03846153846153846
"How to group, sum up and calculate a mean of every other element in a column?",0.03846153846153846
Populate wxPython Grid from DataFrame,0.03846153846153846
How do I resample to 5 min correctly,0.03846153846153846
convert dataframe column from timestamp with timezone to timestamp type,0.03846153846153846
Pandas normalise by column on groupby,0.03846153846153846
How does parallel processing with pandas compare to dask?,0.03846153846153846
Validate multiple date formats (Pandas DataFrame),0.03846153846153846
Removing a value in a specific row of a column without removing the entire row in a pandas dataframe,0.03846153846153846
python script to extract features from huge (60000) JSON file directrory into csv,0.03846153846153846
PYTHON: Extracting data from .xlsx using pandas ExcelWriter and outputting as text on image using PIL,0.03846153846153846
Find substrings that match a list,0.03846153846153846
Create a new column for Repeated elements in pandas,0.03846153846153846
convert string as 'hours' and 'mins' into minutes,0.03846153846153846
Calculating pairwise overlap for multiple boolean columns in pandas dataframe,0.03846153846153846
Function not working when looping through a list of dataframes,0.03846153846153846
Inverse Feature Scaling not working while predicting results,0.03846153846153846
creating new dataframe with manhattan distance in python,0.03846153846153846
Take next group value and assign it to the current group element,0.03846153846153846
Is a += b different than a = a+b?,0.03846153846153846
"Python: Can I replace missing values marked as e.g ""Unknown"" to NaN in a dataframe column?",0.03846153846153846
Using pandas to categories text data in one column and have corresponding categories stated in the next column,0.03846153846153846
Python gets confused by SQL's `LIKE '%something%'` and `%(something)s`,0.03846153846153846
Flatten lists of list for each cell in a pandas column,0.03846153846153846
Python DataFrame : Add a column with the repetition of a value of other column but in a different way,0.03846153846153846
Remove Duplicate Rows by ID if Both Meet a Condition,0.03846153846153846
How to turn a Pandas DataFrame into a table of vectors,0.03846153846153846
Python Pandas groupby multiple columns and append,0.03846153846153846
Exploding a GeoDataFrame Pandas-style,0.03846153846153846
"Creating network from csv file (Python, Pandas, Networkx)",0.03846153846153846
how to add missing rows of time series data to panda dataframes in python,0.03846153846153846
I want to find an existing col/row and edit it,0.03846153846153846
Pandas | Filter DF rows with Integers that lie between two Integer values in another Dataframe,0.03846153846153846
merge several columns into one,0.03846153846153846
Webscraping several URLs into panda df,0.03846153846153846
Attempts at speeding up stats (scipy) calculations failling,0.03846153846153846
Why does Pandas Transpose Fail Without Error?,0.03846153846153846
Apply a condition to only the unique values in another column in Pandas,0.03846153846153846
Transpose pandas Styler,0.03846153846153846
How can I fix errors thrown by py2app in python script with Pandas,0.03846153846153846
Non-overlapping rolling windows in pandas groupby,0.03846153846153846
Pandas scatter matrix - what do the histograms mean?,0.03846153846153846
Unstable results from Bayesian statistical approach(pymc3),0.03846153846153846
How to merge two bins in a pandas data frame?,0.03846153846153846
Complex column and row reverse using Pandas,0.03846153846153846
Export result to csv and print it in one column,0.03846153846153846
How can I combine two dataframes based on a column of lists in Pandas,0.03846153846153846
How to read only first n rows of parquet files to pandas dataframe?,0.03846153846153846
Pandas - List of Duplicates but Only Maintain Rows with Same Value Across All Duplicates,0.03846153846153846
convert/clean scraped data to pandas dataframe python,0.03846153846153846
Replace apostrophes and curly brackets with blank space in multiple columns of dataframe,0.03846153846153846
How to spread the data in pandas?,0.03846153846153846
Dedupe duplicated datetime index values by adding fractional timedelta increments,0.03846153846153846
How to merge rows of a dataframe where index is the same,0.03846153846153846
Possible pandas bug?,0.03846153846153846
Selecting rows from one DataFrame depending on values from another,0.03846153846153846
"Pandas finding local max and min, not plateau values",0.03846153846153846
Numpy unwrap error when using apply() on Pandas dataframe,0.03846153846153846
How to amend specific csv files using pandas,0.03846153846153846
Why is there an incongruence between dataframe input and numeric standard input?,0.03846153846153846
Dataiku : Job failed: Error in Python process: At line 158: <class 'NameError'>,0.03846153846153846
How to omit only weekends from my data frame?,0.03846153846153846
