Title,Correlation Score
"Pandas csv dataframe: Input ""Null"" into all cells in empty colums, input ""NA"" into all empty cells in non-empty colums",0.09288824383164003
"Get pandas.read_csv to read empty fields as NaN, and empty strings as empty strings",0.09288824383164003
"Pandas returns empty DataFrame , empty columns and empty index",0.09288824383164003
Empty values in pandas -- most memory-efficient way to filter out empty values for some columns but keep empty values for one column?,0.09288824383164003
"Using python trying to clean and load file, to CSV but empty fields keep displaying double quotes. I would like empty fields to be empty strings",0.09079180777293983
Empty DataFrame doesn't admit its empty,0.0754437869822485
Pandas: Replace empty column values with the non-empty value based on a condition,0.0754437869822485
Empty Data Error when checking if CSV is empty,0.0754437869822485
How to convert multilevel index to columns in Python. (IndexError: cannot do a non-empty take from an empty axes.),0.0754437869822485
Reading Excel file to dataframe and copying last non-empty column value to empty cells,0.0754437869822485
"Pandas - loop through dataframe, check column values if empty, if empty then add entire row to new list or df",0.0754437869822485
Comparing empty string column with a non empty string column give me True for all the values that do not match,0.0754437869822485
how to create python empty dataframe where df.empty results in True,0.0754437869822485
Fill the empty cells with their neighbours if they are not empty based on another column Pandas,0.0754437869822485
Pandas's dataframe becoming empty after removing empty rows,0.0754437869822485
Remove empty rows and empty [?] using python,0.0754437869822485
Python error cannot do a non empty take from an empty axes,0.0754437869822485
"How to create empty cells in pandas that are recognized as empty by R, using rpy2?",0.0754437869822485
Pandas Recognizes Empty Cell From CSV as EMPTY SPACE Instead of nan,0.0754437869822485
IndexError: cannot do a non-empty take from an empty axes,0.0754437869822485
append row to empty dataframe returns empty dataframe,0.0754437869822485
How to make pandas read empty data file as an empty dataframe?,0.0754437869822485
Empty data frame when it is not supposed to be empty,0.0754437869822485
Python Error: IndexError: cannot do a non-empty take from an empty axes,0.0754437869822485
How can we load a pandas dataframe using an empty csv file and how can we check that the csv file choosen by us for loading the dataframe is empty?,0.0754437869822485
Get pandas.read_csv to read empty values as empty string instead of nan,0.0754437869822485
Is there a way to remove empty cells(commas for empty cells) when writing to csv from pandas python?,0.0754437869822485
"If col is empty string, make adjacent column empty as well",0.0754437869822485
Appending DataFrame to empty DataFrame in {Key: Empty DataFrame (with columns)},0.0754437869822485
Resampling data with mode gives empty lists... Need to convert those empty lists to 0,0.0754437869822485
Pandas is not empty but gets max() arg is an empty sequence,0.0754437869822485
Pandas: How can I fill in the n/a with the mean of previous none-empty value and next none-empty value,0.07402031930333816
Python 3 append to an empty list after a for loop - I get an empty file (updated/edited question),0.07402031930333816
"Looping through text file, finding keywords, creating a dictionary, and then appending dictionary to list of dictionaries",0.07402031930333815
"Remove column if all rows contain NaN, [] (empty list) or {} (empty dict)",0.07402031930333813
empty pandas.Series does not provide .empty = True,0.07192388324463796
"Pandas aggregate with condition. Join if empty, first is not empty",0.07192388324463794
iterating over a dictionary of empty pandas dataframes to append them with data from existing dataframe based on list of column names,0.06982744718593774
Fill empty dataframe with multiple dictionaries,0.0690335305719921
How to unfold a dictionary of dictionaries into a pandas DataFrame for larger dictionaries?,0.06773101112723752
"Given an empty count matrix and a dictionary that maps customers to lists of purchases, how do I fill the matrix with each purchase?",0.06689677843523997
How to serialize empty pandas dataframe into list of dictionaries,0.06689677843523997
python dictionary to pandas dataframe returns empty dataframe,0.06689677843523997
Replace empty dictionaries and lists from within pandas dataframe with Null,0.06476002629848784
Append Dictionary Elements into an Empty Pandas Dataframe Column,0.06476002629848784
"combining an empty ""master"" df with multiple dynamically produced dfs built from nested dictionaries",0.06476002629848784
how to append rows of an empty column with dictionaries?,0.06476002629848784
Replace values of empty dictionaries in a dataframe column,0.0626232741617357
"Calling specific dictionary values from a dictionary with multiple values per key, Python",0.0626232741617357
Convert DataFrame to dictionary with sub-dictionaries,0.0626232741617357
Filling Empty Rows with Dictionary Values via For Loop Pandas,0.0626232741617357
How to create immutable dictionary that won't change its values even if they changed out of dictionary score?,0.0626232741617357
"Python Dataframe contains a list of dictionaries, need to create new dataframe with dictionary items",0.06144170295113691
combine multiple dictionaries of pandas dataframes by dictionary key and common columns,0.06048652202498356
"Using pandas.json_normalize to ""unfold"" a dictionary of a list of dictionaries",0.06048652202498356
How to handle empty dictionary while writing table with pyarrow,0.06048652202498356
Convert list of dictionaries containing another list of dictionaries to dataframe,0.06048652202498356
Pandas: Not getting the desired output when using a nested for loop to fill an empty column,0.06048652202498356
How to unpack dictionary of dictionaries into structured DataFrame,0.06048652202498356
"""ValueError: The truth value of a Series is ambiguous. Use a.empty, a.bool(), a.item(), a.any() or a.all()."" in nested if python and pandas",0.05934526689243671
"File containing dictionaries that are <class 'str'> and no commas separating the dictionaries, need to load into pandas to create csv file easily",0.05834976988823143
Replacing a nested dictionary into empty dataframe,0.05834976988823143
Convert string containing list of dictionaries in DataFrame to list of dictionaries,0.05834976988823143
Converting large string of dictionaries to dictionary,0.05834976988823143
Removing empty dataframes from nested list,0.05834976988823143
Pandas Series.tolist Incorrectly Transcribing Empty Space?,0.05731523378582205
Can you write values output by a python script to an empty list in another python script?,0.05731523378582205
Python-Camelot extracting empty tables,0.05731523378582205
"skip record if empty, blank, or has 'N/A'",0.05731523378582205
"How to not count ""NA"" as a string value and not empty cell?",0.05731523378582205
Why empty data frame message is giving?,0.05731523378582205
Pandas calling apply on an empty dataframe using the reduce option changes datatypes,0.05731523378582205
How to skip csv files who are empty?,0.05731523378582205
Pandas returning empty DF after successful merge,0.05731523378582205
Compare two data frames (Source Vs Target) and leave empty row if records not found in Target table (having same index number as source),0.05731523378582205
How to add an empty Worksheet into an existing Workbook using Pandas ExcelWriter,0.05731523378582205
not produce empty list of lists in pandas,0.05731523378582205
Pandas isin returns an error when encountering an empty DF after using concat,0.05731523378582205
Appending cell Value in Pandas for emptied cell in row,0.05731523378582205
How to insert values into a column of an empty newly created dataframe?,0.05731523378582205
Write CSV content to Excel produces empty sheets,0.05731523378582205
Pandas wide to long bringing empty DataFrame,0.05731523378582205
Retain empty lists when unnesting columns in pandas,0.05731523378582205
Fill empty columns with the number that occurred before in Python,0.05731523378582205
"pandas won't write dataframe to excel file, it remains empty",0.05731523378582205
Empty columns when inserted into into df from another df,0.05731523378582205
How to remove empty list from column?,0.05731523378582205
Make empty file for each subfolder using subfolders' name in Python,0.05731523378582205
find empty cells with support for mixed datatypes of lists and sets and ints and str,0.05731523378582205
"What's the problem with my code , that returns empty plot?",0.05731523378582205
Assigning a scalar value to an empty DataFrame doesn't appear to do anything,0.05731523378582205
labeling data points with dataframe including empty cells,0.05731523378582205
Python function execution on iterator till empty,0.05731523378582205
pandas dataframe throwing an empty list,0.05731523378582205
Folium choropleth defaults to filled rather than empty,0.05731523378582205
Processing empty data,0.05731523378582205
"dataframe.empty gives ""True"" result, which should be ""False"" imo",0.05731523378582205
How to check if an element is an empty list in pandas?,0.05731523378582205
How to insert empty rows and let data start on certain row number?,0.05731523378582205
How to create multiple empty dataframes?,0.05731523378582205
Create two columns based on single column but not when empty,0.05731523378582205
How to insert empty row before columns,0.05731523378582205
Wide to long returns empty output - Python dataframe,0.05731523378582205
Get columns names from one data frame and add them as empty columns in another data frame in pandas,0.05731523378582205
Copy first row of dataframe to empty dataframe with same columns,0.05731523378582205
Quandl returning only empty data frames for requests from 3/27/2018 to now,0.05731523378582205
Python adding empty rows in open with function,0.05731523378582205
Replacing Empty Space in Python Dataframe,0.05731523378582205
Why does pd.date_range return an empty sequence?,0.05731523378582205
How to perform merge when multiple lines are empty,0.05731523378582205
Handling empty value in Excel by pandas read_excel(),0.05731523378582205
Fill in empty value in a dataframe column with the same value if it already exists in another row,0.05731523378582205
Why is my Data frame empty after assigning values through a for loop?,0.05731523378582205
Why is my data empty when i add it to my dataframe column?,0.05731523378582205
How to append dataframe to an empty dataframe using concurrent,0.05731523378582205
"Combine two columns, ignore empty cells and add a separator",0.05731523378582205
Fill an empty column according to information from another column with pandas,0.05731523378582205
Bokeh and pandas- plotting empty graph reading data from csv,0.05731523378582205
How to have an empty first row in pandas dataframe,0.05731523378582205
Creating new rows and adding them to empty data frame,0.05731523378582205
How to get pd.Grouper() to include empty groups,0.05731523378582205
How to handle empty cells that pandas does not recognize?,0.05731523378582205
How do I remove the empty row and columns from the following output?,0.05731523378582205
How to add column with dataframe if the dataframe is not empty?,0.05731523378582205
How to change read_csv handling of empty values,0.05731523378582205
adding data to only few column of an empty dataframe in pandas for each iteration,0.05731523378582205
Appending multiple pandas dataframe using for loop but returns an empty dataframe,0.05731523378582205
Adding elements to an empty dataframe in pandas,0.05731523378582205
.csv is empty after reading it with pd.read_csv(),0.05731523378582205
Pandas merge method returning empty dataframe,0.05731523378582205
Merge columns of dataframe and fill empty digits with zero,0.05731523378582205
"Filter a data frame containing NaN values, results in empty data frame as result",0.05731523378582205
Pandas outer merge with empty data frame is causing merge warning. Why?,0.05731523378582205
Appending to an empty data frame in Pandas using a for loop,0.05731523378582205
How to fill empty column values with another dataframe's value if two other columns have matching values in Pandas?,0.05731523378582205
How to filter rows containing empty lists in a pandas DataFrame?,0.05731523378582205
xarray and netCDF file with empty variables and 0-dimensional object dataframe,0.05731523378582205
"""'x' must be a non-empty numeric vector"" rpy2 error: why is it not working?",0.05731523378582205
How can I create a boolean empty column in a pandas dataframe?,0.05731523378582205
How to check that pandas DataFrame field is a digit and isn't empty?,0.05731523378582205
Insert cells in empty Pandas DataFrame,0.05731523378582205
pandas: write empty DataFrame to HDF file,0.05731523378582205
"pandas, retaining columns when data is empty after groupby?",0.05731523378582205
"In Python, using pandasql: query return ""Empty DataFrame""",0.05731523378582205
When selecting row based on column value got empty row but column value is available in data frame,0.05731523378582205
"How can I count empty cell in .csv file? if row['PredictionString']== "" """,0.05731523378582205
Empty dataframe getting printed when there's no match,0.05731523378582205
Append a list as rows of empty dataframe,0.05731523378582205
Pandas (Python) - Problem appending list to empty dataframe with column names,0.05731523378582205
Filling empty dataframe with loop,0.05731523378582205
How to pad dataframe with empty values when add list to new column,0.05731523378582205
How to match value between columns in dataframe with empty column,0.05731523378582205
Fill missing dates-hours on dataframe with empty values,0.05731523378582205
Having trouble replacing empty strings with NaN using Pandas.DataFranme.replace(),0.05731523378582205
"Merge pandas datagrame on one key with overlapping columns, chose first non-empty",0.05731523378582205
"When converting Date entry in pandas, how to ignore empty values?",0.05731523378582205
"Pandas: is there a way to 1) add two new empty rows above every row in a dataframe, and 2) fill rows with same value?",0.05731523378582205
Pandas Merge returns empty dataframe,0.05731523378582205
"right way to add values in empty column in loop in dataframe , python",0.05731523378582205
How to skip first rows and all empty rows after that in specific column?,0.05731523378582205
How to fill an empty dataframe with certain categories in a double iteration?,0.05731523378582205
store Django models in a dataframe and get column names from it even though dataframe is empty,0.05731523378582205
How do I add a string from an Excel workbook into an empty dataframe?,0.05731523378582205
pandas dataframe groups check the number of unique values of a column is one but exclude empty strings,0.05731523378582205
DataFrame to CSV creates empty files,0.05731523378582205
pandas filter by quantiles results in an empty set,0.05731523378582205
Why is DataFrame Empty in Pandas?,0.05731523378582205
"pandas.errors.EmptyDataError, but the file is not empty",0.05731523378582205
How can I append values from an existing dataframe to an empty dataframe in for loop?,0.05731523378582205
Pandas fails to filter empty groups with DataFrameGroupBy.filter,0.05731523378582205
Removing rows/columns if one entry is empty,0.05731523378582205
Python Pandas Add empty column in the middle of a dataframe,0.05731523378582205
Calculate mean of lists in a DataFrame ignoring empty ones,0.05731523378582205
Pandas return Empty Dataframe,0.05731523378582205
How to fill empty values in a dataframe based on columns in another dataframe?,0.05731523378582205
"In python, how to locate the position of the empty rows in the middle of the file and skip some rows at the beginning dynamically",0.05731523378582205
Pandas read_csv() with one row of data returns Empty Dataframe,0.05731523378582205
populate empty list elements with strings python,0.05731523378582205
Pandas: Counting empty values in columns,0.05731523378582205
Why is my data frame empty even after I append all the article titles to the list and convert the list to a DF?,0.05731523378582205
"what is the problem with the code. It is storing empty matrix except for few places it is printing "",""",0.05731523378582205
Pandas fill in empty values based on the same ID,0.05731523378582205
Pandas filtering off empty list,0.05731523378582205
Creating new dataframe from existing dataframe columns if not empty,0.05731523378582205
Python Pandas: Delete all rows of data below first empty cell in column A,0.05731523378582205
how to remove empty spaces from my output while using findall()?,0.05731523378582205
Insert empty row/s at the end of the data,0.05731523378582205
how to fill values in empty rows with condition in python,0.05731523378582205
"Every time I try to filter dataframe by string values, my dataframe is empty. But when I try to get count value from one column, I get the number",0.05731523378582205
How can I merge one dataframe (right) into another empty dataframe (left) using the datetime index of the left and a datetime column in the right?,0.05731523378582205
Fill missing date for each group and impute empty values in Pandas,0.05731523378582205
I am not getting any value in pandas empty dataframe,0.05731523378582205
"what else could be if it is not blank, NaN or empty?",0.05731523378582205
"Using pandas, how do I get the data in the first set of columns before it runs into an empty field which is then followed up later with more data?",0.05731523378582205
Condition for empty dataframe is not satisfied,0.05731523378582205
"Filtering a dataframe returns an ""Empty Dataframe""",0.05731523378582205
"Pandas: Read excel file for specific columns, remove empty rows, create CSV",0.05731523378582205
How to exclude empty values with exporting with Pandas to csv,0.05731523378582205
How to avoid reading empty rows in pandas.read_excel,0.05731523378582205
pandas read_CSV empty column treated as NaN?,0.05731523378582205
3 of 4 plots are empty while using matplotlib in Pycharm and using plt.show(),0.05731523378582205
How to Append data in While loop into Empty DataFrame,0.05731523378582205
unite several dataframe columns into one in presence of empty or NaN in pandas,0.05731523378582205
How to create an empty table with specific schema in GBQ?,0.05731523378582205
How to skip / ignore the empty fields of rows while appending to the python dataframe line by line?,0.05731523378582205
"Flattening a list of lists, replacing empty sublists with a certain value",0.05731523378582205
"Empty column name in first column, how do I set the name?",0.05731523378582205
Create a copy of an empty dataframe and assign values to it based on criteria,0.05731523378582205
Validating empty columns with pandas_schema,0.05731523378582205
Appending values to empty dataframe returns NaN values,0.05731523378582205
Python pandas empty df but columns has elements,0.05731523378582205
How to drop the rows if two columns cells are empty?,0.05731523378582205
How to preserve rows with empty (nan) cells when doing groupby on a dataframe in python pandas,0.05731523378582205
Upload of a Pandas DataFrame to Google Cloud Storage is adding unwanted empty lines,0.05731523378582205
"After creating pandas data frame from csv, filtering results returns empty dataframe",0.05731523378582205
Using groupby and aggregate creates an empty row on top of the first data row that I can't seem to select,0.05731523378582205
Querying Dates in MongoDB returning empty df,0.05731523378582205
looping through list of pandas dataframes and make it empty dataframe,0.05731523378582205
pandas.DataFrame.loc returning empty dataframes,0.05731523378582205
Python checking if row is empty after slicing,0.05731523378582205
Fill empty Dataframe with filled Dataframe and different column names,0.05731523378582205
Check if datetime column is empty,0.05731523378582205
why is the dataframe based on value in a column empty?,0.05731523378582205
Pandas empty data due to no columns to parse,0.05731523378582205
Python : How to find the count of empty cells in one column based on another column element wise?,0.05731523378582205
Filtering by string giving me empty results,0.05731523378582205
Remove any row with empty columns,0.05731523378582205
"If column and row value are empty or whitespace srping, full with value from a different particular column",0.05731523378582205
Missing values in Pandas DataFrame are always empty when written to CSV,0.05731523378582205
How to fill empty index or empty row based on another column value?,0.05731523378582205
Correlation Matrix using pandas with empty values,0.05731523378582205
Python/Pandas - Writing empty cells to a csv file (instead of zeros),0.05731523378582205
How to handle Empty 'DataFrame': no numeric data to plot error to take string on the graphs,0.05731523378582205
Appending empty dataframe with for loop over CSV files,0.05731523378582205
Bokeh Gives me an Empty Plot with ColumnDataSource,0.05731523378582205
Remove empty fields in json file,0.05731523378582205
"Populating several values in an empty column in a row, based on a value from another column",0.05731523378582205
Remove a row in a dataframe with empty series,0.05731523378582205
df.iloc returning empty when locs are present and data is present,0.05731523378582205
Dataframe Returning Empty - BeautifulSoup,0.05731523378582205
Check if csv file is empty in pandas,0.05731523378582205
DataFrame and Lists returning empty after re-running script,0.05731523378582205
Adding index to the Empty Dataframe pandas Python 3.5.0,0.05731523378582205
dt.time.between returns an empty column in pandas,0.05731523378582205
Adjust variable if I have a empty table,0.05731523378582205
"pandas DataFrame: get cells in column that are NaN, None, empty string/list, etc",0.05731523378582205
Loading a dataframe with check in pyspark is giving me empty dataframe,0.05731523378582205
Pandas empty string to integer,0.05731523378582205
"Pandas df histo, format my x ticker and include empty",0.05731523378582205
Pandas groupby on empty DataFrame results in no columns,0.05731523378582205
Merging two Dataframes returns empty dataframe,0.05731523378582205
"Removing ""empty"" values from string values in dataframe cells",0.05731523378582205
How to fill and merge df with 10 empty rows?,0.05731523378582205
Pandas DataFrame.empty() gives TypeError: 'bool' object is not callable,0.05731523378582205
Unable to replace empty values with 0 in a list of tuples with pandas,0.05731523378582205
"Removing empty space before ""/"" in DataFrame",0.05731523378582205
Pandas DataFrame concatenation in for loop returns empty DataFrame,0.05731523378582205
How to groupby with the criteria that groups' set union is not the empty set?,0.05731523378582205
str.contains based on another column is returning values for empty strings,0.05731523378582205
Creating empty columns for a csv using PANDAS and writing to the file,0.05731523378582205
How to know if a sliced xarray Dataset/DataArray is empty?,0.05731523378582205
Reduce time to fill empty dataframe cells in Pandas (Python),0.05731523378582205
why I get empty when I use b.iloc[10:20] = b.iloc[20:30]?,0.05731523378582205
python pandas groupby unexpected empty column,0.05731523378582205
Printing out values of rows using itertuples() that differ in columns (to not print out empty cells),0.05731523378582205
Drawing a heatmap in BokeH displays empty graph,0.05731523378582205
Efficient way to empty a pandas dataframe using its mutable alias property,0.05731523378582205
Why does the dataframe become empty after merging through pandas?,0.05731523378582205
How to delete empty data rows,0.05731523378582205
Cannot plot dataframe as barh because TypeError: Empty 'DataFrame': no numeric data to plot,0.05731523378582205
How to remove empty values from the pandas DataFrame from a column type list,0.05731523378582205
How to insert multiple consecutive columns with empty values to python dataframe,0.05731523378582205
Fill up empty cells in the dataframe with conditions,0.05731523378582205
Add new column in pandas dataframe using empty string or the value from column A depending on the value on column B,0.05731523378582205
Create message in console when specific dataframe cells are empty,0.05731523378582205
Pandas : Replace NaNs with mean of 'n' nearest non-empty values in column,0.05731523378582205
how to merge two dataframe's one having empty data,0.05731523378582205
how to fill an empty dataframe column in pandas python,0.05731523378582205
Pandas - only keep first instance of a column value (replace rest with empty string),0.05731523378582205
Copy values only to a new empty dataframe with column names - Pandas,0.05731523378582205
modification of skipping empty list and continuing with function,0.05731523378582205
Get the number of empty skipped rows in pandas when parsing,0.05731523378582205
Enter row of data from Pandas Dataframe to next empty row in a csv file,0.05731523378582205
How to drop the rows having two empty column in pandas?,0.05731523378582205
Pandas - how to coerce only empty string values in dataframe column to NaN,0.05731523378582205
Removing empty dataframes inside a dictionary,0.05731523378582205
Pandas - `loc` returns empty DataFrame on all but one column,0.05731523378582205
How to fill empty cell value in pandas with condition,0.05731523378582205
Replacing Empty fields with good data based on other columns in pandas,0.05731523378582205
Add empty row if a condition is met Pandas,0.05731523378582205
