Title,Correlation Score
How to do group by on a multiindex in pandas?,0.03846153846153846
Using Pandas to get the closest value to a timestamp,0.03846153846153846
Add Column to Pandas DataFrame Not in Place,0.03846153846153846
Gobal Variable but inside the while loop and not in a function,0.03846153846153846
Pandas rolling_mean with center keyword leaves last values as NaN,0.03846153846153846
Calculating expanding mean on 2 columns simultaneously,0.03846153846153846
Change a pandas DataFrame column value based on another column value,0.03846153846153846
Interpolation Function,0.03846153846153846
Suppress output of object when plotting in ipython,0.03846153846153846
Behaviour of rolling_mean,0.03846153846153846
problems with reindexing dataframes: Reindexing only valid with uniquely valued Index objects,0.03846153846153846
"Pandas groupby size ""count"" intermittent under-count",0.03846153846153846
Time series through pandas,0.03846153846153846
pandas dataframe row change type,0.03846153846153846
Pandas read_csv and remove daylight saving,0.03846153846153846
Ginput giving wrong date for datetimeindex,0.03846153846153846
Weird Data manipulation in Pandas,0.03846153846153846
understanding MultiIndex,0.03846153846153846
Compute the nth day from the first event in Pandas,0.03846153846153846
Pandas DataFrame with MultiIndex: efficient way of checking duplicate elements in one of the indices,0.03846153846153846
How to accurately convert a matrix to columnar format in Pandas?,0.03846153846153846
Rolling median in python,0.03846153846153846
Installing Pandas with Python 2.5 on Windows,0.03846153846153846
Find the max of two or more columns with pandas,0.03846153846153846
Pandas datetime index from seconds series,0.03846153846153846
How do I combine two dataframes?,0.03846153846153846
Pandas DataFrame Apply,0.03846153846153846
Efficiently construct Pandas DataFrame from large list of tuples/rows,0.03846153846153846
How to group pandas DataFrame entries by date in a non-unique column,0.03846153846153846
Python Pandas: to_panel() from dataframe returns weird numbers for binary variable,0.03846153846153846
Can I export a Python Pandas dataframe to MS SQL?,0.03846153846153846
pandas row specific apply,0.03846153846153846
Pandas: how to plot yearly data on top of each other,0.03846153846153846
Pandas AssertionError: Must be mixed type DataFrame,0.03846153846153846
Selecting from pandas dataframe (or numpy ndarray?) by criterion,0.03846153846153846
JS dataTables from pandas,0.03846153846153846
Pandas file IO Read Error,0.03846153846153846
Assigning column names from a list to a table,0.03846153846153846
Using pytables and pandas with Django,0.03846153846153846
pandas define a season over which to calculate statistics,0.03846153846153846
Pandas: Exponential smoothing function for column,0.03846153846153846
Using python rolling_corr,0.03846153846153846
Repeated measures transform in Pandas,0.03846153846153846
Python pandas: select columns with all zero entries in dataframe,0.03846153846153846
Keep only date part when using pandas.to_datetime,0.03846153846153846
How to build groups with read_csv()?,0.03846153846153846
(In Pandas) Why is frequency information lost when storing in HDF5 as a Table?,0.03846153846153846
Append new columns to HDFStore with pandas,0.03846153846153846
Filter on Pandas DataFrame with datetime columns raises error,0.03846153846153846
Is it possible to insert a row at an arbitrary position in a dataframe using pandas?,0.03846153846153846
How to accumulate unique sum of columns across pandas index,0.03846153846153846
"Pandas, large data, HDF tables and memory usage when calling a function",0.03846153846153846
pandas combine_first with particular index columns?,0.03846153846153846
pandas plot time series ['numpy.ndarray' object has no attribute 'find'],0.03846153846153846
"Using pandas.io.sql.read_frame, can I parse_dates, as in read_csv?",0.03846153846153846
How to broadcast a scalar to a filtered column in a pandas dataframe,0.03846153846153846
From password-protected Excel file to pandas DataFrame,0.03846153846153846
Strategies for handling nominal values with numerical attributes,0.03846153846153846
"""Reindexing only valid with uniquely valued Index objects""",0.03846153846153846
Apply function to pandas groupby,0.03846153846153846
statmodels regression plots not working with pandas datatypes,0.03846153846153846
"Python - time series alignment and ""to date"" functions",0.03846153846153846
Pandas dataframe get next (trading) day in dataframe,0.03846153846153846
Apply function then Filter DataFrame,0.03846153846153846
"Using a User Inputted Value to Filter Values (Pandas, Python 3)",0.03846153846153846
Graphing two dataframe columns on different axis with different scales,0.03846153846153846
Pandas python barplot by subgroup,0.03846153846153846
Filtering one dataframe by two fields in another dataframes,0.03846153846153846
Python Pandas Groupby-apply duplicate execution,0.03846153846153846
pandas - extremely extremely slow,0.03846153846153846
How to resample data in a single dataframe within 3 distinct groups,0.03846153846153846
How to use a for loop to append the data frame generated from a function in python,0.03846153846153846
How can I optimize/vectorize this looped assignment on a DataFrame?,0.03846153846153846
Calculating and plotting count ratios with Pandas,0.03846153846153846
How can I change the original DataFrame from a group?,0.03846153846153846
Pandas Dynamic Row-Based Equity Calculation,0.03846153846153846
Get first element of Series without knowing the index,0.03846153846153846
Set cell value to NaN under certain conditions using lambda map in Pandas,0.03846153846153846
Pandas Interpolate Returning NaNs,0.03846153846153846
pandas apply function that returns multiple values to rows in pandas dataframe,0.03846153846153846
Pandas switching Timestamp when using .unique(),0.03846153846153846
Delete rows where a level of multindex is nan (Pandas),0.03846153846153846
pandas set cell format in excel writer,0.03846153846153846
Idiomatic way of only selecting certain rows from a dataframe (whose index exists in other dataframes),0.03846153846153846
pandas resample dealing with missing data,0.03846153846153846
Plot mean and std. dev. at specific hourly ticks using Pandas,0.03846153846153846
Aligning individual columns in pandas to_latex,0.03846153846153846
select last set of rows in time range with DateFrameGroupBy object,0.03846153846153846
Pandas transposition inside dataframe,0.03846153846153846
Calculate Levenshtein distance using pandas DataFrames,0.03846153846153846
invalid index to scalar variable error related to pandas read_csv separator,0.03846153846153846
Show all the nan in pandas?,0.03846153846153846
Advanced averaging with multiindex dataframe in pandas,0.03846153846153846
data mungling in python-pandas,0.03846153846153846
Load list with date value into pandas dataframe and plot activity over time,0.03846153846153846
Iterate on Groupby Object's fields,0.03846153846153846
Numpy nanmean and dataframe (possible bug?),0.03846153846153846
Pandas exclude row from dataframe if the value is absent in the other dataframe,0.03846153846153846
funnel analysis with pandas (large data set),0.03846153846153846
Pandas: reindex and interpolate non-contiguous data,0.03846153846153846
Counting the number of results for a pandas.loc search,0.03846153846153846
read_csv using uncommon delimiters,0.03846153846153846
NotSupportedError: (NotSupportedError) Authentication plugin 'mysql_old_password' is not supported,0.03846153846153846
pandas.Panel best practice: what axis should hold the DatetimeIndex?,0.03846153846153846
Plot table and display Pandas Dataframe,0.03846153846153846
"Reorder Rows into Columns in Pandas (Python 3, Pandas)",0.03846153846153846
How to use colormaps to color plots of Pandas DataFrames,0.03846153846153846
Python pandas: replace select values in groupby object,0.03846153846153846
Using rolling_apply with a function that requires 2 arguments in Pandas,0.03846153846153846
Pandas equivalent of SQL where on multiple tables,0.03846153846153846
Python: Convert timedelta to int in a dataframe,0.03846153846153846
From tuples to multiple columns in pandas,0.03846153846153846
Calculating column rows from other column rows iteration,0.03846153846153846
Plotting a histogram in Pandas with very heavy-tailed data,0.03846153846153846
pandas dataframe selecting the nan indexes,0.03846153846153846
Plotting Pandas Time Data,0.03846153846153846
Writing full contents of Pandas dataframe to HTML table,0.03846153846153846
How to convert wide to long format with hourly values and datetime index?,0.03846153846153846
Round each number in a Python pandas data frame by 2 decimals,0.03846153846153846
"Pandas, convert column of unicodes to column of list of strings",0.03846153846153846
Pandas merge with logic,0.03846153846153846
Is there a way to store a pandas data frame in R format?,0.03846153846153846
Pandas create new dataframe choosing max value from multiple observations,0.03846153846153846
Pandas Panel as numpy multidimensional array,0.03846153846153846
Understanding groupby and pandas,0.03846153846153846
Large dataframes with many object columns in pandas,0.03846153846153846
Populating a Pandas DataFrame frome another DataFrame based on column names,0.03846153846153846
How to Add a New Column With Selected Values from Another Column In Python,0.03846153846153846
Find String Pattern Match in Pandas Dataframe and Return Matched Strin,0.03846153846153846
Index into dataframe by column value,0.03846153846153846
How to allow custom Class parameter to be tab-completed in ipython?,0.03846153846153846
"Set Pandas Data Frame elements to """" if first column is False",0.03846153846153846
How can I assign a value to a different column for each row in a dataframe?,0.03846153846153846
how to add a const time delta to an index column in python pandas?,0.03846153846153846
Pandas Dataframe - Set Rows Equal to Other Rows,0.03846153846153846
Error Install Pandas for Python on Mac OS X,0.03846153846153846
Map string values in a Pandas Dataframe with integers,0.03846153846153846
Why dataframe.values is very slow,0.03846153846153846
Dynamically appending to a Pandas Dataframe,0.03846153846153846
Returning two values from pandas.rolling_apply,0.03846153846153846
Setting a pandas index or transposing,0.03846153846153846
Pandas how to apply multiple functions to dataframe,0.03846153846153846
Pandas warn_bad_lines=False and error_bad_lines=False is still trying to parse bad lines,0.03846153846153846
Combine groups after iteration,0.03846153846153846
How to make an all-vs-one group of scatterplots - a list of columns against one target column,0.03846153846153846
replace rows in a pandas data frame,0.03846153846153846
Python Pandas groupby and returning result to original Pandas Data Frame,0.03846153846153846
Filtering out values in specific columns with Pandas,0.03846153846153846
Pretty-print a Pandas DataFrame groupby,0.03846153846153846
Calculate increase between periods or rows,0.03846153846153846
"Pandas, dataframe with a datetime64 column, querying by hour",0.03846153846153846
"how to read ""\n\n"" in python module pandas?",0.03846153846153846
Pandas div using index,0.03846153846153846
Pandas remove all elements from one dataframe from another,0.03846153846153846
Add index name to a dataframe / serie,0.03846153846153846
How to normalize data efficently while INSERTing into SQL table (Postgres),0.03846153846153846
How to move my pandas dataframe to d3?,0.03846153846153846
"How to delete ""1"" followed by trailing zeros from Data Frame row values ?",0.03846153846153846
Why does vector lookup in pandas DataFrame not work but it does work with a Series/lookup on date,0.03846153846153846
Automatic (whisker-sensitive) ylim in boxplots,0.03846153846153846
Pandas to D3. Serializing dataframes to JSON,0.03846153846153846
Pandas IndexError when opening Excel file,0.03846153846153846
legend outside and adjusting subplot size shrink picture,0.03846153846153846
How to append data to a panel which is stored in HDFStore file,0.03846153846153846
parallel coordinates plot for continous data in pandas,0.03846153846153846
How do I convert a row from a pandas DataFrame from a Series back to a DataFrame?,0.03846153846153846
Pandas DataFrame merge summing column,0.03846153846153846
Define Pandas DataFrame as composite boolean condition,0.03846153846153846
Append to dataframe from another with calculations,0.03846153846153846
Convert Pandas dataframe to csv string,0.03846153846153846
Custom sorting with Pandas,0.03846153846153846
Pandas printing ALL dtypes,0.03846153846153846
Convert Float to String in Pandas,0.03846153846153846
Column mismatch writing a Python Pandas data frame to csv in unix vs windows,0.03846153846153846
Pandas: Right way to query timeseries with DateTime object,0.03846153846153846
Time reindexing,0.03846153846153846
How to select multiple columns based on their names in python?,0.03846153846153846
Missing data when perform df.sum(),0.03846153846153846
flatten a deep json structure with jq for pandas,0.03846153846153846
Pandas Install Error on Mac,0.03846153846153846
Pandas Column Calculations in PivotTable,0.03846153846153846
"How to resample pandas series monthy (not end, not start)?",0.03846153846153846
add new column and calculate ratio,0.03846153846153846
Python Pandas Create Records from Complex Dictionary,0.03846153846153846
"Data frame group ID, create value: count in column",0.03846153846153846
How do I release memory used by a pandas dataframe?,0.03846153846153846
Adding Arbitrary points on pandas time series using Dataframe.plot function,0.03846153846153846
Pandas insert alternate blank rows,0.03846153846153846
How do I remove blank elements from an AstroPy table?,0.03846153846153846
Merge two dataframes with pandas,0.03846153846153846
how to use *and* in pandas loc API,0.03846153846153846
Can't convert a Python List to timeSeries,0.03846153846153846
Applying lambda function to Dataframe to get the datatypes,0.03846153846153846
Data Conversion Error while applying a function to each row in pandas Python,0.03846153846153846
Convert text data from requests object to dataframe with pandas,0.03846153846153846
pandas: pandas.DataFrame.describe returns information on only one column,0.03846153846153846
plot sensor boolean data matplotlib,0.03846153846153846
ValueError: You must specify a freq or x must be a pandas object with a timeseries index,0.03846153846153846
Resample a 'tidy' dataframe with pandas,0.03846153846153846
"removing rows with any column containing NaN, NaTs, and nans",0.03846153846153846
Pandas sql equivalent,0.03846153846153846
pandas dataframe look ahead value,0.03846153846153846
(Python) How can I turn a csv file with thousands of 10 digit numbers into decimal? (10dig -> 3dig+7decimal),0.03846153846153846
Convert non-strict JSON Amazon SNAP metadata to Pandas DataFrame,0.03846153846153846
write dataframe to .xlsx too slow,0.03846153846153846
Pandas: resample time group names after a dataframe groupby,0.03846153846153846
Creating Relational Database in Pandas and SQL?,0.03846153846153846
Broadcasting logical operators along a different axis,0.03846153846153846
Python pandas selction of rows on unknown number of parameters,0.03846153846153846
speed up slicing dicing of customers mysql,0.03846153846153846
Boolean filter using a timestamp value on a dataframe in Python,0.03846153846153846
How to draw a graphical count table in pandas,0.03846153846153846
How to group by a column and get a mean of freashest n records?,0.03846153846153846
collect rows and columns based on id matching,0.03846153846153846
scikit-learn - train_test_split and ShuffleSplit yielding very different results,0.03846153846153846
"Indexing dataframe by datetime python ignoring hour, minutes, seconds",0.03846153846153846
Optimal way to add small lists to Pandas DataFrame,0.03846153846153846
Error when trying to write a matplotlib plot from Pandas DataFrame to pdf,0.03846153846153846
pandas read_csv create new column and usecols at the same time,0.03846153846153846
Best way to combine datetime in pandas dataframe when times are close,0.03846153846153846
LabelEncoder().fit_transform vs. pd.get_dummies for categorical coding,0.03846153846153846
Python Convert Datetime from csv for matplotlib,0.03846153846153846
Loop over Colums in Pandas Dataframe to create multiple plots with one x variable and mulitple y (colum values),0.03846153846153846
ValueError: Could not broadcast during Pandas Dataframe Apply When Chunking,0.03846153846153846
How to sum columns in pandas and add the result into a new row?,0.03846153846153846
How to create rows and columns in a .csv file from .log file,0.03846153846153846
geopandas AttributeError: 'MultiPolygon' object has no attribute 'exterior',0.03846153846153846
Pandas Group to Divide by Max,0.03846153846153846
How to compare four columns of pandas dataframe at a time?,0.03846153846153846
Python pandas most pythonic way to calculate rolling betas on a DataFrame,0.03846153846153846
extend a pandas datetimeindex by 1 period,0.03846153846153846
Pandas: ignore null values when using .astype(str)?,0.03846153846153846
Python compare two columns of a list,0.03846153846153846
Using space in pd.read_hdf column while reading,0.03846153846153846
"How to ""flatten"" a Panda Panel by summing up specific columns",0.03846153846153846
"row to columns while keeping part of dataframe, display on same row",0.03846153846153846
Left merge leads to larger rows than in left dataframe,0.03846153846153846
Pandas Sort_Values generates error message:,0.03846153846153846
How to set correct x axis with datetime index so that intervals are proper in the Bokeh plot?,0.03846153846153846
"Pandas - Concat strings after groupby in column, ignore NaN, ignore duplicates",0.03846153846153846
basic groupby operations in Dask,0.03846153846153846
Correlation: make a graph,0.03846153846153846
Creating new pandas columns containing count of distinct entries,0.03846153846153846
Mark date by column contents in pandas (vectorized),0.03846153846153846
pandas dataframe: meaning of .index,0.03846153846153846
RE pandas resample,0.03846153846153846
How to create pandas dataframe from python dictionary?,0.03846153846153846
Filter data with groupby in pandas,0.03846153846153846
Subtracting a fixed date from a column in Pandas,0.03846153846153846
create new pandas dataframe column based on if-else condition with a lookup,0.03846153846153846
Pandas DatetimeIndex converting dates to 1970,0.03846153846153846
Python: how convert values in column to one encoding,0.03846153846153846
matching a substring in a dateframe column,0.03846153846153846
Splitting a data file in python or pandas,0.03846153846153846
Search and delete duplicate time-series data in pandas dataframe,0.03846153846153846
Repeating python code multiple times - is there a way of condensing it?,0.03846153846153846
Distribute value equally across NaN in pandas,0.03846153846153846
How to trasfer a string to DataFrame,0.03846153846153846
Pandas dataframe wrong number of rows,0.03846153846153846
"Parsing Excel with Python Pandas 0.18 => 23,999 (European style) gets parsed as 23999",0.03846153846153846
first date of week greater than x,0.03846153846153846
drop rows with errors for pandas data coercion,0.03846153846153846
How to find location of Pandas installed on Windows,0.03846153846153846
Flag similarities between dataframes in new column,0.03846153846153846
"Reading random rows of a large csv file, python, pandas",0.03846153846153846
Create dataframes from unique value pairs by filtering across multiple columns,0.03846153846153846
Modifying a subset of rows in a pandas dataframe using a different column to apply function,0.03846153846153846
How do I set ylim for subplots using Pandas dataframe?,0.03846153846153846
Groupby with pandas,0.03846153846153846
Pandas select the second to last column which is also not nan,0.03846153846153846
"How to Parse records from API call, from within the API call?",0.03846153846153846
Python equivalent of Excel's PERCENTILE.EXC,0.03846153846153846
Index must be called with a collection of some kind: assign column name to dataframe,0.03846153846153846
Applying iterative function to every group in pandas DataFrame,0.03846153846153846
Categorize Data in a column in dataframe,0.03846153846153846
"""ValueError: unknown locale: UTF-8"" when importing pandas in python 2.7",0.03846153846153846
Pandas: using groupby with condition,0.03846153846153846
Python: Pandas Series - Why use loc?,0.03846153846153846
"HDF5 with Python, Pandas: Data Corruption and Read Errors",0.03846153846153846
python-pandas: dealing with NaT type values in a date columns of pandas dataframe,0.03846153846153846
how to change default precision in python,0.03846153846153846
No output with .duplicated in pandas?,0.03846153846153846
different amount of rows after merging two dataframes with pandas,0.03846153846153846
How do i change color based on value of an HTML table generated from a pd.DataFrame using to_html,0.03846153846153846
Panda DataFrame.groupby() wierd behaviour with numpy array,0.03846153846153846
Panda's dataframe split a column into multiple columns,0.03846153846153846
Selecting rows from Pandas Series where rows are arrays,0.03846153846153846
how to add a new column to a dataframe in python and insert d/f values in it for d/f rows?,0.03846153846153846
Pandas Datetime Formatting,0.03846153846153846
Improving the speed of cross-referencing rows in the same DataFrame in pandas,0.03846153846153846
Pandas - Datetime Manipulations Not Using Apply or Map,0.03846153846153846
Pandas: how to edit values in a column of a .csv file?,0.03846153846153846
Pandas Dataframe and Converting DateTime Objects,0.03846153846153846
"All rows within a given column must match, for all columns",0.03846153846153846
Can I append to a compressed stream with pandas?,0.03846153846153846
How to remove common rows in two dataframes in Pandas?,0.03846153846153846
Grab data from one cell and write it to a json string in Pandas,0.03846153846153846
Trying to convert a CSV into JSON in python for posting to REST API,0.03846153846153846
Pandas Dataframe to Seaborn Grouped Barchart,0.03846153846153846
Parallelize groupby with multiple arguments,0.03846153846153846
Cannot convert pandas column from string to int,0.03846153846153846
change data structure of pandas dataframe,0.03846153846153846
Pandas: substitute NA's with shadow values obtained from contemporary non missing values in other column,0.03846153846153846
How to create a dummy column from a string expression in pandas data frame?,0.03846153846153846
keep rows that have data in list of columns python,0.03846153846153846
modify string values in dataframe column,0.03846153846153846
Filtering DataFrame by list of substrings,0.03846153846153846
Specifying number of decimal places for individual fields in pandas to csv,0.03846153846153846
"Two Dataframes, one with more columns than the other -> Subtract and Combine",0.03846153846153846
Validating missing mandatory columns in pandas read_csv command,0.03846153846153846
Plot proportion from Dataset,0.03846153846153846
Simple way to create multiple columns with one row from multiple rows sharing the same key in pandas,0.03846153846153846
How to store large columnar text+numeric data in Python?,0.03846153846153846
"pandas, convert DataFrame to MultiIndex'ed DataFrame",0.03846153846153846
pandas groupby: building multiple columns efficiently,0.03846153846153846
How to determine column values changing in a particular direction?,0.03846153846153846
reading from file and manipulate in python,0.03846153846153846
Cannot assign row in pandas.Dataframe,0.03846153846153846
multiheader pandas dataframe,0.03846153846153846
"Want to know the diff among pd.factorize, pd.get_dummies, sklearn.preprocessing.LableEncoder and OneHotEncoder",0.03846153846153846
pandas how to check dtype for all columns in a dataframe?,0.03846153846153846
why can?? the function DataFrame.apply change the DataFrame values,0.03846153846153846
How this converters can not work?,0.03846153846153846
Latency heatmap in python?,0.03846153846153846
Most efficient way to pass data from one pandas DataFrame to another,0.03846153846153846
Converting from hours and minutes to total minutes in Python,0.03846153846153846
Getting a mongo collection array into a python dataframe using pymongo,0.03846153846153846
python - pandas - O() Big O complexity of grouping and summing a data frame,0.03846153846153846
Using pandas to summarize and plot data,0.03846153846153846
How to modify all rows of duplicates values in a Pandas DataFrame,0.03846153846153846
Merge dataframes with loops,0.03846153846153846
pandas Read undelimited text file to dataframe,0.03846153846153846
Problems while merging two pandas dataframes with different shapes?,0.03846153846153846
Python Pandas from dictionary,0.03846153846153846
Pandas replace selective data with new set,0.03846153846153846
using pandas dataframe group agg function,0.03846153846153846
Complex function for getting combinations of one column with other,0.03846153846153846
Applying a function to only part of a Pandas Dataframe columns,0.03846153846153846
formatting a .txt file in pandas,0.03846153846153846
how to get rows based on Email id with condition where Count is max or latest date,0.03846153846153846
How to create a new column to a pandas dataframe that was created after using apply()?,0.03846153846153846
Pandas Median on index not values,0.03846153846153846
