Title,Correlation Score
"How do I get conversion with ""OverflowError: Python int too large to convert to C long"" error working on Windows Server 2012?",0.03846153846153846
How to do iterations to change dummy variable in multiple columns from 1 to 0 in Python and Pandas?,0.03846153846153846
Parsing old tweets and putting their attributes into a Pandas dataframe,0.03846153846153846
How to remove data from DataFrame permanently,0.03846153846153846
How to plot one column in different graphs?,0.03846153846153846
How can I divide up a Pandas column based on its values?,0.03846153846153846
How to check values of column in one dataframe available or not in column of another dataframe?,0.03846153846153846
append pandas series in loop,0.03846153846153846
Assigning float as a dictionary key changes its precision (Python),0.03846153846153846
How to search datetime index and place None-values to another variables whenever it is weekend Python,0.03846153846153846
Pandas: Filter in rows that have a Null/None/NaN value in any of several specific columns,0.03846153846153846
"Take union of two columns, Python + Pandas",0.03846153846153846
"Pandas crosstab, but with values from aggregation of third column",0.03846153846153846
"Cannot get pandas to open CSV [Python, Jupyter, Pandas]",0.03846153846153846
How to calculate the values of a pandas DataFrame column depending on the results of a rolling function from another column,0.03846153846153846
pandas histogram: plot histogram for each column as subplot of a big figure,0.03846153846153846
Processing data with different number of features,0.03846153846153846
Can a pandas DataFrame hold non-scalar values?,0.03846153846153846
Select Columns in pandas DF,0.03846153846153846
Split pandas dataframe by column variable,0.03846153846153846
Pandas Ffill on rows that contain only NaN,0.03846153846153846
pandas groupby aggregation results from another dataframe,0.03846153846153846
What's the best way to serialize a Dataframe inline?,0.03846153846153846
Global dataframes - good or bad,0.03846153846153846
python pandas assigning to existing dataframe in iteration,0.03846153846153846
Stacking in pandas dataframe based on column name,0.03846153846153846
Python Pandas replace replaces wrong,0.03846153846153846
Groupby and Cumulative count in Pandas,0.03846153846153846
How to remove multiple columns that end with same text in Pandas?,0.03846153846153846
Data Transformation in Python,0.03846153846153846
Upgrading pandas on linux,0.03846153846153846
df.set_index() on datetime objects list column for future dates not working.,0.03846153846153846
Store object as datetime before while loop,0.03846153846153846
Condition in pandas dataframe,0.03846153846153846
set list as value in a column of a pandas dataframe,0.03846153846153846
Pandas: Summarize table based on column value,0.03846153846153846
How to fix size exceeds expected in python 3,0.03846153846153846
Delete columns with extremely unequally distributed values from pandas dataframe,0.03846153846153846
"""Anti-merge"" in pandas (Python)",0.03846153846153846
"How to use applymap, lambda and dataframe together to filter / modify dataframe in python?",0.03846153846153846
How to add a column to a multi-indexed DataFrame?,0.03846153846153846
Struggling with regex in Pandas,0.03846153846153846
Deleting rows with certain keywords of csv file,0.03846153846153846
"two steps filtering, pandas",0.03846153846153846
Pandas - return a dataframe after groupby,0.03846153846153846
Change column in df from column from another,0.03846153846153846
How to loop rows and columns in pandas while replacing values with a constant increment,0.03846153846153846
Calculate count of rows matching a condition in a pandas frame (if possible using sortedness of the data),0.03846153846153846
ValueError when apply function to data frame in python-pandas,0.03846153846153846
ValueError: Cannot cast DatetimeIndex to dtype datetime64[us],0.03846153846153846
How to get the max/min value in Pandas DataFrame when nan value in it,0.03846153846153846
Pandas: use groupby to count difference between dates,0.03846153846153846
Pandas rolling apply to update the Series for next iteration?,0.03846153846153846
Value Counts of Column Slice to Contain All Possible Unique Values in Column,0.03846153846153846
pandas pivot_table with dates as values,0.03846153846153846
using a variable name for a column name in pandas,0.03846153846153846
Make console-friendly string a useable pandas dataframe python,0.03846153846153846
Pandas still getting SettingWithCopyWarning even after using .loc,0.03846153846153846
How to filter and print entire row via index in pandas,0.03846153846153846
"How should I go about geolocating 1,100,000 lines of coordinate information?",0.03846153846153846
Remove cancelling rows from Pandas Dataframe,0.03846153846153846
Merge dataframes on nearest datetime / timestamp,0.03846153846153846
Check if a row in one data frame exist in another data frame,0.03846153846153846
"Convert ""slightly inconsistent"" Pandas Column to DateTime",0.03846153846153846
Shortest way to browse an LMDB in pandas under jupyter notebook,0.03846153846153846
Different box plots on the same oX position,0.03846153846153846
How to do time diff in each group on Pandas in Python,0.03846153846153846
Pandas - Explanation on apply function being slow,0.03846153846153846
How to select several rows in a dataframe based on index in pandas,0.03846153846153846
No error while trying to delete row with a keyvalue,0.03846153846153846
add one column (subtraction) to a dataframe with python,0.03846153846153846
Pandas compare columns of list,0.03846153846153846
Compare Pandas dataframes and add column,0.03846153846153846
How to rank DataFrame by subgroup,0.03846153846153846
.value_counts() giving truncated results,0.03846153846153846
Pandas rank based on several columns,0.03846153846153846
python pandas read various dataframe from same excel sheet,0.03846153846153846
"How can I make a Pandas data_frame column based on ""If any observation in a particular column meets a condition, then True?""",0.03846153846153846
How to scan a pandas dataframe for all values greater than something and returns row and column number corresponding to that value?,0.03846153846153846
Python pandas: store Series subclass as a DataFrame column,0.03846153846153846
harmonic mean of column in pandas,0.03846153846153846
A more efficient way of repeating pandas rows for each row in another data frame?,0.03846153846153846
Mapping data from 2 dataframes in pandas,0.03846153846153846
Spark converting Pandas df to S3,0.03846153846153846
Python (Pandas) error 'the label [Algeria] is not in the [index]',0.03846153846153846
Why does it take so long to create a SparseDataFrame (Python pandas)?,0.03846153846153846
Pandas - split large excel file,0.03846153846153846
Python Pandas: returning more then one field value when applying function to a data frame row,0.03846153846153846
what is the quickest way to determine if an array is sorted?,0.03846153846153846
Python PANDAS df.duplicated and df.drop_duplicated not finding all duplicates,0.03846153846153846
Replace and add data in pandas automatically ??ith some filter??<python><python-2.7><pandas><replace>,0.03846153846153846
If statement using Pandas Python,0.03846153846153846
Determining Pandas Column DataType,0.03846153846153846
Count occurence of row while looping through dataframe,0.03846153846153846
how to search particular value and modify it in pandas DataFrame?,0.03846153846153846
Reshape column to multiple columns,0.03846153846153846
Does pandas have a default fill value when constructing a dataframe of a specific dtype?,0.03846153846153846
How to use pd.apply with my own custom function that take 1 input argument,0.03846153846153846
How to delete fraction of rows that has specific attribute value from pandas data frame,0.03846153846153846
Select DataFrame data base on series value,0.03846153846153846
How do I remove numbers and/or parenthesis from names in a DataFrame column,0.03846153846153846
Pandas idiomatic way to custom fillna,0.03846153846153846
Add a column in dataframe conditionally from values in other dataframe python,0.03846153846153846
Pandas merge how to avoid unnamed column,0.03846153846153846
Python: Pandas: Sort columns by cluster algorithm,0.03846153846153846
pandas dataframe : add & remove prefix/suffix from all cell values of entire dataframe,0.03846153846153846
resample irregularly spaced data in pandas,0.03846153846153846
Is there a way to select a column that is an index in pandas?,0.03846153846153846
Pandas read_excel() with multiple sheets and specific columns,0.03846153846153846
Python pandas write resulted dataframe to xlsm without losing the macro,0.03846153846153846
Python JSON to Pandas Dataframe,0.03846153846153846
Mapping function with specific string in Pandas,0.03846153846153846
pandas: merging dataframes and replacing values,0.03846153846153846
Pandas multilevel index to and from sql,0.03846153846153846
Pandas - Remove index column,0.03846153846153846
How to perform correlation between categorical columns,0.03846153846153846
how to implement a randlong in numpy,0.03846153846153846
plot pandas dataframe two columns,0.03846153846153846
Pandas group by cumsum keep columns,0.03846153846153846
Comparing dates of values in 2 dataframes to decide output,0.03846153846153846
convert mongodb collection to panda dataframe,0.03846153846153846
Pandas Dataframe to Code,0.03846153846153846
Add json elements to a pandas data frame,0.03846153846153846
Can I group files by Date and ID and do diff on them?,0.03846153846153846
Pandas -selecting data from last minute of hour for 24hr data,0.03846153846153846
"How to overlay data over a ""day period"" in Pandas for plotting",0.03846153846153846
moving window in numpy with dynamic stride and window size,0.03846153846153846
Pandas style function to highlight specific columns,0.03846153846153846
Is my pandas DataFrame selection bug-free?,0.03846153846153846
Quick ways to fill the missing values of a pandas dataframe with complicated rules,0.03846153846153846
Get pandas groupby object to ignore missing dataframes,0.03846153846153846
Reading & Interacting With HTML Table Using Python,0.03846153846153846
What is the best way to swap values in Python pandas DataFrame to clean up the data,0.03846153846153846
Highlighting multiple cells in different colors with Pandas,0.03846153846153846
How can I get basic statistics about a series of list?,0.03846153846153846
Problems while filtering pandas dataframe by row values?,0.03846153846153846
Assigning values to duplicate row in pandas dataframe,0.03846153846153846
Tobin's Annualized Standard Deviation in Pandas,0.03846153846153846
"Filtering rows from dataframe on multiple conditions, getting ValueError",0.03846153846153846
Group by data in pandas dataframe,0.03846153846153846
Rearranging a DataFrame,0.03846153846153846
How can I select the indexes where my dataframe has more than two entries?,0.03846153846153846
"Removing Space row(i dont know, whether its row or not) in pandas dataframe",0.03846153846153846
How to drop a column in a Pandas DataFrame which contains the same value,0.03846153846153846
df[column] = apply(lambda row: row.sort_values()[1]) behaves weirdly,0.03846153846153846
xarray DataArray - how to fillna using ffill?,0.03846153846153846
python pandas - would like to vectorize this loop function and apply to a panel,0.03846153846153846
"Pandas ""type of <class 'str'>""",0.03846153846153846
Add columns in pandas dataframe dynamically,0.03846153846153846
Pandas: Change a specific column name in dataframe having multilevel columns,0.03846153846153846
Filter Pandas dataframe based on strict inequality and missing data,0.03846153846153846
python pandas to_datetime change format,0.03846153846153846
How to calculate the max click interval using pandas?,0.03846153846153846
Cross-sectional weight in a time-series dataframe,0.03846153846153846
python convert informal complex number file to formal amplitude data,0.03846153846153846
"How to translate ""bytes"" objects into literal strings in pandas Dataframe, Python3.x?",0.03846153846153846
Identify the row in a group that has the highest value and extract all rows in that share its name in Pandas,0.03846153846153846
Produce Stacked Barchart in Pandas along with checkbutton,0.03846153846153846
python pandas- AttributeError: 'Series' object has no attribute 'columns'?,0.03846153846153846
Why do I get 0 when dividing two numbers?,0.03846153846153846
Comparing dates of different formats between pandas dataframes,0.03846153846153846
pandas loc modifies dataFrame with multi index?,0.03846153846153846
Comparing Column Values in a Pandas Dataframe,0.03846153846153846
Split pandas dataframe into multiple dataframes,0.03846153846153846
How to create a multi-index in Pandas,0.03846153846153846
Using logistic regression for a multiple touch response model (python/pandas)?,0.03846153846153846
Pandas means in column for subset in another column,0.03846153846153846
Pandas dataframe merge on rows,0.03846153846153846
pandas new column equals another column with condition,0.03846153846153846
Filter max number by id,0.03846153846153846
Better way to replace values in DataFrame from large dictionary,0.03846153846153846
How to load a dataset's examples into different arrays for a decision tree classification?,0.03846153846153846
"How to convert a time stamp column of type ""object"" to proper ""time"" type?",0.03846153846153846
Pandas Group-by Multiple Columns Period() Key error,0.03846153846153846
"In pandas, i have 2 columns(ID and Name). If ID is assigned to more than one name how do i replace duplicates with first occurance",0.03846153846153846
applying user defined function on data frames in pandas,0.03846153846153846
Fill NAN values of a column in dataframe from other dataframe pandas,0.03846153846153846
Why is Pandas not returing a scalar/string instead of a Series when accessing a DataFrame with both a column and an index value?,0.03846153846153846
pandas dataFrame with datetime64[ns] as Index with microsecond precision,0.03846153846153846
How to improve iterations runtime in a pandas dataframe,0.03846153846153846
How to parse pandas dataframes between functions,0.03846153846153846
Python Multiprocessing Pool Doesn't Create Enough Processes,0.03846153846153846
Iterate over pandas dataframe in jinja2,0.03846153846153846
Upsampling Dataframe in Pandas,0.03846153846153846
Recombine groupby rollling sum with original pandas DataFrame,0.03846153846153846
python pandas - groupby.first() returning NaT values,0.03846153846153846
How to combine two dataframes on parent-child relation (something between concat and merge),0.03846153846153846
best way to merge stock prices from pandas in one table?,0.03846153846153846
Force incrementation in pandas rank method,0.03846153846153846
Python Pandas subset column x values based on unique values in column y,0.03846153846153846
"Appending incomming api data to pandas dataframe, what is wrong with my function?",0.03846153846153846
wide vs long format when saving data in pandas hdf5,0.03846153846153846
How to avoid generating unwanted blank columns when looping through Pandas dataframe?,0.03846153846153846
Can I render only part of a scatter_matrix?,0.03846153846153846
Pandas sum DataFrame into a larger DataFrame already containing same index with same columns name,0.03846153846153846
Pandas DataFrame list strange behavior,0.03846153846153846
Pandas DataFrame: How to print single row horizontally?,0.03846153846153846
scikit-learn - Process input as DataFrame in custom estimator,0.03846153846153846
Using any() and all() on multiIndex DataFrame while slicing via .xs: strange behavior or just me?,0.03846153846153846
Pandas Panel Merge,0.03846153846153846
retain function in python,0.03846153846153846
NAN values considered strings in python,0.03846153846153846
Get nearest time value and convert format,0.03846153846153846
Python Dictionary Adding Values,0.03846153846153846
Resample TimedeltaIndex and normalize to frequency,0.03846153846153846
pandas.to_datetime() returning different dtypes for columns,0.03846153846153846
How get ranges of one column gruop by class column? In Pandas,0.03846153846153846
Build specific grouping in Pandas,0.03846153846153846
Convert dataFrame to list,0.03846153846153846
Pandas Unstack MemoryError - Is There A Way To Unstack in Chunks?,0.03846153846153846
how to calculate ratio on some condition in pandas dataframe,0.03846153846153846
Python Pandas Counting the Occurrences of a Specific value,0.03846153846153846
pandas top n values when group name in multiple columns,0.03846153846153846
Django Pandas to http response (download file),0.03846153846153846
Import Module Error for Python-Pandas in Atom (works fine in CLI???),0.03846153846153846
How to make a function for groupby based on number of inputs from user?,0.03846153846153846
Subsetting Pandas dataframe via column number,0.03846153846153846
How to send csv from angular to flask and load into pandas?,0.03846153846153846
Fatal Python error: Py_Initialize: importlib install failed (ImportError: No module named '_frozen_importlib_external'),0.03846153846153846
Creating a line graph with ggplot library which plots two lines (the high and low of stock prices) on the same graph,0.03846153846153846
pandas combine_first but always overwrite,0.03846153846153846
Extracting data from a file read in with Pandas,0.03846153846153846
Calculating velocities and acceleration in python for large numpy arrays,0.03846153846153846
Counting values in a DataFrame based on a condition -- too slow,0.03846153846153846
Broadcasting Error Pandas,0.03846153846153846
Subtract DataFrame rows from other's dataframe specific rows,0.03846153846153846
calling variable inside string returns ValueError,0.03846153846153846
How to write a pandas DataFrame to a CSV by fixed size chunks,0.03846153846153846
Do columns have to be named manually in pandas?,0.03846153846153846
Repeat rows based on field in Pandas,0.03846153846153846
Pandas moving window over rows,0.03846153846153846
Changing Data Frame style in pandas,0.03846153846153846
Warning: A value is trying to be set on a copy of a slice from a DataFrame,0.03846153846153846
How can I retrieve a row by index value from a Pandas DataFrame?,0.03846153846153846
Setting column types while reading csv with pandas,0.03846153846153846
Index a DataFrame with a list and return NaN for out-of-bounds indices in Pandas?,0.03846153846153846
How to filter dataframe rows if column value (string) contains any of the values in a set in python?,0.03846153846153846
Generating a list from several dataframes,0.03846153846153846
How repeat index in pandas pivot table such that nan fill record-less rows?,0.03846153846153846
Adding a column in Pandas while editing the values,0.03846153846153846
"Getting Large Dataset Out of MySQL into Pandas Dataframe keeps Failing , Even With Chunksize",0.03846153846153846
"python, pandas, csv import and more",0.03846153846153846
Python Pandas Align text in cells,0.03846153846153846
Taking legend outside of grouped plots,0.03846153846153846
python plotting with pandas,0.03846153846153846
"Bokeh, can't use callback with CSV files",0.03846153846153846
How do you fix inconsistent numbers of samples when using GaussianNB()?,0.03846153846153846
overwrite column names in pandas dataframe automatically,0.03846153846153846
Frequency that a value occurs in a data frame using pandas,0.03846153846153846
pandas series.sum() how to skip some indexes,0.03846153846153846
Python pandas - apply function to grouped dataframe,0.03846153846153846
Python - Pandas - Write Dataframe to CSV,0.03846153846153846
"How to turn pandas data frame w/ row per unique term & date into df which contains 1 row per date, w/ unique terms + their values as columns?",0.03846153846153846
pandas groupby and convert to json list,0.03846153846153846
Handle Nan when using Pandas ExcelWriter in python,0.03846153846153846
Fill pandas DataFrame nans with index value,0.03846153846153846
reading excel sheet as multiindex dataframe through pd.read_excel(),0.03846153846153846
web2py function call does not display pandas dataframe converted to html content as expected,0.03846153846153846
Pandas.DataFrame - find the oldest date for which a value is available,0.03846153846153846
Getting a Pandas dataframe from an Apache log file,0.03846153846153846
Not understanding output of MonthEnd() in pandas,0.03846153846153846
Pandas merge leads to scientific number,0.03846153846153846
How to apply a expanding window formula that restarts with change in date in Pandas dataframe?,0.03846153846153846
How to convert an string file to matrix with Python,0.03846153846153846
Can pandas.DataFrame have list type column?,0.03846153846153846
pandas Groupby after groupby,0.03846153846153846
Dendrogram using pandas and scipy,0.03846153846153846
Syntax error when modifying pandas dataframe object,0.03846153846153846
Pandas : Add new column with function based on index,0.03846153846153846
Replacing values in columns based on conditions,0.03846153846153846
Selecing a large number of data points in column,0.03846153846153846
Create DataFrame from another DataFrame.describe() - Pandas,0.03846153846153846
Reshape Pandas Dataframe,0.03846153846153846
Group DataFrame by entries X amount of time from each other,0.03846153846153846
Plot values vs. the time of day,0.03846153846153846
python pandas: computing argmax of column in matrix subset,0.03846153846153846
"Iterate row csv file using pandas, python",0.03846153846153846
Efficient way to loop over Pandas Dataframe to make dummy variables (1 or 0 input),0.03846153846153846
pandas data frames delta (subtraction),0.03846153846153846
panda add several new columns based on values from other columns at the same time?,0.03846153846153846
Pandas Apply Function with Multiple **Kwarg Arguments,0.03846153846153846
Python pandas: groupby output duplicate,0.03846153846153846
finding dataframe group count,0.03846153846153846
Pandas split column into multiple,0.03846153846153846
How to combine series and pandas' dataframe into one dataframe?,0.03846153846153846
Find a string in a huge string file,0.03846153846153846
Pandas - non overlapping group members,0.03846153846153846
"""The truth value of a Series is ambiguous. "" Series vs Element Fuction",0.03846153846153846
Shifting all rows in dask dataframe,0.03846153846153846
Resampling pandas dataframe is deleting column,0.03846153846153846
python pandas series loc value from multi index,0.03846153846153846
Efficiently write JSON to sqlite database,0.03846153846153846
Is it possible to insert a worksheet into an existing workbook using Python?,0.03846153846153846
python loadtxt to read delimited file,0.03846153846153846
In pandas how to filter based on a particular weekday and range of time,0.03846153846153846
Subsetting pandas dataframe with list in cell,0.03846153846153846
Returning most occurring element in row of pandas dataframe,0.03846153846153846
Python: extracting arrays from DataFrame column,0.03846153846153846
Pandas escape carriage return in to_csv,0.03846153846153846
"Dictionary in Pandas DataFrame, how to split the columns",0.03846153846153846
Use string.capwords with Pandas column,0.03846153846153846
Plotting GroupBy Object in Pandas,0.03846153846153846
Rolling_mean over a certain time period with Pandas,0.03846153846153846
How to get a new dataframe with column count out of groupby function in pandas?,0.03846153846153846
replace string in pandas dataframe,0.03846153846153846
Pandas: control new column names when merging two dataframes?,0.03846153846153846
Pandas conditionally replace value if >1 unique values for other column,0.03846153846153846
Why is this datetime string not converting to a datetime object in a Pandas dataframe?,0.03846153846153846
converting pandas dataframe into series,0.03846153846153846
pandas.DataFrame.apply() using index as an arg,0.03846153846153846
How do I decode a msgpack file in Python?,0.03846153846153846
Python function to calculate distance using haversine formula in pandas,0.03846153846153846
Python pandas combine the second row if the first row IDs are the same,0.03846153846153846
pythonic way to get a zero-record slice of a pandas dataframe,0.03846153846153846
Pandas Dataframe - How to combine multiple rows to one,0.03846153846153846
Adding sheets to existing excelfile with pandas,0.03846153846153846
Pandas/Python: Replace multiple values in multiple columns,0.03846153846153846
Pandas DataFrame column value remapping,0.03846153846153846
How to conditionally transpose in pandas (similar to SQL case when withn group by),0.03846153846153846
Using pandas to select specific seasons from a dataframe whose values are over a defined threshold,0.03846153846153846
How can I filter a Pandas GroupBy object and obtain a GroupBy object back?,0.03846153846153846
Pandas: Convert lists within a single column to multiple columns,0.03846153846153846
pandas corr table column name behavior,0.03846153846153846
I need to change the format of the current Dataframe. How should i do this?,0.03846153846153846
Using pyinstaller with pandas,0.03846153846153846
Exclude columns from pandas where(),0.03846153846153846
How to do this pandas group by and count functionality?,0.03846153846153846
Pandas : combine rows of a dataframe with a list,0.03846153846153846
pandas apply lambda multiple arguments no query different dataframes,0.03846153846153846
Pandas strftime running slow within multiprocessing,0.03846153846153846
Merging float columns in pandas,0.03846153846153846
