Title,Correlation Score
DateTimeIndex Pandas .Series attribute Error,0.03846153846153846
What is the quickest way to convert a pandas dataframe to json?,0.03846153846153846
how to replace stock-prices symbols in a dataframe,0.03846153846153846
Split single dataframe into multiple dataframe,0.03846153846153846
How do I add new column that adds and sums counts from existing column?,0.03846153846153846
Creating dataframes from each .csv in a folder after grabbing important part of the filename,0.03846153846153846
Pandas transform on a object column,0.03846153846153846
This particular way of using .map() in python,0.03846153846153846
Pandas data type catch errors while converting without using Try Except,0.03846153846153846
Pandas - how to use a dataframe index to search for values,0.03846153846153846
Filter Pandas Series by dictionary values,0.03846153846153846
pandas multiple independent indexes(not multi index),0.03846153846153846
Convert a dataframe to json?,0.03846153846153846
How to select columns keeping a reference column pandas dataframe,0.03846153846153846
Validate the merge keys error when using trying to merge two csv columns?,0.03846153846153846
How to use group to group categorical column pandas,0.03846153846153846
How to add a looped group-by in Python?,0.03846153846153846
Can't get rid of ??from pandas text dataframe despite using 'string replace' and 'remove punctuations',0.03846153846153846
How do you add 1 column to multiple dataframes with pandas?,0.03846153846153846
Python3 Pandas replacing on rows based on inner condition,0.03846153846153846
pandas groupby rolling behaviour,0.03846153846153846
Label dataframe column with a list,0.03846153846153846
Applying scikitlearn preprocessing to pandas without causing warnings,0.03846153846153846
Get column in datetime format and check if value is in it,0.03846153846153846
Dict to JSON or Dataframe to JSON export yields no square brackets,0.03846153846153846
Change matplotlib subplots to seperate plots,0.03846153846153846
Reading index based range from Parquet File using Python,0.03846153846153846
What is the difference between str(x) and x.str?,0.03846153846153846
Custom Comparison to create new Pandas dataframe after Comparison,0.03846153846153846
How can I add comma into existing value in dataframe? Pandas,0.03846153846153846
"while filtering the data from dataframe TypeError: must be real number, not str",0.03846153846153846
Replace values by result of a function,0.03846153846153846
How to get the mean of the first and third quartile using Pandas?,0.03846153846153846
How can I OneHot Encode data from multiple files,0.03846153846153846
How to access specific rows in a pandas multiindex dataframe,0.03846153846153846
Looking to combine excel files without added space to the right 'between files',0.03846153846153846
Cleaning up dataset where each record is treated as a table,0.03846153846153846
Pandas group by using values in a Column,0.03846153846153846
Pandas change multiple columns based on multiple conditions,0.03846153846153846
How can I create a column that flags when another datetime column has changed date?,0.03846153846153846
"Python: Set the values of a dataframe equal to those of another one, given equality between several columns of the two dataframes",0.03846153846153846
Downloading OECD data with Python into a dataframe,0.03846153846153846
Spark with Scala and Pandas,0.03846153846153846
python: multi-column pandas data-file obtained in FOR loop,0.03846153846153846
Set list to subset of pandas dataframe,0.03846153846153846
Loop through schools append to dataframe pandas,0.03846153846153846
Compare dataframe columns: TypeError: Cannot interpret 'StringDtype' as a data type,0.03846153846153846
How to make an interactive time serie plot using plotly?,0.03846153846153846
Selecting multiple columns in pandas that start with similar letter,0.03846153846153846
Pandas dataframe `apply` using recursive lambda function possible?,0.03846153846153846
dataframe remove last digit from string if it is number,0.03846153846153846
How to turn pandas.groupby.agg and pandas.resample on minutes into SQL queries?,0.03846153846153846
create rows with specific values from another column after particular cells_python,0.03846153846153846
Why do I get an error installing pandas on Linux (NAS)?,0.03846153846153846
Pad zeros to a Python list,0.03846153846153846
How to add subtotals in a multi_index dataframe,0.03846153846153846
can't convert a pandas.Series to a numpy.array with dtype=np.float64,0.03846153846153846
Batch convert pandas dataframe to protobuf,0.03846153846153846
How to set the columns in dataframe to the values obtained from another column?,0.03846153846153846
Is there a way to directly print an attribute of an object stored in a pandas DataFrame?,0.03846153846153846
Different scores when mutual_info_classif used independently and through SelectKBest,0.03846153846153846
Merge multiple dataframes in Python on key,0.03846153846153846
"compare 2 csv file and find out missing, inserted data and modified data using pandas",0.03846153846153846
converting csv to excel if header is mentioned multiple times in pandas,0.03846153846153846
How to color code pandas dataframe according to frequency of elements?,0.03846153846153846
"Add rows to a DataFrame, but with same values as preexisting rows for some columns",0.03846153846153846
setting a variable equal to the value in the adjacent column in pandas dataframe,0.03846153846153846
Interpreting the probability of still being alive matrix plot BG/NBD model,0.03846153846153846
Pandas : How to return Friday as business day if date is falling on Sunday or Saturday?,0.03846153846153846
Plot different errorbars on panda concat plot,0.03846153846153846
Compare columns values iteratively in the same dataframe,0.03846153846153846
How to delete multiple occurences IDs in a DataFrame?,0.03846153846153846
Pandas datetime failing when mocking datetime.datetime.now(),0.03846153846153846
Twill causing print() not to show,0.03846153846153846
How to groupby in an ordering manner than taking a different column on same rows with it?,0.03846153846153846
Python - Pandas writing blank files to file,0.03846153846153846
"Warning with settingsWithCopyWarning , when creating another column",0.03846153846153846
How to count ocurrences in a column dataframe Python,0.03846153846153846
Trouble using pandas read_html() : ValueError,0.03846153846153846
Pandas: Groupby return error after PD cuts,0.03846153846153846
Matrix multiplication and matrix powers using pandas,0.03846153846153846
"When using pandas dataframe.to_csv(), with compression='zip', it creates a zip file with two archive files with the EXACT same name",0.03846153846153846
"Optimizing for loops, dataframe partition",0.03846153846153846
How to convert a JSON file and convert it to CSV keeping the headings using Dataframes,0.03846153846153846
Extract Datetime information from a string in a DataFrame column,0.03846153846153846
How do I find the intersection of row and column in Pandas or Openpyxl,0.03846153846153846
How to create a date(day) intervals using Pandas,0.03846153846153846
"Find mean, mode and median with Python",0.03846153846153846
Applying Condition in Pandas DataFram on more than one column,0.03846153846153846
return the span of two numbers grouped by ID,0.03846153846153846
How do I correctly use .loc in pandas?,0.03846153846153846
choose which columns to display when using Boolean filtering in pandas for python,0.03846153846153846
How to loop or repeat code in pandas Dataframe?,0.03846153846153846
How to replace keys to values in DataFrame?,0.03846153846153846
Pandas - How to replace those exception values with NaN,0.03846153846153846
Storing DataFrame output utilizing Pandas to either csv or MySql DB,0.03846153846153846
Returning filtered dataframe after grouping by counts with a condition,0.03846153846153846
Create a new Column in pandas dataframe based on the filetered values in the row of other columns,0.03846153846153846
How to use Multiprocessing pool in Databricks with pandas,0.03846153846153846
How can I change the Index name using python pandas?,0.03846153846153846
Convert number of miliseconds from midnight from datetime objct using pandas,0.03846153846153846
PANDAS: why can't i use a previously created column in a new calc field?,0.03846153846153846
Python Pandas Dataframe: How to append more than one index to a list at the same time?,0.03846153846153846
process columns in pandas dataframe,0.03846153846153846
Append data from one pandas dataframe into other one,0.03846153846153846
Melt multiple columns to correspondent columns based on prefix in Pandas,0.03846153846153846
Resizing HTML table in Outlook body won't work,0.03846153846153846
Splitting Dataframe into different group by product,0.03846153846153846
"Skip rows stated with ""#"" using pandas",0.03846153846153846
Sum values of columns that start with the same text string,0.03846153846153846
Multi level categorical excel data representation with python,0.03846153846153846
Python Pandas Commands .replace() Not Working despite inplace = True,0.03846153846153846
Replacing values in a row based on conditions,0.03846153846153846
Renaming dictionary keys through a loop problem,0.03846153846153846
Convert text file with header to pandas dataframe,0.03846153846153846
Transposing and Creating Flat files Using Pandas,0.03846153846153846
Pandas - binning column of numeric values while preserving NaN,0.03846153846153846
How to create DataFrame where some fields changes and remaining repeats?,0.03846153846153846
"How to format ""dd/mm/yyyy"" of string type to ""yyyy-mm-dd"" enclosed in single quotes in python?",0.03846153846153846
Why do I get keep getting this tzinfo error?,0.03846153846153846
Apply results of pandas groupby to multiple rows,0.03846153846153846
How to assign value in row of empty pandas data frame which initially is zero row?,0.03846153846153846
How to calculate the diff between values of 2 adjacent values across every column in a pandas dataframe?,0.03846153846153846
How to extract a part of column based on two other columns from a python dataframe,0.03846153846153846
For loop over dataframe python,0.03846153846153846
Handling duplicate values in pandas,0.03846153846153846
OptimizeWarning: Covariance of the parameters could not be estimated - what does it really mean?,0.03846153846153846
Python set - how to filter for all combinations,0.03846153846153846
Python inserting consecutive numbers per group,0.03846153846153846
Apply customized function for extracting numbers from string to multiple columns in Python,0.03846153846153846
check for duplicate values in dataframe in column within two index,0.03846153846153846
Can't read xlsx file in python,0.03846153846153846
Python - Dictionary with arrays to csv file,0.03846153846153846
Does this occur because there is an NaN?,0.03846153846153846
Not all columns display when I type df.columns in Pandas (Python),0.03846153846153846
Pandas gives me a SettingWithCopyWarning,0.03846153846153846
df. drop results in unsupported operand type(s) for &: 'float' and 'bool',0.03846153846153846
Error isn't going down and nan | KerasModel,0.03846153846153846
Convert Rows to Columns and Forward Fill First Column,0.03846153846153846
Python: Finding missing values in a list,0.03846153846153846
How do I avoid subclassing a pandas DataFrame using composition?,0.03846153846153846
filter pandas dataframe on column and add string to the filtered data,0.03846153846153846
how to create a histogram in python using my own values and frequencies witthout bins,0.03846153846153846
Get other columns after applying unique / distinct on one column of dataframe pandas,0.03846153846153846
Comparison based on derived operator in Python,0.03846153846153846
Visualize multiple data in python,0.03846153846153846
Creating dataframe from list of arrays (varying shapes),0.03846153846153846
Pandas: Merge two rows if row contains certain string,0.03846153846153846
Apply style to specific columns in dataframe,0.03846153846153846
How to change values in a column to fake values,0.03846153846153846
Merge columns from two dataframes when value in columns are not equal,0.03846153846153846
Need work around for downloading xlsx from website,0.03846153846153846
Using Colormap feature with Pandas.DataFrame.Plot,0.03846153846153846
Pandas: how to add an incremental value to a new column?,0.03846153846153846
Rolling Cummulative Sum of a Column's Values Until A Condition is Met,0.03846153846153846
How to transform dictionary into dataframe in a specific way in python?,0.03846153846153846
How to merge two dataframes with multiple element from one column,0.03846153846153846
Performance Comparisons between Series and Numpy,0.03846153846153846
Remove rows that are not a number or a date from pandas dataframe,0.03846153846153846
Resampling error with pandas dataframe datetime index,0.03846153846153846
Cannot convert from pandas._libs.tslibs.timestamps.Timestamp to datetime.datetime,0.03846153846153846
"Cumulative pandas column ""reseting"" once threshold is reached",0.03846153846153846
Python pandas: Sum first n rows of grouped values x,0.03846153846153846
How to change date format in Pandas dataframe?,0.03846153846153846
Why am I getting the message Keyword error?,0.03846153846153846
Reshape dataframe by reversing columns names with columns values,0.03846153846153846
groupby in pandas and exclude grouper column from output DataFrame,0.03846153846153846
Pandas: Remove values that meet condition,0.03846153846153846
How to accelerate the speed of this pandas apply,0.03846153846153846
Keep one column in df2 based on value in df1,0.03846153846153846
python: better way to handle case sensitivities with df.replace,0.03846153846153846
Conditionally replace values in pandas dataframe - numpy where behaviour,0.03846153846153846
How do I add duplicates from a CSV to the end of a specific row over several instances using Python?,0.03846153846153846
How to turn unwanted string values into NaNs in pandas,0.03846153846153846
Where is the MultiIndex information stored?,0.03846153846153846
Insert new row before each duplicated ID,0.03846153846153846
Assign number by appearance and then cumsum by iD,0.03846153846153846
Getting Google Analytics pagination as part of a Python loop into Pandas dataframe,0.03846153846153846
Edit dataframe column values to a certain format,0.03846153846153846
Calculate percentage of grouped values,0.03846153846153846
Refer to or INNER JOIN a Pandas dataframe value in the WHERE clause of a SQL Server query,0.03846153846153846
Merge dataframes base on Column and Row values,0.03846153846153846
Keeping only the Last occurrences of a data in column on a given date in pandas,0.03846153846153846
Group by one column to assign quantiles based on another column,0.03846153846153846
modify specific row in filter separately pandas,0.03846153846153846
Drop duplicate values from hierarchical index,0.03846153846153846
Renaming a subset of a dataframes columns after original dataframe has changed,0.03846153846153846
Writting columns of data in *.dat file in Python,0.03846153846153846
Pandas: how to fill missing data with a mean value?,0.03846153846153846
Element wise max comparison of two pandas dataframes,0.03846153846153846
defaultdict of pd.Series,0.03846153846153846
UnicodeDecodeError again: 'utf-8' when debugging Python files in PyCharm Community,0.03846153846153846
pandas loop to run multiple cross tabs,0.03846153846153846
group by id1 and id2 and apply a function using another dataframe and dates,0.03846153846153846
How to get a python lookup to return another column after match,0.03846153846153846
quandl dataframe how to select loc,0.03846153846153846
Replacing dataframe column list values with values from another dataframe,0.03846153846153846
Dataframe - convert rows to columns - grouped by another columns,0.03846153846153846
Convert Web Scraped JSON data to Pandas Dataframe / then CSV file,0.03846153846153846
Histograms side by side: change axis,0.03846153846153846
Removing comma from values in column (csv file) using Python Pandas,0.03846153846153846
How do I correctly remove all text from column in Pandas?,0.03846153846153846
How to find/filter/combine based on common prefix in rows and columns with use of python/pandas?,0.03846153846153846
How to find exact match of a column based on another column values on python?,0.03846153846153846
find a string and extract the full row,0.03846153846153846
Lines between points by id,0.03846153846153846
Datetime conversion in Python,0.03846153846153846
Compare rows with conditions and generate a new dataframe in Pandas,0.03846153846153846
Sparse columns in pandas: directly access the indices of non-null values,0.03846153846153846
How do I convert a column of type 'int64' to datetime?,0.03846153846153846
replacing rows in pandas with certain conditions,0.03846153846153846
Retrieve a substring from text in a pandas dataframe,0.03846153846153846
Python yfinance can't get tickers added to list of dataframes,0.03846153846153846
Why does appending columns after merging not work?,0.03846153846153846
Getting the name of the row with highest count,0.03846153846153846
How does Python Pandas find the data types of variables?,0.03846153846153846
Pandas groupby and then find max value per group in another column,0.03846153846153846
replace dictionary keys in DataFrame column with values,0.03846153846153846
For loop and conditions on pandas dataframe,0.03846153846153846
How to map or sort values of two different dataframe?,0.03846153846153846
pandas: groupby respecting conditions in python,0.03846153846153846
How to select columns based on date in one column and NaN in second column in Python Pandas?,0.03846153846153846
Get IDs which have multiple values in a column,0.03846153846153846
I want to apply multiple filters and change a column value accordingly in pandas [Working now],0.03846153846153846
How to propagate non-NaN values n times backward,0.03846153846153846
"Groupby, iterate and concatenate to text file",0.03846153846153846
How do I select a range of columns that are datetimes?,0.03846153846153846
"pandas date_range with (start, end) in generated list",0.03846153846153846
"Populating new Dataframe in Python taking too long, need to remove explicit recursive loops to improve performance",0.03846153846153846
Calculating pandas rolling mean and assigning it to a new df column returns only NaNs,0.03846153846153846
Generate custom frequency from dataset for pd.date_range,0.03846153846153846
How to rank a table using for loop statement based on date without using pandas df.groupby and .rank?,0.03846153846153846
Pandas: sum column values against specific value in another column,0.03846153846153846
Dissolve polygons based on values in python,0.03846153846153846
Export pandas data frame to excel only exports final row?,0.03846153846153846
'MultiOutputClassifier' object is not iterable when creating a Pipeline (Python),0.03846153846153846
Shuffle Columns in Dataframe,0.03846153846153846
How to reset a groupby cumsum when a condition in another column is met?,0.03846153846153846
How to resample specific two rows of a dataframe?,0.03846153846153846
Calculating one row down lambda pandas,0.03846153846153846
Webscraping: How to deal with NA values in a dataframe returned?,0.03846153846153846
exporting pandas dataframe into a access table using to_sql generate error,0.03846153846153846
Slicing columns from a Dataframe based on a list,0.03846153846153846
How many non-NaN values should a column have for a non-NaN corrwith() result?,0.03846153846153846
Using Pandas dataframe to group data by dates and then hours,0.03846153846153846
How to cast variable in .query() function to lower case?,0.03846153846153846
Jupyter Notebook - Print DataFrame columns in Javascript console,0.03846153846153846
How to convert -99 value in datetime column to a date of my choosing?,0.03846153846153846
"How to get a date from year, month, week of month and Day of week in Pandas?",0.03846153846153846
Webservice Query to Pandas Dataframe,0.03846153846153846
Python time series - count periods below/above and threshold for specified minimum duration,0.03846153846153846
execute part of string as code pandas/python,0.03846153846153846
Pandas series remains the same after appending to it through a function,0.03846153846153846
Properly deal with delimiters in Pandas,0.03846153846153846
Python Pandas: Create a column that sums certain other columns,0.03846153846153846
How do get the first 15 min high from OHLC data through pandas?,0.03846153846153846
NLP: Create spaCy Doc objects based on delimiters or combine multiple Doc objects to form a single object,0.03846153846153846
TypeError: unsupported operand type(s) for -: 'str' and 'DateOffset',0.03846153846153846
python-how to convert 'ipywidgets.widgets.widget_output.Output' object to a pandas dataframe,0.03846153846153846
Get first half of string from pandas dataframe column,0.03846153846153846
"Dataframe, apply scaler after groupby",0.03846153846153846
Insert list into df at specific row gives Warning,0.03846153846153846
Join Pandas DataFrames matching by string and substring,0.03846153846153846
Datafram add new column with condition and base on another column,0.03846153846153846
Timedelta calculation on Dataframe column condition,0.03846153846153846
moving a row of a pandas dataframe but index unchanged,0.03846153846153846
Python Dataframe - replace NaN value with an existing value from Dataframe,0.03846153846153846
How do I access some rows with the largest values from a dataframe in pandas?,0.03846153846153846
Reading xlsx files on a mac in python,0.03846153846153846
How can I get a repr of a DataFrame that is a valid Python expression?,0.03846153846153846
Merge 2 dataframes of different sizes after a groupby function,0.03846153846153846
How to select values around the cell with NaN value in a 3X3 windows?,0.03846153846153846
How to combine rows with different values in columns in pandas dataframe,0.03846153846153846
How can we combine csv files in pandas?,0.03846153846153846
Apply function to all columns of a Polars-DataFrame,0.03846153846153846
Python dataframe converting time date 'SylmiSeb' (2018-12-31 23:43:02+00:00) to datetime,0.03846153846153846
How to Expand Series in JSON to Columns?,0.03846153846153846
Is there a way to work with time period iterations on Python?,0.03846153846153846
How can I remove leading zeroes and convert an alphabet letter to a number?,0.03846153846153846
"python Samples of a Dataframe, like pandas Dataframe.sample() but always selecting n adjacent values",0.03846153846153846
How do I change the date format from 01-Mar-19 to 2019-03-01 in pandas?,0.03846153846153846
Merge two data frames based on instring value,0.03846153846153846
How to change the for loop in the code to give me an additional column in my dataframe?,0.03846153846153846
How to aggregate data in a Pandas Pivot Table?,0.03846153846153846
import SQL tables from database into Pandas Dataframe without knowing the whole name of the tables,0.03846153846153846
"Input contains NaN, infinity or a value too large for dtype('float64') but i've manually changed Nan values in my database to equal 0",0.03846153846153846
"Extracting All Unique Patterns in Column of Strings (Python, Pandas DF)",0.03846153846153846
extract txt data to cloumn using python,0.03846153846153846
Error while preprocessing the data in python - machine learning project for predicting stock prices using lstm,0.03846153846153846
Filter dataframe,0.03846153846153846
Pandas pandas backward fill from another column,0.03846153846153846
How to read and write certain columns in pandas?,0.03846153846153846
pandas resample last taking the next value,0.03846153846153846
how to convert a barycentric coordinate calculation in c++ to python?,0.03846153846153846
get the sign change count from Dataframe,0.03846153846153846
Pandas add column to df after group_by and value_counts,0.03846153846153846
How to merge two dataframes according to their indexes?,0.03846153846153846
Choose specific calendar dates in python,0.03846153846153846
How to do a string replace with only the decimal digits and remove exceptions?,0.03846153846153846
Replacing two convoluted for loops with vectorization,0.03846153846153846
Alter pandas DF using another location pandas df,0.03846153846153846
Pandas transpose on double column index,0.03846153846153846
Keep numeric value from string Pandas,0.03846153846153846
Pandas: I want to sum a count if a string exists in any one of several columns and add this count to another dataframe with the searched term,0.03846153846153846
Compare two dataframes and output new column,0.03846153846153846
Error with sum() in MySQL running on Google Colab,0.03846153846153846
Find timestamps in pandas dataframe that are at least 30 minutes apart but not at regular 30 minute intervals,0.03846153846153846
Python : How to assign ranks to categorical variables within a group in Python,0.03846153846153846
Python3.x Pandas .ewm() .std() returns all NaN with half-life,0.03846153846153846
Python if else conditions when date gets changed,0.03846153846153846
how to convert string to integer in pandas data frame,0.03846153846153846
How to rasterize a daily geo-datatable?,0.03846153846153846
Counter for consecutive negative values in a Data-frame,0.03846153846153846
Python pandas transformation of different versions of a number into one,0.03846153846153846
How to create a dummy dataframe from two columns?,0.03846153846153846
Python pandas group by column and return most recent modal value,0.03846153846153846
