Title,Correlation Score
How to concatenate rows with similar IDs in multiple TSV files in python?,0.0464219875984582
Dropping Pandas Dataframe Columns based on column name,0.0464219875984582
Embed a pivot table as a picture in an email body in python,0.0464219875984582
Pandas pivoting/stacking/reshaping,0.0464219875984582
Drop Pandas DataFrame rows that contain string of interger,0.0464219875984582
Python Pandas Memory Error during Drop,0.0464219875984582
How to force zero (0) to the center of an axis in matplotlib,0.0464219875984582
Drop rows with non-missing values,0.0464219875984582
How can I split multiple columns of a df into multiple rows?,0.0464219875984582
Concatenate two Excel spreadsheet data (side by side),0.0464219875984582
Matplotlib change x-axis unit,0.0464219875984582
Pandas - Dataframe - How to keep or drop columns using regex/time expressions,0.0464219875984582
Drop all columns before a particular column (by name) in pandas?,0.0464219875984582
Datatypes issue when convert parquet data to pandas dataframe,0.0464219875984582
Pandas dataframe- Drop missing value rows or replace missing values with 0 based on condition,0.0464219875984582
Concatenating columns in pandas,0.0464219875984582
Pandas drop rows when all columns in a subset of columns meet a condition,0.0464219875984582
Converting only selected columns to transpose using melt and pivot?,0.0464219875984582
Comparing two dataframes with identical shape and iterate over rows calculating the pct_change of df1 - line1 to df2 - line1,0.0464219875984582
"Concat python dataframes, drop duplicate and keep record of rows origin",0.0464219875984582
Pivoting pandas dataframe to return two values per column,0.0464219875984582
how to convert series(24 numbers) into datetime like Y/M/D H:M:S,0.0464219875984582
Python currency styling issue in html,0.0464219875984582
How can I drop rows from a data frame where the row contains a duplicate value in the row itself?,0.0464219875984582
How to control differences between line and bar plot in Python?,0.04642198759845819
How to find first occurrence of a significant difference in values of a pandas dataframe?,0.04642198759845819
Within group move date to same date in prior year if certain condition is met,0.04642198759845819
Drop column values,0.04424333836098544
How to duplicated or drop the row with condition in Python,0.04424333836098544
Dropping rows in python pandas,0.04424333836098544
Drop duplicate if the value in another column is null - Pandas,0.04424333836098544
How to drop pandas default index column?,0.04424333836098544
How do I concatenate to a cell under one column where another column has a certain value?,0.04424333836098543
(Python) How to calculate the average over a time period?,0.04424333836098543
concatenate multiple rows to one single row in pandas,0.04424333836098543
Calculate the average consumption from data in Pandas Dataframe,0.04424333836098543
Concatenating values from earlier rows with different dates in a pandas dataframe,0.04424333836098543
How do I apply the findings of a Pandas GroupBy to the source data,0.03846153846153846
Pandas: Loop for specific column values,0.03846153846153846
Rename Multiple pandas Dataframe Column Names using function,0.03846153846153846
Count if in multiple index Dataframe,0.03846153846153846
How to convert datetime into GMT +7 in Python?,0.03846153846153846
insight into array function in python,0.03846153846153846
If nth character of a string in a dataframe is a certain character delete that row,0.03846153846153846
Pandas groupby and substract depending on condition,0.03846153846153846
Reduce dataframe using a running flag,0.03846153846153846
How to partial fill in missing value based on some condition python pandas?,0.03846153846153846
How can I filter specific column values after groupby?,0.03846153846153846
Is there a way to sum 2 columns by grouping 2 other columns on the same value?,0.03846153846153846
txt data cleaning up with pandas and regex,0.03846153846153846
expand datetime data in pandas like interpolation,0.03846153846153846
Filter rows based on list of values and number in a column,0.03846153846153846
Appending list from dataframe with for statement,0.03846153846153846
Data cleaning using Python 3,0.03846153846153846
Filtering Pandas Dataframe using OR statement over a list of columns,0.03846153846153846
Pandas convert columns of datetime format from 31JAN2020 to 2020-01-31,0.03846153846153846
Pandas function with 2 arguments to find threshold,0.03846153846153846
How to convert dictionary with list of unequal size and elements to Dataframe with 1 and 0 values,0.03846153846153846
How do I divide one row in a DataFrame with all other rows in another df?,0.03846153846153846
pandas read path without file folder,0.03846153846153846
How to convert json dataframe to normal dataframe?,0.03846153846153846
Object has no atribute,0.03846153846153846
How to combine multiple dtype 'objects' into a single variable?,0.03846153846153846
.json - File in Pandas-DataFrame: 'NoneType' object has no attribute 'keys',0.03846153846153846
Removing Row Indices and Reverting them to a Column,0.03846153846153846
sum rows in dataframe based on different columns,0.03846153846153846
"python groupby multiple columns, count and percentage",0.03846153846153846
Extract consecutive negative values in pandas,0.03846153846153846
Dividing multiple pandas dataframes by a scalar,0.03846153846153846
Pandas merge two df's where df1.column is = or between df2.column1 and df2.column2,0.03846153846153846
Pandas: Collapse many rows into a single row by removing NaN's in a multiindex dataframe,0.03846153846153846
pandas dataframe merging when columns are not same,0.03846153846153846
How to calculate the size of blocks of values in a list?,0.03846153846153846
Python dataframe columns fill for the same digit data,0.03846153846153846
Pandas Python How to handle question mark that appeared in dataframe,0.03846153846153846
Extra entries ignored in axis legend,0.03846153846153846
Find missing days and grouping,0.03846153846153846
Search for column in pandas,0.03846153846153846
Creating a JSON structure,0.03846153846153846
How to create correlation based on different columns in pandas?,0.03846153846153846
How to create a time chart display in python pandas,0.03846153846153846
Group by similar dates in pandas,0.03846153846153846
Normalize values according to category in pandas,0.03846153846153846
Proper way to convert to an int,0.03846153846153846
Select rows from a dataframe where a column does not take one of the values in a list,0.03846153846153846
"Pandas Dataframe: selecting multiple column by value does not work, why?",0.03846153846153846
Splitting a CSV File Starting at row 28,0.03846153846153846
I'm trying to get days between the two dates but it's not working,0.03846153846153846
Traversal and manipulation of data in a dataframe,0.03846153846153846
how to solve this attribution error AttributeError: 'DataFrame' object has no attribute 'as_matrix' (using Python 3.8),0.03846153846153846
How to create multiple .md files based on a .csv file and enter the correct rows of the .csv file into each newly created .md file?,0.03846153846153846
Creating a New Dataframe based off a SumIf Calculation in Another Datafram Using Pandas,0.03846153846153846
pandas apply() function without having to return a value? / quick looping through df?,0.03846153846153846
Extract a part of address in python,0.03846153846153846
Pandas - create a new string column based on the values of a datetime column,0.03846153846153846
converting wide matrix in to condense sparse format,0.03846153846153846
Creating row numbers based on a column value,0.03846153846153846
Is there a quick way in python to convert a string '1/100' to float 0.01?,0.03846153846153846
Received 'Boolean Series key will be reindexed to match DataFrame index' warning when creating a new data frame,0.03846153846153846
How to store for loop iterations to a new data set,0.03846153846153846
pandas: How to count the unique categories?,0.03846153846153846
How do i check that the unique values of a column exists in another column in dataframe?,0.03846153846153846
Can we assign the calendar of pandas.DatetimeIndex as 'noleap' ? or Can datetime.timedelta skip Feb 29th,0.03846153846153846
pandas csv reader produces wrong result,0.03846153846153846
Comparing values in a pandas Dataframe which are indexed differently,0.03846153846153846
Create new column on basis of another column in Pandas,0.03846153846153846
Copy value from one dataframe to another based on multiple column index,0.03846153846153846
"I have dataframe column with time in integer format, I want to convert it into hours and mins and categorize them into bins",0.03846153846153846
How to return a cell value from Pandas instead of a series?,0.03846153846153846
Modify the line style for matplot.pyplot.plot() of a Pandas DataFrame crosstab(),0.03846153846153846
Using multiprocessing in for loop?,0.03846153846153846
Y intercept of pandas dataframe with multiple series for linear regression,0.03846153846153846
How can I open an excel file once the program finishes,0.03846153846153846
Python read string object and search for a format,0.03846153846153846
Python - Pandas Groupby - When to Use apply() / agg(),0.03846153846153846
pd.to_datetime doesn't work with %a format,0.03846153846153846
Unstack Groupby does not group the data in proper dataset using Pandas,0.03846153846153846
Eliminating for loop by using pandas,0.03846153846153846
column selection and row filtering in one step,0.03846153846153846
"How to ""fix"" object type returned after sql queries with Pandas read_sql_query",0.03846153846153846
How to extract specific rows using Python?,0.03846153846153846
Pandas to_csv is removing commas,0.03846153846153846
Pandas DataFrame - for duplicate rows move column value,0.03846153846153846
Create Pandas dataframe from dictionary - python3,0.03846153846153846
can't read quotes correctly with pandas read_csv,0.03846153846153846
python column replacement and fillnna,0.03846153846153846
"How to make use of ""Time stamp"" column in Multiple Linear regression using Python",0.03846153846153846
Python convert 2 columns to JSON like with extra quotes,0.03846153846153846
Can I create Python Pandas ExcelWriter format without pre-creating a workbook object?,0.03846153846153846
Merging Multiple Dataframes by Multiple Columns,0.03846153846153846
How to write a function to find all rows where value in a column is null when values in dependent columns are not null,0.03846153846153846
Pandas: create columns with deviation from mean in each group,0.03846153846153846
'SeriesGroupBy' object has no attribute '_aggregate_item_by_item',0.03846153846153846
Using regex to find a data in an improper format in pandas data frame?,0.03846153846153846
Animating a geographical heatmap,0.03846153846153846
How to replace row value without changing the other values in dataframe pandas?,0.03846153846153846
Gaussian rolling weights pandas,0.03846153846153846
Create pandas MultiIndex DataFrame from multi dimensional np arrays,0.03846153846153846
"Extract the value 505 from total , the file fails to load as a json file",0.03846153846153846
Python - Compare TS in 2 col and 2 rows,0.03846153846153846
"sequare mean error resulting in error -Input contains NaN, infinity or a value too large for dtype('float64')",0.03846153846153846
Unable to run module,0.03846153846153846
Transforming a Dataframe in Pandas,0.03846153846153846
Pandas to_sql with transactions,0.03846153846153846
List comprehension to get rows from a dataframe that contains matching column values of another dataframe,0.03846153846153846
How to use apply to subtract tuple's elements in DataFrame,0.03846153846153846
Filter columns of the dataframe with specific string,0.03846153846153846
apply using a function with iloc pandas,0.03846153846153846
How to filter data by column content?,0.03846153846153846
Retrieve first non-NA value from a group of columns,0.03846153846153846
Why is the file csv in pandas stored incorrectly?,0.03846153846153846
Python how to convert object to the timestamp,0.03846153846153846
Why is the first row of my pandas dataframe index the name of the index column?,0.03846153846153846
Change date format for specific cells in Pandas,0.03846153846153846
"How to use pandas set_index if the columns have no name and consist only ""rangeindex""",0.03846153846153846
Regular expression to extrat date from columns in a dataframe,0.03846153846153846
Look for n-grams into texts,0.03846153846153846
Pandas flipping sign on certain rows of dataframe,0.03846153846153846
replace row values in a single column pandas,0.03846153846153846
"Pandas, table filling, python",0.03846153846153846
pandas: Convert int Series to new StringDtype,0.03846153846153846
Reading a json webpage using python,0.03846153846153846
Python Merge Pandas Dataframe,0.03846153846153846
Remove rows from pandas dataframe if string has 'only numbers',0.03846153846153846
parse json data to pandas column with missing quotes,0.03846153846153846
Create 5 new columns from multiple CSV files,0.03846153846153846
AttributeError: 'DataFrame' object has no attribute 'path',0.03846153846153846
Selecting between timestamps pandas,0.03846153846153846
How to add a new column to an existing csv file based on another column within the csv file,0.03846153846153846
Pandas shift column based on value of column below,0.03846153846153846
"How do you compute minimum from pandas data frame columns, without creating temporary column?",0.03846153846153846
How to access to the text that is in a section that exists more than once in a html file?,0.03846153846153846
Dataframe increase speed of for loop for set value of column,0.03846153846153846
How to calculate the Jaccard Index in Python?,0.03846153846153846
Most frequently occurring numbers across multiple columns using pandas,0.03846153846153846
Naming excel files using column values + aliases for those values in python,0.03846153846153846
groupby on multiple columns and re-assigning results to new dataframe python,0.03846153846153846
Pandas Dataframe - reducing number of columns (destructuring data),0.03846153846153846
groupby and ranking based on the string in one column,0.03846153846153846
How do I select rows where I x% of the columns have NaN values in pandas?,0.03846153846153846
Lambda function as callable in .iloc[],0.03846153846153846
Pandas ???ave to csv replaces columns,0.03846153846153846
pandas> dataframe consolidation and modification,0.03846153846153846
Complete NaN values in a dataframe based on the values completed in another dataframe,0.03846153846153846
How to extract row value of different length to new columns from a Pandas Series?,0.03846153846153846
Converting object to int to perform aggregation,0.03846153846153846
How to get the Percentage of a Column based on a Condition? Python,0.03846153846153846
Check how many times value of column change when other column value is specific,0.03846153846153846
Filtering pandas dataframe by matching rows in another dataframe,0.03846153846153846
Fix Cell Wrap in Pandas Data Frame,0.03846153846153846
Pandas files not found,0.03846153846153846
Efficiently converting pandas dataframe to scipy sparse matrix,0.03846153846153846
Python Loop with IF condition on pandas dataframe gives me incomplete result or KeyError,0.03846153846153846
Pandas Groupby First - Extract Index from Original Dataframe,0.03846153846153846
Feature importance in Python using SelectKBest,0.03846153846153846
Can not merge pandas dataframe using loop for many times,0.03846153846153846
asfreq yields unexpected results with Period dtype,0.03846153846153846
Divide a column with other columns except itself in pandas dataframe,0.03846153846153846
For loop within a Pandas dataframe to add a new column after each iteration,0.03846153846153846
Appending a single row from multiple CSV files to another CSV,0.03846153846153846
How do you reverse the axis of a Pandas plot?,0.03846153846153846
Hierarchical Columns in Panda,0.03846153846153846
Adding two df columns with different sizes with condition,0.03846153846153846
Select row based on the closest hour and date,0.03846153846153846
"Add a column to a pandas dataframe with A, B, C repeating",0.03846153846153846
python- Multiindex grouped percentages,0.03846153846153846
blank excel export using pandas,0.03846153846153846
How to create a new column in the dataframe with the count of equal terms in the other columns,0.03846153846153846
Python Get min max betweeen 2 columns across sequence of number,0.03846153846153846
Find local datetime at a specific zipcode given UTC time,0.03846153846153846
Efficient way of row-based calculation in Pandas,0.03846153846153846
How to select rows with single value in pandas dataframe column which has both single value and comma seperated values?,0.03846153846153846
Error when imputing using .fit() from SimpleImputer,0.03846153846153846
Need advise in merging dataframes,0.03846153846153846
Can't install python pandas on Windows 10,0.03846153846153846
How to insert values ??nto a column from another table?,0.03846153846153846
How do I create one column in pandas (Python) based on indexes out of multiple columns?,0.03846153846153846
"TypeError: 'numpy.int64' object is not iterable, Webpage Automation",0.03846153846153846
1D list to Pandas DataFrame,0.03846153846153846
Subtract argument-specific column mean in pandas DataFrame,0.03846153846153846
How to strip a string from a datetime stamp?,0.03846153846153846
Vectorising .apply function to return 2 columns,0.03846153846153846
Change int value to .00 format,0.03846153846153846
Can't read data using read_csv due to encoding errors,0.03846153846153846
Select a number of rows in a dataframe after a valid condition,0.03846153846153846
Pandas: add column based on logic across the dataframe,0.03846153846153846
Incremental GroupBy in pandas,0.03846153846153846
"List comprehension for pandas: if column in pandas contains string, return a new column with string",0.03846153846153846
ValueError when settign xlim in pandas plot,0.03846153846153846
Pandas doesn't recognize columns in a document,0.03846153846153846
"Do what np.select(condlist, choicelist) does but instead with pandas only",0.03846153846153846
Finding the mean of r squared in a dictionary list,0.03846153846153846
Add encoder.categores_ as column name in Pandas dataframe after using OneHotEncoder,0.03846153846153846
Missing data from dataframe calculations,0.03846153846153846
Anaconda Pandas install version doesn't match Jupyter Notebook version,0.03846153846153846
Pandas datetime index.is_quarter_end error,0.03846153846153846
How to use a column value in Pandas agg() function with df.groupby(),0.03846153846153846
INSERT or UPDATE bulk data from dataframe/CSV to PostgreSQL database,0.03846153846153846
AttributeError: Can only use .dt accessor with datetimelike values when use dataframe to deal time,0.03846153846153846
pandas matching database with string keeping index of database,0.03846153846153846
sequence of pattern in last 3 values in column pandas + python,0.03846153846153846
Merging 1300 data frames into a single frame column-wise becomes really slow,0.03846153846153846
Determine whether elements of a pandas sequence contain elements of a different sequence as substrings,0.03846153846153846
Plot 2 pandas dataframes with same columns,0.03846153846153846
How to calculate when inventory will run out using pandas?,0.03846153846153846
How can you index a variable inside a pandas query expression?,0.03846153846153846
How to make a radar chart using python with data stored in variables,0.03846153846153846
Can we apply pandas.map() where the function mapping takes more than 1 argument?,0.03846153846153846
Convert TimeIndex of dataframe to DateTimeIndex in place,0.03846153846153846
Code to detect Sunday to Saturday date windows and modify Dataframe,0.03846153846153846
How to append .pkl files in for loop to pandas dataframe created in for loop?,0.03846153846153846
Delete row based on specific datetime and conditions columnwise,0.03846153846153846
extract datetime from SQL table or text file using python,0.03846153846153846
Dataframe merge in python,0.03846153846153846
Ignore minimum values from distincts rows in pandas,0.03846153846153846
How to divide one data frame to another completely,0.03846153846153846
Choosing combinations from Pandas Dataframes,0.03846153846153846
Pandas concat function timing out when combining large dataframes,0.03846153846153846
Writing excel formulas on pandas DataFrame that depends on Row/Column values,0.03846153846153846
How do I suppress scientific notation in pandas DF when exporting to an excel file?,0.03846153846153846
how to merge two pandas dataframe on slightly different keys,0.03846153846153846
Log scale for multiple subplot histograms in pandas,0.03846153846153846
A dataframe contain '\t' how to avoid '\t' from a dataframe,0.03846153846153846
Fill NaN in pandas dataframe with interpolate function,0.03846153846153846
Reduce the number of rows in a dataframe based on a condition,0.03846153846153846
Python: I don't know why this keeps giving me KeyError: 5,0.03846153846153846
closure table in pandas,0.03846153846153846
Pandas Dataframe groupby one column and sum of all other columns,0.03846153846153846
Remove randomly selected purchases that have been copied,0.03846153846153846
How do I un-sort value counts by value in Pandas?,0.03846153846153846
Pandas: Replace col values before first postive with 0?,0.03846153846153846
Pandas apply function with vector argument,0.03846153846153846
Python.pandas: how to select rows where objects start with letters 'PL',0.03846153846153846
how to return a dataframe if one of rows in column match certain value,0.03846153846153846
"How to merge two large pandas dataframes by mergining common columns and keeping the rest, without keys",0.03846153846153846
How to convert text table to dataframe,0.03846153846153846
"Python, pandas dataframe, groupby column and known in advance values",0.03846153846153846
pandas read_csv slow performance when using parse_dates,0.03846153846153846
Plotting data from Excel file in python,0.03846153846153846
Highlight dataframe cells based on multiple conditions in Python,0.03846153846153846
Syntax error when assigning an absolute path using pandas,0.03846153846153846
Pandas KeyError when using .loc(),0.03846153846153846
How to find sum of two cells with same row names in a dataframe (Pandas),0.03846153846153846
Deleting colums of dataFrame where row value is constant for all rows,0.03846153846153846
where() providing unusual output,0.03846153846153846
Column name disappears after resampling dataframe,0.03846153846153846
Check multiple columns data format and append results to one column in Pandas,0.03846153846153846
Get values in another column depending on values in another column pandas,0.03846153846153846
Fetch max value column with row cells condition,0.03846153846153846
output row with recent date base on specific values,0.03846153846153846
Plotting dataframe with paramater,0.03846153846153846
Loop Function with Interaction Plotly,0.03846153846153846
Creating new rows from single cell strings in pandas dataframe,0.03846153846153846
Rename a column based on values in another column,0.03846153846153846
Retrieving a table for values from weatherbug query,0.03846153846153846
Python: SettingWithCopyWarning when trying to set value to True based on condition,0.03846153846153846
How to extract a string from tuple index based on if-else condition in pandas?,0.03846153846153846
Append Dataframe inside the loop - Python,0.03846153846153846
How to Iterate & Count Each Categorical Value Based on Some Condition,0.03846153846153846
How can I write the output of .describe() for a df column to a new df?,0.03846153846153846
How can I use cumsum skipping the first entry?,0.03846153846153846
Python Pandas shift by given value in cell within groupby,0.03846153846153846
Dataframe Interpolation based on table values,0.03846153846153846
R10/H10 application error when trying to open Flask app with Heroku,0.03846153846153846
Compare the three columns and replace the unique string with the string in the remaining columns. Python,0.03846153846153846
use Other Dataframe in the condition to get Sub Dataframe,0.03846153846153846
Transform list of tuples in pandas.DataFrame,0.03846153846153846
Elegant way to shift multiple date columns - Pandas,0.03846153846153846
Transforming Database with Pandas Dataframe,0.03846153846153846
pandas create category column based on sequence repetition in another column,0.03846153846153846
detecting only changing value sign from positive to negative,0.03846153846153846
Avoid pandas.to_sql writes into table with double quotes (PostgreSQL database),0.03846153846153846
How to only use the first match when merging Pandas Dataframes?,0.03846153846153846
Compare Values in a entire Dataframe Row to another Dataframe,0.03846153846153846
Filtering records in one dataframe based on matching values from another dataframe,0.03846153846153846
Dynamically make comparisons between columns in pandas columns,0.03846153846153846
How do I use conditional selection and groupby aggregation to produce a df with dummy variables?,0.03846153846153846
how to provide file name to excel using python dataset?,0.03846153846153846
Replacing values in Dataframe based on data from a DataFrameGroupBy object,0.03846153846153846
Interesting pandas groupby confusion,0.03846153846153846
"create columns based on groupby elements using sql , pandas or pyspark?",0.03846153846153846
