Title,Correlation Score
how to add proportion label on the stacked bar chart in python bar chart,0.1096866096866096
Plotly: How to plot a bar & line chart combined with a bar chart as subplots?,0.1096866096866096
How can I create a stacked bar chart in matplotlib where the stacks vary from bar to bar?,0.1076923076923077
Plot Stacked bar chart and Multiple bars chart from Pandas dataframe,0.1076289965178854
Matplotlib bar chart - overlay bars similar to stacked,0.09288824383164003
"Pandas, Horizontal Bar Chart With Error Bars",0.09288824383164003
Bars in matplotlib bar chart are not the same width?,0.09288824383164003
Plotly: plot bar chart in stock price chart,0.09288824383164003
how do I add error bars to a grouped bar chart with python pandas?,0.09288824383164003
How to create a bar chart with python/ploty with grouped and stacked bars?,0.09288824383164003
"Pandas Bar plot, how to annotate grouped horizontal bar charts",0.09288824383164003
How to plot a multiple bar chart? I can't make gaps between bars,0.09288824383164003
Stock price bars--get next closest price in dataframe of bars if bar doesn't exist for some X timeframe,0.09288824383164003
Matplotlib bar chart: independently adjust alpha values for specific bars,0.09288824383164003
How to color bars in grouped plotly bar chart,0.09288824383164003
Python Pandas Bar Chart - change color for specific bars,0.09288824383164003
Change the stacked bar chart to Stacked Percentage Bar Plot,0.09288824383164003
How to make a stacked bar chart with 3 categories inside the bars?,0.09288824383164003
bar chart legend based on coloring of bars by group not value,0.09288824383164003
Bar chart: How can I get the same date format on the x-axis as in a time series chart?,0.09288824383164003
How do you remove spaces between bars in bar charts for where plotted values are zero?,0.09288824383164003
Change bar width with a python Bokeh grouped bar chart?,0.09288824383164003
How to remove 'value.0' from the top of a bar in a bar chart in pandas,0.09288824383164003
How to add a baseline and written values next to the bars in a bar chart,0.09288824383164003
Change distance between bar groups in grouped bar chart (plotting with Pandas),0.09288824383164003
Create a bar chart whose bars are percent progress filled relative to a maximum or minimum,0.09288824383164003
How to make matplotlib/pandas bar chart look like hist chart?,0.09288824383164003
How to draw the value on the bars in a bar chart with Pandas?,0.09288824383164003
Drawing Candlestick and volume chart using Matplotlib's bar chart with skip weekend,0.09288824383164003
Using the amount of bars to set the width/labelsize of a bar chart,0.09288824383164003
Horizontal stacked bar chart in python giving multiple charts in Jupyter Notebook,0.09288824383164003
Click on bar in bar chart to return a data frame in python,0.09288824383164003
Python (matplotlib): how to flip negative bars from upside down to upright in a bar chart,0.09288824383164003
Plotly: Making bar chart bars visible when data has large range,0.09288824383164003
horizontal bar chart with color bar directly from a dataframe pandas object,0.09288824383164003
Pandas- stacked bar chart with independent/unrelated partitions of bars,0.09288824383164003
Bar chart with separate bars for positive and negative values,0.09116809116809114
How to combine two categories of one column in not separate bars but one combined bar in a chart or histogram?,0.09116809116809114
matplotlib: bar chart with datetime x axis causing uncontrollable bar width,0.09116809116809113
Attempting create bar charts form a Pandas Data Frame. Charts to be specific to the month,0.09116809116809113
Why are bars missing in my stacked bar chart -- Python w/matplotlib,0.09116809116809113
How to remove one bar label from the legend in a multiple bar chart,0.09116809116809113
"When plotting month wise data in Line chart, I get extra ticks in x_axis, but when I plot in Bar chart it's fine, why so?",0.09116809116809113
How to change color of each bar in bar plot and high of description above each bar in Python Pandas Matplotlib?,0.09116809116809113
Creating bar chart showing percent change off the top of a bar,0.09116809116809113
Seaborn catplot (kind='count') change bar chart to pie chart,0.09116809116809113
'missing' bars in matplotlib bar chart,0.09116809116809113
Changing width of bars in bar chart created using seaborn.factorplot,0.09116809116809113
Modifying bar-width and bar-position in matplotlib bar-plot (looping over containers),0.09116809116809113
How to add error bars to a Data Frame Grouped bar plot or even an array of arrays grouped bar plot?,0.09116809116809113
show values on bars in bar charts,0.09116809116809113
Highlight (select) a bar in a holoviews bars chart,0.09079180777293983
How to determine the order of bars in a matplotlib bar chart,0.08951048951048948
Change bar colors in pandas matplotlib bar chart by passing a list/tuple,0.08951048951048948
How to sort bars in increasing order in a bar chart?,0.08911047799936686
Trying to create bar charts form a Pandas Data Frame. Charts to be specific to the month,0.08911047799936686
Arrange the Bar color based on Column name in Matplotlib Bar Chart,0.08911047799936686
Pandas: Bar-Plot with two bars from repetitive x-column in dataframe,0.07544378698224849
plot stacked bar chart using bokeh,0.07544378698224849
How to set a colour legend with the days of the week in Plotly bar chart,0.07544378698224849
pandas stacked bar plot - change the edgecolor of stacked bar,0.07544378698224849
Need Assistance: Unable to get datetime as x ticks with bar chart,0.07544378698224849
How to create and annotate a stacked proportional bar chart,0.07544378698224849
Stacked bar chart from multiple CSVs in python,0.07544378698224849
How can I normalize data and create a stacked bar chart?,0.07544378698224849
Dynamic grouped bar chart,0.07544378698224849
Pandas Grouped Bar Chart,0.07544378698224849
How to plot a grouped bar chart from a dataframe with several columns in x?,0.07544378698224849
"Changed frequency of ticks in Pandas '.bar' plot, but messed up the actual bars",0.07544378698224849
Python polar bar chart - Remove degrees & color one ring,0.07544378698224849
How to add error bars to a grouped bar plot?,0.07544378698224849
Plotting Column against Boolean Column (Bar Chart),0.07544378698224849
No Axis Named 1 for Object Type <class 'pandas.core.frame.DataFrame'> when trying to create stacked bar chart,0.07544378698224849
Displaying values of bar graph with multiple groups of bars,0.07544378698224849
Pandas - Stacked bar chart with multiple boolean columns,0.07544378698224849
Jupyter Notebook bar chart formatting,0.07544378698224849
Plotting Panda Dataframe into 3D bar chart,0.07544378698224849
Panda DataFrame Plot xaxis.set_major_locator leaves ticks blank on bar chart,0.07544378698224849
Same Color for Bar Charts as a Scatter Plot,0.07544378698224849
How to put percentage bars in DataTable similar to pandas style.bar,0.07544378698224849
Plotting a grouped pandas data in plotly bar chart,0.07544378698224849
Plotting a bar chart in pandas dataframe,0.07544378698224849
Need help plotting 2 sliced indexes into bar chart in python,0.07544378698224849
Is there any built in function in pandas to subtract various columns to manipulate a stacked bar chart?,0.07544378698224849
python stacked bar chart using categorical data,0.07544378698224849
Pie and bar charts in Python,0.07544378698224849
Pandas series stacked bar chart normalized,0.07544378698224849
How to do Pandas stacked bar chart on number line instead of categories,0.07544378698224849
"How to add custom annotations, from the dataframe, to a stacked bar chart?",0.07544378698224849
Colours in bar chart form values in dataframe?,0.07544378698224849
"Stacked bar chart , stacking by genre of games",0.07544378698224849
Plotting bar chart -colors python,0.07544378698224849
How do I get a bar chart by pandas dataframe axis python,0.07544378698224849
how to label the bar charts in python,0.07544378698224849
Create a stacked bar chart of the N largest columns per row in a dataframe,0.07544378698224849
How to decide which bars are plotted on top/last in overlay of 2 Pandas bar plots where one plot uses alpha,0.07544378698224849
stacked bar chart from grouped object,0.07544378698224849
pandas - Grouped weighted Bar Chart,0.07544378698224849
In Python is there a way to create a bar chart based on the first column in a two-column groupby table?,0.07544378698224849
How to add a colorbar to a plt.bar chart?,0.07544378698224849
Pandas count unique value and change to percentage and put into the plotly bar chart,0.07544378698224849
Pandas DataFrame Bar Plot - Plot Bars Different Colors From Specific Colormap,0.07544378698224849
Plotting Bar and Line charts with Pandas data frame using secondary Y axis and adding the legend together,0.07544378698224849
How to display the values count on the bar chart,0.07544378698224849
Plotting bar chart from dataframe using subplot,0.07544378698224849
Bar Chart from Dataframe,0.07544378698224849
matplotlib axes bar plot unable to plot bars next to each other due to indexing x-axis from pandas df,0.07544378698224849
"Python Plot Bar Chart Summing a Column, Grouped by Two Different Columns",0.07544378698224849
How to plot multiple bar charts in python,0.07544378698224849
Plot a side by side bar charts with sharing only Y-axis,0.07544378698224849
How to plot a bar chart from a dataframe with only dummy variables?,0.07544378698224849
Python Stacked bar chart from DF with index dates?,0.07544378698224849
How to plot line and bar-chart on the same x-axis (datetime) but different y-axis with pyplot?,0.07544378698224849
Using Python libraries to plot two horizontal bar charts sharing same y axis,0.07544378698224849
How can I plot a stacked bar chart of median of a column in pandas dataframe?,0.07544378698224849
Rearranging groupings in bar chart from pandas dataframe,0.07544378698224849
Pandas plot bar chart over line,0.07544378698224849
How to annotate bar chart with values different to those from get_height(),0.07544378698224849
Plotly bar chart not ascending/descending,0.07544378698224849
Stacked Bar chart of many columns grouped by the values of one column (Pandas),0.07544378698224849
How to zoom in on portions of bar charts,0.07544378698224849
Bar chart in pandas,0.07544378698224849
Python pandas bar chart (Populations of the Countries of the World),0.07544378698224849
A simple bar chart of the populations of the countries of the world with Pandas,0.07544378698224849
How to plot time series stacked bar chart using plotly python,0.07544378698224849
Horizontal Bar Chart on Pandas Data Frame with Dynamic Column Names,0.07544378698224849
How to turn groupby() and value_counts() into multiple pie/bar charts,0.07544378698224849
Create vertical stacked bar chart referenced to y values (lithology/stratigraphic column),0.07544378698224849
Plotting multiple bar charts,0.07544378698224849
matplotlib plot line and bar chart together on same x-axis,0.07544378698224849
How to plot a (grouped) bar chart from a dataframe using pandas,0.07544378698224849
Display totals and percentage in stacked bar chart using DataFrame.plot,0.07544378698224849
Pandas bar chart with unequal groups,0.07544378698224849
Pandas/matplotlib bar chart with colors defined by column,0.07544378698224849
How to make a stacked bar chart in python,0.07544378698224849
Stacked bar chart is cut off at the edges,0.07544378698224849
How to plot a bar-plot with only one bar colored?,0.07544378698224849
Matplotlib bar chart from two variable column - Pandas data manipulation (mostly),0.07544378698224849
Horizontal stacked unique 100% bar chart plotly python,0.07544378698224849
How to generate a bar chart with data from a csv?,0.07544378698224849
Stacked Bar Chart count by a certain column which contains string values,0.07544378698224849
How to label the bars of a stacked bar plot from a pandas DataFrame?,0.07544378698224849
Selecting rows from Pandas data frame to build bar chart,0.07544378698224849
Altair: How do I change the font size of the column title in a grouped bar chart?,0.07544378698224849
Stacking just one of the bars on a pandas MultiIndex dataframe using matplotlib bar plot,0.07544378698224849
plotting multiple stacked bar chart,0.07544378698224849
Create simple bar chart from data frame with many columns,0.07544378698224849
Matplotliib: Creating multi bar charts for multiple columns from a Pandas dataframe,0.07544378698224849
Plotting bar charts by each two rows,0.07544378698224849
How to plot stacked bar chart of Parisian venues grouped by arrondissement (neighborhood),0.07544378698224849
How can multiple groups of data be put in a single bar chart?,0.07544378698224849
Stacked bar chart with bokeh and pandas dataframe,0.07544378698224849
Plotting a DataFrame (that has a date index) as a bar chart,0.07544378698224849
Bar chart and plot with same ax,0.07544378698224849
How to plot bar and line chart together and formatting the x axes with dates,0.07544378698224849
Group by column in panda bar chart,0.07544378698224849
Pandas TypeError when adding bar chart to the plot,0.07544378698224849
Creating stacked bar chart from dataframe,0.07544378698224849
plot bar chart for multiple categorical values with groupby,0.07544378698224849
"New to python, i need to plot a bar chart from the output which is in percentages",0.07544378698224849
How can I represent the values of particular row in form of bar chart in dataframe,0.07544378698224849
Plotting JSON from dict() to pie charts and bar graphs,0.07544378698224849
How to make pandas bar chart starting from 0?,0.07544378698224849
How to plot bar chart with first row as index?,0.07544378698224849
"How to get two legends using pandas plot, one for the colors of the stacked bars and one for the hatches of the bars?",0.07544378698224849
Plotly stacked bar chart pandas dataframe,0.07544378698224849
How to plot multi-index dataframe as stacked bar chart in Plotly,0.07544378698224849
pandas bar plots x axis behaves differently than caling Axes.bar directly,0.07544378698224849
Annotating Pandas Bar Chart with Images,0.07544378698224849
Offline Plotly: Generate bar chart of 2 columns on (y axis) & 1 column on ( x axis),0.07544378698224849
How to merge line graph with grouped bar chart with annotation,0.07544378698224849
stacked bar plot from loop not adding different components of bars,0.07544378698224849
Python Grouped bar chart. Count doesnt work,0.07544378698224849
Python Bokeh -- Incorporate HoverToolTip into Bar Chart by using DataFrame Columns,0.07544378698224849
Plotly two bar charts overlaid,0.07544378698224849
Annotate bars with values on Pandas bar plots for subplots,0.07544378698224849
How to select which data is plotted on a bar chart from a 'groupby' object in pandas,0.07544378698224849
Stacked bar chart. Create one integrated Tooltip with information from all categories (Altair),0.07544378698224849
Stacked Bar-chart based on bool value column Altair,0.07544378698224849
matplotlib grouped bars in a bar graph,0.07544378698224849
Bar chart with customised width in Python,0.07544378698224849
Bar chart pandas Dataframe with Bokeh,0.07544378698224849
Adjusting the Scale on Bar Chart in Pandas,0.07544378698224849
Pandas crosstab stacked bar chart with subplots impossible to use,0.07544378698224849
Adding Legend to Grouped Bar Chart in Chartify,0.07544378698224849
Bar Chart Colour Manipulation in Pandas,0.07544378698224849
Change the edgecolor of single bar in bar plot through time,0.07544378698224849
How to plot a bar chart if the input data is of type list?,0.07544378698224849
How to plot a line over a bar chart,0.07544378698224849
stacked bar plot missing bar,0.07544378698224849
"how to plot a ""group by"" dataframe in Bokeh as Bar chart",0.07544378698224849
How to turn on scientific notation in matplotilb bar chart?,0.07544378698224849
Bar Chart Color Key is Incorrect,0.07544378698224849
add color stacked chart bar,0.07544378698224849
Creating bar chart with CSV data python,0.07544378698224849
How to plot a stacked bar chart using pandas,0.07544378698224849
Plot subplot with bar chart from pandas dataframe,0.07544378698224849
Python plot bar chart and percentage line chart on same graph,0.07544378698224849
How to add a line on top of a bar chart?,0.07544378698224849
Line chart + grouped bar chart with different frequency,0.07544378698224849
Plot bar chart in multiple subplot rows with Pandas,0.07544378698224849
How to make a plotly grouped bar chart using two different columns from spreadsheet?,0.07544378698224849
Pandas stacked bar chart went wrong,0.07544378698224849
bar plot - annotate the bars with some values,0.07544378698224849
"Drawing a horizontal stacked bar chart, from the mean of two columns",0.07544378698224849
Numbers to come on top of bar charts in python matplot.lib,0.07544378698224849
Matplotlib bar chart with multiple columns and string X axis,0.07544378698224849
Bars not aligning with X-axis tick and first bar cut-off in Bokeh plot,0.07544378698224849
bar chart of monthly temperature,0.07544378698224849
Plotting Pandas Crosstab Dataframe into 3D bar chart,0.07544378698224849
How to plot stacked bar chart to summarise each categorical column for proportion of values,0.07544378698224849
How do I combine 2 bar charts in Python pandas plotly with 2 y-axes?,0.07544378698224849
matplotlib grouped bar chart and line graph is not align to x-axis,0.07544378698224849
Bokeh bar plot: color bars by category,0.07544378698224849
Annotating bar chart in pandas,0.07544378698224849
Plotly.py bug using discrete colour data on stacked bar chart with customdata in hover text,0.07544378698224849
"I am trying to categorize bars on a Bokeh chart using a pandas multi-index, but I can't seem to get it to work",0.07544378698224849
How do I make pandas catagorical stacked bar chart scale to 100%,0.07544378698224849
Matplotlib - Add value label on bar chart from column in dataframe,0.07544378698224849
Generating a python plotly grouped bar chart timeseries,0.07544378698224849
Colors for pandas bar chart,0.07544378698224849
How merge a list of dataframe on date to do a bar chart ? Pandas Python,0.07544378698224849
How to create an unequally spaced bar chart?,0.07544378698224849
Dropdown bar chart (plotly) based on values column,0.07544378698224849
How do I convert this csv data into a bar chart?,0.07544378698224849
Color Bar Chart based on values in Dataframe,0.07544378698224849
Correctly Label Bar Chart Segments based on DataFrame,0.07544378698224849
How to annotate bar plots when adding error bars,0.07544378698224849
non-overlapping color fill in plotly bar chart,0.07544378698224849
How to create a bar chart with non-numeric X axis?,0.07544378698224849
Python/pandas: Bar Chart with non-numerical categories,0.07544378698224849
Sankey bar chart diagramm with pandas or python,0.07544378698224849
Pandas plot bar chart with it's value plotted,0.07544378698224849
Make Stack Bar Chart Plotly Different Colors,0.07544378698224849
Make a bar-chart in pandas,0.07544378698224849
Pandas stacked bar chart,0.07544378698224849
How to make bar charts for muultiple groups?,0.07544378698224849
Add 95% confidence intervals as error bars to pandas bar plot,0.07544378698224849
How to bar plot with percentage of each bar,0.07544378698224849
Python package bar-chart-race 0.1.0: can't change separator thousands to dot,0.07544378698224849
Plotting a stacked Bar Chart in pandas for multiple x-axis attributes,0.07544378698224849
My Bar Plot is not showing bars for all the data values,0.07544378698224849
display value of bars when bars are grouped,0.07544378698224849
Pandas bar plot: one bar coloured in palette and the rest single colour,0.07544378698224849
Pandas - Multiple stacked bar charts on column values,0.07544378698224849
Put the legend of pandas bar plot with secondary y axis in front of bars,0.07544378698224849
"How do I plot such stacked bar chart from pandas dataframe? I want 2 column names (""A"" and ""B"") as X axis",0.07544378698224849
pandas - plot bar chart for multiple categories,0.07544378698224849
last bar is hiding behind in pandas grouped bar plot,0.07544378698224849
How can i graph this as a stacked bar chart?,0.07544378698224849
How to make percentage bar chart of topics from topic modeling?,0.07544378698224849
pandas group bar chart,0.07544378698224849
Percentage stacked bar chart pandas,0.07544378698224849
pandas plot bar chart -- Unexpected layout,0.07544378698224849
Unsupported operand type(s) for -: 'str' and 'float' when building a bar chart,0.07544378698224849
Bar Chart with Line Chart - Using non numeric index,0.07544378698224849
For loop charts - changing xtick frequency dynamically for each chart,0.07544378698224849
How to create grouped bar chart for situations,0.07544378698224849
Visualization: Grouped and stacked Bar chart,0.07544378698224849
How to plot a bar chart with a range of values on one axis and the sum of corresponding values of rows of other column in that range on other axis,0.07544378698224849
Frequency histogram/bar-chart in Python from two lists,0.07544378698224849
Why are my bar chart percentages all off?,0.07544378698224849
Export styled pandas df with bar charts as png,0.07544378698224849
pandas plot dataframe as multiple bar charts,0.07544378698224849
How to plot and annotate a grouped bar chart,0.07544378698224849
Pandas Bar Chart,0.07544378698224849
Grouped bar chart with multiple markers,0.07544378698224849
Looking To Combine 2 Bar Charts,0.07544378698224849
Space bevor the fist Bar in df.plot.bar(),0.07544378698224849
"Create a bar plot in pandas with dates on x-axis, one bar for each value in other column",0.07544378698224849
How to use matplotlib to plot complex bar graphs??ultiple subplots with multiple rows of bars?,0.07544378698224849
How to plot Horizontal Bar Chart in Bokeh (Python),0.07544378698224849
Python - How to make a bar chart from csv file when the data is not numeric,0.07544378698224849
Trying to create a bar chart from this DataFrame,0.07544378698224849
In Python Plotly is there a bar chart equivilant to histogram binning?,0.07544378698224849
Pandas using pivot_table to achieve barplot with overlay bars and groups of bars,0.07544378698224849
3d bar chart with dataframe in pivot table format,0.07544378698224849
Layered bar chart based on columns in pandas,0.07544378698224849
Combining two stacked bar plots for a grouped stacked bar plot,0.07544378698224849
"How to pick pairs of columns, plot them against each other in a bar chart pandas?",0.07544378698224849
Creating a Stacked Bar Chart using Groups (and sum),0.07544378698224849
Stacked Bar Chart Python from pivot/groupby table,0.07544378698224849
Stacked bars are unexpectedly annotated with the sum of bar heights,0.07544378698224849
How do i make Bar Chart of a subset of counts of categorical Column?,0.07544378698224849
"SPSS style ""Clustered"" bar chart of counts in multiple columns with python and pandas",0.07544378698224849
Plotly: How to animate a bar chart with multiple groups using plotly express?,0.07544378698224849
Why does merging two bar chart subplots into one change the axis and how can I fix this?,0.07544378698224849
How to plot a stacked bar chart for pandas grouped features?,0.07544378698224849
how do I get a grouped bar chart based on the dataframe I have?,0.07544378698224849
matplotlib categorical bar chart creates unwanted whitespace,0.07544378698224849
Data Frame transpose and bar chart,0.07544378698224849
pandas plot of bar chart of postitive and negative values from a csv file,0.07544378698224849
Add vertical line to multi horizontal bar-chart,0.07544378698224849
I am having a bit of trouble with my stacked bar chart,0.07544378698224849
Annotate One variable in a stacked Bar chart,0.07544378698224849
Matplotlib interactive bar chart,0.07544378698224849
Pandas plot bar charts where X and Y values are column values,0.07544378698224849
How to feed the x and y values of a Plotly bar chart from a Pandas data frame,0.07544378698224849
Make Bar Chart With Binned X Values Python,0.07544378698224849
Python Bar Chart y-axis with value mean,0.07544378698224849
How to create a single legend for a group of bar charts generated from a dataframe,0.07544378698224849
Python Pandas - sort a groupby plot bar chart,0.07544378698224849
how to sort the bar chart values in python?,0.07544378698224849
"Matplotlib, horizontal bar chart (barh) is upside-down",0.07544378698224849
Adding grouping ticks to a bar chart,0.07544378698224849
Stacked bar chart in Bokeh; interactively plotting grouped data,0.07544378698224849
Clustered stacked bar plot with error bars,0.07544378698224849
Grouped bar chart of multiindex,0.07544378698224849
"How can I print it out in this order: table, bar chart, table ...?",0.07544378698224849
Update (or redraw?) matplotlib bar chart using y value from onclick,0.07544378698224849
Bar plot with date range cuts bars in plotly,0.07544378698224849
creating bar chart with different groups in different colors in python,0.07544378698224849
how to draw categorized bar chart from data frame in python pandas,0.07544378698224849
How to show multiple text and text position in Python Plotly stacked bar chart,0.07544378698224849
Pandas Bar Plot Error Bar,0.07544378698224849
Pandas - stacked bar chart with column values for stacking,0.07544378698224849
matplotlib bar chart with data frame row names as legend,0.07544378698224849
Multiple Bar Chart - no results,0.07544378698224849
"How to create ""100% stacked"" bar charts in plotly?",0.07544378698224849
