Title,Correlation Score
issue in creating Data frame by passing list,0.05621301775147929
Pandas Error: Passing lists with missing labels,0.05621301775147929
How to pass multiple elements in dictionary to replace values python,0.05621301775147929
Appending items to a DataFrame in a loop from a nested list,0.05621301775147929
"How to make an ""and"" operation in Pandas DataFrame with items in a list",0.05621301775147929
Drop rows not equal to values for unique items - pandas,0.05621301775147929
How to find cumulative sum of items in a list of dictionaries in python,0.05621301775147929
Iterating on Pandas DataFrame to pass data into API,0.05621301775147929
Adding an item on top & bottom of series pandas,0.05621301775147929
Remove dictionary key if any item of the tuple that composes it is not in a dataframe,0.05621301775147929
Split Dataframe based on list items in a column,0.05621301775147929
How do I 'squash' the values in a DataFrame that I know only has one item per row into a Series?,0.05621301775147929
split item to rows pandas,0.05621301775147929
Removing specific items from a dictionary in python?,0.05621301775147929
Python: Making a dictionary with items of two columns,0.05621301775147929
"Efficiently get a list of booleans that correlates to wheter an item exists in a list of dictionaries, using panda data frame",0.05621301775147929
best way to find the row of dictionary contain the list item python,0.05621301775147929
Apply two sorting methods to one dataframe based on condition of rows,0.05621301775147929
Python - how to pass a result from group by to Pivot?,0.05621301775147929
pandas replace items in df from mappings defined in separate df,0.05621301775147929
Is it possible to add a string as a legend item in matplotlib,0.05621301775147929
How to remove the special characters in the columns and convert the columns into float?,0.05621301775147929
How to iterate values from a dataframe and pass the values to a send email function in Python,0.05621301775147929
Add index to duplicated items in Pandas Series,0.05621301775147929
Passing list-likes to .loc or [] with any missing labels is no longer supported Some Vale Miss,0.05621301775147929
All objects passed were none error with pandas concatenate,0.05621301775147929
Passing a parameter into a pivot table,0.05621301775147929
substitute attribute zero values with average of items with similar attributes,0.05621301775147929
Pass values of a pandas column as separate arguments in a function,0.05621301775147929
How to iterate over files extract file name and pass to pandas logic,0.05621301775147929
How to find the maximum number of words and characters in sentences from a dataframe?,0.05621301775147929
Pandas - count how many total items were in each month (with a cumulative sum?),0.05621301775147929
how to pass in f-string inside another string in dataframe series,0.05621301775147929
Pandas get_dummies to create one hot with separator = ' ' and with character level separation,0.05621301775147929
Remove an item if value is NaT from list of dictionaries?,0.05621301775147929
Pandas: How to apply a passed conditional operator to select rows in pandas?,0.05621301775147929
using cumsum method on multi level index in pandas,0.05621301775147929
python pandas: How dropping items in dateframe,0.05621301775147929
Issue while passing values from data-frame into python Email sending function using boto3,0.05621301775147929
"Find all numbers after a character, separated by commas",0.05621301775147929
Fastest way to check pandas dataframe and show other elements in the other columns at the same row,0.05621301775147929
"Passing list-likes to .loc or [] with any missing label will raise KeyError in the future, you can use .reindex() as an alternative",0.05621301775147929
"Python, Pandas - Issue applying function to a column in a dataframe to replace only certain items",0.05621301775147929
Get Top N items per month in pandas,0.05621301775147929
Pb: 'Passing list-likes to .loc or [] with any missing labels is no longer supported,0.05621301775147929
Append select items from one nested dictionary to another,0.05621301775147929
Pass Series of colors/markers to matplotlib with geopandas,0.05621301775147929
"OneHotEncoder : ValueError: The truth value of a Series is ambiguous. Use a.empty, a.bool(), a.item(), a.any() or a.all()",0.05621301775147929
Split dataframe column into two based on first occurrence of an item in column value,0.05621301775147929
Is there a way to group data and split it in different bins according to each categorical data in it's column (as set item) in Python/Pandas?,0.05621301775147929
Python Pandas Data Formatting: Difference in passing index and iloc,0.05621301775147929
Import all values to excel,0.05621301775147929
Iterate over rows and calculate mean of selected items putting the new value in a new column,0.05621301775147929
matplotlib y axis labels disappearing with fontsize change,0.05621301775147929
"pandas ""groupby"" produced a level in headers that is unable to access or delete",0.05621301775147929
Logistic Regression Model (binary) crosstab error = shape of passed values issue,0.05621301775147929
How do I save treeview items into user_name(entry.get) and display them in another treeview,0.05621301775147929
"Joining Three Data Frames for all Iterations of Car Color, Pets, and Items Purchased in Pandas- groupby?",0.05621301775147929
Dictionary of lists - find keys in a dictionary for which the item's (lists) are the same,0.05621301775147929
"Using concat for a dictionary I get the error: first argument must be an iterable of pandas objects, you passed an object of type ""DataFrame""",0.05621301775147929
How to iterate a Pandas DataFrame and replace string if there is match of items from another column,0.05621301775147929
Pandas 'Passing list-likes to .loc or [] with any missing labels is no longer supported' on train_test_split returned data,0.05621301775147929
Will passing ignore_index=True to pd.concat preserve index succession within dataframes that I'm concatenating?,0.05621301775147929
Python How to count a series with multiple items in one line,0.05621301775147929
Compare items separated by comma in two column,0.05621301775147929
"model.fit validation_set ValueError: The truth value of a DataFrame is ambiguous. Use a.empty, a.bool(), a.item(), a.any() or a.all()",0.05621301775147929
Pandas - Split column by number of items in cell,0.05621301775147929
How to pass an object between app routes in a Flask app if it is a dataframe with null values and a column that has numbers separated by underscores?,0.05621301775147929
"How should I pass a matplotlib object through a function; as Axis, Axes or Figure?",0.05621301775147929
"Pandas: Using .loc to find items, iterate a list within the column cells",0.05621301775147929
Passing matplotlib subplots generated from a pandas dataframe to HTML for display using flask,0.05621301775147929
returning one-item series as a tuple in pandas,0.05621301775147929
How to transpose the csv file data based on series of group data items,0.05621301775147929
Pandas: Find consecutive items in a column separated by 50 units,0.05621301775147929
How can I iterate through different CSV files with Python/Pandas by first column and item value?,0.05621301775147929
How to pass nested JSON from dataframe while adding another field?,0.05621301775147929
How to split items within one cell in a certain column and implement one-hot encoding?,0.05621301775147929
Produce separate line plots with multiple legend items,0.05621301775147929
Passing values of a data frame column values using for loop\iterate the loop,0.05621301775147929
Generate matrix from series taking N items at a time?,0.05621301775147929
"seaborn.kdeplot (pandas.DataFrame) - ValueError: If using all scalar values, you must pass an index",0.05621301775147929
Pandas append row using a dictionary somehow adds columns for some of the new dictionary items,0.05621301775147929
Pandas: vlookup type search to get average/mean values of same name/id items from multiple columns in a multi-index dataframe,0.05621301775147929
usecols issue in read_excel: passing in a string list,0.05621301775147929
"Pandas, iterate over datafralme items and built new dataframe based on columns values",0.05621301775147929
AttributeError: 'NoneType' object has no attribute 'items' when iterating over the rows of the list,0.05621301775147929
'Passing list-likes to .loc or [] with any missing labels is no longer supported,0.05621301775147929
Python passing entire list as argument without iterating over it?,0.05621301775147929
Passing datetime-like object to seaborn.lmplot,0.05621301775147929
Merge Python Pandas Index only or combine multiIndex Cartesian with multiIndex aggregates to show in-use vs not in use,0.05621301775147929
Searching items of large list in large python dictionary quickly,0.05621301775147929
Convert Dictionary Unequal Items to Data-frame,0.05621301775147929
"Python,ML error: The truth value of a Series is ambiguous. Use a.empty, a.bool(), a.item(), a.any() or a.all()",0.05621301775147929
How to access/split items in a column that contains a list,0.05621301775147929
importing dict to dataframe getting index error or columns are not correct,0.05621301775147929
"Within a loop, match items with values in a dataframe column, then store a separate column value as a variable",0.05621301775147929
How to check column values of a dataframe with dictionary items,0.05621301775147929
"TypeError: 'str' object does not support item assignment, pandas operation",0.05621301775147929
"Pandas DF Creating from Dictionary Error: ValueError: If using all scalar values, you must pass an index",0.05621301775147929
Passing list-likes to .loc or [] with any missing labels is no longer supported,0.05621301775147929
"Simple pivoting of DataFrame in python should work. Is this a bug when passing 'values' argument? If so, how to fix it?",0.05621301775147929
pandas and matplotlib: Combine two plots into one legend item,0.05621301775147929
Creating a new dataframe by passing a series of datetimes through an existing dataframe,0.05621301775147929
Explode items to rows and convert dictionary to columns does not work,0.05621301775147929
Select one item from Series and keep the index,0.05621301775147929
Python tkinter operation for pass the value from the Textbox,0.05621301775147929
I'm trying to pass usernames to excel using praw I get: AttributeError: 'list' object has no attribute 'to_excel,0.05621301775147929
Randomly split dataframe into bins of unique items by multiple conditions,0.05621301775147929
KeyError in Pandas when passing concatenated string as key,0.05621301775147929
In PYTHON how do I associate values in dataframes to pass them both to a SQL update?,0.05621301775147929
perform operation on list of arguments passed to a function,0.05621301775147929
How to write values to excel from get method using python,0.05621301775147929
"Attempting Pivot Table, how to resolve ""If using all scalar values, you must pass an index """,0.05621301775147929
pandas: How to get the most frequent item in pandas series?,0.05621301775147929
How to add Calculated item as values in Python pandas pivot table,0.05621301775147929
Plotting Multiple Items as line graph in Matplotlib,0.05621301775147929
"Python / Pandas - The truth value of a Series is ambiguous. Use a.empty, a.bool(), a.item(), a.any() or a.all()",0.05621301775147929
"Apply a function to multiple columns, giving error : unsupported format string passed to Series.__format__",0.05621301775147929
"How to iterate over every N-th row in column, and pass values as list without brackets too URL?",0.05621301775147929
Unnecessary .list.item nesting in BigQuery schemas from pyarrow upload dataframe with lists as columns. enable_list_inference partly works?,0.05621301775147929
Create a customised pandas dataframe from items in a dictionary,0.05621301775147929
Pandas: parse merged header columns from Excel,0.05621301775147929
Iterate over items in one column while referencing a tag in another column,0.05621301775147929
How to populate a list/dictionary with item counts?,0.05621301775147929
"How to set current row item to previous if smaller, in Pandas?",0.05621301775147929
KeyError: 'Passing list-likes to .loc or [] with any missing labels is no longer supported on json file,0.05621301775147929
Neither atom or visual code shows dataset output,0.05621301775147929
python- flagging a second set of items in a series,0.05621301775147929
Python - Get the top 5 items from dictionary type column pandas dataframe,0.05621301775147929
Converting pandas column with list of items to dictionary,0.05621301775147929
Pass conditional expression as function argument,0.05621301775147929
Loading and interpreting multiple csv files as separated items of machine learning dataset,0.05621301775147929
"Separating strings into chunks with, then passing those chunks to a new object. Python 3",0.05621301775147929
"pd.DataFrame(data, columns=[]). How to pass a data which is with nested dictionary?",0.05621301775147929
How to make a Pandas count pivot table with related children items?,0.05621301775147929
Counting number of empty cells in pandas data frame on the row level and create a column accordingly,0.05621301775147929
Iterate over list of items and extract the data for the list from web browser and append the data frame as final output,0.05621301775147929
"Filter all unique items in column1 as a Key, along with Column2 and Column3 as key:value as a Value in nested Dataframe from regular DataFrame",0.05621301775147929
How to use pandas to group items by classes bounded by a difference less that 4,0.05621301775147929
"When i pass tuple into panda Dataframe, it splits it by default..how do i keep it in tuple?",0.05621301775147929
Faster way to aggregate 20 columns to one in Python,0.05621301775147929
How to loop through scraped items and add them to a dictionary or pandas dataframe?,0.05621301775147929
"getting this ""KeyError: Passing list-likes to .loc or [] with any missing labels is no longer supported""",0.05621301775147929
List items not updating outside of for loop,0.05621301775147929
How to group items then iterate through subgroups,0.05621301775147929
Pass Plot to Function Matplotlib Python,0.05621301775147929
"Pandas If row value contains items from a list as substrings, save row value to a different dataframe",0.05621301775147929
Problem parsing a big nested Json with list of items inside,0.05621301775147929
Passing Pandas dataframe to matplotlib markers and text,0.05621301775147929
Can ask for strides of k subsequent items from a pandas series?,0.05621301775147929
Counting items in pandas column of dictionaries,0.05621301775147929
What is plotted when string data is passed to the matplotlib API?,0.05621301775147929
how to iterate items of list in columns of dataframe,0.05621301775147929
"Converting a dictionary to DataFrame in python for stocks - ValueError: If using all scalar values, you must pass an index",0.05621301775147929
"pd DataFrame, need to add columns, parsing text string date_time into pandas year, dayOfWeek, etc in one pass",0.05621301775147929
Errorbar plot for pandas DataFrame shows weird items in the legend,0.05621301775147929
Combining Two Row Values as a dictionary item,0.05621301775147929
"Iterate Over Rows, Ask for Input for Items Over 0, Store Responses",0.05621301775147929
How to join two dataframes and leave blank items not found?,0.05621301775147929
How do you graph multiple items in a dataframe on one graph using pandas and matplotlib.pyplot?,0.05621301775147929
Pandas + Patsy + Statsmodels Linear Reg issue passing in categorical variable (duplicate rows),0.05621301775147929
Is there a way to create a graph that has iterated pairs of consecutive items in its own x-axis and values of the pairs in its own y-axis?,0.05621301775147929
"ValueError: If passed as a pd.DataFrame, X must be a nested pd.DataFrame, with pd.Series or np.arrays inside cells",0.05621301775147929
Is there a way to calculate dataframe which depend on previous row item?,0.05621301775147929
"Averaging every 10 rows of one column within a dataframe, pulling every tenth item from the others?",0.05621301775147929
"Compare two columns both of which are concatenated, and append missing items from one to the other",0.05621301775147929
How to groupby average and extract the last item in a dataframe,0.05621301775147929
Finding an average per item and ID through time (Python),0.05621301775147929
Bottleneck in item-based collaborative filter using pandas data frames and nested for loops in Python,0.05621301775147929
Using slicing and indexing of PANDAS dataframe to pass as x y co-ordinates to Matplotlib,0.05621301775147929
Concatenate list items with other column values,0.05621301775147929
for loop does not iterate until the last item,0.05621301775147929
Count number of times each item in list occurs in a pandas dataframe column with comma separates vales,0.05621301775147929
How do I pass two dataframe column values as keys to a 2-key to one value dictionary and get the result into another column?,0.05621301775147929
"Pandas - ValueError: The truth value of a Series is ambiguous. Use a.empty, a.bool(), a.item(), a.any() or a.all(). What did I miss?",0.05621301775147929
How can I remove control characters with python pandas on csv import?,0.05621301775147929
Pandas adding empty row below the header of csv file?,0.05621301775147929
How to avoid empty rows being imported into Pandas Dataframe?,0.05621301775147929
Pandas Dataframe drop items where index condition is true,0.05621301775147929
looping through an index and the previous item,0.05621301775147929
How to convert items is dictionary to new columns in a pandas dataframe?,0.05621301775147929
"KeyError: ""Passing list-likes to .loc or [] with any missing labels is no longer supported",0.05621301775147929
pandas fails while passing conditional selection,0.05621301775147929
Pandas: How to concatenate two Panels without duplicating Items axis (i.e. like columns in DataFrames)?,0.05621301775147929
"Pandas pivot with multiple items per column, how to avoid aggregating them?",0.05621301775147929
Complex processing of two list of lists in Python (with Joins on multiple items),0.05621301775147929
KeyError-Passing list-likes to .loc or [] with any missing labels is no longer supported,0.05621301775147929
Pandas sum column until >= sum(values) then split left df items to dfNEW,0.05621301775147929
Obtaining a list of items in a pandas column of timestamps where the time difference from one row to next is zero,0.05621301775147929
Pandas dataframe - how to calculate the difference of end and start values for a list of items,0.05621301775147929
How can I transform items from a list into separate column values?,0.05621301775147929
Perform different operations based on index modulus of list items,0.05621301775147929
"Error while importing Pandas: ""numpy: 'gitdb' could not be found in your PYTHONPATH""",0.05621301775147929
"ValueError:. Use a.empty, a.bool(), a.item(), a.any() or a.all(). while calling a function",0.05621301775147929
Python pandas to read an Excel file with more than one row headers,0.05621301775147929
Pass a variable in xlsxwriter for pandas conditional formatting,0.05621301775147929
Classifying items in a panel dataframe based on their average value over time,0.05621301775147929
Error : Passing list-likes to .loc or [] with any missing labels is no longer supported,0.05621301775147929
Get unique count of items of a column in pandas pivot table,0.05621301775147929
Counting instances of items in a dictionary (Pandas),0.05621301775147929
Groupby multiple attributes and pass outcome/save to_excel,0.05621301775147929
How to iterate over items one by one on a dataframe?,0.05621301775147929
Why the for loop is iterating through 1 item in python?,0.05621301775147929
Efficient way of looping through list of dictionaries and appending items into column in dataframe,0.05621301775147929
Iterate through Groupby.unstack() items to make separate plots,0.05621301775147929
Binning Pandas Series and passing user defined label,0.05621301775147929
The total number of times User U bought Item T out of the 3 recent months,0.05621301775147928
Accessing the first items in a numpy array of tuples,0.05621301775147928
Sorting values in plt.bar,0.05621301775147928
pass an array of values into bigquery query with pandas,0.05621301775147928
Years between two date column = 'Timedelta' object has no attribute 'item',0.05621301775147928
Python Pandas Iterate over columns and also update columns based on apply conditions,0.05621301775147928
Create new list in sequence of lists if previous list exceeds item threshold,0.05621301775147928
"How can I sort DataFrame in Python on 1st variable in ascending, on 2nd variable in custom order and on 3rd variable in Descending",0.05621301775147928
Getting a number of items created in a particular year in Pandas,0.05621301775147928
Preserving column order in the pandas to_csv method,0.05621301775147928
Pandas rolling apply: pass in a two-dimensional array,0.05621301775147928
Count the number of uppercase and lowercase letters for each item in an array,0.05621301775147928
How to select the first occurrence of a repeated item in sequence in a list using traditional python or using pandas/numpy/sciy,0.05621301775147928
"TypeError: sequence item 3: expected string, float found",0.05621301775147928
Can't check if any item inside an array is also in another dataframe,0.05621301775147928
sum of bar code-locations combination along a timeline,0.05621301775147928
Creating array of numbers and passing them as pandas column,0.05621301775147928
column with previous year value python,0.05621301775147928
Plotly axis is showing dates in reverse order (recent to earliest) -Python,0.05621301775147928
Updating Column Names from Excel in Combobox for Tkinter in Python,0.05621301775147928
"Getting an Error Using Dash for Figure as Invalid argument `figure.layout` passed into Graph, Expected `object`. Was supplied type `array`",0.05621301775147928
"In pandas / numpy, how to make a PivotTable with count of string items?",0.05621301775147928
put items from array list to unique rows (Pandas),0.05621301775147928
How are pandas objects able to be passed into numpy functions?,0.05621301775147928
Calculate subtotals in Pandas sorted by level,0.05621301775147928
"dataframe with date as index, fill other dates with previous items",0.05621301775147928
Getting time difference per unique row items using pandas,0.05621301775147928
Filtering a datatime set from the starting and ending year with Pandas Numpy Python,0.05621301775147928
Add a new column to a pandas dataframe if the corresponding item in the previous column is in a list,0.05621301775147928
"Python Pandas: Passing previous, current and next row to a function",0.05621301775147928
How do I update a Pandas dataframe with values from a list of dicts?,0.05621301775147928
"TypeError: ('sequence item 0: expected string, numpy.int64 found', u'occurred at index 1')",0.05621301775147928
How to pass values to model that was trained by dataset encoded with pd.dummies? I am getting Value Error: Unable to convert array,0.05621301775147928
Difference between df.items() and df.iteritems(),0.05621301775147928
Pandas: multiple bar plot from aggregated columns,0.05621301775147928
How to remove certain array items in one column by using condition array of another columns in pandas,0.05621301775147928
"Pandas, sorting days whilst preserving order",0.05621301775147928
How can I get result ofr Dataframe in terms of another array items by using lambda,0.05621301775147928
Python ReportLab Excel Create new page for each item in array and drawstring,0.05621301775147928
unmapped memory access in array passed from python to c++,0.05621301775147928
Updating NaN values in a dataframe when there's a match to a list item in another dataframe column,0.05621301775147928
Thinking like pandas: how to update all rows in order(row use info of row before),0.05621301775147928
How can I sort a column of strings in pandas dataframe where I force the order of the letters the column is sorted by?,0.05621301775147928
Pandas hierarchical index: merge/join rows based on 2nd level index value,0.05621301775147928
How to keep rows order from a pandas DataFrame to a dict,0.05621301775147928
Passing numpy arrays from dataframe after using groupby into a function that returns numpy arrays before appending back to dataframe,0.05621301775147928
Is there a way to vectorize counting items' co-occurences in pandas/numpy?,0.05621301775147928
pass dataframe in numpy vectorization function as an argument,0.05621301775147928
Summing items in an array -- in a DataFrame -- in a groupby,0.05621301775147928
How to order column names that are strings in a bar graph in matplot lib,0.05621301775147928
Python/Pandas - Sum dataframe items if indexes have the same month,0.05621301775147928
How do I calculate time difference of rows passed on column value,0.05621301775147928
Access the result of a previous calculation in custom function passed to apply(),0.05621301775147928
Iterating over rows to add items to dictionary,0.05515239477503629
How to split column header in Pandas and export to Excel properly,0.05515239477503629
Python and importing floating-point numbers from the excel file,0.05515239477503629
Is it possible to pass conditionals through a dictionary?,0.05515239477503629
Extract characters or Split column (dtype float64),0.05515239477503629
How To Speed Up This Pandas Operation (Group By Nested List Item),0.05515239477503629
