Title,Correlation Score
Is It Possible To Set Transparency When Using LineCollection in Matplotlib?,0.04860063683593097
How to remove periods with no data from a datetime axis in Matplotlib?,0.04860063683593097
"python seaborn(SNS) lineplot with fitting smooth, how to do this?",0.04860063683593097
Seaborn scatter plot animation over datetime values,0.04860063683593097
How to plot top 5 values in seaborn,0.04860063683593097
How to create boxplot of two dataframes grouped by multiple columns in pandas or seaborn?,0.04860063683593097
How to change the color of a seaborn lineplot (singular line),0.04860063683593097
Pandas - Matplotlib - How to create the best EDA Visualtion to 2 col,0.04860063683593097
Plotly - Plot labels/notes from dataset on graph (Streamlit),0.04860063683593097
Matplotlib error occurs in JupyterNotebooks even though plot is called in a try/except block,0.04860063683593097
Formatting Seaborn x-axis,0.04860063683593097
Plotting line graph on the same figure using matplotlib,0.04860063683593097
Assign additional labels to a string column in pandas,0.04860063683593097
Merge dataframes with consistent label namess,0.04860063683593097
Python/Matplotlib: Coloring cells in table based on customized/altered colormap,0.04860063683593097
matplotlib : how to draw a line perfectly dividing my graph into two sections and color them,0.04860063683593097
Pulling Dataframe Name for graph title in pandas/matplotlib,0.04860063683593097
How to make the following barchart with seaborn?,0.04860063683593097
get the date format on a Matplotlib plot's x-axis,0.04860063683593097
Removing zeros from a column with pandas and matplotlib,0.04860063683593097
install cyrllic fonts in matplotlib,0.04860063683593097
Same x values confuses Matplotlib so y-values are associated with incorrect x-values,0.04860063683593097
How to categorize strings in pandas and color them with seaborn by category?,0.04860063683593097
Automate graph generation with Seaborn using Pandas dataframe,0.04860063683593097
seaborn implot combine datasets into one plot,0.04860063683593097
Matplotlib Switch X and Y Axis,0.04860063683593097
Python 3.x Pandas Matplotlib Ignore non float dtype in series (ignore mixed data),0.04860063683593097
How to add a dollar sign to a seaborn heatmap,0.04860063683593097
Pandas convert long to wide based on multi labels(composite keys),0.04860063683593097
How can I properly graph these two datasets using Pandas in Matplotlib?,0.04860063683593097
How to list all values that can be sent as keyword arguments in seaborn,0.04860063683593097
How to change pandas dataframe plot from vertical to horizontal and add line spacing for the axis labels?,0.04860063683593097
Multiple lollipop plots in a for loop in Matplotlib: Setting xticks and removing spines,0.04860063683593097
MATPLOTLIB - Datapoints sticking together on the x-axis,0.04860063683593097
How to change dimension of Seaborn relplot in Jupyter notebook,0.04860063683593097
Pandas and Matplotlib: Can't get the stackplot to work with using Matplotlib on the dataframe,0.04860063683593097
Pandas: Mapping values between 2 dataframes by matching 2 columns values (composite key) to 1 column and the column labels/index of another dataframe,0.04860063683593097
Matplotlib: Thousands separator for y axis,0.04860063683593097
How to align xlabels and ylabels in seaborn?,0.04860063683593097
Normalized and percentage plots using matplotlib,0.04860063683593097
matplotlib: customised x-axis ticks for cdf of datetime values,0.04860063683593097
Rotate Axis for matplotlib Annotate text : python,0.04860063683593097
Replace dataframe values with labels from a second dataframe,0.04860063683593097
seaborn clustermap row reorder,0.04860063683593097
Matplotlib subplot using for loop Python,0.04860063683593097
Matplotlib: How to plot multiple datasets on the same subplot(s),0.04860063683593097
log_scale = True in seaborn.histplot(),0.04860063683593097
"Matplotlib Plot function returns lines in a same plot,",0.04860063683593097
"How to slice over a labeled index + 1, python?",0.04860063683593097
Conditional Pandas combined with matplotlib,0.04860063683593097
How to plot different line style for each column in the dataset using seaborn,0.04860063683593097
Scaling a figure axis in Matplotlib,0.04860063683593097
How to plot multiple sets of X and Y in matplotlib,0.04860063683593097
Plot bubbleplot of entire dataframe with categorical x and y labels,0.04860063683593097
"Appending pandas DataFrame with MultiIndex with data containing new labels, but preserving the integer positions of the old MultiIndex",0.04860063683593097
Plot is unclear using matplotlib and pandas library,0.04860063683593097
How can two time columns in a pandas DataFrame be used to label rows in a reindexed DataFrame?,0.04860063683593097
Matplotlib pandas plot_date colors category,0.04860063683593097
seaborn heatmap with binary color coding and annotation of raw inputs,0.04860063683593097
Seaborn heatmap spacing on x axis,0.04860063683593097
making groupby plot using matplotlib and pandas,0.04860063683593097
How to scale an axis in matplotlib and avoid axes plotting over each other,0.04860063683593097
How to access/change properties of individual points on matplotlib scatter plot,0.04860063683593097
Best plot for 2 categorical and 1 quantitative variable over time matplotlib,0.04860063683593097
matplotlib subplot - colors are alternate,0.04860063683593097
draw graph by matplotlib in python,0.04860063683593097
Plotting with with datetime64[ns] objects in Seaborn,0.04860063683593097
Seaborn FacetGrid KDE ValueError,0.04860063683593097
Matplotlib error while coloring barplot with list,0.04860063683593097
Scientific Notation Matplotlib / Pandas,0.04860063683593097
How can I plot the sum of values (rather than the count) using seaborn violinplot?,0.04860063683593097
Matplotlib: Getting full hour ticks on y-axis in scatterplot,0.04860063683593097
Processing data with multiple labels for same features Pandas,0.04860063683593097
Plotting Two Data Frame Value Counts Problems with the X-Axis Labels,0.04860063683593097
Pandas: seaborn countplot from several columns,0.04860063683593097
seaborn : plotting time on x-axis,0.04860063683593097
Skip missing timestamp when plotting with Matplotlib Python,0.04860063683593097
Seaborn plot two data sets on the same scatter plot,0.04860063683593097
Matplotlib errorbar fails on Pandas datetime column,0.04860063683593097
"KeyError after combining date and hour columns, matplotlib won't recognize one of my columns, others work fine",0.04860063683593097
"For two dataframes , how to retrieve rows where a combination of two label values is in one but not the other",0.04860063683593097
Plotting histograms in Python using Matplotlib or Pandas,0.04860063683593097
Need to label % change over time on the line graph of a dataframe with matplotlib,0.04860063683593097
"I can't make the size of my graph bigger using matplotlib.pyplot and using plt.figure(figsize = (10, 12))",0.04860063683593097
How to plot seaborn lmplots in multiple subplots,0.04860063683593097
Matplotlib - set Alpha and color dynamically,0.04860063683593097
Why doesnt indexing a dataframe with only one row label work?,0.04860063683593097
Change line width of specific line in line plot pandas/matplotlib,0.04860063683593097
Change xtick labels from pandas plot to different date format,0.04860063683593097
Sum of values of a column is different when plotted on a seaborn barplot,0.04860063683593097
Dual Axis plot returning ValueError: view limit is less than 1 and is an invalid Matplotlib date value,0.04860063683593097
Matplotlib Not Plotting negative values: Extremely misleading,0.04860063683593097
How to plot two list of tuples in Pandas using matplotlib?,0.04860063683593097
Time series plot of categorical or binary variables in pandas or matplotlib,0.04860063683593097
How to graph semi-large datasets (~20k points) using pandas and matplotlib.pyplot? Are there better tools for graphing?,0.04860063683593097
"In pandas dataframes, how would you convert all index labels as type DatetimeIndex to datetime.datetime?",0.04860063683593097
Bokeh doesn't show labels?,0.04860063683593097
Seaborn scatterplot overlaping points in y-tick,0.04860063683593097
Seaborn: Plot multi color points without breaking lines in point plot,0.04860063683593097
Remove one out of two legends from Seaborn Scatterplot,0.04860063683593097
How to add a marker from a different column to a seaborn pandas barplot,0.04860063683593097
how to specified color in plot from matplotlib,0.04860063683593097
Images getting merged into single plot while saving plot using matplotlib,0.04860063683593097
How to plot a multiple line plot in Seaborn using specific columns?,0.04860063683593097
Matplotlib Assistance with Stocks Graphing,0.04860063683593097
missing data points in x axis when using lineplot in seaborn,0.04860063683593097
Setting fixed Matplotlib figure size height,0.04860063683593097
Modify X axis labels in plot,0.04860063683593097
Seaborn - categorical variables in x-y axis,0.04860063683593097
How can I animate Pandas dataframe using matplotlib,0.04860063683593097
How to choose the ticker frequency display in matplotlib?,0.04860063683593097
Scatterplot using Seaborn,0.04860063683593097
Unexpected result while encoding labels pandas,0.04860063683593097
Remap string values to new labels with pandas,0.04860063683593097
"extracting value from a ""timestamp"" labeled dictionery",0.04860063683593097
How to change degrees in polar plot projection (seaborn.FacetGrid) with datas from a column in my df?,0.04860063683593097
seaborn multiple boxplot based on multiple assignments,0.04860063683593097
How to pad a legend in matplotlib,0.04860063683593097
Plotting Sorted Values Seaborn,0.04860063683593097
How to create a list out of multiple labels given in a column,0.04860063683593097
Export a pd.DataFrame with latex labels to latex,0.04860063683593097
Cluster labels comparison - label match,0.04860063683593097
"How to enable hover tool in bokeh, python.I cant get the hover tool to work in seaborn library in python jupyter notebook",0.04860063683593097
DateTime index produces wrong x axis labels,0.04860063683593097
Plotting the most recent data points with Seaborn scatterplot,0.04860063683593097
Matplotlib and Pandas treatment of timeseries without weekends,0.04860063683593097
Hue in Seaborn plots covers the main plot...creating problem,0.04860063683593097
plot stacked percentage barchart matplotlib,0.04860063683593097
Format X-axis in pandas and matplotlib,0.04860063683593097
How to groupby dataframe with categorical variables for making linechart in matplotlib?,0.04860063683593097
How to add labels to particular positions and make a sum of values as a size of plot,0.04860063683593097
pandas plot x axis labels overlapping,0.04860063683593097
Mapping of lists according to labels into DataFrame,0.04860063683593097
Specifying colors for multiple lines on plot using matplotlib and pandas,0.04860063683593097
"How do I create a linear regression graph using Matplotlib, pandas, and sklearn?",0.04860063683593097
Plotting more than 10K data point using Seaborn for x-axis as timestamp,0.04860063683593097
Animating 2 lines on the same plot in python's matplotlib,0.04860063683593097
trend of the csv data in pandas(python) by using matplotlib any improvement to the function?,0.04860063683593097
Include Labels from SciKit Learn Prediction,0.04860063683593097
How to plot evenly spaced values on the x axis while plotting using matplotlib,0.04860063683593097
How to annotate a histogram in matplotlib with a bracket,0.04860063683593097
Can only compare identically-labeled DataFrame objects Error,0.04860063683593097
How to plot a seaborn ridge plot,0.04860063683593097
"NameError on Global 'Key Position' Variable, and ax.cla() majorly slowing things down - Matplotlib, Python",0.04860063683593097
Date in X-Axis (Matplotlib Plot),0.04860063683593097
Matplotlib different color base on values of dataframe,0.04860063683593097
String values are not displaying on graph created using matplotlib-python,0.04860063683593097
"In pandas, how to convert a numeric type to category type to use with seaborn hue",0.04860063683593097
Matplotlib: Add color legend to scatter plot,0.04860063683593097
Adding unique titles to subplots within a for-loop in matplotlib,0.04860063683593097
Plotting by Index with different labels,0.04860063683593097
Change pandas plotting backend to get interactive plots instead of matplotlib static plots,0.04860063683593097
Looping to create multiple graphs in matplotlib from one dataframe?,0.04860063683593097
Plotting a connected scatter plot in Matplotlib,0.04860063683593097
Automated legend creation in a matplotlib scatter plot with legend_elements(),0.04860063683593097
Pandas and seaborn plot unexpected time frame on x axis,0.04860063683593097
Can pd.cut use interval range and labels together?,0.04860063683593097
How to add a clear border around a graph with matplotlib.pyplot,0.04860063683593097
Matplotlib - Subplot from already created plots,0.04860063683593097
Matplotlib problem: tick re-mapping of x-axis of time-series data,0.04860063683593097
How can I solve this problem in seaborn boxplot of flexible type?,0.04860063683593097
Matplotlib plot market between ticks (X axis),0.04860063683593097
How to visualize a list of strings on a colorbar in matplotlib,0.04860063683593097
scatter plot with different colors and labels,0.04860063683593097
Formatting plots with Matplotlib,0.04860063683593097
Pandas Dataframe Group-by columns not working in Matplotlib Barplot,0.04860063683593097
Matplotlib Subplot axes sharing: Apply to every other plot?,0.04860063683593097
Dataframe structures in pandas/seaborn. Do I need to be careful about observations vs variables?,0.04860063683593097
Pandas: How to set the last rows value of a labeled column?,0.04860063683593097
Creating a seaborn factor plot using two data sets?,0.04860063683593097
How to remove duplicates of column by giving appropriate value to its label in the row?,0.04860063683593097
Box and whisker plot versus date-time in python using matplotlib,0.04860063683593097
Transform timeseries dataframe with start/stop times labelled,0.04860063683593097
How can i create multiple pie chart using matplotlib,0.04860063683593097
How to do dynamic matplotlib plotting with a fixed pandas dataframe?,0.04860063683593097
Formatting of a datetime axis in matplotlib,0.04860063683593097
"ImportError: matplotlib is required for plotting when the default backend ""matplotlib"" is selected",0.04860063683593097
Set boxplot 'boxes' facecolor transparency in Python matplotlib,0.04860063683593097
Creating label in Scatter Matplotlib from dataFrame,0.04860063683593097
Seaborn pairplot not working fine using anaconda and pycharm. getting Degrees of freedom warning,0.04860063683593097
How to set xticks label for specific data instead of every data?,0.04860063683593097
Change axis along which Seaborn applies color palette,0.04860063683593097
"le.transform() ValueError: y contains previously unseen labels: [1, 2, 3, 4]",0.04860063683593097
"Linear regression plot with pandas, matplotlib and dates?",0.04860063683593097
Prescribing axes to the figure in matplotlib,0.04860063683593097
Make Seaborn Distplot and Barplot the same color,0.04860063683593097
How to prevent seaborn FacetGrid from overlapping when wrapped,0.04860063683593097
Set axis offset dynamically on seaborn.despine(),0.04860063683593097
How to load csv data to matplotlib?,0.04860063683593097
How to generate discrete data to pass into a contour plot using pandas and matplotlib?,0.04860063683593097
ValueError: view limit minimum -35738.3640567 is less than 1 and is an invalid Matplotlib date value,0.04860063683593097
How to plot multiple columns side by side with Seaborn countplot,0.04860063683593097
How to make a distribution plot of labelled data points?,0.04860063683593097
How to label multiple points in animation with matplotlib,0.04860063683593097
Matplotlib: How to plot graph with time(HH24:MI) as Y-axis,0.04860063683593097
Unable to set xlabel when when Pandas creates scatter plot in multiple subplots with color label,0.04860063683593097
Putting text inside plot in matplotlib,0.04860063683593097
Plot data set read by pandas with seaborn,0.04860063683593097
Very many lines in one plot in matplotlib,0.04860063683593097
Matplotlib plot creation with loop,0.04860063683593097
Plot table within subplot - matplotlib,0.04860063683593097
How to set xticks for a pandas plot from a list of labels?,0.04860063683593097
Creating an instance of an object in a for loop and plotting attributes on a matplotlib plot or subplot,0.04860063683593097
Prescribing color to index matplotlib,0.04860063683593097
tensorflow error while training model - Labels dtype should be integer Instead got <dtype: 'string'>,0.04860063683593097
"Finding the largest area under a curve | pandas, matplotlib",0.04860063683593097
ValueError: view limit minimum -0.05 is less than 1 and is an invalid Matplotlib date value,0.04860063683593097
"from a series of datetimes, how to downsample and select less number of dates and put them in the x labels and xticks?",0.04860063683593097
Shared Categorical Y Axis on Matplotlib,0.04860063683593097
Generating CDF Graphs using Seaborn,0.04860063683593097
Animation multiple columns as dots with matplotlib very slow for large dataset with networkx graph as background,0.04860063683593097
"Python matplotlib ""No handles with labels found to put in legend"" Error when doing subplots",0.04860063683593097
How to plot time series in a colored grid fashion based on cell string in matplotlib?,0.04860063683593097
Categorical axis labels instead of numbers for box plot?,0.04860063683593097
"Sort y axis of a mixed % change in csv file, using matplotlib in Python",0.04860063683593097
Error selecting columns of pandas dataframe to plot with seaborn lineplot,0.04860063683593097
How to plot seaborn barplots as subplot?,0.04860063683593097
"Pandas Dataframe Plotting fails due to date ""ValueError: view limit minimum 0.0 is less than 1 and is an invalid Matplotlib date value.""",0.04860063683593097
ValueError: view limit minimum 0.0 is less than 1 and is an invalid Matplotlib date value.,0.04860063683593097
Seaborn Line Plot for plotting multiple parameters,0.04860063683593097
Seaborn lineplot plot all entries (lines) separately using one grouping variable for coloring,0.04860063683593097
Converting a pandas nodes and edges list from node labels to node index,0.04860063683593097
Lookup with Missing Labels,0.04860063683593097
to_csv storing columns label on every insert of data to csv file,0.04860063683593097
Represent a continuous graph using `matplotlib` and `pandas`,0.04860063683593097
How to distinguish points scatter matplotlib on pick,0.04860063683593097
Assigning labels to rows when there exists some value in a row that is the same as another row,0.04860063683593097
How to format data in Pandas to allow for the correct representation using Seaborn?,0.04860063683593097
how to plot graded letters like A* in matplotlib,0.04860063683593097
Compare two date columns in pandas and assign labels,0.04860063683593097
Seaborn color palette: how to choose which part to center on (e.g. which end of the plot is red and which end is blue)?,0.04860063683593097
python. matplotlib. plot values based on other column's values (parallel lines),0.04860063683593097
Matplotlib: Line plot point not aligned with X values,0.04860063683593097
ValueError: While plotting feature importance using matplotlib,0.04860063683593097
Unable to change color of plotted lines on matplotlib,0.04860063683593097
"altair outputs ""ufunc 'isinf' not supported for the input types"" error, when matplotlib does not",0.04860063683593097
matplotlib doesn't plot all values,0.04860063683593097
Python KeyError when creating a Series for Matplotlib,0.04860063683593097
Plotting in loop hangs matplotlib: strange memory leak?,0.04860063683593097
How do I change the colors of the boxplots when overlaying them in Matplotlib?,0.04860063683593097
How do I connect two sets of XY scatter values in MatPlotLib?,0.04860063683593097
How to change the x-axis in matplotlib without changing the value in title of DataFrame,0.04860063683593097
Plotting two histograms from a pandas DataFrame in one subplot using matplotlib,0.04860063683593097
Automatic reshape of seaborn.heatmap with available dataframe rows,0.04860063683593097
X tick labels for timeseries in multiindex pandas plot,0.04860063683593097
plot time series dataframe and mark certain points using pandas and matplotlib,0.04860063683593097
"Using matplotlib to plot time on my x axis, however it starts from 0, not the actual start time",0.04860063683593097
How to plot proportions of datapoints using seaborn python,0.04860063683593097
Matplotlib/Pandas line plot doesn't connect properly,0.04860063683593097
Monthly shaded error/std plot in matplotlib from daily timeseries data,0.04860063683593097
Plotting a CSV-file with time using matplotlib,0.04860063683593097
Seaborn Time-Series Plot,0.04860063683593097
python/pandas read labels of hyperlink from excel,0.04860063683593097
How to access/edit elements in Pandas Dataframe by label without index,0.04860063683593097
Set axis maximum with seaborn distplot,0.04860063683593097
Create Shapely Polygon around labelled coordinates,0.04860063683593097
I want to make a dropdown using Matplotlib widgets,0.04860063683593097
Create a temporal plot of events with dashed lines with matplotlib & pandas,0.04860063683593097
Pandas/Matplotlib: How to change scale of x-axis,0.04860063683593097
Is the barplot in matplotlib using the mean?,0.04860063683593097
How to plot categories against specific event times in matplotlib,0.04860063683593097
"Matplotlib Plot points on an existing line, only by knowing x values",0.04860063683593097
Adjusting the attribute `hue` with a condition using the lmplot from seaborn,0.04860063683593097
Plotting datetime from PyMongo -> Pandas in matplotlib,0.04860063683593097
Seaborn Box Plot Whiskers Not Matching Calculations,0.04860063683593097
Pandas data frame values are plotting with their individual labels and not on the correct scale,0.04860063683593097
With Matplotlib is it possible to annotate the latest datapoint from live data?,0.04860063683593097
Matplotlib: how to classify values/data in a scatter plot?,0.04860063683593097
Pandas23 change the way it treats multindex labels for xticklabels?,0.04860063683593097
Matplotlib clearing old axis labels when re-plotting data,0.04860063683593097
Changing fontsize for Matplotlib table?,0.04860063683593097
Unknown cause of seaborn.violinplot() KeyError,0.04860063683593097
pairplot columns from multiple dataframes labelled by classes from the category column,0.04860063683593097
How to draw time series of words occurrence in Matplotlib with python?,0.04860063683593097
How to draw BarPlot or Histogram using Subplot in MatplotLib?,0.04860063683593097
Scatter plot size not changing as expected matplotlib,0.04860063683593097
Python Seaborn Pandas Dataframe plot first few groups,0.04860063683593097
Increase size and spacing of matplotlib figure xaxis,0.04860063683593097
LinePlot with Seaborn: View Limit Minimum Error,0.04860063683593097
Change seaborn.catplot marker colour brightness depending on values in pandas.DataFrame,0.04860063683593097
Generating a scatter plot in Matplotlib with negative and positive axes,0.04860063683593097
2D kernel density plot with seaborn joinplot,0.04860063683593097
How do I disable the x_axis label in Pyplot?,0.04860063683593097
Matplotlib - Skipping xticks while maintaining correct x value,0.04860063683593097
How to draw multiple plots with seaborn factorplot?,0.04860063683593097
Animate text within a circle - Matplotlib,0.04860063683593097
How to make automatic chart size adjustment in matplotlib?,0.04860063683593097
"Setup the width, size and all of the barchart (seaborn)",0.04860063683593097
seaborn plotting with datetime object,0.04860063683593097
Unable to create pandas dataframe with particular number of class label,0.04860063683593097
How to get rid of all ylabels of all subplots.[matplotlib],0.04860063683593097
set or peg bivariate distribution values using matplotlib,0.04860063683593097
How to get multiple labels in Pandas 1.1.2?,0.04860063683593097
How to set the axis of two y axis plots using the same starting point instead of two in matplotlib,0.04860063683593097
Truncating y axis in matplotlib,0.04860063683593097
I am getting an error when trying to plot a matplotlib scatter plot using for loop?,0.04860063683593097
One hot encoding vs. label encoder in the same dataframe,0.04860063683593097
How to add correlation coefficients on the seaborn pairgrid's diagonal rather than distplot?,0.04860063683593097
How to create diurnal profiles by month with pandas and matplotlib?,0.04860063683593097
Change the axis name seaborn plot from value/variable,0.04860063683593097
manipulating data values from csv file while using matplotlib in python,0.04860063683593097
File Not Found Matplotlib Line Plot with 2 lines,0.04860063683593097
Using clicks and keys for different events on Matplotlib,0.04860063683593097
Arange `figures` from matplotlib?,0.04860063683593097
add_patch in boxplot with matplotlib (python),0.04860063683593097
choose which subplot in matplotlib to plot,0.04860063683593097
How to set the tick scale as the power of 2 in matplotlib?,0.04860063683593097
Text based colors in scatterplot python matplotlib,0.04860063683593097
