Title,Correlation Score
"In Python, what is the panda syntax to select a subheader from a table being pulled from a url?",0.03846153846153846
Summarize active time of user activity log data in hourly buckets,0.03846153846153846
Search dataframe across two tables and replace value from another column,0.03846153846153846
check if my two columns contain at least one seminar value in python,0.03846153846153846
Count days between dates using pandas,0.03846153846153846
"Python: Can't Filter CSV, ValueError: can only convert an array of size 1 to a Python scalar",0.03846153846153846
KeyError when applying with multiple conditions including the date format to Pandas DataFrame,0.03846153846153846
split and drop pandas dataframe by label,0.03846153846153846
Does .loc in Python Pandas make inplace change on the original dataframe?,0.03846153846153846
Python: FileNotFound Error. No such file or directory,0.03846153846153846
Can't update StatsModels SARIMAX with new observation (ValueError),0.03846153846153846
How to add multiple dataframe to individual cells inside a new dataframe,0.03846153846153846
Pandas read csv with columns name spread over multiple rows,0.03846153846153846
Python folium GeoJSON map not displaying,0.03846153846153846
python xgboost: Forecast model via time series,0.03846153846153846
How to factorize multiple dataframe columns with same values?,0.03846153846153846
Python: Merging two datasets using pd.merge,0.03846153846153846
Generate numbered rows in indexed Pandas DataFrame,0.03846153846153846
Pandas merge dataframe with conditions depends on value in a column,0.03846153846153846
Converting non-numeric integers in column that also contains strings,0.03846153846153846
How to create a list from pandas dataframes,0.03846153846153846
Pandas error reading csv with double quotes,0.03846153846153846
Trim Pandas DataFrame based on values in list,0.03846153846153846
How to multiply arrays in pandas?,0.03846153846153846
Python: Inserting a Row into a Data Frame,0.03846153846153846
Index creation in pandas groupby,0.03846153846153846
Pandas create a new dataframe by returning the rows matching strings from a list checked against cells in 1 column from an another dataframe,0.03846153846153846
Replacing values of a column which is of type list,0.03846153846153846
How can I pull the first five values from a Dask DataFrame without computing the whole DataFrame?,0.03846153846153846
vectorizing forward-looking function pandas dataframe,0.03846153846153846
How to replace sections of a database with Python Pandas?,0.03846153846153846
How to calculate total running hours/ minutes/seconds of timestamps in a python pandas series?,0.03846153846153846
How to combine time range and boolean indexing?,0.03846153846153846
How to display/render images in pandas.io.formats.style.Styler?,0.03846153846153846
Reduce decimal places in CSV Column,0.03846153846153846
how to convert series integer to datetime in pandas,0.03846153846153846
Append CSVs without column names,0.03846153846153846
Execute chain of functions in Python,0.03846153846153846
How to groupby and convert data to NaN values if there is at least 1 NaN value?,0.03846153846153846
Why I get Attribute Error when slicing through object type rows in a dataframe with .str accessor?,0.03846153846153846
Resampling by day and category a DataFrame that have datetime start and datetime end,0.03846153846153846
send keys using a condition python,0.03846153846153846
Change object to float or numeric in Python Pandas,0.03846153846153846
Sum rows and columns of DataFrame with MultiIndex,0.03846153846153846
I have a table with a time index. I want to choose from it only some of the days that are not continuous I did so and did not work,0.03846153846153846
Connecting DataFrames via for loop,0.03846153846153846
Python Pandas Multiindex names warning,0.03846153846153846
Setting a maximum RAM usage of an interactive session in Pydev,0.03846153846153846
Indexing and Data Columns in Pandas/PyTables,0.03846153846153846
Pandas - Create a new column with apply for float indexed dataframe,0.03846153846153846
How can I exclude records containing N/A values using read_sql with pandas?,0.03846153846153846
Lookup using two columns in two dataframe and create new column pandas,0.03846153846153846
How do I delete duplicate rows in pandas by a column; but not compare None to None values,0.03846153846153846
Convert Pandas dataframe to a dictionary with first column as key,0.03846153846153846
My pandas dataframe is not appending a dictionary,0.03846153846153846
"Pandas concat ValueError: Buffer dtype mismatch, expected 'Python object' but got 'long long'",0.03846153846153846
create dummy by group for first/largest change of value in a column pandas dataframe,0.03846153846153846
How can I subset a dataframe based a second DatetimeIndex in Pandas?,0.03846153846153846
"Invalid comparison between dtype=datetime64[ns, UTC] and Timestamp",0.03846153846153846
comparing values of a column with a variable and make new column,0.03846153846153846
How is best to cache a Panda dataframe in Redis Cluster,0.03846153846153846
Create matrix from indices and value points,0.03846153846153846
IPython load balancer fails to read file,0.03846153846153846
Pandas: Apply filter for specific rows,0.03846153846153846
pandas apply for certain row only,0.03846153846153846
Pandas second largest value's column name,0.03846153846153846
Saving a cleaned dataframe python,0.03846153846153846
Print A Pandas Data Frame to a Text File (Python 3),0.03846153846153846
How do I plot both median and mean of a dataframe slice using pandas plot function on jupyter notebook?,0.03846153846153846
Substract Two Dataframes by Index and Keep String Columns,0.03846153846153846
Broken Korean strings when reading DataFrame from CSV,0.03846153846153846
Resamping pandas index with datetime.time type,0.03846153846153846
"Drop rows in DataFrame where two date columns match, otherwise, change value in another column",0.03846153846153846
Pandas - Create new column w/values from another column based on str contains,0.03846153846153846
Find/Filter all rows that contains an incorrect date format,0.03846153846153846
Merging dataframes with multi indexes and column value,0.03846153846153846
Time differentiation in Pandas,0.03846153846153846
Pandas read from remote Postgresql with SSH tunnel and sqlalchemy,0.03846153846153846
Python Pandas Merge Two Dataframes Based on Another Correspondence Dataframe,0.03846153846153846
Pandas: which ??unction names??can be used? (how are they looked up?),0.03846153846153846
Python Pandas Highlight single signs possible?,0.03846153846153846
Filter pandas data frame for col == None,0.03846153846153846
I want to replace specific values from one column to another column to Nan Values?,0.03846153846153846
How to fill missing data from a dataframe with another dataframe when having a common key,0.03846153846153846
How to deal with duplicate records when grouping in pandas,0.03846153846153846
Is there a way to encode a csv file to UTF-8 in pandas?,0.03846153846153846
Operating on Pandas groups,0.03846153846153846
Read stored procedure select results into pandas dataframe,0.03846153846153846
Merge time series dataframes and their collective additional annotation using Pandas in Python,0.03846153846153846
How to test for a potential linear and/or categorical or binary relationships between two variables in the same column?,0.03846153846153846
Compare datetime index with a datetime column and change the corresponding value in another column,0.03846153846153846
"How to filter the pandas dataframe, apply calculation to the column and return it back to the full dataframe?",0.03846153846153846
Need help in filtering top 3 counts from pandas dataframe,0.03846153846153846
Regression of a timeseries delta in pandas,0.03846153846153846
Converting large series from datetime64[ns] to ISO format with timezone (store as object type),0.03846153846153846
Conditionally subtracting Pandas Dataframe rows based on row names,0.03846153846153846
Decorator Function makes data reading return nonetype,0.03846153846153846
Test for np.nan in row wise function,0.03846153846153846
Create a Python script which compares several excel files(snapshots) and compares and creates a new dataframe with rows which are diffirent,0.03846153846153846
How do I extract the dictionary from a JSON file to a pandas Dataframe?,0.03846153846153846
How can i make two different rows zero at a time in pandas?,0.03846153846153846
dataframe that reveals missing values,0.03846153846153846
Combinning dataframes with datetime and pandas Python,0.03846153846153846
Pandas Class with Pandas .pipe(),0.03846153846153846
How do you create locations markers from a pandas dataframe to a folium map,0.03846153846153846
Using transform with condition within a dataframe,0.03846153846153846
How to convert dataframe from horizontal to vertical,0.03846153846153846
How to use Rolling OLS Model interface in Pandas?,0.03846153846153846
pandas merge rows with same value in one column,0.03846153846153846
Problems with replacement in pandas,0.03846153846153846
Pandas plot subplots of a 'group by' result,0.03846153846153846
How to get values from table if they contains substrings from values in another table via pandas (dataframe) in python?,0.03846153846153846
"Store a pandas dataframe as an Excel object in S3 from AWS lambda using ""Openpyxl""",0.03846153846153846
"Pandas: Make a column with (1,2,3) if string of another column-Row value starts with (""A"",""B"",""C"")",0.03846153846153846
Getting error while creating dataframe from S3 Bucket in python,0.03846153846153846
Pandas to_sql to localhost table returns 'Engine' object has no attribute 'cursor',0.03846153846153846
select rows by comparing columns using HDFStore,0.03846153846153846
In Python Pandas: How to reshape rows to columns without aggregation?,0.03846153846153846
Trying to merge 3 data frames into one while keeping the first column constant,0.03846153846153846
CSV: How to find name of the value from the list,0.03846153846153846
How to make scatter plot from Pandas DataFrame using plotly?,0.03846153846153846
How do I get the keys of 'Properties' in this json file and make them column names in a DataFrame?,0.03846153846153846
How to merge multiple Excel files into one sheet and keep the formatting of the files in Python?,0.03846153846153846
Pandas create new category based on position-column without for loop,0.03846153846153846
How to randomly shuffle columns in pandas dataframe with duplicates values,0.03846153846153846
Why does concatenation work with one small dataframe but not a larger version of the same?,0.03846153846153846
Pandas: Create column in a df dependig on a column of a different df,0.03846153846153846
Trouble optimizing python interpolation script,0.03846153846153846
Python Pandas Dataframe fill NaN values,0.03846153846153846
ModuleNotFoundError: No module named 'eventClass' when reading a *.pkl file,0.03846153846153846
langdetect.detect throws error on bold text,0.03846153846153846
understand functions that operate on whole array in groupby aggregation,0.03846153846153846
Rotate rows of a dataframe,0.03846153846153846
How Filter dataframe with dictionary in pandas?,0.03846153846153846
Malformed CSV file and Pandas read_csv by chunk,0.03846153846153846
Efficient algorithm for expanding grouped tabular data,0.03846153846153846
Convert any file (Readable as Text File) to Excel Format (.xlsx) virtually then convert as dataframe -Python,0.03846153846153846
Get the index corresponding to True boolen values only,0.03846153846153846
Remove outliers using a multiple groupby statement,0.03846153846153846
Applying where condition when using pandas read_sql_table() -SQLAlchemy,0.03846153846153846
Understanding Panda's groupby,0.03846153846153846
Access csv file using pandas dataframe,0.03846153846153846
Convert Pandas Dataframe to specific json format,0.03846153846153846
Vectorized string interpolation in Pandas? Is this doable without iteration?,0.03846153846153846
Pandas Filter dataframe according to working days,0.03846153846153846
Pandas : Valid regex doesn't seem to work with str.extract on dataframe,0.03846153846153846
How to connect boxplots with a mean line,0.03846153846153846
How to check if a Pandas Dataframe column contains a value?,0.03846153846153846
Pandas add column from list with bigger index,0.03846153846153846
Sort values that have the most distinct values in Pandas df,0.03846153846153846
pandas dataframe 2 dim index slice,0.03846153846153846
PANDAS efficient large dataframe iteration?,0.03846153846153846
Create Dataframe from unknown number of Series pandas,0.03846153846153846
Convert leading nan to trailing nan in pandas,0.03846153846153846
Create a column with values of a list and depending on another column,0.03846153846153846
Groupby past date values into a list,0.03846153846153846
Unable to add data to pandas without hardcoding,0.03846153846153846
numpy digitize with datetime64,0.03846153846153846
Query term is not valid [[Condition : [None]]],0.03846153846153846
matplotlib multi seriesline plot dataframe,0.03846153846153846
Fill in missing boolean rows in Pandas,0.03846153846153846
Alternative options to replace column values,0.03846153846153846
Trouble matching and setting values from multiple dataframes,0.03846153846153846
Add column of grouped max - min?,0.03846153846153846
CVXPY - conic solver does not support the cones output by the problem,0.03846153846153846
Pandas turn column with list into string,0.03846153846153846
Replicate self join method SQL on Pandas,0.03846153846153846
Elongating a Data Frame in Pandas,0.03846153846153846
"add a single ""missed"" event in a dataframe if there is no event in this day",0.03846153846153846
"Changing the same column of dataframe to int type which contains string like ""12Kms"" , ""13 kms"" . Column must contain only numbers like 12, 13",0.03846153846153846
How to convert a pandas plot into an image,0.03846153846153846
How to Give Title for graphs from Dataframe column,0.03846153846153846
MemoryError when appending Pandas Dataframe to HDF file,0.03846153846153846
table.remove removes certain elements but not all,0.03846153846153846
Pandas script doesnt work properly inside function but works fine if used step by step on jupyter notebooks,0.03846153846153846
pandas tokenized column to array,0.03846153846153846
PCA plot parameters,0.03846153846153846
Python Pandas-read-datetime when timepate ends with 00:00:00.000 eg: '05NOV2019:00:00:00.000',0.03846153846153846
SparkError: PickleException: expected zero arguments for construction of ClassDict. DataBricks,0.03846153846153846
Adding HTML elements to a pandas dataframe,0.03846153846153846
Using Python parser to sniff delimiter Spammed to STDOUT,0.03846153846153846
How to retrieve each row from a groupby dataframe,0.03846153846153846
create multiple index for a dataframe in pandas,0.03846153846153846
How to sentence tokenize within a dataframe,0.03846153846153846
Pandas merge 2 dataframes,0.03846153846153846
How do I do column transform for two categories in Ames Housing dataset?,0.03846153846153846
comparing columns by ignoring null values (pandas),0.03846153846153846
forward min and max in time series,0.03846153846153846
Calculation behind memory usage of index in pandas dataframe,0.03846153846153846
Row-based dynamic column subset mean in Pandas,0.03846153846153846
How to filter pandas dataframe rows based on dictionary keys and values?,0.03846153846153846
Using matplotlib axvline with time object on x-axis,0.03846153846153846
Turn columns to rows in pandas,0.03846153846153846
Creating a python function to change sequence of columns,0.03846153846153846
How can I access the data after zooming in a plot using wxmplot interactive module?,0.03846153846153846
Mapping values from one to the other df based on multiple columns in both dataframes,0.03846153846153846
"How to parse JSON array of objects, and then append to Pandas Dataframe",0.03846153846153846
Dataframe adding rows no returning correctly,0.03846153846153846
Adding a new column to a Pandas DataFrame by comparing two columns to two similar columns in a different Dataframe,0.03846153846153846
how do you read a pytables table into a pandas dataframe,0.03846153846153846
datetime plot with errorbars in pandas,0.03846153846153846
df.insert results in NAN value,0.03846153846153846
Assigning a value on remaining blanks in a category without impacting others,0.03846153846153846
How do I turn this json object into a pandas dataframe?,0.03846153846153846
How to use `pandas.offsets.MonthBegin` to get the latest monthstart before (or at) a timestamp?,0.03846153846153846
Adding values to the DataFrame to the corresponding values,0.03846153846153846
NoneType value in result of processing csv file in pandas,0.03846153846153846
How to get which datapoints are in histogram bin based on another column in dataframe?,0.03846153846153846
Count number of columns above a date,0.03846153846153846
Removing square bracket symbols in Pandas dataframe,0.03846153846153846
Pandas apply function to column and fill 2 columns from function return,0.03846153846153846
Pandas DataFrame conditions across rows,0.03846153846153846
How can I make this plot awesome (colours by group plus alpha value by second group),0.03846153846153846
How to choose values from col1 if their values are in col2 but not on list in Python Pandas?,0.03846153846153846
unstack multiindex dataframe to flat data frame in pandas,0.03846153846153846
Apply function that operates on Pandas dataframes on a subset of the rows,0.03846153846153846
use isin inside groupby,0.03846153846153846
Pandas group by time windows,0.03846153846153846
Read csv and retain index names,0.03846153846153846
Sklearn iterative Impture creating more nans,0.03846153846153846
How to convert wide dataframe to long dataframe,0.03846153846153846
Match list of strings with column and return corresponding column value,0.03846153846153846
how to read .dat file in jupyter notebook,0.03846153846153846
format data using pandas.dataframe,0.03846153846153846
CSV File Not Found Error when trying to read file in Jupyter Notebook,0.03846153846153846
Not able to use python eval() in pyspark as pandas udf but the same in python udf works,0.03846153846153846
Looping through grouped and assign value in new column in python,0.03846153846153846
Convert string in 1d array to 2d array with each character as seperate element,0.03846153846153846
datetime.strptime extracting from dataframe: error,0.03846153846153846
Unstack doesn't return a dataframe,0.03846153846153846
Pandas DataFrame ValueError is not in range,0.03846153846153846
Converting JSON file to Pandas data,0.03846153846153846
IPython - have print default to print head & tail on long variables,0.03846153846153846
How can I insert a dataframe in Excel using xlwings without pywintypes.com_error?,0.03846153846153846
How to get the max value of a multiple column group-by pandas?,0.03846153846153846
New secondary index based on column value (pandas dataframe),0.03846153846153846
"pandas: iterate over dataframe, do SQL query for each row",0.03846153846153846
pandas: detect and print outliers in a dataframe,0.03846153846153846
Plot joint distribution,0.03846153846153846
Pandas - apply a custom function to two columns after a group_by - reformulated,0.03846153846153846
How to keep all elements of a list in one row while creating a dataframe from it,0.03846153846153846
Question on adding a ranking column to csv in python,0.03846153846153846
How iterate pandas dataframe if condition is met then add new rows to df,0.03846153846153846
Use multiple pandas list in postgresql query to filter data,0.03846153846153846
Reset time part of a pandas timestamp,0.03846153846153846
How to count the occurence of semantic tags loaded by UCREL Semantic Analysis System (USAS),0.03846153846153846
FIltering Pandas Dataframe using vectorization,0.03846153846153846
Find closest event in one dataframe before an event in another dataframe,0.03846153846153846
How to remove the following outliers?,0.03846153846153846
How can you check if a column in a DataFrame is stale?,0.03846153846153846
Pandas data frame to dictionary of lists,0.03846153846153846
How to print rows from dataframe between two index numbers,0.03846153846153846
adding reversed columns to dataframe,0.03846153846153846
Transferring columns to a new df with exploded cells and repeated title name,0.03846153846153846
Deleting an unnamed column from a csv file Pandas Python,0.03846153846153846
How to flatten rows in df pandas,0.03846153846153846
Fill column hierarchically or recursively,0.03846153846153846
Pandas read_csv reading time offset strings,0.03846153846153846
Pandas rolling count frequency of specific value in column,0.03846153846153846
TypeError when applying pygeohash decode on a column,0.03846153846153846
Pandas Conditional Vlookup Loop,0.03846153846153846
np.where with two conditions,0.03846153846153846
How to check if data is going up or down and add column - Python,0.03846153846153846
Python 3 - I need to create a new df with ceil and floor for each system,0.03846153846153846
Create a dummy variable from Categorical Dummy,0.03846153846153846
"Index pandas DataFrame by column numbers, when column names are integers",0.03846153846153846
Assigning Day or Night to a time,0.03846153846153846
Add the values of several columns when the number of columns exceeds 3 - Pandas,0.03846153846153846
Add rolling standard deviation to Pandas dataframe based on filter from other columns,0.03846153846153846
Pandas - Reiterating rows through csv,0.03846153846153846
Plot heatmap of jaccard similarity,0.03846153846153846
Equivalent of SUMPRODUCT in dataframe with strings,0.03846153846153846
DataFrame correlation produces NaN although its values are all integers,0.03846153846153846
Python: Tag keywords and create new columns of tags with 1's and 0's,0.03846153846153846
How to tag keywords and add to new column in Python,0.03846153846153846
Scrape wikipedia table using BeautifulSoup,0.03846153846153846
Divide pandas data frame into test and train based on unique ID,0.03846153846153846
Pytables Undo vs Pandas hdf5 write,0.03846153846153846
Dataframe loc with multiple string value conditions,0.03846153846153846
TypeError: read_hdf() takes exactly 2 arguments (1 given),0.03846153846153846
Create a new interdependent df column using itertuples(),0.03846153846153846
How to get an excel file from s3 bucket and upload the file again to s3 bucket without using pandas - Python,0.03846153846153846
How to add non time-series data into a time series dataset for ML?,0.03846153846153846
add suffix to column name based on condition,0.03846153846153846
Combine DataFrame Rows to eliminate NaNs,0.03846153846153846
Merging multiple CSV's with different columns,0.03846153846153846
Fill matrix with transposed version,0.03846153846153846
"Sample and group by, and pivot time series data",0.03846153846153846
How to delete observation where in some column values do not have certain number of numbers in Python Pandas?,0.03846153846153846
Dummy if the same value occurs on a later date in python (pandas),0.03846153846153846
How to use pandas variable in sql script using jupyter,0.03846153846153846
Functionto create a DF,0.03846153846153846
Finding max row after groupby in pandas dataframe,0.03846153846153846
GroupBy Date and Name,0.03846153846153846
I have a DataFrame which contains first and last number of some intervals. how can I get how many times each number was in each interval?,0.03846153846153846
Round function to avoid error caused by null data,0.03846153846153846
Removing date and keeping time only from timestamp in a uneven pandas column,0.03846153846153846
"how do i get the # of the row of a dataframe, not the value of the index?",0.03846153846153846
Create a new column in a Pandas DataFrame from existing column names,0.03846153846153846
Matching values based on one column value in pandas,0.03846153846153846
python create a column with polygons from column with coordinates,0.03846153846153846
Insert innormation to new row in DF using another csv,0.03846153846153846
Use list to find keyword match in Dataframe,0.03846153846153846
Remove unwanted str in Pandas dataframe,0.03846153846153846
Optimizing DataFrame Filtering in Pandas,0.03846153846153846
Pandas: create a period based on date column,0.03846153846153846
Query HDF5 in Pandas,0.03846153846153846
Counting weight of unique combinations within groups,0.03846153846153846
How trunc datetime column with pandas?,0.03846153846153846
sqlalchemy pandas to_sql OperationalError,0.03846153846153846
Pandas - Get last non Nan value plus count number of non Nan in column on a rolling basis,0.03846153846153846
How variable names from a numpy 4d array can be put in 5 columns of a Pandas Dataframe with one to one relation including a value column (5th one),0.03846153846153846
Failed to add content from multiple tables to a csv file using pandas.read_html(),0.03846153846153846
how to create a dataframe using groupy such that the grouping criteria is contained in the data,0.03846153846153846
How can I display user input from a function into a pandas dataframe?,0.03846153846153846
"Grouping a DataFrame, counting occurrences in one column, putting other column values in sets",0.03846153846153846
print a string if no null value is found,0.03846153846153846
Maximum value in a specific index of lists within a dictionary,0.03846153846153846
python3 single column dataframe compare,0.03846153846153846
Python keyerror: 0,0.03846153846153846
