Title,Correlation Score
How to remove or hide x-axis labels from a seaborn / matplotlib plot,0.0845024995968392
How to remove ticks lines and labels when using add_gridspec in matplotlib seaborn,0.0845024995968392
Matplotlib shows extra set of x labels overlapping regular x labels,0.07882241215574545
Python pandas matplotlib how to remove category labels in the plot?,0.07330703484549637
Data Labels: sklearn.model_selection.train_test_split for data with individual labels,0.07330703484549637
"Pandas Seaborn FacetGrid same x labels on every plot, though different y values",0.07330703484549637
Matplotlib - How can I add labels to legend,0.07330703484549637
Python Pandas and Seaborn date format issue: strftime working different for different seaborn graphs,0.07192388324463796
Heatmap drawing using matplotlib or seaborn?,0.07117028270874423
How to set specific labels to seaborn graph?,0.07117028270874423
How to add data labels to seaborn barplot?,0.07117028270874423
Seaborn lineplot high cpu; very slow compared to matplotlib,0.07117028270874423
Control tick labels in Python seaborn package,0.07117028270874423
Limit labels in bubble plot using Matplotlib,0.07117028270874423
Make axes unequal in matplotlib or seaborn,0.07117028270874423
Add In Plot Labels to Seaborn Lineplot,0.07117028270874423
Seaborn heatmap is combining multiple labels as xticks,0.07117028270874423
Modify the orientation of default xtick labels in matplotlib,0.07117028270874423
Adding labels to points in seaborn stripplot,0.07117028270874423
added labels to a pandas df and then concatenated that df to another df - now the labels are a list - what gives?,0.06982744718593772
Seaborn/Matplotlib - Faceting a line plot with confidence intervals,0.0690335305719921
Matplotlib: How can i use a column as data segmentation on matplotlib?,0.0690335305719921
create seaborn plot with pandas of matplotlib,0.0690335305719921
How to count plot column value with interval in matplotlib/seaborn?,0.0690335305719921
"Seaborn Box and Whisker plot, X and Y labels, making it bold?",0.0690335305719921
"seaborn heatmap displays axis labels, but no values when df.corr is NaN",0.0690335305719921
How can I add median labels to my seaborn boxplot?,0.0690335305719921
Maximum number of index of a data-frame to plot any graph using matplotlib or seaborn,0.0690335305719921
Plot categorical scatterplot in seaborn or matplotlib,0.0690335305719921
Rotate xtick labels in seaborn boxplot?,0.0690335305719921
How to generate labelled barplots using seaborn?,0.0690335305719921
Rotate Y-axis categorical label in Seaborn plot?,0.0690335305719921
pandas matplotlib x-axis only labels every fifth location,0.0690335305719921
Changing X axis labels in seaborn boxplot,0.0690335305719921
How to get data labels on a Seaborn pointplot?,0.0690335305719921
Display percentage labels in Seaborn displot,0.0690335305719921
How do I add a title and axis labels to Seaborn Heatmap?,0.0690335305719921
using a custom colour scheme in pandas/matplotlib/seaborn python,0.0690335305719921
Seaborn: Passing column name as Label in a function,0.06773101112723752
"raise ValueError(""Can only compare identically-labeled "" ValueError: Can only compare identically-labeled Series objects",0.06773101112723752
pandas pie charts subplots labels overlap with slice labels,0.06773101112723752
How do I construct ticks and labels when ploting large temporal series with matplotlib where the dates are a str column?,0.06773101112723752
"pandas using plot to draw a line graph, the time is not continuous, how to make the line continuous??,<python><pandas>,2,5
36225,66561523,,2021-03-10 09:07:30,0,26,pandas errors with attempt to cont unique,<python><pandas>,0,2
36226,66561620,66561732.0,2021-03-10 09:13:44,0,316,How to group rows with duplicate value in 1 column and different value in another column without removing/dropping other duplicated rows?,<python><pandas><dataframe>,1,6
36227,66561813,,2021-03-10 09:26:03,0,721,Set bar width in a seaborn barplot,<python><pandas><seaborn>,0,4
36228,66561948,66562132.0,2021-03-10 09:35:58,2,42,How to create a new Data Frame with columns from lists of values (better described below)?,<python><pandas>,2,0
36229,66562089,66562149.0,2021-03-10 09:45:30,1,102,Numpy.isin not detecting presence of a datetime in a vector of datetime64[ns] elements",0.06728826728826727
Adding labels to boxplots in one graph (matplotlib),0.06689677843523997
how to get correct correlation plot on time series data with matplotlib/seaborn?,0.06689677843523997
Change X axis labeling using Pandas/matplotlib in Python,0.06689677843523997
Formatting Date labels using Seaborn FacetGrid,0.06689677843523997
"Matplotlib or seaborn or pandas : Plot with ""deep"" discretization",0.06689677843523997
Add Labels to seaborn barchart,0.06689677843523997
Multiplying value corresponding to a label in one dataframe by all values with the same label in another dataframe,0.06689677843523997
Why has seaborn/matplotlib filled below the line in this lineplot in my jupyter notebook?,0.06689677843523997
seaborn barplot with labels for x values (and no hue),0.06689677843523997
Plot outliers using matplotlib and seaborn,0.06689677843523997
Change 1 point color in scatter plot regardless of color palette in seaborn matplotlib,0.06689677843523997
Add labels ONLY to SELECTED data points in seaborn scatter plot,0.06689677843523997
How to correct overlapping tick labels in matplotlib plot,0.06689677843523997
Matplotlib/Seaborn plot a boxplot with on the x-axis different range of values categories,0.06689677843523997
"How to plot Date in X Axis, Time in Y axis with Pandas/Matplotlib and present time in HH:MM format as tick labels?",0.06689677843523997
Creating Axis Labels on Seaborn Countplot,0.06689677843523997
datetime x-axis matplotlib labels causing uncontrolled overlap,0.06689677843523997
Matplotlib / Seaborn legend changes style upon adding labels,0.06689677843523997
Reduce ticks & format axis labels in Matplotlib - scaling,0.06689677843523997
How to rotate seaborn barplot x-axis tick labels,0.06689677843523997
Seaborn presents all the labels on the X axis,0.06689677843523997
matplot:problem displaying labels in matplotlib,0.06689677843523997
Renaming X-Axis Labels when using Matplotlib and Pandas,0.06689677843523997
KeyError: 0 Plotting Labels in Matplotlib,0.06689677843523997
How to add labels to a violin plot using Seaborn,0.06689677843523997
"Why is there unnecessary whitespace while plotting figures with pandas, matplotlib and seaborn?",0.06689677843523997
Can I overlay a Seaborn plot onto a Matplotlib graph?,0.06689677843523997
Data formatting for grouped boxplot using seaborn or matplotlib,0.06689677843523997
Rotation labels matplotlib,0.06689677843523997
"pandas, matplotlib, use dataframe index as axis tick labels",0.06689677843523997
"For a column label or combination of labels in pandas dataframe, get the name of deals with 'X' values in those column labels, using python for loop",0.06689677843523997
Hiding xticks labels every n-th label or on value on Pandas plot / make x-axis readable,0.06689677843523997
"How can I adjust the x-axis ""Date"" labels of the graph using the Matplotlib?",0.06689677843523997
Seaborn tick labels not complete & not aligned to the graph,0.06689677843523997
Rotate existing axis tick labels in Matplotlib,0.06689677843523997
How to display Summary statistics next to a plot using matplotlib or seaborn?,0.06689677843523997
How to avoid overlapping of the x-labels of a Seaborn swarm plot?,0.06689677843523997
"Seaborn / MatplotLib Axis and Data Values formatting: Hundreds, Thousands, and Millions",0.06689677843523997
I got incorrect labels on my X-Axis on a Seaborn Table,0.06689677843523997
Python Matplotlib (1) format x-axis labels to Year-Quarter and (2) set major_locator to end of month,0.06647673314339977
How to change the order of x-axis labels in a seaborn lineplot?,0.06563457506853732
"Pandas, most secure way to drop duplicates based on two labels, keeping the row with highest third label score",0.06563457506853732
formatting x-axis labels with two y-axis in matplotlib (bar and line plot),0.06563457506853732
What is the best way in python to create a confusion matrix out of an already aggregated table with counts of actual labels and predicted labels,0.06563457506853732
Python Matplotlib plot with x-axis labels correctly aligned and matching colors for series and errors,0.06563457506853732
Split labels of dataframe with multiple categorical values in python for encoding labels,0.06563457506853732
"seaborn or matplotlib line chart, line color depending on variable",0.06563457506853732
How to avoid displaying x-axis labels without any associated data in seaborn factorplot,0.06476002629848784
How to customize y-labels in seaborn heatmap when I use a multi-index dataframe?,0.06476002629848784
Problems with x-axis in Jupyter Notebooks with MatPlotLib and Seaborn,0.06476002629848784
Adding labels to points from a Pandas dataframe object using Matplotlib,0.06476002629848784
"Matplotlib: Different colors for each date, labelled via colorbar",0.06476002629848784
"Pandas Boxplot X-Axis Column Labels Overlapping, no title or labels",0.06476002629848784
How to cut long labels in Matplotlib,0.06476002629848784
How do I make the x-axis consistent when plotting multiple subplots in the same figure in matplotlib (or seaborn)?,0.06476002629848784
"Hide some x axis labels, only keep 1 matplotlib",0.06476002629848784
How to create conditional plots of groupby objects using matplotlib/seaborn?,0.06476002629848784
Artificial tick labels for seaborn heatmaps,0.06476002629848784
Seaborn does not give me a proper plot and remove some tick labels automatically,0.06476002629848784
Continuous heat map or Profile plotting in Pandas + Matplotlib + Seaborn using Python,0.06476002629848784
Accessing and printing particular label in with the corresponding label elements in a text file using python,0.06476002629848784
Plotting and removing a vertical line inside a loop matplotlib/seaborn,0.06476002629848784
Applying style to index labels and column labels pandas dataframe,0.06476002629848784
Draw line chart and highlight minimum point in matplotlib or seaborn and with the help of pandas,0.06476002629848784
How to use column values for x axis labels in matplotlib,0.06476002629848784
How to customize Seaborn / Matplotlib to display Letters in Matrix with Custom Colors for Backgrounds and Letters,0.06476002629848784
Multicolumn plot Seaborn and Matplotlib,0.06476002629848784
"Matplotlib: Set manual x-axis labels given string label array input, but only on major ticks",0.06476002629848784
Matplotlib double major tick labels?,0.06476002629848784
how to display the x axis labels in seaborn data visualisation library on a vertical plane rather than horizontal,0.06476002629848784
How can I auto-adjust my scatterplot labels without them being overlapped by other labels in python?,0.06476002629848784
How to load the images with class labels from a single directory into Keras model using a dataframe containing filenames and labels?,0.06476002629848784
"The most elegant way to modify messy and overlapping date labels below x axis? (Seaborn, barplot)",0.06476002629848784
Xaxis Labels not matching Data Points - Pandas/Matplotlib,0.06476002629848784
"Seaborn, matplotlib not recognizing time as time",0.06476002629848784
labels dimension or rotate python seaborn graphs,0.06476002629848784
how to plot categorical and continuous data in pandas/matplotlib/seaborn,0.06476002629848784
How to increase font of axis and labels in factorplot in Seaborn in Python?,0.06476002629848784
"ValueError: Location based indexing can only have [labels (MUST BE IN THE INDEX), slices of labels (BOTH endpoints included! Can be slices of integers",0.06476002629848784
Seaborn/Matplotlib: how to access line values in FacetGrid?,0.06476002629848784
Matplotlib/Seaborn - Plotting datetime objects on the x-axis is giving a very long label,0.06476002629848784
One-hot-encoding labels giving input labels,0.06476002629848784
Labels on matplotlib within a loop,0.06476002629848784
Error with x-axis labels when plotting multi-index dataframe using Matplotlib,0.06476002629848784
Seaborn: how to get labels nicely centered in a column?,0.06476002629848784
Return amount of labels in the x-axis matplotlib,0.06476002629848784
Pandas: Remove aggfun np.sum labels and value labels from pivot table,0.06353813900983712
"Apply ""date tick labels"" on seaborn chart",0.06353813900983711
Pandas: Aggregate rows based on index labels vs. columns labels condition,0.06353813900983711
Retrieve all columns from one label in the top level alongside only a subset of another label,0.06353813900983711
How to set rotation for seaborn FacetGrid and figure-level xtick labels,0.06353813900983711
Make a stacked bar plot from seaborn to matplotlib,0.06353813900983711
Dynamic labels in matplotlib stacked area chart,0.06353813900983711
Adding multiple labels at once for matplotlib subplots from pandas dataframe,0.0626232741617357
annotate a single line from a multi-line plot with labels from another pandas column matplotlib,0.0626232741617357
How to make secondary labels in matplotlib chat?,0.0626232741617357
Matplotlib + Pandas = how to see labels ?,0.0626232741617357
How to plot value counts for each subset in matplotlib/seaborn?,0.0626232741617357
Python XGB Labels not reading the correct label size,0.06262327416173569
Add hue category labels in seaborn stripplot,0.06262327416173569
how to make the text size of the x and y axis labels and the title on matplotlib and prettyplotlib graphs bigger,0.06262327416173569
Confusion matrix with labels plot in matplotlib not organized properly,0.06262327416173569
Seaborn scatter plot: Rotate labels / text,0.06262327416173569
Align secondary x-axis with main x-axis in Matplotlib/Seaborn,0.06262327416173569
How can I apply seaborn.scatterplot(style) in matplotlib module?,0.06262327416173569
Removing outliers from dataset identified in Matplotlib/Seaborn boxplot,0.06262327416173569
the bins are not being labeled even if i have provided the list of labels while using pd.cut,0.06262327416173569
How do I plot subplots with different labels from pandas dataframe columns using matplotlib,0.06262327416173569
How do I create a Seaborn FactorPlot with different X-axis labels?,0.06262327416173569
Plotting the relation between two columns using matplotlib or seaborn,0.06262327416173569
How can I get a square wave by using python pandas or matplotlib??<python><pandas><matplotlib><plot>,0.06262327416173569
seaborn heatmap labels can't be display clearly,0.06262327416173569
Cannot prepare proper labels in Matplotlib,0.06262327416173569
"Removing y axis tick labels for certain subplots in Matplotlib,Python",0.06262327416173569
I need to plot grouped data using matplotlib or seaborn,0.06262327416173569
"Add two matrices having different dimensions, labels and retain labels in sum matrix",0.06262327416173569
labels column shape is inconsistent after splitting data into features and labels,0.06262327416173569
"How to shift axis labels, shift subplots and modify axis scaling in matplotlib",0.06262327416173569
"Is it possible to plot a barchart with upper and lower limits of the bins with Pandas,seaborn or Matplotlib",0.06262327416173569
get lines and labels from matplotlib.axes,0.06262327416173569
matplotlib: horizontal labels as style,0.06262327416173569
Wrangling x-axis datetime labels on matplotlib,0.06262327416173569
How to use a 3rd dataframe column as x axis ticks/labels in matplotlib scatter,0.06262327416173569
Matplotlib: Rotate x-axis tick labels when don't know x-axis value variable,0.06262327416173569
How do you rotate x axis labels in matplotlib subplots?,0.06262327416173569
Creating a labeled series with labels that correspond to each 'color' and values?,0.06144170295113691
Matplotlib fill_between() error: compare identically-labeled Series objects,0.06144170295113691
Change x-axis order of labels in Pandas / Matplotlib histogram?,0.0614417029511369
convert pandas datetime64[ns] to matplotlib date-float for date x-axis in seaborn tsplot,0.0614417029511369
Any way to correctly aggregate time series data to make scatter plot with matplotlib/seaborn?,0.0614417029511369
How to plot and annotate grouped bars in seaborn / matplotlib,0.0614417029511369
Centering x-tick labels between tick marks in matplotlib,0.06048652202498355
Is there a better way to align these labels with the lines in this plot I created using matplotlib?,0.06048652202498355
Positioning labels in a way that they don't touch each other donutplot matplotlib pandas,0.06048652202498355
Hide axis names/labels in matplotlib,0.06048652202498355
Change x axis labelling Matplotlib?,0.06048652202498355
Randomly downsample rows of a dataframe 1.Conserving the distribution of column labels OR 2.Same number of samples per each label?,0.06048652202498355
How to move labels from graph in matplotlib?,0.06048652202498355
Transform coordinates Seaborn/Matplotlib,0.06048652202498355
Matplotlib Deprecation Warning : The is_first_col function was deprecated in Matplotlib 3.4 and will be removed two minor releases later,0.06048652202498355
Groupby plot in year wise for different categories of other column pandas and seaborn or matplotlib,0.06048652202498355
Matplotlib missing x tick labels,0.06048652202498355
Group labels in matplotlib barchart using Pandas MultiIndex,0.06048652202498355
Spacing between the labels on pie plot matplotlib,0.06048652202498355
Seaborn/Matplotlib: Plot filtered data on a horizontal barchart,0.06048652202498355
Seaborn Matplotlib Python - How to annotate heatmap if value > x,0.06048652202498355
Matplotlib Subplot Boxplot x tick labels not displaying,0.06048652202498355
Matplotlib data plot contains too many labels,0.06048652202498355
Error while using DateLocator and DateFormatter with Matplotlib and Seaborn,0.06048652202498355
"Matplotlib, changing figure size along with labels",0.06048652202498355
subplots based on records of two different pandas DataFrames ( with same structure) using Seaborn or Matplotlib,0.06048652202498355
matplotlib scatterplot x axis labels,0.06048652202498355
How to plot ring by zones under two variables using matplotlib or seaborn?,0.06048652202498355
"Matplotlib why am I getting ""ValueError: view limit minimum 0.0 is less than 1 and is an invalid Matplotlib date value""?",0.06048652202498355
Python: Sharing scale between matplotlib and seaborn,0.06048652202498355
scatter plots in seaborn/matplotlib with point size and color given by continuous dataframe column,0.06048652202498355
Matplotlib: quarterly minor tick labels,0.06048652202498355
Matplotlib Subplot Labels Disappear,0.06048652202498355
How can I display value labels just at the right of each bar in seaborn horizontal barplot in bold?,0.05934526689243669
how to create upside down bar graphs with shared x-axis with matplotlib / seaborn and a pandas dataframe,0.05934526689243669
Matplotlib dataframe pie chart plotting is overlapping my 0% labels,0.05934526689243669
Group together bars and labels in python matplotlib barchart,0.05934526689243669
How to get the color of a seaborn/matplotlib bar graph,0.05934526689243669
Wrong labels when plotting a time series pandas dataframe with matplotlib,0.05934526689243669
Matplotlib : display several labels on a single line,0.05834976988823141
Sklearn train_test_split split a dataset to compare predicted labels with ground truth labels,0.05834976988823141
Reformat seaborn axis tick labels (datetime and scientific notation),0.05834976988823141
Python Matplotlib x-axis improperly labels timedelta64 object,0.05834976988823141
How to stop y-labels in matplotlib overlapping when plotting?,0.05834976988823141
How to annotated labels to a 3D matplotlib scatter plot?,0.05834976988823141
How do I generate multiple plots from grouped data using Matplotlib or Seaborn?,0.05834976988823141
"How do I create a pie chart in Matplotlib using a dataframe, and use the categorical variables in a column as labels?",0.05834976988823141
How to plot every label once in matplotlib legend with corresponding color?,0.05834976988823141
Plot time series data by first counting frequency using pandas and matplotlib/seaborn,0.05834976988823141
How to erase specific labels inside a matplotlib Legend,0.05834976988823141
"Plotting worldwide COVID-19 evolution as lines using python (matplotlib, seaborn or plotly)",0.05834976988823141
Python error No handles with labels found to put in legend with matplotlib,0.05834976988823141
How to keep the index when using pd.melt and merge to create a DataFrame for Seaborn and matplotlib,0.05834976988823141
Detect when matplotlib tick labels overlap,0.05834976988823141
What is the reason for matplotlib for printing labels multiple times?,0.05834976988823141
Copy DataFrame columns with particular labels to new pandas DataFrame under different labels,0.05834976988823141
How to add a legend from class labels in dataframe with matplotlib?,0.05834976988823141
Visualize numerical vs categorical data that makes sense in matplotlib/seaborn,0.05834976988823141
"How do you add (x,y) labels to a pandas matplotlib figure?",0.05834976988823141
matplotlib plot from dataframe but shift dates in x labels,0.05834976988823141
Seaborn and/or Matplotlib is grouping my X axis. How do I stop it being grouped,0.05834976988823141
Python: making column/row labels of matplotlib table bold,0.05834976988823141
"How to reproduce this plot's aestethics with matplotlib, seaborn or pandas",0.05834976988823141
Transpose factorplot in seaborn,0.05731523378582205
Seaborn heatmap not displaying all xticks and yticks,0.05731523378582205
How to merge two columns content identically labelled?,0.05731523378582205
"How to alter plot axes in seaborn scatterplot matrix, sns.pairplot()",0.05731523378582205
seaborn heatmap color map,0.05731523378582205
Handle labels not present in train data. KNN sklearn,0.05731523378582205
Seaborn lineplots: plotting from dataframe plots only even plots,0.05731523378582205
How to add a hue of one categorical column to Seaborn barplot (of each column mean and std)?,0.05731523378582205
Reshaping pandas DataFrame by transforming columns to labels contained in single column,0.05731523378582205
How to plot wide format dataframe with seaborn.relplot,0.05731523378582205
using matplotlib visualize two pandas dataframes in a single scatter plot,0.05731523378582205
Seaborn Distplot: Data does not match probabilities,0.05731523378582205
Python plotting dataframe with list cells using Seaborn Relplot,0.05731523378582205
A mysterious behavior of matplotlib - plot,0.05731523378582205
Two Seaborn plots on one twinx figure become distorted,0.05731523378582205
Seaborn barchart y values not summed as expected,0.05731523378582205
Is there a way to make Seaborn or Vincent interactive?,0.05731523378582205
Boxplots with Seaborn for all variables in a dataset at once,0.05731523378582205
selecting secondary index by tuple of labels,0.05731523378582205
plotting value_counts() in seaborn barplot,0.05731523378582205
xarray - convert values of a variable to labels of another variable in a Dataset,0.05731523378582205
Plotting two distributions in seaborn.jointplot,0.05731523378582205
Seaborn Heatmap - Remove Excess Repeated Xticks,0.05731523378582205
How to plot univariate distribution using seaborn (pairplot diagonal only)?,0.05731523378582205
Dates in X-axis using pandas and matplotlib,0.05731523378582205
Changing x ticks labels iteratively,0.05731523378582205
"Python, seaborn, statistic analysis using statannot doesn't look right",0.05731523378582205
Expected index while trying to use Label propagation,0.05731523378582205
Plotting distplots on one panel for different features with seaborn,0.05731523378582205
pandas scatter plot colors with three points and seaborn,0.05731523378582205
Need help speeding up seaborn heatmap to png in a for loop,0.05731523378582205
Seaborn Facetgrid countplot hue,0.05731523378582205
Manipulating Pandas Columns into different labels,0.05731523378582205
python 3 pandas and seaborn struggle using swarmplot - multiIndex,0.05731523378582205
How to set datetime format for pandas dataframe column labels?,0.05731523378582205
Plot specific column values in Seaborn instead of every column value,0.05731523378582205
Seaborn: I just want a log scale,0.05731523378582205
How to segregate data on the basis of class label using pandas an Python,0.05731523378582205
How to plot graphs from own function in subplot in Python Pandas Matplotlib?,0.05731523378582205
Adapting heikin ashi code ERROR: list-likes to .loc or [] with any missing labels is no longer supported,0.05731523378582205
Plot two heatmaps together (Seaborn),0.05731523378582205
Changing alpha of a line in seaborn factorplot,0.05731523378582205
Controlling tick labels alignment in pandas Boxplot within subplots,0.05731523378582205
Select column from DataFrame rows using a list of column labels,0.05731523378582205
Remove rows with conflicting labels,0.05731523378582205
Filtering a labeled image by particle area,0.05731523378582205
How to plot multiple Seaborn Jointplot in Subplot,0.05731523378582205
How to plot a stacked seaborn histogram colored from a different column,0.05731523378582205
How to parse labeled values of columns into a Pandas Dataframe (some column values are missing)?,0.05731523378582205
How to convert y axis to % values in Seaborn graph?,0.05731523378582205
Python seaborn plotting from dataframe that was filtered using `pd.Categorical`,0.05731523378582205
efficiently extract rows from a pandas DataFrame ignoring missing index labels,0.05731523378582205
