Title,Correlation Score
Pandas- create rows that show the sum of all items by date minus the specific item (creating ex-item rows for each item),0.1076923076923077
"AssertionError: Number of manager items must equal union of block items # manager items: 6004, # tot_items: 6005",0.09288824383164003
Pandas Item to features matrix in to item-item matrix,0.09288824383164003
"ValueError: 4 columns passed, passed data had 3 columns when converting python list to dataframe. How to add blank values if 3 passed?",0.09288824383164003
Bokeh - plotting fewer items than number of items passed,0.09288824383164003
from dataframe get number of days between the first order of the item A and the previous order which can be the item A or different item,0.08791208791208793
Pandas / SQL - Passing items from Dataframe in a loop in chunks,0.0754437869822485
"ValueError: Wrong number of items passed 500, placement implies 1, Python and Pandas",0.0754437869822485
Dataframe users who did not purchase item for user-item collaborative filtering,0.0754437869822485
"How to get count of items in rows as well as check one item is present or not, and finally keep the first row in python?",0.0754437869822485
creating a df of unique items and the max value of another column for each unique item,0.0754437869822485
"Python pandas dataframe read from_records, ""AssertionError: 1 columns passed, passed data had 22 columns""",0.0754437869822485
Transform dataframe rows with lists of items into rows with pairs of items,0.0754437869822485
How to choose random item from a dictionary to df and exclude one item?,0.0754437869822485
"Keep getting Wrong number of items passed 2, placement implies 1 when adding new column",0.0754437869822485
How to find the most similar item from within a set to my test item depending on certain criteria?,0.0754437869822485
"Pandas function .apply() not passing arguments ""ValueError: Point coordinates must be finite. (nan, nan, 0.0) has been passed as coordinates.""",0.0754437869822485
"Filter Pandas DataFrame Column Error: Wrong number of items passed 4, placement implies 1",0.0754437869822485
Match two dataframes to select items having exactly matching line items,0.0754437869822485
Enumerate Items in Pandas based on Group and Item Group,0.0754437869822485
"python pandas dataframe, is it pass-by-value or pass-by-reference",0.0754437869822485
"Pandas concat function gives ValueError : Shape of passed values is {passed}, indices imply {implied}",0.0754437869822485
"pandas.get_dummies() throws ValueError: Wrong number of items passed 4, indices imply 3",0.0754437869822485
"I am getting the following error: ""ValueError: Must pass 2-d input. shape=(1, 3, 1)"" but I am passing a 2-d input. What is happening here?",0.0754437869822485
Replace an item in a column with a similar item from that column that has repeated the most,0.0754437869822485
"pandas Wrong number of items passed 6, placement implies 1",0.0754437869822485
"ValueError: Wrong number of items passed 5, placement implies 1, error while finding the second max value in a row",0.0754437869822485
"Getting an error in python that Wrong number of items passed 8, placement implies 1",0.0754437869822485
Pandas - Ranking items within group by treating repeat items in a group as new,0.0754437869822485
Where Column item is equal to specific value insert new item,0.0754437869822485
converting user-item-rating list to user-item-matrix with pyspark,0.0754437869822485
When does pandas do pass-by-reference Vs pass-by-value when passing dataframe to a function?,0.0754437869822485
"Counter to count items' occurrence in several lists and return tuple (item, count in list 1, count in list 2)",0.0754437869822485
Pandas pd.concat works on first pass but says 'No objects to concat' on subsequent passes,0.0754437869822485
Pandas Python: Slice / Transform URL to get item and item counts,0.0754437869822485
Item price factor compared to items in same subgroup,0.0754437869822485
"ValueError: 0 columns passed, passed data had 3 columns",0.0754437869822485
"Pandas: rank() under groupby() returns ""ValueError: Wrong number of items passed 2, placement implies 1""",0.0754437869822485
"Generate a Pandas DataFrame from Pre-made Lists? (""5 columns passed, passed data had 500 columns"")",0.0754437869822485
How to convert df with item ratings to df that contains number of users that rated a pair of items?,0.0754437869822485
"ValueError: Wrong number of items passed 5, placement implies 1",0.0754437869822485
"Python Pandas, counting all the occurrences of an item in a CSV and assigning that count to a unique name for that item",0.0754437869822485
"3 columns passed, passed data had 50 columns",0.0754437869822485
Reconstruct pandas dataframe with users (rows) and items (column) so that each row is a user-item interaction,0.0754437869822485
Matching item in list with item in column containing list,0.0754437869822485
"When attempting to pass a dictionary to a pandas dataframe, how to resolve: ValueError: If using all scalar values, you must pass an index",0.0754437869822485
ValueError: Wrong number of items passed,0.0754437869822485
"Pandas, str.extract multiple expression error - ValueError: Wrong number of items passed 5, placement implies 1",0.0754437869822485
"For each item in list L, find all of the corresponding items in a dataframe",0.0754437869822485
No item error in Pandas when the item is certainly there,0.0754437869822485
How to extract a item from list of items in a python dataframe column?,0.0754437869822485
"Value Error:Wrong number of items passed 2, placement implies 1",0.0754437869822485
"Combining two columns give ValueError: Wrong number of items passed 2, placement implies 1",0.0754437869822485
"Python - Wrong number of items passed 2, placement implies 1",0.0754437869822485
Passing items in a list into a sql query in python,0.0754437869822485
How to print f-strings and other items simultaneously but each item be seperated by atleast one line/ space?,0.0754437869822485
"Wrong number of items passed 4, placement implies 1 when trying to extract in pandas",0.0754437869822485
ValueError: Inferred frequency None from passed values does not conform to passed frequency MS,0.0754437869822485
How to compare an item to the next item in a pandas dataframe?,0.0754437869822485
How can I count how many diverse item in the column 'item'?,0.0754437869822485
"ValueError: Wrong number of items passed 2, placement implies 1 with same number of columns",0.0754437869822485
Select all items in a pandas dataframe within certain range and 1 item outside of range,0.0754437869822485
"AssertionError: 5 columns passed, passed data had 1 columns",0.0754437869822485
How to replace an item in a list with a dataframe column if column contains the item,0.0754437869822485
How do I replace items on one DataFrame with items from other DataFrame?,0.0754437869822485
"ValueError: 21 columns passed, passed data had 20 columns",0.0754437869822485
ValueError with .groupby - Wrong number of items passed,0.0754437869822485
"Error, 'only list-like objects are allowed to be passed to isin(), you passed a [int]'",0.0754437869822485
Better way to compare all items in a dataframe and replace similar items with fuzzy matching python,0.0754437869822485
Why am I getting just one item (instead of multiple items) in a pandas column?,0.0754437869822485
"How to resolve ""ValueError: Wrong number of items passed""?",0.0754437869822485
"Wrong number of items passed 5, placement implies 1",0.0754437869822485
Error during creation of variable on Pandas - Wrong number of items passed,0.0754437869822485
"Pandas RegEx extract first match on substring, wrong number of items passed",0.0754437869822485
"Error: Wrong number of items passed 4, placement implies 1",0.0754437869822485
Wrong number of items passed - Pandas and Transform,0.0754437869822485
"Pandas DataFrame ValueError: Wrong number of items passed 2, placement implies 1",0.0754437869822485
"Pandas adding new column based on another column (Wrong number of items passed 19, placement implies 1)",0.0754437869822485
??. in pandas..html.py .. self.fmt.col_space.items()?? AttributeError: 'NoneType' object has no attribute 'items',0.0754437869822485
"Python List - group by first item, count and sum second item",0.0754437869822485
"Pandas groupby not working with Wrong number of items passed 4, placement implies 1",0.0754437869822485
"Wrong number of items passed 4, placement implies 1 while extracting with regex",0.0754437869822485
Group the most frequent items in a column associated with the most frequent items in another column,0.0754437869822485
"np.select returns error ""Wrong number of items passed 2, placement implies 1?""",0.0754437869822485
Dataframe unique items and x y locations to a grid of roomates (shared location) items,0.0754437869822485
Pandas - If items in a column equal then append items from another column,0.0754437869822485
Allocating the Sub items to the main Items in pandas,0.0754437869822485
"Pandas - Filtering value by columns throws error (ValueError: Wrong number of items passed 3, placement implies 1)",0.0754437869822485
Geocoding Pandas wrong number of items passed,0.0754437869822485
Is there a way to check if a list item is the ONLY item in the list?,0.0754437869822485
Pandas DataFrame column assignment ValueError: Wrong number of items passed,0.0754437869822485
"ValueError: Wrong number of items passed X, placement implies Y",0.0754437869822485
"Error ""Value error of : Wrong number of items passed 2, placement implies 1."" Python, Pandas",0.0754437869822485
"ValueError: Wrong number of items passed 1, placement implies 2",0.0754437869822485
"Concatenation error (Wrong number of items passed x, placement implies 1)",0.0754437869822485
Create loop with parameters for list of items (add in items as you go),0.0754437869822485
"ValueError: Wrong number of items passed 47, placement implies 1 and KeyError: 'size'",0.0754437869822485
"Pandas: DataFrame Error - 2 columns passed, passed data had 3 columns",0.0754437869822485
"ValueError: Wrong number of items passed 2, placement implies 1 when doing group by on two columns and transforming the group to calculate counts",0.0754437869822485
"I have a list of 60 complicated items, i have a dataframe with a text column that I would like to extract all the items from the list",0.0754437869822485
"How to fix ""wrong number of items passed 5, placement implies 1""",0.0754437869822485
AssertionError: Number of manager items must equal union of block items,0.0754437869822485
Python pandas: sum item occurences in a string list by item substring,0.0754437869822485
"How to select rows where items of two columns match with items of two lists (same index), using Pandas?",0.0754437869822485
Add items to a dataframe if item in column already present,0.0754437869822485
How do I remove items in my pandas groupby which only have one item associated with them?,0.0754437869822485
python pandas: How to check if a column item is also item of a list,0.0754437869822485
Can we pass a column instead of a variable to access nth item of a list?,0.0754437869822485
"Panda AssertionError columns passed, passed data had 2 columns",0.0754437869822485
"ValueError: Wrong number of items passed 9, placement implies 1 or NaNs when set calculated results as one column values in Pandas",0.0754437869822485
pandas DataFrame: get column item when the corresponding item in another column is greater than a value,0.0754437869822485
How to count the occurrence of specific items on grouped items of a csv file using python,0.0754437869822485
"Wrong number of items passed 1, placement implies 3 (Pandas 1.1.5)",0.0754437869822485
ResultSet object has no attribute 'text'. You're probably treating a list of items like a single item.,0.0754437869822485
Counting list items and storing in dataframe column corresponding to list item,0.0754437869822485
GroupBy items and count item every hour in Pandas,0.0754437869822485
"ValueError: 9 columns passed, passed data had 3 columns",0.0754437869822485
"ValueError: Wrong number of items passed 2, placement implies 3",0.0754437869822485
Barplot with top N items and one bin for the remaining items,0.0754437869822485
"How to overcome the 'ValueError: Wrong number of items passed 2, placement implies 1' error?",0.0754437869822485
"ValueError: 5 columns passed, passed data had 9 columns",0.0754437869822485
"Pandas error 2 columns passed, passed data had 1 columns",0.0754437869822485
Check whether an item appears previously in a list of items using Python Pandas,0.0754437869822485
ValueError: Wrong number of items passed - Meaning and suggestions?,0.0754437869822485
"ValueError: Wrong number of items passed 3, placement implies 1",0.0754437869822485
How to list JSON non-list items together with list items with pandas.json_normalize with Python?,0.0754437869822485
How search for items in list1 in a second list2 and return a data-frame with items that are equal,0.0754437869822485
Finding closest item in df2 for every item in df1,0.0754437869822485
Is there a way for me to pass to my view a context passed on to my template?,0.0754437869822485
"Pandas df.mode ValueError: Wrong number of items passed 5, placement implies 1",0.0754437869822485
How do i combine specific panda dataframe items into one item,0.0754437869822485
"Error **ValueError: Wrong number of items passed 2, placement implies 1**",0.0754437869822485
"'Wrong number of items passed 2, placement implies 1' error with pandas dataframe by operating two columns",0.0754437869822485
How to resample dates with Pandas item by item?,0.0754437869822485
For loop comparing items in a list with all items in previous rows in pandas,0.07402031930333815
"Dictionary to DataFrame Pandas: Error: 6 columns passed, passed data had 2 columns. - While loop in python",0.07402031930333815
Python - passing items from a list as columns for pandas read_csv method,0.07402031930333815
"Wrong number of item passed 13, placement implies 1 while pivot using pandas",0.07402031930333815
How to extract specific items from a data frame column and use them as labels for the remaining items?,0.07402031930333815
converting a text file that contains items and sub-items into a dictionary or datastructure,0.07402031930333815
Iterate through list items and convert items to pandas df using with forloop in python,0.07402031930333815
"Assigning time series prediction confidence interval array to pandas dataframe (Wrong number of items passed 2, placement implies 1)",0.07402031930333815
"Counting number of items active in each month, calculated from per-item start and end dates in a Pandas DataFrame",0.07402031930333815
"Why am I getting this error ??alueError: Wrong number of items passed 2, placement implies 4??even the code is fine?",0.07402031930333815
Pandas Create a new Column which takes the Most Frequent item Description given Item Codes,0.07402031930333815
Passing all items in a dict as arguments in an efficient way,0.07402031930333815
How to efficiently re-arrange pass/fail as a pass percentage by day in Pandas and NumPy?,0.07402031930333815
Fitting beta distribution over each item in a dictionary of items,0.07402031930333815
"Python pandas dataframe : In an array column, if first item contains specific string then remove that item from array",0.07402031930333815
Adding individual items and sequences of items to dataframes and series,0.07402031930333815
Operate on every list item *except* matching item in pandas series,0.07402031930333815
"Scrapy output items - multiple parse methods, one row per item",0.07402031930333815
"series.str.split(expand=True) returns error: Wrong number of items passed 2, placement implies 1",0.07402031930333815
"Left join and ValueError: Wrong number of items passed 55, placement implies 1",0.07402031930333815
Searching for an item within a list in a column and saving that item to a new column,0.07402031930333815
Pandas: Exclude items from an array column if that item is in another column,0.07402031930333815
How can I pass an entire array to a function while utilizing multiprocessing to pass each row of a pandas dataframe separately?,0.07402031930333815
basic python: how do i create the next item on the list based on previous item?,0.07402031930333815
"AssertionError: 22 columns passed, passed data had 21 columns",0.07330703484549637
"Why is df.cumsum() giving ValueError: Wrong number of items passed, placement implies 1",0.07330703484549637
"ValueError: Wrong number of items passed 2, placement implies 1",0.07330703484549637
"Pandas: For each item in a column, count the number of different items in another given column",0.07330703484549637
"ValueError: 2 columns passed, passed data had 1 columns",0.07330703484549637
Pandas and confusion over passing by value and passing by reference,0.07330703484549637
"Pandas ValueError: 6 columns passed, passed data had 7 columns",0.07330703484549637
"dataset.drop_duplicates() gives ValueError: Wrong number of items passed, but sample(frac=1) doesn't",0.07330703484549637
"In Pandas, how do I apply a function to a row of a dataframe, where each item in the row should be passed to the function as an argument?",0.07330703484549637
"Error : 5 columns passed, passed data had 2 columns but dimensions are not wrong",0.07330703484549637
Pandas Value Error (columns passed) No matter how many columns passed,0.07330703484549637
How to get indexes of items greater or less than each item in a NumPy array without using a loop?,0.07264957264957264
Wrong number of items passed - Adding to dataframe column a numpy array content,0.07264957264957264
How to split a column with string values like '[title:item]['title2:item]'...etc into a dictionary with pandas,0.07264957264957264
Pandas - Add columns to dataframe which finds the sum and mean of item sales by item id in the previous month,0.07264957264957263
python pass extra information through nested for/in/if loop that iterates over items in a dataframe,0.07264957264957263
Comparing Next Item with Previous Item in a Dictionary,0.07264957264957263
"I need to iterate over list items with for loop to use this items to filter pandas data frame columns and save the return columns to new data frame,",0.07264957264957263
Pandas Dataframe str.split error wrong number of items passed,0.07192388324463794
"Split pandas column with list of item and values, into separate columns with item as column header",0.07132867132867132
Wrong number of items and non match shape of passed values when to merge dtype(O) and 'float64' array to a dataframe,0.07059195948084834
passing text user input into another function as string,0.05731523378582205
Pandas get frequency of item occurrences in a column as percentage,0.05731523378582205
"Passing list of row numbers into 2 dataframes, labeling, and adding to new dataframe",0.05731523378582205
Program calculating tax rate per line item equaling into VAT,0.05731523378582205
Passing Pandas as Variable changes it,0.05731523378582205
Creating test & train set while keeping certain items together in one set,0.05731523378582205
Pass multiple variables to a function when using pandas.DataFrame.assign,0.05731523378582205
"TypeError: sequence item 1: expected str instance, int found when flattening MultiIndex pandas column",0.05731523378582205
How to count paired occurence of items within subgroups in a pandas dataframe?,0.05731523378582205
Python function passing parameters,0.05731523378582205
How to repeat a row for each value of its corresponding columns items,0.05731523378582205
pass random variable to agg function python,0.05731523378582205
Value counts for specific items in a DataFrame,0.05731523378582205
How to pass named arguments to a function invoked by Pandas transform?,0.05731523378582205
Splitting a string into list and converting the items to int,0.05731523378582205
How to assign an item in a pandas dataframe after checking for conditions?,0.05731523378582205
Extract text from python list item,0.05731523378582205
Implement df.groupby('user')['item'].apply(np.array) in cuDF,0.05731523378582205
GroupBy of a dataframe by comparison against a set of items,0.05731523378582205
Comparing and replacing column items pandas dataframe,0.05731523378582205
Trying to pass numpy array mode value to df column,0.05731523378582205
how to return some default value for items in 'where' clause which are not matching(not existing) in database table column,0.05731523378582205
pass by reference for mutable object?,0.05731523378582205
Insert items from MultiIndexed dataframe into regular dataframe based on time,0.05731523378582205
Pass DataFrame to parse() in spider class,0.05731523378582205
Using pandas apply to pass in both a row and the entire dataframe with it,0.05731523378582205
Splitting a a string into a list of items in pandas dataframe | Python | Pandas |,0.05731523378582205
Pandas GroupBy- Remove groups with less than 2 items,0.05731523378582205
Passing columns as arguments to pandas groupby apply function,0.05731523378582205
passing string arguments to filter database rows in python,0.05731523378582205
Passing values from one data frame columns to another data frame in Pandas,0.05731523378582205
how can i find correlation between very few items in dataframe pandas,0.05731523378582205
Grouping items before a certain date,0.05731523378582205
Tkinter - passing 3 user input variables to functions to search a csv file via a pandas query,0.05731523378582205
How to pass a list of dates as VALUES into read_spl using parameter substitution?,0.05731523378582205
create a data frame from multiple lists where each items of the list is goes to the columns,0.05731523378582205
Trying to transform items in data frame. Maybe JSON,0.05731523378582205
pass multiple rows into a function,0.05731523378582205
Is there a way to modify the dataframe passed to a facetgrid in seaborn?,0.05731523378582205
"Three Dimensional Pandas DataFrame Error ""Must Pass 2-D Input""",0.05731523378582205
pandas qcut and pandas cut functions do not distribute the number of items uniformly,0.05731523378582205
Subset df by last valid item - pandas,0.05731523378582205
Efficient way to map items from one column into new column in Pandas,0.05731523378582205
"Unable to convert a list into a dataframe. Keep getting the error ""ValueError: Must pass 2-d input. shape=(1, 4, 5)""",0.05731523378582205
groupby a column and count items above 5 in another pandas,0.05731523378582205
Passing datetime64[ns] from pandas' data frame as an argument to a function,0.05731523378582205
AttributeError: 'DataFrame' object has no attribute 'items' (pandas DataFrame error),0.05731523378582205
Pandas: How to get last daily value for each item in one column and subtract it from the value in each row,0.05731523378582205
How to plot the proportion or count of items given a datetime?,0.05731523378582205
How to return the frequency of each value for every item inside of a pandas dataframe?,0.05731523378582205
pandas - top count items after groupby on multiple columns,0.05731523378582205
How to call strings from a list in Python to pass into function,0.05731523378582205
Binned scatterplot -- how to ensure the top 'viewable' is the item in the bin with the lowest value in a column?,0.05731523378582205
How to put a list item inside a url?,0.05731523378582205
"How to rise ""{ValueError}Shape of passed values is ..., indices imply ..."" during pandas read_csv() function?",0.05731523378582205
Trying to move items from a column into rows but not transapose and not long to wide,0.05731523378582205
Convert string of different items in pandas dataframe with counts into categorical count,0.05731523378582205
Counting Distinct Items That Equal 0 Based On Another Column,0.05731523378582205
"Pandas read_excel new string type error when passing ""string"" using converters parameter",0.05731523378582205
"Unpacking many columns of lists using apply get ValueError: If using all scalar values, you must pass an index",0.05731523378582205
create individual class variables of all column items in a data frame,0.05731523378582205
how to pass and access a list as parameter in Python,0.05731523378582205
"Python: Pandas occurred ValueError: If using all scalar values, you must pass an index",0.05731523378582205
Passing string to dataframe iloc,0.05731523378582205
Pass / Fail Dataframe example,0.05731523378582205
Unique Items in a pandas dataframe with a list,0.05731523378582205
Pass row numbers while using apply() function in a column in Pandas,0.05731523378582205
"Pandas ValueError: Shape of passed values is (6, 3), indices imply (6, 4)",0.05731523378582205
"How to use the items of the list, with the glob.glob to get the files?",0.05731523378582205
"Trying to insert new data into a mongo db, which might contain duplicate items intentionally",0.05731523378582205
Find sum of row items where the index contains a string,0.05731523378582205
Passing string variable value in Pandas dataframe,0.05731523378582205
How to pass multiple values from a panda df to pyspark SQL using IN OPERATOR,0.05731523378582205
String replace with multiple items,0.05731523378582205
Bokeh Legend Object - passing assigned color to legend,0.05731523378582205
pass over errors with for loops and fill in row with None,0.05731523378582205
python: How to delete all items in a group if one matches a condition (string comparison)?,0.05731523378582205
Count items in list when each observation is a string that looks like a list,0.05731523378582205
More Pythonic way of writing If-Else-Pass,0.05731523378582205
"web scrape , pass search values from csv list and return csv",0.05731523378582205
Passing a lambda function to DataFrame.apply - what's happening here?,0.05731523378582205
