Title,Correlation Score
"After I drop columns, I run my linear regression and the columns are there",0.03846153846153846
how to find combinations present in different columns,0.03846153846153846
Setting number format for floats when writing dataframe to Excel,0.03846153846153846
Error 'utf-8' codec can't decode byte 0xf4,0.03846153846153846
Insert large Dataframe into Oracle DB using python,0.03846153846153846
Is there any possible way to loop through a python list and create individual pdf files instead of csv files?,0.03846153846153846
Find first occurrence of value by date,0.03846153846153846
Sum values in dataframe depending on columns,0.03846153846153846
strip some value from a column -pandas/python,0.03846153846153846
Python pandas parsing with dataframes,0.03846153846153846
Using f-string and raw string at same time,0.03846153846153846
Add a title to a dataframe,0.03846153846153846
White space not trimming in Pandas dataframe csv export,0.03846153846153846
How do I change the numbers in the variable with the For Loop on Python?,0.03846153846153846
Python Decorator to convert Pandas DataFrame to dict,0.03846153846153846
Python: fill NaN with value based on condition on other columns,0.03846153846153846
Streamline groupby process,0.03846153846153846
scraping with BS4,0.03846153846153846
Is it possible to decrease line spacing between rows in a docs table generated with pandas dataframe?,0.03846153846153846
Is there a way to convert few cells in python date which are pulled as excel dates?,0.03846153846153846
How to create a string out of a pandas Series of lists?,0.03846153846153846
how do i unflatten a dataframe back to json/xml format?,0.03846153846153846
Dask map_partitions() prints `partition_info` as None,0.03846153846153846
python pandas astype not working properly when chained with sklearn encoder,0.03846153846153846
Custom Label mapping pandas,0.03846153846153846
how do I compare these two tables?,0.03846153846153846
Pandas: How to fill nan value for column with part of value in other columns,0.03846153846153846
Matplotlib axvspan() function fills wrong date,0.03846153846153846
pandas append column from dataframe to a list in python,0.03846153846153846
"Input contains NaN, infinity or a value too large for dtype('float64') - sklearn cosine similarity",0.03846153846153846
pandas insert and append into a new dataframe in a loop,0.03846153846153846
Dataframe to grouped JSON,0.03846153846153846
File is not a zip file error despite pandas older version,0.03846153846153846
Count custom values from a list in a python dataframe per column,0.03846153846153846
How to Coalesce datetime values from 3 columns into a single column in a pandas dataframe?,0.03846153846153846
Combine text using delimiter for duplicate column values,0.03846153846153846
how can i store rows that repeat on a certain value pandas,0.03846153846153846
Replacing values in a pandas dataframe with values from other column with a certain condition,0.03846153846153846
How to calculate rolling average in dataframe?,0.03846153846153846
how to explode a list of strings while keeping the other columns?,0.03846153846153846
How to highlight all duplicate rows except NaN?,0.03846153846153846
How to get regression outputs from a multi-input model in tensorflow?,0.03846153846153846
Creating histograms for mulitple IDs in pandas dataframe,0.03846153846153846
"How to insert a DF into a clickhouse table, if data type is uuid and list of datetime?",0.03846153846153846
How can I get day_name() after groupby dayofweek?,0.03846153846153846
Convert calendar date to julian date with a base date,0.03846153846153846
Avoiding for loops using list comprehension in Python,0.03846153846153846
Write JSON to parquet file using pyarrow,0.03846153846153846
How to combine pandas df so that rows with permuted col1 and col2 values can be merged containing only one combination & summing a count column,0.03846153846153846
how to insert dataframe into SQl server database in pandas,0.03846153846153846
Add a count unique combinations across rows in pandas,0.03846153846153846
Sum specific columns for selected rows with a specific value,0.03846153846153846
"Get a subset of a dataframe where columns must contain substring (if not, ignore those rows)",0.03846153846153846
How can I use TF's `ImageDataGenerator.flow_from_dataframe` for one-hot encoded output?,0.03846153846153846
Change value for ID for each row in the quarter where the value is one,0.03846153846153846
how to get a list of sorted values filling missing ones in python?,0.03846153846153846
Insert values of dataframe to class atributes with for loop in python,0.03846153846153846
How to create multiple undersamples from dataframe without replacement?,0.03846153846153846
Problem adding sheet by creating latest Excel File,0.03846153846153846
Pandas error in merging two files based on different number of columns (2 and 1) in 2 dataframes,0.03846153846153846
How to replace rows based on this condition?,0.03846153846153846
Problem with NaN values and fillna function python pandas,0.03846153846153846
How can i find out different languages in pandas dataframe other than english,0.03846153846153846
How do I change the same string within a column and make it permanent using Pandas,0.03846153846153846
How to create a Pandas DataFrame with columns?,0.03846153846153846
Pandas: How to explode data frame with json arrays,0.03846153846153846
Calculate row mean excuding outliers in Pandas Dataframe,0.03846153846153846
Python/Pandas - Time Series Forecasting: Building a temporal data frame from two different dataframes,0.03846153846153846
Convert str into float but problems with multiple dots in numbers,0.03846153846153846
txt into pandas dataframe deleting some lines first,0.03846153846153846
Use trained model sentiment on the dataframe python,0.03846153846153846
Parsing list stored as string in Pandas dataframe column,0.03846153846153846
Distance between two coordinates in a column to a matrix,0.03846153846153846
Calculate column in pandas based on values of other columns ( col3 = 1 if col1<col2 and col2 > col1),0.03846153846153846
Python Pandas drop_duplicates - adds a new column and row to my data frame,0.03846153846153846
Python utility to filter records in a dataset into retention1 dataframe and retention2 dataframe,0.03846153846153846
How to fit data in sklearn,0.03846153846153846
pandas returns a series instead of a dataframe while adding a new column,0.03846153846153846
Pandas UDF Function Takes Unusually Long to Complete on Big Data,0.03846153846153846
google sheets API invalid values for input data using JSON conversion of pandas data frame,0.03846153846153846
DataArray.to_dataframe size increase,0.03846153846153846
Turn cell into False based another row/column Pandas,0.03846153846153846
Pandas not renaming column names,0.03846153846153846
python while loop didn't append any values into to the DataFrame,0.03846153846153846
Find min value and one index above it,0.03846153846153846
Sort Dataframe by Index then by Column,0.03846153846153846
How to replace data in dataframe based on a condition,0.03846153846153846
Python Pandas DataFrame Describe Gives Wrong Results?,0.03846153846153846
Pandas: Get all ids that have more than one corresponding value,0.03846153846153846
Store python array in each entry of a column,0.03846153846153846
Create running total with multiple columns in Python,0.03846153846153846
Similarity score to filter dataframe columns in pandas,0.03846153846153846
Get the percentage frequency of the dataframe,0.03846153846153846
Is this the correct way to replace a string with the mean of a column in pandas?,0.03846153846153846
Sample data using np.random.choice(),0.03846153846153846
Transforming Missing Column Data from Available Data from same column in pandas dataframe?,0.03846153846153846
Python find number of student assessments by using pd.groupby and insert the score of each assessment,0.03846153846153846
Remove all rows of dataframe which include atleast x amount of values from list,0.03846153846153846
ValueError: Protocol not known,0.03846153846153846
Create from-to pairs from a pandas `dataframe`,0.03846153846153846
How to iterate over a series with identical indices,0.03846153846153846
Set Dataframe Index from row values of another Dataframe,0.03846153846153846
Want to Create new columns in dataframe and append earliest and latest datetime from other column which mapped to other columns of duplicate values,0.03846153846153846
Cannot load json file using pandas read_json in Jupyter lab,0.03846153846153846
Avoid for loop in dataframes when committing the csv records to database columns,0.03846153846153846
Match of rows between two files,0.03846153846153846
How can I perform the following transformation?,0.03846153846153846
Combining rows in a Geopandas Dataframe,0.03846153846153846
Repeated x values on a pandas plot,0.03846153846153846
Pandas and differential/derivative for non-uniform samples?,0.03846153846153846
Meaning of colon in function Init signature,0.03846153846153846
Using value_counts with False/True. How to get false/true = 0 when there is any false or true,0.03846153846153846
ODBC Driver 17 for SQL Server]Numeric value out of range on Windows,0.03846153846153846
calculate churn based on 21 days interval,0.03846153846153846
Read Excel file in python with the same format as the Excel file,0.03846153846153846
"Merging two dataframes of different sizes, as per some condition",0.03846153846153846
Merge rows with same index and prioritize column values,0.03846153846153846
How do you distinguish spatio-temporal trajectories from clusters?,0.03846153846153846
Comparing strings in two different dataframe and adding a column,0.03846153846153846
Get data which falls between at least one of multiple date ranges,0.03846153846153846
pandas correlation between two string column,0.03846153846153846
"Data validation: TypeError: can only concatenate str (not ""int"") to str",0.03846153846153846
How to flatten this MultiIndex table?,0.03846153846153846
How to include extreme in Pandas IntervalIndex?,0.03846153846153846
Pandas crosstab plot - how to show values,0.03846153846153846
"Delete duplicate datas from csv and training (Keras, python, pandas)",0.03846153846153846
How to calculate the percentage of a value among values in a sliding window,0.03846153846153846
Why I cant append tempDF to df?,0.03846153846153846
Python Dataframe. Move rows values left according index of rows,0.03846153846153846
How can I extract data from a web page and turn it into proper Pandas dataframe?,0.03846153846153846
pandas map list values to corresponding column,0.03846153846153846
Is there a way to know which columns have different datatypes to be able to merge? Python - Pandas,0.03846153846153846
How to find the rolling percentage Pandas,0.03846153846153846
"Pandas, Python - Problem with converting xlsx to csv",0.03846153846153846
Extracting data using datetime but getting a dtype error?,0.03846153846153846
Changing NaN values to 0 based on the value on other column in pandas DataFrame,0.03846153846153846
How to divide rows within the same dataframe,0.03846153846153846
Conversion of row elements in a column in pandas dataframe,0.03846153846153846
Convert strings of numbers with spaces in a column (1234) to int,0.03846153846153846
"FALSE changed to ""false"" while using pd.read_csv",0.03846153846153846
avoid overwriting excel file and create a new name with pandas,0.03846153846153846
Replace the string in pandas dataframe,0.03846153846153846
Pandas dataframe get unique value of a column,0.03846153846153846
pandas merge with multiindex columns but single index index,0.03846153846153846
Python parsing unstructured data,0.03846153846153846
Map string values in Dataframe to integers using Python,0.03846153846153846
Create columns in pandas dataframe based on values in a particular column,0.03846153846153846
Incrementally append data from a large number of files given column value,0.03846153846153846
I need help While counting the cities in a dataframe,0.03846153846153846
Splitting Location Pandas column into city and state and inserting Not specified if it is not,0.03846153846153846
pandas returning column name as value if column name matches value of another data frame,0.03846153846153846
Converting yes/no to integer type 1/0 (not just replacing) in Pandas data frame,0.03846153846153846
How to create a full window of a 30 days on a pandas dataframe with groupby if some days are missing,0.03846153846153846
"Pandas dataframe: grouping by unique identifier, checking conditions, and applying 1/0 to new column if condition is met/not met",0.03846153846153846
I'm trying to create a table from text,0.03846153846153846
Conditionally Create Temp Table in SQL from Python,0.03846153846153846
Backfill DataFrame Index by Minute?,0.03846153846153846
How to split a dataframe string column into multiple columns?,0.03846153846153846
How to filter DataFrame using isna?,0.03846153846153846
Pandas un-exponde Series based off of Index,0.03846153846153846
convert 30 min data to 15 min data in python,0.03846153846153846
Pandas check if cell value is between range from another data frame,0.03846153846153846
Erasing outliers from a dataframe in python,0.03846153846153846
Merging data from one spreadsheet into another based on two parameters,0.03846153846153846
"Pandas udf on multiple columns, pandas applay analogue in pyspark",0.03846153846153846
Python: how to reshape a dataframe based on reapeted rows?,0.03846153846153846
Pandas multiple condition and get dataframe,0.03846153846153846
Parse Dates from column within Pandas dataframe,0.03846153846153846
what is the best way to modify a particular line of a csv file without erasing everything?,0.03846153846153846
visualization Panda in Python,0.03846153846153846
Loading vaex dataframe to dash datatable,0.03846153846153846
check for value in pandas Dataframe cell which has a list,0.03846153846153846
How to count the number of non-NA observations of a dataframe using Dplyr R (like df.count() in Python Pandas),0.03846153846153846
compare the row values to get the value from other column,0.03846153846153846
Unable to overwrite a Column Value using Pandas,0.03846153846153846
Rename column names of my data frame in Pandas,0.03846153846153846
using double for loop in one line within a function,0.03846153846153846
Python list how to identify the given number is in the range Challenge Question,0.03846153846153846
How to delete duplicates pandas,0.03846153846153846
Replace values of outliers with mean of closest normal data points in Pandas DataFrame,0.03846153846153846
How do I add missing dates to multi index df?,0.03846153846153846
TypeError: multiply(): incompatible function arguments in PySeal library,0.03846153846153846
Transform table following ID using pandas,0.03846153846153846
Training and Testing Splitting Tagging,0.03846153846153846
Get values of a column having more than a certain value for given number of times,0.03846153846153846
Python Pandas DataFrame difficulties flattening after GroupBy,0.03846153846153846
"Python, Pandas Pivot Table: How to get Sum of SubCount?",0.03846153846153846
How to write a SQL to count total number of occurrences of value in column after group by while taking count as 1 if the group has the value?,0.03846153846153846
Grouping and pivoting dataframe,0.03846153846153846
Pandas Multiindex,0.03846153846153846
Use recurring row values or booleans to define boundaries of pandas groupby,0.03846153846153846
Subtracting two pandas dataframes with different shapes,0.03846153846153846
Making PANDAS identify a PATTERN inside a value on a DF,0.03846153846153846
Create a new 100 % total column for every group,0.03846153846153846
Barplot using for loop for all columns irrespective of data type,0.03846153846153846
I can't seem to get plotly to display multiple graphs,0.03846153846153846
Unable to Read a large CSV into Panda dataframe,0.03846153846153846
Append data to the last row of the Excel sheet using Pandas,0.03846153846153846
How to apply t.test on every ith pair of values of two columns with pandas?,0.03846153846153846
append 1 Series (column) at the end of a dataframe with pandas,0.03846153846153846
Why are feature selection results different for Random forest classifier when applied in two different ways,0.03846153846153846
Combine two columns with same column name using pandas,0.03846153846153846
Pandas DataFrame.value_counts() does not allow dropna=False,0.03846153846153846
Improvise the apply/lambda for run time,0.03846153846153846
Converting Lemmatized output to string in data frame,0.03846153846153846
how can i change values in a column by checking the next rows value in another column,0.03846153846153846
csv_read: convert dates to int/boolean,0.03846153846153846
Parsing XML using Python and create an excel report - Elementree/lxml,0.03846153846153846
Pandas: Subtract timestamps,0.03846153846153846
Python: collect rows of a column value to a single row,0.03846153846153846
How to convert the date format in a dataframe using Python?,0.03846153846153846
Balance calculation pandas,0.03846153846153846
Why square brackets are used in dtf.loc[] in pandas?,0.03846153846153846
How to build pd series with user input iteratively one cell at a time?,0.03846153846153846
Combine multiple csv with 'datetime' columns,0.03846153846153846
Filling data in Pandas,0.03846153846153846
Get Max Sum value of a column in Pandas,0.03846153846153846
Pandas Data frame from complex data,0.03846153846153846
iteratively merging varying number of rows,0.03846153846153846
export multible dataframes to multible worksheets in one csv,0.03846153846153846
Removing duplicates within a Multi-index df with `n` spaces in between,0.03846153846153846
Convert 34:37 into 34.37 in pandas,0.03846153846153846
Create a Dataframe with 3 columns from requests.get(url).text,0.03846153846153846
Append and fill row dataframe to a larger dataframe to create new columns,0.03846153846153846
Convert single column in dataframe to rows | Pandas Facebook Ads,0.03846153846153846
how do the same calculation for every row with values of the same row: Zero Division Error,0.03846153846153846
How can I send (request.post) pandas dataframe/json to my raspberry-pi webserver?,0.03846153846153846
Start function from a specific row,0.03846153846153846
row values get replaced after new iteration,0.03846153846153846
Apply function to every cell in DataFrame and include value from specific column,0.03846153846153846
"Pandas : Apply weights to another column, for certain ids only",0.03846153846153846
Split column that contains two values,0.03846153846153846
Pandas data series in one pandas cell,0.03846153846153846
Sentence tokenization using NLTK package in Pandas Dataframe,0.03846153846153846
"How to remove space ""before"" column name when importing csv data in Pandas",0.03846153846153846
How to map by similar rows in Pandas?,0.03846153846153846
Pandas processing getting killed,0.03846153846153846
unknown number of columns into one,0.03846153846153846
Create function to count number of web sessions in dataframe per unique ID,0.03846153846153846
Method .replace in python,0.03846153846153846
"Create multiple columns with calculations using groupby, aggregate functions in Pandas",0.03846153846153846
Python/Pandas: How do I use FuzzyWuzzy to replace typos in a column with names of countries?,0.03846153846153846
Group boolean values in Pandas Dataframe,0.03846153846153846
Convert a dataframe with string representations of lists to a dataframe with lists,0.03846153846153846
More efficient way to write this lambda function,0.03846153846153846
Manipulating two dataframes to arrive at the output,0.03846153846153846
Using Python: How to divide two different indicators (amount and exchange rate) in case two attributes match (Country AND date)?,0.03846153846153846
Reading large database table into Dask dataframe,0.03846153846153846
How to Interpolate and Upsample columns in Pandas,0.03846153846153846
Pandas `read_sql` SUM column differs from CLI output,0.03846153846153846
Pandas read_sql reading Access Database: First row missing,0.03846153846153846
Pandas: Replace index values(int) in column with column values (string) of another dataframe matching the index values,0.03846153846153846
Pandas: Creating a new column using a definied function,0.03846153846153846
Keep N first elements from a string fileds using pandas,0.03846153846153846
Keras Numerical and Categorical Features Embedding for RNNs,0.03846153846153846
Cleaning Excel File Using Pandas,0.03846153846153846
Convert lists present in each column to its respective datatypes,0.03846153846153846
Replace whitespace in pandas dataframe with 0 in all columns,0.03846153846153846
Python: How to Webscrape All Rows from a Specific Table,0.03846153846153846
Is there a way in pandas to group rows in a dataframe based on a quantity in one column?,0.03846153846153846
Loop Adding New Column for Each Letter of the Alphabet,0.03846153846153846
Extract value from JSON data of a pandas column with condition apply,0.03846153846153846
Seaborn box plot cut off on graph,0.03846153846153846
Why I get an error while working on a slice of dataframe?,0.03846153846153846
F1 score in pandas dataframe row-wise comparisons,0.03846153846153846
List Comprehensions in dataframe with multiple conditions,0.03846153846153846
"using regex ,searching for patterns in a list which is in data frame and placing the matching results into new column in pandas",0.03846153846153846
"In python, I want to loop through multiple csv files and remove specific rows",0.03846153846153846
How to detect the language of a sentence in python,0.03846153846153846
Pandas how to inner merge DateTimeIndex of a DataFrame with a date column of another DataFrame?,0.03846153846153846
Using a Data Frame Column as start & another as end for range to calculate mean for another dataframe column,0.03846153846153846
Change appearance of pandas df in jupyer notebook,0.03846153846153846
how to pick single row from multiple rows in pandas,0.03846153846153846
"How can i list the data of price next to title? ex: Pepsi Pepsi Max - 330Ml LBP 17,999",0.03846153846153846
Python Pandas transform multiple csv files in parallel,0.03846153846153846
Searchable pandas release notes,0.03846153846153846
How to add two text rows to one and keep other rows same as before pandas,0.03846153846153846
Count number of column value repeats in a pandas time window,0.03846153846153846
Read specific column and get other columns with csv or pandas module,0.03846153846153846
Python or R -- create a SQL join using a dataframe,0.03846153846153846
Check if different columns of two dataframes are equal,0.03846153846153846
Add comma in all rows of a column in DF except last row in pandas python,0.03846153846153846
How to avoid memory error in pandas dataframe?,0.03846153846153846
How to populate value of a column in a pandas df from another df?,0.03846153846153846
pandas.concat and bad/corrupt data,0.03846153846153846
Trying to use python to find if a column contains text with pandas,0.03846153846153846
"Pandas merge, right file has more than one instance of the same key",0.03846153846153846
Error handling when reading S3 bucket with parquet files into pandas,0.03846153846153846
Loop through time series data and collect specific timeframe window keeping the runtime O(N),0.03846153846153846
Pandas Sort by ID and Date and find row where conversion happens,0.03846153846153846
Unable to install Pandas Library using pip3,0.03846153846153846
How to merge two dataframes based on time?,0.03846153846153846
"How to sort dataframe by some columns with nans, as if they were one column?",0.03846153846153846
How to generate JSON from a pandas data frame for dynamic d3.js tree,0.03846153846153846
Only last line of Pandas webscraped data is appearing in spreadsheet,0.03846153846153846
Plot groupby percentage dataframe,0.03846153846153846
"in a Pandas Dataframe Column, how to convert two datetime formats to one Datetime format",0.03846153846153846
"In a for loop with the objective of automatically returning count plots for all categorical variables, how would you filter data for only cat columns?",0.03846153846153846
Slicing a hierarchical dataframe in Pandas,0.03846153846153846
"I am trying to merge two CSV files and rearrange their columns using pandas in python, but am having trouble with an identical column",0.03846153846153846
Why we transfer seried objects to the function?,0.03846153846153846
Creating a new dataframe from an existing dataframe,0.03846153846153846
Need to Compare DataFrames in Pandas using < and > operators for specific data in a column,0.03846153846153846
Add multiple columns to my dataframe (if statement),0.03846153846153846
Rolling window with pandas,0.03846153846153846
How to keep a dataframe loaded,0.03846153846153846
"Advanced calculation using pandas (if next cell is greater, then note value, merge)",0.03846153846153846
How to read an access file on mac M1 into a DataFrame for pandas?,0.03846153846153846
Python how to filter a csv based on a column value and get the row count,0.03846153846153846
Count the number of labels on IOB corpus with Pandas,0.03846153846153846
extract and subset dictionary from pandas dataframe in correct format - python,0.03846153846153846
comparing a new version of a data frame to identify changes into a new data frame,0.03846153846153846
Pandas str.contains not giving valid result when string ends with .(dot) along with boundryline,0.03846153846153846
Pandas explode to create new columns,0.03846153846153846
