Title,Correlation Score
How to Gaussian Fit Histogram?,0.03846153846153846
How load huge data json in jupyter on VSCode,0.03846153846153846
How can I sort a boxplot in pandas by the median values?,0.03846153846153846
How to remove extra column (with no header) in csv in Python,0.03846153846153846
"Extracting data by regex and writing to CSV, Python glob (pandas?)",0.03846153846153846
"Transforming list elements in a DataFrame into simple values (Pandas, Python)",0.03846153846153846
How to convert text extracted from tesseract to pandas dataframe,0.03846153846153846
Calculate 30 Day retention rate for new customers acquired each day,0.03846153846153846
Other conda environments do not automatically activate in VScode git bash,0.03846153846153846
Pandas to_datetime inconsistent conversions,0.03846153846153846
Wordcloud with text from a column with list of strings,0.03846153846153846
How can I extract only the date from a timestamp?,0.03846153846153846
Change the range of numbers of dataset to text in Python,0.03846153846153846
KeyError: 'key of type tuple not found and not a MultiIndex' SVM,0.03846153846153846
Pandas - How to identify `nan` values in a Series,0.03846153846153846
How to extract values from a column of list string pandas dataframe,0.03846153846153846
"Python TA library, ATR getting errors in dataframe series",0.03846153846153846
Changing Default Python env.(from 2.7 to 3.3) in Anaconda on Mac OS 10.8,0.03846153846153846
How do I create a column based on the values of two existing columns?,0.03846153846153846
Data corruption - pyodbc to SQL server,0.03846153846153846
Split a pandas time-series DF into batches of 1hr/4hr/8hr etc,0.03846153846153846
read_sql() works but to_sql gives an error Orcale DB sqlalchemy,0.03846153846153846
How do I create a histogram from a pandas dataframe?,0.03846153846153846
Is there any way to use `.pkl` sklearn model in Pyspark DataFrame,0.03846153846153846
Lost data when use 'for' Python,0.03846153846153846
Modify time column to exclusive and inclusive time in Pandas DataFrame,0.03846153846153846
Removing specific records based on sequences of value in one column,0.03846153846153846
How to append dataframe to excel,0.03846153846153846
Assigning a list to a subset of a df,0.03846153846153846
How to display data from csv file,0.03846153846153846
data file to .arff file for Weka software,0.03846153846153846
"How can you add a column label to a data frame with a before, during, and after phase over time?",0.03846153846153846
How to slice pandas DataFrame so pylance doesn't give error about returned type being NDFrame?,0.03846153846153846
"How to put linear regression results (variable name, p_value) into a dataframe using for loop?",0.03846153846153846
Speed up of iteration through Pandas column that applies if condition and recursive function - Python,0.03846153846153846
Pandas- Add a new row based on a specific condition,0.03846153846153846
Mapping different data frames based on multiple conditions in pandas df,0.03846153846153846
Pairwise regressions in Pandas,0.03846153846153846
How to combine two datasets vertically in pandas?,0.03846153846153846
"New to pandas, I would like to merge 2 rows into 1 if values of columns match",0.03846153846153846
"EasyGUI functions freezing, hanging, or not popping up",0.03846153846153846
How to set multiple conditions for a Dataframe while modifying the values?,0.03846153846153846
Import not well formatted txt file using python (eliminate first rows),0.03846153846153846
How to get median values across diagonal lines in a matrix?,0.03846153846153846
Why am i obtaining differents f1 score?,0.03846153846153846
"How can I merge one dataframe into another, inserting rows that do not exist?",0.03846153846153846
Iteratively merge panda columns with new column names,0.03846153846153846
Pandas - locating using index vs column name,0.03846153846153846
Assign a value to duplicates in Python,0.03846153846153846
"Both selections yield the same result, but with one I cannot assign values to the DataFrame",0.03846153846153846
How to copy a few columns from an existing sheet into new one in the same workbook?,0.03846153846153846
Daily frequency count with pandas,0.03846153846153846
Dataframe does not accept results from lambda function,0.03846153846153846
Class that returns a transformed dataframe,0.03846153846153846
conditionally filling blanks in pandas according multiple columns from other rows,0.03846153846153846
How to use True and False statements in the next calculation?,0.03846153846153846
"A value is trying to be set on a copy of a slice from a DataFrame when using .loc[row_idx, col_idx] = value",0.03846153846153846
make new column using value_counts in dataframe pandas,0.03846153846153846
Using a list to generate dataframes in for loop,0.03846153846153846
How to find x-value of maximum in a certain range?,0.03846153846153846
How to remove the duplicate string completely from the list using pandas python?,0.03846153846153846
Adding a new line after appending to a data frame,0.03846153846153846
What is the best pythonic approach to read large set of small .txt files from the disc apply data extraction logic and store result in database?,0.03846153846153846
Detecting certain columns and deleting these,0.03846153846153846
Plot value in range determined by MultiIndex,0.03846153846153846
Error 'str' object has no attribute 'values' pops up when using json_normalize,0.03846153846153846
Grouping by entries in a column in Pandas Dataframe,0.03846153846153846
Storing and accessing dataframe objects,0.03846153846153846
How to add new edges to the stellargraph dataset?,0.03846153846153846
Python Pandas get matching data from different dataframe,0.03846153846153846
How to filter values in data frame by grouped values in column,0.03846153846153846
pandas to_datetime throwing a value error for incorrect date format,0.03846153846153846
DataFrame is a string dtype and calculating diff with pandas,0.03846153846153846
Removing Rows that contain values in a list,0.03846153846153846
Web scraping with open API on multiple keywords,0.03846153846153846
How do I add row indices to a column using lambda functions in Pandas?,0.03846153846153846
Is there a way to select interior True values for portions of a DataFrame?,0.03846153846153846
Padding zeroes to columns with NaN values,0.03846153846153846
ValueError on inverse transform using OrdinalEncoder with dictionary,0.03846153846153846
Check values between two columns,0.03846153846153846
Different aggregation for dataframe with several columns,0.03846153846153846
Merging DataFrames with Different Columns,0.03846153846153846
"create new column based on weekly change, based on ID",0.03846153846153846
How to apply Geopy in a pandas column?,0.03846153846153846
Pandas Merging Multiple Columns at the Same Between Two Dataframes,0.03846153846153846
add row value if not exist group by date,0.03846153846153846
How to interpolate by copying values?,0.03846153846153846
"Pandas groupby, bin and average",0.03846153846153846
Finding the index of the max scores and using that index to find corresponding gross and calculate mean?,0.03846153846153846
Add count column to dataframe in 3 step intervals,0.03846153846153846
Using case when statements in Python,0.03846153846153846
Problems writing to file in pandas,0.03846153846153846
How to select number columns in pandas dataframe,0.03846153846153846
Get only the value of row with maximum count in Pandas,0.03846153846153846
Access segment of row with correct dtype,0.03846153846153846
pandas remove entire row if it contains negative values,0.03846153846153846
Pandas Transform into Dataframe,0.03846153846153846
Pandas: summing nanoseconds time delta to timestamp,0.03846153846153846
Additional functionalities of datetime subclass is lost when inserted into pandas dataframe,0.03846153846153846
Python: Process lines from csv file with pandas,0.03846153846153846
Creating a list of sentences from a file and adding it into a dataframe,0.03846153846153846
Convert DataFrame encoding from latin-1 to utf-8 python.read_csv(),0.03846153846153846
Process Large Data in Chunks,0.03846153846153846
Finding the smallest indices of a pandas datafrmae where column value equality holds,0.03846153846153846
Extract values from WaldTestResults pandas DataFrame,0.03846153846153846
Python Pandas Memory Loss,0.03846153846153846
PANDAS python referencing 2nd dataframe and group criteria to obtain value of new column,0.03846153846153846
fixing the toolbar i made with tkinter,0.03846153846153846
Scikit-Learn: Changing columns of trained model to predict with ColumnTransformer and GridSearchCV,0.03846153846153846
how to go to next webpage web scraping,0.03846153846153846
Pandas groupby quantiles with indices,0.03846153846153846
Restoring the default display context in Pandas,0.03846153846153846
pandas intraday 8Min resample bug?,0.03846153846153846
Pandas Dataframe from NumPy array - incorrect datatypes and can't change,0.03846153846153846
Fillna() depending on another column,0.03846153846153846
Plot many plots for each unique Value of one column,0.03846153846153846
How to replace &/or delete rows depending on values in pandas?,0.03846153846153846
How to add new columns to dataframe with value taken from another dataframe?,0.03846153846153846
Converting multiple unique strings to single string with Pandas?,0.03846153846153846
Replace relative path with absolute path in dataframe,0.03846153846153846
Maintaining Power Query connections for Excel workbook when it's run through Python,0.03846153846153846
Python - Printing Results from data.count to a dataframe,0.03846153846153846
Unnest strange dictionary in pandas,0.03846153846153846
Pandas: remove duplicates from a Dataframe where lots of numbers are duplicated,0.03846153846153846
How to use pandas to further process data in application/csv format,0.03846153846153846
How to reset index on pandas dataframe after unstack?,0.03846153846153846
Pandas shorten links,0.03846153846153846
"Extract topological features from dataframe an add them to a new, expanded dataframe",0.03846153846153846
"Pandas, TypeError: expected string or bytes-like object",0.03846153846153846
How to handle zero after decimal in pandas dataframe,0.03846153846153846
How to plot a single column of a dataframe with no 0s (histogram),0.03846153846153846
Pandas - Euclidean Distance Between Columns,0.03846153846153846
What is the difference between a pandas Series and a single-column DataFrame?,0.03846153846153846
How to remove time from the out of to_datetime?,0.03846153846153846
sort rows by quantiles in pd data frame and find indices of initial data frame in each quantile,0.03846153846153846
The tick label in scatterplot with Pandas is not drawn correctly,0.03846153846153846
Pandas timebased mean,0.03846153846153846
Plot against dummy variables and grouped values,0.03846153846153846
how to fix pandas column name to show only columnname instead of tablename.columnname,0.03846153846153846
How do I count the number of occurrences of a string in a Dataframe field?,0.03846153846153846
Python Pandas for Selecting Multiple Rows with one row having conditions,0.03846153846153846
Retrieve value associated with max date from list of tuples in a series,0.03846153846153846
how to multiple scatter plots from multiple dataframes by using for loop in python,0.03846153846153846
is there way to get numbers from list,0.03846153846153846
Data wrangling with Pandas - Counting occurrences,0.03846153846153846
How to use groupby to apply multiple functions to multiple columns in Pandas?,0.03846153846153846
"Panda's DataFrame dup each row, apply changes to the duplicate and combine back into a dataframe",0.03846153846153846
deleting rows from data frame based on a condition,0.03846153846153846
Inconsistent results from pandas.rolling.std(),0.03846153846153846
Python: How to error protect reading a csv/xlsx file with pandas,0.03846153846153846
How to efficiently combine two large Pandas dataframes by datetime,0.03846153846153846
Pandas: Generate new columns by old one,0.03846153846153846
pandas mergeing two dataframes without duplicate rows,0.03846153846153846
How to unstack two columns from groupby(),0.03846153846153846
Python: Copy identical .csv files from various folders (each folder has one .csv file) into a single folder,0.03846153846153846
Dataframe column interpolation weigthed by values of another column,0.03846153846153846
Python: How to plot time interval from a Dataframe in Pandas,0.03846153846153846
Ignore specified rows when using `count`/ `sum` with `groupby` but retain the index as a group,0.03846153846153846
How to replace a column in dataframe for the result of a function,0.03846153846153846
Filter one dataframe using multi-index of another dataframe,0.03846153846153846
Cleaning text using nltk,0.03846153846153846
add rows even if columns mismatch,0.03846153846153846
Condensing Multiple DataFrame Columns into a Single Indicator Column in Pandas,0.03846153846153846
python pandas yahoo stock data error,0.03846153846153846
pandas: how to merge 2 dataframes on 'X' from df1 and f['Y'] from df2,0.03846153846153846
Set each individual column to have its own datatype,0.03846153846153846
how to correctly fetch dataframe from url in python?,0.03846153846153846
How can I avoid loop in this incomplete vector solution,0.03846153846153846
How to display content of Pandas data frame in Tkinter GUI window,0.03846153846153846
Merging two string rows into one using Pandas,0.03846153846153846
Possible to directly feed SMILE structures stored in a pandas dataframe into RDKit to calculate molecular fingerprint and similarity?,0.03846153846153846
Add Datalabel on the end of barchart (lollypop),0.03846153846153846
Add a moving formula to excel using python,0.03846153846153846
Sklearn FitFailedWarning: Estimator fit failed. ValueError: kth(=-9) out of bounds (1),0.03846153846153846
Store table as response into DataFrame using Pandas python,0.03846153846153846
Filter pandas columns based on row condition,0.03846153846153846
Python: create new column from existing and add generated numbers,0.03846153846153846
Parsing nested JSON with list comprehension in Python,0.03846153846153846
df.column.any() < 1 giving True when not a single value is less than 1 python pandas,0.03846153846153846
Finding the maximum entry based on another column in a data frame,0.03846153846153846
How to count values in a panda dataframe with specific index dates,0.03846153846153846
"I'm still learning A.I and trying to create a Linear Regression algorithm model, but I keep getting KeyError when trying to pop a column",0.03846153846153846
Pandas get min / max value of last X rows based on condition,0.03846153846153846
Extract data using Pandas library from Python,0.03846153846153846
"Error in loop, only one value is added to Data Frame with results in Python?",0.03846153846153846
How to make a Continuous Line Plot with NaN Values?,0.03846153846153846
How to fill missing values based on column patterns using pandas?,0.03846153846153846
pandas: Get combination of columns where correlation is high,0.03846153846153846
Proper way to merge DataFrame columns in Pandas?,0.03846153846153846
keep only rows of one dataframe whose values for certain columns are also presented in another dataframe,0.03846153846153846
read_sql() from MySQL is extremely slow,0.03846153846153846
How do I create Dataframe in Pandas?,0.03846153846153846
"What will be the best approach, apply function or for loop in pandas dataframe for replacing null values?",0.03846153846153846
Is there a way to create sparkline based on the data on an existing excel sheet?,0.03846153846153846
how to display multiple informations in single dataframe?,0.03846153846153846
Assigning a value to the same dates fulfilling a condition in a more efficient way in a dataframe,0.03846153846153846
How to write pandas command more efficiently using for loop,0.03846153846153846
Convert data into a pandas DataFrame and remove some,0.03846153846153846
Break text files into multiple datasets at each \newline with Pandas,0.03846153846153846
Group Pandas dataframe by two columns and output the maximum column value indication to new column,0.03846153846153846
how to compare two column in two dataframes using a complex condition,0.03846153846153846
How do you select values from a SQL column in Python,0.03846153846153846
Leave rows in pandas dataframe based on a column in anotherr data frame,0.03846153846153846
Outer merge pandas dataframes with overwrite,0.03846153846153846
cumcount() None,0.03846153846153846
How to delete rows in a CSV file based on blank columns,0.03846153846153846
assign values on one column to the specific column on other column using a common key,0.03846153846153846
Pandas reading a string from an API and creating and appending to a dataframe,0.03846153846153846
"How can I solved KeyError: ""None of [Index(['lymphoid_neoplasm'], dtype='object')] are in the [index]""",0.03846153846153846
How to Group by and calculation of other column. pandas,0.03846153846153846
Extracting columns values based on values in a list,0.03846153846153846
drastically improve speed to subset and summarize pandas dataframe,0.03846153846153846
DataFrame with WKT Column to GeoPandas Geometry,0.03846153846153846
Replace int values in string with letters in a column using Python,0.03846153846153846
convert list of tuples into single column of pandas dataframe?,0.03846153846153846
Remove pandas dataframe row if one column's element is non-numeric,0.03846153846153846
How do I go line by line in my dataframe?,0.03846153846153846
Append dataframe to Excel table with formatting on same sheet,0.03846153846153846
Pandas: Combining two rows in the same dataframe,0.03846153846153846
Merge rows with same identifier columsn (PANDAS),0.03846153846153846
Display dataframe index name with Streamlit,0.03846153846153846
How to resample a pandas data indexed by datetime.time (not datetime objects)?,0.03846153846153846
Looping through a list and applying the same manipulation to them,0.03846153846153846
Using Pandas how to find the count of values that satisfies a condtn?,0.03846153846153846
Pandas - adding another column with the same name as another column,0.03846153846153846
Applying a function using index of row to all columns in dataframe,0.03846153846153846
Pandas merge different excel sheets into one along with a new column derived by sheet name,0.03846153846153846
Filter data by column using user input value in python,0.03846153846153846
extract certain columns from existing data frame using for loop in python,0.03846153846153846
Pandas create boolean column from subset index array,0.03846153846153846
How can I keep Date and Time columns when I use parse_dates in pandas?,0.03846153846153846
how to use pandas isin function in 2d numpy array?,0.03846153846153846
Pandas: Create new column that finds & selects value from another row based on conditions,0.03846153846153846
Python divide dataframe into chunks,0.03846153846153846
"Create dataframe, get columns from the list",0.03846153846153846
running pandas script on databricks/koalas returns null results in new column,0.03846153846153846
How to use `apply` in python without specifying the column name of the data frame?,0.03846153846153846
Conversion of a .fits file,0.03846153846153846
Create and set an element of a Pandas DataFrame to a list,0.03846153846153846
Modifying several pandas DataFrames,0.03846153846153846
Pandas counting first row as header when it should not,0.03846153846153846
From tuple's list to dataframes,0.03846153846153846
How to convert Python JSON to API call string from dataframe,0.03846153846153846
Using np.cumsum within a group in pandas dataframe,0.03846153846153846
Pandas correlation maxtrix between float columns and string columns,0.03846153846153846
How can I divide a column count total (sum) by a dollar amount using python and pandas?,0.03846153846153846
Can't connect to SQL docker container (SSL rissues),0.03846153846153846
Calculate a np.arange within a Panda dataframe from other columns,0.03846153846153846
Replacing in Pandas?Python,0.03846153846153846
python pandas data frame: assign function return tuple to two columns of a data frame,0.03846153846153846
Add column of WordNet synonyms to DataFrame,0.03846153846153846
"Check if a row in one DataFrame exist in another, BASED ON SPECIFIC COLUMNS ONLY",0.03846153846153846
Insert into phpmyadmin with python sql fails,0.03846153846153846
Dask: Running out of memory during filtering (MRE),0.03846153846153846
Ho to convert a column of object type to HexaDecimal,0.03846153846153846
Is there a more efficient way to Iterate unique pairs of indices and create measurement,0.03846153846153846
Where function ignoring Nan,0.03846153846153846
Python/Pandas: How do I select rows in one column where value iis equal to a different row in a different column?,0.03846153846153846
How to check if my data is one-hot encoded,0.03846153846153846
pandas time series and pickling,0.03846153846153846
create new column from a list of columns and get only the last columns condition in pandas,0.03846153846153846
value counts of a Database chunk by chunk using pandas,0.03846153846153846
pandas.interval_range end time is smaller than start time Python,0.03846153846153846
Pandas create ranking based on grouping criteria,0.03846153846153846
pandas fillna with selected multiple columns is slower than its over looping,0.03846153846153846
table extraction: adding column with file name and path of origin file to df,0.03846153846153846
"Append Two Dataframes Together (Pandas, Python3)",0.03846153846153846
merging 2 data frames in pandas with user defined values in one column,0.03846153846153846
How to create custom Pipeline in Python?,0.03846153846153846
Create a new Pandas dataframe from column of lists,0.03846153846153846
plotting an interactive graph for a pandas dataframe using plotly-dash is throwing callback error updating output,0.03846153846153846
LSTM neural network test to predict SPY prices giving me this error after training,0.03846153846153846
How to group pandas dataframe by custom overlapping periods?,0.03846153846153846
Get only one value from a panda condition search with loc(),0.03846153846153846
How do I parse value as datetime?,0.03846153846153846
Function to select pandas dataframe rows based on list of tuples of columns and cutoffs?,0.03846153846153846
How to apply python pandas formula to categorise individuals based on their haemoglobin samples,0.03846153846153846
Inserting data into a cell in pandas,0.03846153846153846
Plotting similar values on a shared index with Nans,0.03846153846153846
Python Rolling sum for 32 bit vs 64 bit,0.03846153846153846
Efficient way to replace a large number of entries in a dataframe,0.03846153846153846
pandas.DataFrame() AttributeError: 'Index' object has no attribute '_ndarray_values',0.03846153846153846
How to sum values under GroupBy and consecutive date conditions?,0.03846153846153846
Calculate Avg based on the specific conditions in another column pandas,0.03846153846153846
df.isin returning false when clearly true,0.03846153846153846
"Bin data by x and y columns, and output the mean of a third column",0.03846153846153846
Multi-index slicing of dataframe with list,0.03846153846153846
Python Pandas custom time format in Excel output,0.03846153846153846
How to get continue statement to go to outer-most loop?,0.03846153846153846
how to convert a two column/multiple group groupby() objetc to a dataframe?,0.03846153846153846
How to add empy datetime rows?,0.03846153846153846
Get name if range values are true Python,0.03846153846153846
Seeing or filtering using indexed columns in pandas?,0.03846153846153846
How to return ONLY top 5% of responses in a column PANDAS,0.03846153846153846
How do i concat dataframes without duplicates however keeping duplicates in the first dataframe,0.03846153846153846
"PyCharm's console hangs with ""big"" objects",0.03846153846153846
Recoding a category column in a DataFrame in Python,0.03846153846153846
Pandas DataFrame constructor not properly called in web scraping,0.03846153846153846
pandas-ta with multiindex dataframe,0.03846153846153846
"How to modify a value in one ""cell"" of a pandas data frame?",0.03846153846153846
Why are Pandas Documentation Pages being Flagged as Unsafe by Google Search?,0.03846153846153846
Selecting multiple excel files in different folders and comparing them with pandas,0.03846153846153846
pandas read from excel with multilevel columnnames and concat,0.03846153846153846
Rate of change over last n hours using pandas timeseries,0.03846153846153846
How to identify key from python dictionary that contains a substring value that corresponds with column of dataframe?,0.03846153846153846
Redefining index values in Pandas DataFrame,0.03846153846153846
Merging multiple CSV files based on specific column - Python,0.03846153846153846
Extending np.polyfit to 3 dimensions,0.03846153846153846
Convert 2019-11-06 00:00:00 to date-time object pandas,0.03846153846153846
how to generate a list within a list delimited by a space,0.03846153846153846
python - doing a left merge and getting wrong output,0.03846153846153846
Select rows from dataframe where column values are lists of strings,0.03846153846153846
ipython - pandasql.sqldf doesn't return an error,0.03846153846153846
how to pair rows of a data frame with respect of a group?,0.03846153846153846
Pandas Series/Dataframe: Format string numbers with commas as Thousands Separators,0.03846153846153846
python pandas : decimal point after integer?,0.03846153846153846
