Title,Correlation Score
Pandas Cumulative Sum of Difference Between Value Counts in Two Dataframe Columns,0.0464219875984582
Python/Pandas: drop columns *not* containing either of two strings in one step?,0.0464219875984582
Difference between to_numpy() vs .values,0.0464219875984582
Calculate the percentage difference between two specific rows in Python pandas,0.0464219875984582
Drop Rows with Non-Numeric Entries in a Column (Python),0.0464219875984582
Write a List of Dictionaries to the same row in Pandas Dataframe,0.0464219875984582
Drop rows where multi-index is some number,0.0464219875984582
Dropping highest and lowest values in a pandas dataframe row,0.0464219875984582
Efficiently dropping rows from a DataFrame if some row-values are identical with row-values in a second DataFrame,0.0464219875984582
Drop rows from dataset,0.0464219875984582
Dropping multiples rows based on list of column values,0.0464219875984582
How to calculate time difference by group using pandas?,0.0464219875984582
Scatter plot label overlaps - matplotlib,0.0464219875984582
"Save a ""pretty"" JSON Object to disc with json.dump in Python",0.0464219875984582
Drop columns in a pandas dataframe based on the % of null values,0.0464219875984582
Drop duplicates based on two columns with an OR condition,0.0464219875984582
How to use dropna to drop columns on a subset of columns in Pandas,0.0464219875984582
dropping rows in pandas dataframe based on column entries,0.0464219875984582
pandas dataframe drop rows by multiindex,0.0464219875984582
Drop rows at beginning of group with a specific value in pandas groupby,0.0464219875984582
Scraping a table based on the option value from a drop down,0.0464219875984582
drop rows from a pandas dataframe based on list of points in another dataframe,0.0464219875984582
Drop rows with no values after checking all columns in Pandas Python,0.0464219875984582
Split csv file only for first 4 delimiters then drop the rest for the line,0.0464219875984582
Python Pandas Library get drop column and combine duplicates,0.0464219875984582
Drop columns if number of NaNs equals the threshold parameter,0.0464219875984582
How to drop NA rows in a column?,0.0464219875984582
Python Dropping columns containing large percentage of missing values,0.0464219875984582
"How to get the index of duplicated values, while dropping NAs? Resulting index is smaller than original dataframe",0.0464219875984582
"Pandas - Opposite of drop duplicates, keep first",0.0464219875984582
Drop columns by name that appear in multiple pandas dataframes,0.0464219875984582
Drop Dates greater a given date (keyerror),0.0464219875984582
how to customize x-axis in matplotlib when plotting,0.0464219875984582
Pandas - Drop duplicates but change keep:first/last according to a value in a column,0.0464219875984582
How to drop duplicates in dataframe ignoring punctuations?,0.0464219875984582
How to drop rows with ALL zero values but not zeros WITH non zero values,0.0464219875984582
Drop rows in a subset of columns in mixed data type data frame,0.0464219875984582
pandas datetime format drop timezone,0.0464219875984582
Unexpected Behavior for pd.DataFrame.drop when using with Multilevel Index dataframe,0.0464219875984582
pandas dataframe use np.where and drop together,0.0464219875984582
Grouping pivot table dates by week in pandas,0.0464219875984582
dropping all the rows with @ sign in it,0.0464219875984582
How to merge three dataframes into one and drop the duplicates also?,0.0464219875984582
Drop duplicate columns,0.0464219875984582
How to drop the index column while writing the DataFrame in a .csv file in Pandas?,0.0464219875984582
drop the non exist row value from dataframe,0.0464219875984582
Finding and Dropping the Negative values,0.0464219875984582
how to drop rows in dataframe if it contains duplicate values,0.0464219875984582
Pandas pivoting/stacking/reshaping from string in rows,0.0464219875984582
Example: Drop a column name in pandas,0.0464219875984582
groupby calculating average with timestamp field,0.0464219875984582
Drop the smallest value from pandas Series,0.0464219875984582
Pandas drop leading zero values by group,0.0464219875984582
Dropping rows based on timeseries using .loc,0.0464219875984582
How to drop rows in pandas mat?hing on a columns and satisfying an equation on another column?,0.0464219875984582
Python dataframe drop rows which occur less frequently,0.0464219875984582
"Drop duplicates, but keep rows with highest value including ties",0.04642198759845819
Drop contradicting duplicates from a pandas dataframe,0.04642198759845819
How to drop duplicated rows in data frame based on certain criteria?,0.04642198759845819
drop column from dataframe if all values in this column are a specific value,0.04642198759845819
Drop rows in dataframe if the column matches particular string,0.04642198759845819
Dropping the Indexed Column,0.04642198759845819
python drop row if for particular strings only,0.04642198759845819
How to drop a row using idmax in pandas,0.04642198759845819
Python Pandas: How to drop rows by time?,0.04642198759845819
Pandas Resample not working - also drop-duplicates not working,0.04642198759845819
how to drop decimal digits in pandas,0.04642198759845819
Dropping rows with specific string value Pandas,0.04642198759845819
How to iterate over DataFrame columns and drop NaN value,0.04642198759845819
Dropping columns with high missing values,0.04642198759845819
Automate the process of dropping similar looking columns and then transposing the data in python,0.04642198759845819
Drop duplicates and complete nan with oldest values and optimise runing time,0.04642198759845819
How to drop DataFrame columns based on dtype,0.04642198759845819
Python Pandas DataFrames: Dropping entire rows if one entry is unwanted,0.04642198759845819
Dropping specific cells (nulls/NaN) instead of rows or columns in a DataFrame,0.04642198759845819
drop row if one column is greater than another,0.04642198759845819
Drop rows in pandas if records in two columns do not appear together at least twice in the dataset,0.04642198759845819
How to drop string values from pandas dataframe column?,0.04642198759845819
Drop row if lambda returns None Pandas,0.04642198759845819
"Select columns of Pandas dataframe if name is in list, or create default and drop the rest",0.04642198759845819
How to drop duplicates from one data frame if found in another dataframe,0.04642198759845819
Dropping the columns that contain NaN,0.04642198759845819
Drop row keep similiar value column data,0.04642198759845819
python - drop duplicated index in place in a pandas dataframe,0.04642198759845819
How to drop float values from a column - pandas,0.04642198759845819
Compare and drop consecutive rows in a dataframe Python,0.04642198759845819
Dask: why has CPU usage suddenly dropped?,0.04642198759845819
Merging two dataFrames and drop one afterwards,0.04642198759845819
pyarrow write_to_dataset with partition_cols drops pandas index info,0.04642198759845819
Error while trying to drop a row from pandas DataFrame index?,0.04642198759845819
python dataframe drop().index confusion,0.04642198759845819
Drop columns with low standard deviation in Pandas Dataframe,0.04642198759845819
Pandas resample without dropping nan values,0.04642198759845819
Function drops invalid values in dataframes but then it returns original dataframes with invalid values,0.04642198759845819
How to prevent Python from disabling drop-down list in an existing excel workbook?,0.04424333836098544
Drop rows randomly from a dataframe such that no rows exist with a count over N,0.04424333836098544
Sum DataFrame Columns without Dropping Columns,0.04424333836098544
Mutli-category one-hot encoding to pivot-table,0.04424333836098543
"Concatenate Two pandas Dataframes (A & B) in an Alternating Pattern of Columns (A,-B-A, A-B-A)",0.04424333836098543
How to concatenate values of all rows in a dataframe into a single row without altering the columns?,0.04424333836098543
Not able to concatenate two dataframes,0.04424333836098543
Concatenate two data frames to a data frame of square matrix,0.04424333836098543
Transform Pandas series to monotonically increreasing with forward fill,0.03846153846153846
How to generate one hot encoded data for a set of columns with similar categories,0.03846153846153846
Reversing a MultiLabelBinarizer to create a list within a column,0.03846153846153846
Python DataFrame : Get count from a dataframe column based on condition?,0.03846153846153846
Pandas - count of all unique column combinations including rows with NONE,0.03846153846153846
how to solve 'list' object has no attribute 'apply',0.03846153846153846
how can I convert a big pandas dataframe to a streaming data frame?,0.03846153846153846
How to map a function to an array of dataframes in parallel in python?,0.03846153846153846
"How to merge on multiple columns and then if there is not a match, merge on different columns in pandas?",0.03846153846153846
How to web scrape a table by using Python?,0.03846153846153846
replacing all the column values (delimited by comma) with a function ouput in Pandas,0.03846153846153846
pandas rolling sum return time series,0.03846153846153846
Boolean indexing between two different Dataframes in Pandas,0.03846153846153846
How do I split a df column with multiple delimiters into different columns?,0.03846153846153846
How do I change column values in pandas if it contains a part of string which I want to replace?,0.03846153846153846
How to avoid pandas class overriding?,0.03846153846153846
how do I get mixed JSON and TSV data into a data frame?,0.03846153846153846
return different values from different columns according to conditions pandas,0.03846153846153846
Is there any possibility to convert string timestamp to float or datetime using java,0.03846153846153846
"From a pandas column of lists, how to remove all values not in another column of list?",0.03846153846153846
How to create a dynamic solver (optimization function) in Python,0.03846153846153846
Can I create a dataframe from few 1d arrays as columns?,0.03846153846153846
pandas convert delta time column into one sole unit time,0.03846153846153846
add group index value to groups,0.03846153846153846
Most efficient way to find shared members of a list inside a dataframe?,0.03846153846153846
pd.to_datetime producing inconsistent results for columns in df,0.03846153846153846
Error: astype() got an unexpected keyword argument 'categories',0.03846153846153846
JSON packing of DataFrame with each unique ID in the column,0.03846153846153846
how to convert string representaion of 2 dimensional array into numpy array in pandas series object?,0.03846153846153846
resampling collection of time series with numbers and strings,0.03846153846153846
Python pandas to_sql populates all rows with NA,0.03846153846153846
Merging one column in pandas - only keep one row with all values instead of new row for each matc,0.03846153846153846
How can i print Values from the first column from a CSV file and fix this error?,0.03846153846153846
Normalize within groups in Pandas,0.03846153846153846
Efficient calculation across dictionary consisting of thousands of correlation matrizes,0.03846153846153846
Pandas: Reading files with regex,0.03846153846153846
comparing values of 2 columns from same pandas dataframe & returning value of 3rd column based on comparison,0.03846153846153846
FileNotFoundError in SQL Server Python ML Services,0.03846153846153846
Converting several 2D DataFrames into one 3D DataFrame,0.03846153846153846
Group by column values based on another column condition along with sum and count,0.03846153846153846
python3: Split time series by diurnal periods,0.03846153846153846
Pandas groupby and pivot,0.03846153846153846
Show the Min & Max values for each column of X when X created with make_blobs,0.03846153846153846
Python Pandas replacing part of a string,0.03846153846153846
How to keep track of columns that have been changed in a pandas dataframe,0.03846153846153846
How to export data from multiple data frames and store it in a text file with specific format,0.03846153846153846
Convert csv column of strings to datetime,0.03846153846153846
Python: How to label this dataset,0.03846153846153846
Get the distance to each nearest element in a 1D/2D without for loop,0.03846153846153846
JupyterLab kernel dies when plotting 100k markers in folium,0.03846153846153846
Create a feature in pandas based on another column,0.03846153846153846
Iterate over a groupby dataframe to operate in each row,0.03846153846153846
How do I sum the bottom X rows of a column in a Pandas dataframe?,0.03846153846153846
How to reshape a DataFrame,0.03846153846153846
Pandas - apply & lambda with a condition and input from a function,0.03846153846153846
Convert Sharepoint List into Pandas Dataframe,0.03846153846153846
unable to filter on a specific string pattern and unable to change the index in pandas,0.03846153846153846
Python web scraper using selenium,0.03846153846153846
Difficulty making 2 subplots in a figure,0.03846153846153846
to concat csv files having different dimensions,0.03846153846153846
Pandas get_dummies include columns for missing categories?,0.03846153846153846
Scrape data from link inside a link: Python Beautiful Soup,0.03846153846153846
python 3.8 how to convert txt to csv with seperator of 2 or more spaces,0.03846153846153846
Matching Buy Sell entries from two dataframes and creating a new one. Python 3.8 / W10,0.03846153846153846
Fuzzy match within the same column - Python,0.03846153846153846
Pandas -change id to string using map and lambda,0.03846153846153846
Pandas fixing Date Index from 2061 to 1961,0.03846153846153846
Iteratively naming Pandas columns,0.03846153846153846
How to get rid of small space between numbers in list?,0.03846153846153846
How to add row name to cell in pandas dataframe?,0.03846153846153846
Filter df to a simple spreadsheet,0.03846153846153846
Round scientific value of a dataframe,0.03846153846153846
Python Pandas how to compare date from one Dataframe with dates in another Dataframe?,0.03846153846153846
Pandas Copy Values from Rows to other files without disturbing the existing data,0.03846153846153846
Check uniqueness for a specific value in each column,0.03846153846153846
What are error's regarding Beautiful Soup?,0.03846153846153846
How to fill data in a dataframe based on first column,0.03846153846153846
Replace with NaN by length of strings,0.03846153846153846
Plot columns of data-frame based on conditions of other columns in Python,0.03846153846153846
How can I export dataframes to each Excel sheet?,0.03846153846153846
Can I make dataframes by for loop?,0.03846153846153846
Filtering only some rows in a column?,0.03846153846153846
json.decoder.JSONDecodeError: Expecting value: line 1 column 1 (char 0) error occurs sometimes using googletrans and Pandas in Python,0.03846153846153846
"Data Frame: row content partial text match in a list , create new column",0.03846153846153846
Using Pandas Rank on strings in DataFrameGroupBy,0.03846153846153846
Getting index from a Pandas dataframe using a string from another dataframe,0.03846153846153846
Render pandas table in R markdown,0.03846153846153846
How to group every other unique value in pandas dataframe outside top 5 values (by size) into an 'Other' category for plotting and tabling?,0.03846153846153846
Having NaN as result instead of Error when trying to divide by 0,0.03846153846153846
How can I convert multiple time-series columns into a cross-sectional data?,0.03846153846153846
Files uploaded to s3 are missing content,0.03846153846153846
How to do pd.fillna() with condition,0.03846153846153846
How to create a cumulative sum column in python if column value is greater than other value,0.03846153846153846
Matplotlib Heat-Map Y Axis,0.03846153846153846
How to draw graphs Pandas,0.03846153846153846
Replacing NaN with null python pandas,0.03846153846153846
how i can perform group by based on range value of two columns?,0.03846153846153846
Error : UndefinedVariableError: name 'injured_persons' is not defined,0.03846153846153846
Python : Appending series to dataframe does not place the data in the correct columns,0.03846153846153846
Deleting Rows in a .csv File (Python),0.03846153846153846
How can I create a new dataframe column by creating a list from the existing one?,0.03846153846153846
How to check for null elements in a list in a dataframe in np.where()?,0.03846153846153846
How to convert the result of evalmetrics C3.ai COVID-19 API to pandas dataframe for easier analysis?,0.03846153846153846
keyerror when referencing dataframe index with date,0.03846153846153846
df.plot fails after pandas upgrade to v 1.0.1,0.03846153846153846
"Find consecutive dates in a dataframe, grouped by another column value",0.03846153846153846
Finding unique rows in a specific column,0.03846153846153846
How to find correlation between two categorical variable num_chicken_pox and how many time vaccine given,0.03846153846153846
Replace null values based on other rows,0.03846153846153846
pandas merge with conditionnal aggregation,0.03846153846153846
Pandas masking a specific column by date,0.03846153846153846
Add value in Pandas Dataframe from Numpy Array,0.03846153846153846
Pandas - Compare 2 dataframes and find nearest values,0.03846153846153846
Creating a multiindex pd.DataFrame using hypothesis library,0.03846153846153846
Insert CSV through Pandas to SQLITE: How to avoid the Memory Error?,0.03846153846153846
Modifying/transforming dataframe in python,0.03846153846153846
Count occurrences of feature pairs for a given set of mappings,0.03846153846153846
Multiply many columns by one column in dask,0.03846153846153846
Handling a large amount of large data files in pandas,0.03846153846153846
R sequence function in Python,0.03846153846153846
Python Feature Engineering Patients Data,0.03846153846153846
How can I match the values of one dataframe(more than column) with values of another dataframe(more than one column)?,0.03846153846153846
Possible to shift rows in for loops? (Pandas),0.03846153846153846
Populate same value to several rows in Pandas Dataframe,0.03846153846153846
Filters in Pandas - why doesn't this work?,0.03846153846153846
how to change the column value based on other column value in data frame?,0.03846153846153846
Pandas: Clean way to calculate running error based on boolean column of a dataframe?,0.03846153846153846
stacked barplot with total and edited axis limit - python,0.03846153846153846
Extracting data from an existing plot in pandas,0.03846153846153846
How to compare daily active data to cumulative data?,0.03846153846153846
How to apply a formula on column in pandas,0.03846153846153846
Check presence of multiple keywords and create another column using python,0.03846153846153846
How to access a row in pandas?,0.03846153846153846
Pandas time Zone Conversion,0.03846153846153846
How to multiply a pandas DataFrame Column by a single value?,0.03846153846153846
R: is there an R equivalent for df.info() of pandas (Python)?,0.03846153846153846
"My python program freezes in the middle without any exceptions or errors , the same screen remains for hours without changing",0.03846153846153846
Convert spark dataframe column,0.03846153846153846
how to arrange output dfs on a single worksheet,0.03846153846153846
How can I get the max value from groupby object with multiple values?,0.03846153846153846
Index boolean values to Pandas column,0.03846153846153846
Pandas Find Best Match & Show Result in Table,0.03846153846153846
Apply row logic on date while extracting only multiple columns of a dataframe,0.03846153846153846
How to convert PDF document to JSON Using Python script,0.03846153846153846
merge parquet files with different schema using pandas and dask,0.03846153846153846
Geopandas Overlay (Intersection) Returns Zero Rows,0.03846153846153846
Pandas melt function using column index positions rather than colum names,0.03846153846153846
Pandas: MID & FIND Function,0.03846153846153846
"How do I ""merge/add"" 2 confusion matrix dataframes that have the same columns and rows using Python Pandas?",0.03846153846153846
One to Many comparison in pandas two excel column comparison?,0.03846153846153846
How will i get the co-ordinate value from the below JSON using python json into a pandas dataframe?,0.03846153846153846
pandas: how can I get the data of the line that I want?,0.03846153846153846
Deleting multiple columns of dataframe,0.03846153846153846
".loc slicing KeyError(f""None of [{key}] are in the [{axis_name}]"")",0.03846153846153846
Fetching data from postgresql takes a ton of memory even when chunk loading,0.03846153846153846
Creating a column based on matches from a list,0.03846153846153846
"Input 0 of layer dense_18 is incompatible with the layer: expected axis -1 of input shape to have value 3500 but received input with shape [None, 7]",0.03846153846153846
How to merge two data frames based on one column in one data frame and two column in second dataframe,0.03846153846153846
How to compare two data in python,0.03846153846153846
"ParserError(""String does not contain a date: %s"", timestr) error",0.03846153846153846
Pandas: converting yyyy-mm-dd to dd Mon yyyy,0.03846153846153846
"My bokeh could runs fine, but outputs a blank chart. What am I doing wrong?",0.03846153846153846
Regex Sub and Pandas,0.03846153846153846
Extract row data from dictionary if dataframes based on filter on a column value,0.03846153846153846
How to apply groupby in pandas to work out customer-specific queries over time,0.03846153846153846
how to save sum of str.contains() in a pandas column?,0.03846153846153846
How to add labels and title to matplotlib.pyplot.matshow plot,0.03846153846153846
How to replace white space in column? Pandas,0.03846153846153846
Deleting values from a variable,0.03846153846153846
What is the best way to add a new column to an existing pandas df based on external function?,0.03846153846153846
How to calculate the sum indicating the presence of particular value in each column and take total count for each id?,0.03846153846153846
mapping values from one dataframe to another dataframe,0.03846153846153846
How to add functions with groupby in pandas?,0.03846153846153846
Reversing the first two columns of a DataFrame and appending results,0.03846153846153846
Issue when I groupby & fill na with the min date value by the grouped element,0.03846153846153846
How can I get the sum of values in a pandas column that meet certain conditions?,0.03846153846153846
Pandas: create column in multi-indexed dataframe from the relative indexes of elements within their group,0.03846153846153846
Vectorize two pandas columns at once with CountVectorizer,0.03846153846153846
how to do a rolling regression in pandas,0.03846153846153846
Pandas Merging multiple DataFrames generating huge data,0.03846153846153846
Make a column in test dataframe with the output of a regression model from the train set?,0.03846153846153846
Loading Text Data from a CSV and Applying a Tokenizer in Keras,0.03846153846153846
Removing nan from pandas dataframe and reshaping dataframe,0.03846153846153846
Unable to remove certain symbols from a string?,0.03846153846153846
Filtering for a column for all rows that have a specific string in it,0.03846153846153846
pandas read_html not finding soup table,0.03846153846153846
ndarray throws Data must be 1-dimensional,0.03846153846153846
Filtering a pandas dataframe comparing two columns,0.03846153846153846
create new dataframe out of selected row from multi dataframe pandas,0.03846153846153846
creating coumn for each output receive in one field in python,0.03846153846153846
Extract unique minimum distance pairs using each element only once,0.03846153846153846
Merge based on latest Date in pandas,0.03846153846153846
Pandas Dataframe Question: Groupby show largest value,0.03846153846153846
pandas groupby resample leads to missing data,0.03846153846153846
Applying lambda to whole dataframe with if condition,0.03846153846153846
merging tables and combining columns together in python,0.03846153846153846
Using Foursquare API with python,0.03846153846153846
Weird error with unique() for pandas dataframe,0.03846153846153846
Summarize ids of student project,0.03846153846153846
"How to add new Dataframe Column with Dictionary Key, if the Value is found in a column text string",0.03846153846153846
Pandas to_datetime parsing for oddly formatted date,0.03846153846153846
How to set specific column when saving to sql?,0.03846153846153846
How to find and replace values of an interval in a list?,0.03846153846153846
Pandas apply().to_excel() got DataFrame is not callable,0.03846153846153846
Zero-Variance Removal,0.03846153846153846
"Merge and ""unfold"" referencing row values in pandas",0.03846153846153846
Pandas pd.read_excel throwing error no matter the filename/path,0.03846153846153846
convert pandas datetime64[ns] to julian day,0.03846153846153846
How to open a .scd2 type file,0.03846153846153846
copy dataframe lines and replace on the same dataframe,0.03846153846153846
new column in Pandas python based on condition,0.03846153846153846
How can I extract the rate of my pandas timeseries data?,0.03846153846153846
Compare two data frames by each column in python?,0.03846153846153846
Reducing loop time of a for loop python pandas,0.03846153846153846
Pandas Python highest 2 rows of every 3 and tabling the results,0.03846153846153846
Data frame regex,0.03846153846153846
How to check if an element of one list is another when they are in pandas columns,0.03846153846153846
how to merge multiple row into single one considering the label,0.03846153846153846
