Title,Correlation Score
Cartesian list of files from separate folders,0.05077928607340373
split a workbook into different workbooks with worksheets using python pandas,0.05077928607340373
"Panda module export, split data",0.05077928607340373
Split dataframe columns and rename columns received Type Error,0.05077928607340373
Separate column values by backslash pandas,0.05077928607340373
Is it possible to split a varialbe period pandas timeseries data object without itteration?,0.05077928607340373
Matching split string to pandas columns,0.05077928607340373
Pandas slicing along multiindex and separate indices,0.05077928607340373
Pandas: Split a dataframe rows and re-arrange column values,0.05077928607340373
Marking duplicates in a separate column using pandas,0.05077928607340373
Pandas groupby on comma separated values,0.05077928607340373
How to split a row into two or more based on a string in a column in pandas python?,0.05077928607340373
How to split a 74 rows and 3234 columns dataframe on columns in python based on condition,0.05077928607340373
How to split a column using a delimiter while still retaining its value,0.05077928607340373
Computing separate tfidf scores for two different columns using sklearn,0.05077928607340373
Pandas Dataframe split multiple key values to different columns,0.05077928607340373
Reading csv file using pandas where columns are separated by varying amounts of whitespace and commas,0.05077928607340373
Split pandas dataframe into multiple dataframes with equal numbers of rows,0.05077928607340373
Select corresponding column value for max value of separate column(from a specific range of column) of pandas data frame,0.05077928607340373
Split train and test set according to categorical columns,0.05077928607340373
Split column based on last digit found,0.05077928607340373
Python - How to split column values using multiple separators,0.05077928607340373
"How can I split a text from a parenthesis in a CSV, and create another column with it",0.05077928607340373
"Read text file in Python, separated by ',' and with ';' as line terminator",0.05077928607340373
Python Dataframe: Split a value in a row to multiple rows?,0.05077928607340373
How to split one column into multiple columns with pipes acting as a separator,0.05077928607340373
Take out keys and values from json to separate rows in pandas,0.05077928607340373
Train and test split not seperate,0.05077928607340373
Split columns into MultiIndex with missing columns in pandas,0.05077928607340373
Split and replace all strings in a pandas dataframe,0.05077928607340373
Regular expression to replace string separated by comma with thier sum in pandas dataframe,0.05077928607340373
Split the data into every 10 instances and concat with new dataframe,0.05077928607340373
I have a data frame with one column and I'd like to split it into two columns,0.05077928607340373
split numbers and string to differents columns on pandas,0.05077928607340373
Split a column and stack it based on other multiple columns,0.05077928607340373
Trying to find the nearest date before and after a specified date from a list of dates in a comma separated string within a pandas Dataframe,0.05077928607340373
Python3 Pandas how to split rows in csv file,0.05077928607340373
Split dataframe by two repeated values,0.05077928607340373
Split column into two new columns in Pandas,0.05077928607340373
"Create a new column in a dataframe, based on Groupby and values in a separate column",0.05077928607340373
How to separate columns values to create a new different column,0.05077928607340373
Split dataframes in groups and sub-groups and store the output in a CSV file,0.05077928607340373
if error then do something else - string split,0.05077928607340373
Pandas convert groupby parameter to separate rows,0.05077928607340373
Spliting using pandas with comma followed by space or just a space,0.05077928607340373
Split column into multindex columns based on unique values,0.05077928607340373
"How to split a column, which contains a list, into different entries in Dataframe?",0.05077928607340373
Split DataFrame rows by DateTime in pandas,0.05077928607340373
How to split long strings in pandas columns by punctuation,0.05077928607340373
Split Column into Unknown Number of Columns by Delimiter in Pandas Dataframe,0.05077928607340373
pandas filter dataframe based on chained splits,0.05077928607340373
How to split rows in dataframe based on specific names in python?,0.05077928607340373
Split data into train/ test files such that at least one sample is picked for both the files,0.05077928607340373
Python Split multiple values in a cell into multiple rows,0.05077928607340373
Merging data from a separate .csv file using Pandas,0.05077928607340373
Pandas split a row into 4 distinct rows while splitting a column string in 4,0.05077928607340373
How do I split last 3 digits in values in a column in a Dataframe into two new Dataframes?,0.05077928607340373
Convert Comma Separated String in Nested JSON to List Python,0.05077928607340373
separate datafiles negative sign and white-space delimiter,0.05077928607340373
How to split a column into three columns?,0.05077928607340373
Split Pandas Dataframe Column According To a Value,0.05077928607340373
Pandas merge rows where a certain column data is split over multiple rows,0.05077928607340373
Split a dataframe where every row is a list into columns,0.05077928607340373
How to strip and split in pandas,0.05077928607340373
Pandas Split Column String and Plot unique values,0.05077928607340373
How to split a multiindex df in 80/20 parts based on date?,0.05077928607340373
creating new dataframe with Max Value of one column using a subset of a separate column as condition,0.05077928607340373
Split a dataframe column's list into two dataframe columns,0.05077928607340373
How can I split a txt file with encoding as delimiter in python or R?,0.05077928607340373
merging files from separate folders,0.05077928607340373
pandas dataframe split values in one row by weights,0.05077928607340373
How do you split an array column and group it with the equivalent rows in Pandas?,0.05077928607340373
split rows in pandas dataframe based on spaces in cell entries,0.05077928607340373
"How to split key, value from text file using pandas?",0.05077928607340373
How can I transform a code that split '|' into a function,0.05077928607340373
Pandas: Write dataframe to json with split,0.05077928607340373
How to automate in SQL query split using Python,0.05077928607340373
Pandas: Sort and Split a Column by Multiple Delimiters,0.05077928607340373
Split dataframe into chunks and multiprocess/thread merge,0.05077928607340373
Removing duplicate entries from a comma separated string column in pandas,0.05077928607340373
"split dataframe in train, test, validate with %rate",0.05077928607340373
How can I split a column into 2 in the correct way?,0.05077928607340373
"can't print split data result, keep printing original data result in python",0.05077928607340373
Convert all rows of a Pandas dataframe column to comma-separated values with each value in single quote,0.05077928607340373
"how to partition/split range between two dates into week number (w1 , w2 , w3, w4, ...) in python",0.05077928607340373
Split a string column and put the splits in different columns,0.05077928607340373
Split a numeric string to a list of integers,0.05077928607340373
How to split train and test dataset to X_Train y_train and X_Test y_Test?,0.05077928607340373
Pandas Split rows based on different delimiters,0.05077928607340373
Split a DataFrame by rows containing zero in python pandas,0.05077928607340373
Pandas split one column according to a special requirement,0.05077928607340373
Split column and only keep one part in Pandas,0.05077928607340373
How to split column values when list index goes out of range in Jupyter notebook?,0.05077928607340373
Fix duplicate rows when spliting csv using pandas,0.05077928607340373
How to get result of str.split inplace for renaming columns?,0.05077928607340373
How to split a columns into 2 correctly with pandas in Python 2.7?,0.05077928607340373
Types of Train test split,0.05077928607340373
PANDAS: Split list into rows,0.05077928607340373
Split first name and last name if there is common matching in another column,0.05077928607340373
How to split the content of two columns to many other columns with converting the text to Zeros and Ones in dataframe,0.05077928607340373
Pandas GroupBy: comma separated list of sums,0.05077928607340373
split string no delimiter with limitative field names and content,0.05077928607340373
how to split a single column data into muliple columns in pandas?,0.05077928607340373
Pandas groupby individual elements from a larger split string,0.05077928607340373
Why does this not split the genres properly? (Python),0.05077928607340373
split rows where one column's value changed the sign but crossed zero - python pandas,0.05077928607340373
Multiple splits in pandas string,0.05077928607340373
Split string using delimiter ????in python windows,0.05077928607340373
How can I split the values from one column into two using (preferably) a regex pattern?,0.05077928607340373
Split categorical column to multiple columns in Python?,0.05077928607340373
Split dataframe column into different columns based on condition,0.05077928607340373
Find if a pattern matches then outputting split data from another column - $|$ separator failure,0.05077928607340373
How to generate a dataframe from lists of separate variables,0.05077928607340373
I keep getting a value error in the train test split function despite trying to adjust the params,0.05077928607340373
Extracting JSON like data from pandas data frame to separate columns,0.05077928607340373
Split text in Pandas columns into different columns based on condition,0.05077928607340373
How to split column into 3 column in large text file using python?,0.05077928607340373
How do I split each record in a column to new columns using the the key as column namesin Panda,0.05077928607340373
How to make 18 separate scatterplots for 18 different columns from the same pandas Dataframe?,0.05077928607340373
Drop nan rows unless string value in separate column - Pandas,0.05077928607340373
Split Random Data Training And Data Testing in Pandas CSV,0.05077928607340373
How do I split a dataframe by a list of numbers of rows for each chunk?,0.05077928607340373
Split strings in DataFrame and keep only certain parts,0.05077928607340373
I would like to split text in a column for a pandas dataframe based on multiple Delimiters and create new rows for each,0.05077928607340373
Separate pandas dataframe using sklearn's KFold,0.05077928607340373
Pandas str.split() function is not working properly,0.05077928607340373
Multi-label imbalanced train test split,0.05077928607340373
Pandas : Split a column into n columns based on repeating index,0.05077928607340373
How do I split a dataframe by a repeating index and enumerate?,0.05077928607340373
Split dataframe column containing iterable,0.05077928607340373
"Pandas: Split large file into seperate files by Date, preserving original ordering.",0.05077928607340373
How to loop through Pandas DataFrame and split a string into multiple rows,0.05077928607340373
Creating lists from a text file by splitting it vertically,0.05077928607340373
How to split multiple columns based on the value of another column,0.05077928607340373
Separate content the single column into multiple column?,0.05077928607340373
Pandas Dataframe How to Split Column that contain different amount of elements by comma into rows,0.05077928607340373
Split single row into multiple row based on no of sets in python,0.05077928607340373
Pandas DataFrame plot - separate graphics with dot notation,0.05077928607340373
Split one dataframe in 4,0.05077928607340373
how to use pandas groupby with None and NaN treated as separate values,0.05077928607340373
Split one column into multiple columns by multiple delimiters in Pandas,0.05077928607340373
pandas dataframe split value into 3 and two-two combine,0.05077928607340373
How to merge similar rows and split column into rows by values?,0.05077928607340373
Spliting cells from 2 columns to rows,0.05077928607340373
spliting a column in a pd.dataframe python,0.05077928607340373
How to split one dataframe column into many columns,0.05077928607340373
Split Data from each cell of one selected column from Dataframe Python,0.05077928607340373
Create a function that finds dates and split them into pandas dataframe columns,0.05077928607340373
Split a pandas dataframe every 5 rows,0.05077928607340373
Split with underscores within list in column pandas,0.05077928607340373
dataframe.loc with split string,0.05077928607340373
"Split text columns into two columns in Pandas DataFrame, for different dataframes",0.05077928607340373
How to split parallel corpora while keeping alignment?,0.05077928607340373
How to store values of selected columns in separate rows?,0.05077928607340373
Pandas split data frames into multiple csv's based on value from column,0.05077928607340373
how to apply .strip().split() function to an entire column in a Pandas dataframe,0.05077928607340373
How to separate text into two different columns (pandas),0.05077928607340373
How can I split this dataframe by blank spaces?,0.05077928607340373
How to separate files using dask groupby on a column,0.05077928607340373
pandas split one column into multiple KeyError,0.05077928607340373
Pandas: split row into multiple rows based on value in column,0.05077928607340373
How to split a dataframe into two dataframes,0.05077928607340373
How to split an integer in n parts (each integer)?,0.05077928607340373
Pandas dataframe split by memory usage,0.05077928607340373
Python: Is there a way to randomly split data from pandas dataframe into train and validation set,0.05077928607340373
Pandas split DataFrame by Column Function with Grouping,0.05077928607340373
Regular Expression Behavior in R unnest_token() v.s Python pandas str.split(),0.05077928607340373
Split dataframe into many sub-dataframes based on timestamp,0.05077928607340373
How could I plot the relative frequency of data split into categories?,0.05077928607340373
Split and concat values in Python,0.05077928607340373
How to split a list in a column into two column in a dataframe using python?,0.05077928607340373
Bokeh Hovertool Data from Separate Columns,0.05077928607340373
split list values into columns :python,0.05077928607340373
Data Cleaning How to split Pandas column,0.05077928607340373
Selecting multiple columns in a pandas dataframe with separate but sequential columns,0.05077928607340373
How to split df column into many rows and counts (long df) Python / pandas,0.05077928607340373
Pandas split/extract string within brackets with exception,0.05077928607340373
Split pandas dataframe rows into multiple rows,0.05077928607340373
Using str.split(expand=True) on DataFrame for massive data sets,0.05077928607340373
How to separate price(number) from a web scraped mixed string,0.05077928607340373
python separate text into different column with comma,0.05077928607340373
"How to find best-fit line between two columns in Pandas Dataframe, but split up by each individual group (Python)?",0.05077928607340373
Pandas str.split() is not working properly with regex,0.05077928607340373
Replace comma-separated values in a dataframe with values from another dataframe,0.05077928607340373
Pandas: Split a specific column values to new columns and find occurrences of a value in all newly created columns,0.05077928607340373
Split data and plot them with solid and dashed lines with Python,0.05077928607340373
group-by values obtained from splitting indexes,0.05077928607340373
Drop values after train test split,0.04980276134122288
Pandas conditional split,0.04980276134122288
How can I split out this list containing a dictionary into separate columns?,0.04980276134122288
How to Concatenate/Merge Columns from Separate Dataframes with Same Column Names/Location Creating New Frames for Each Column Conatination/Merge,0.04980276134122288
Issue Pivoting Dataframe,0.04980276134122288
Separate data frames for each dictionary keys() dynamically,0.04980276134122288
Python --- Split DataFrame column names into multiple columns names based on dictionary having values in a list,0.04980276134122288
python pandas split datafram column into two new column and drop the original column,0.04980276134122288
How to split by a delimiter and then concatenate to form a new string based on a substring in Pandas?,0.04980276134122288
"How to split a df into smaller df's based on the unique values in one column, then pivot each df over another column",0.04980276134122288
DataFrame. Split Column to antoher Columns with average by date,0.04980276134122288
Averaging and plotting values across separate dataframes,0.04980276134122288
Conditional formatting Multiple Columns in Pandas Data Frame and saving as HTML for emailing,0.04980276134122288
Split Columns with ' ' and Drop One of the New Columns,0.04980276134122288
Conditional count column in Pandas where separate strings match in multiple columns,0.04980276134122288
Pandas: extract values from a column with multiple list of dictionaries and split the values into multiple columns,0.04980276134122288
High difference in predictions on different train test split sizes,0.04980276134122287
Python Dataframe Drop Bad lists Using Numpy logical operations,0.04886308659893565
pandas: reshape column and row information into separate columns,0.04860063683593097
How split a pandas dataframe in muliple excel files,0.04860063683593097
Parsing xml - join split xml files into 1 pandas dataframe by file name in same directory,0.04860063683593097
Split Pandas Dataframe into bands,0.04860063683593097
Is there a way to efficiently split data into columns based on key in pandas,0.04860063683593097
json_normalize to split multiple json object: python,0.04860063683593097
How to split a dataframe row into two rows in Pandas?,0.04860063683593097
How to split a column into 4 columns based on spaces in python?,0.04860063683593097
Split list os strings and integers in single elements or rows ith the same ID,0.04860063683593097
Replicate rows in pandas based on criteria and split string in one column between the existing and new row,0.04860063683593097
How to split the column into two under same column name and having same values in Python?,0.04860063683593097
how do i split multiple rows in different column in pandas,0.04860063683593097
python split the column values of a dataframe,0.04860063683593097
Split the line using delimiter and a string in one line for a bunch of rows using pandas,0.04860063683593097
How to split a pandas string to extract middle names?,0.04860063683593097
How to split a Dataframe column whose data is not unique,0.04860063683593097
split several columns using pandas,0.04860063683593097
AttributeError: 'float' object has no attribute 'split' when making a generator object,0.04860063683593097
Split dataframe in 3 subgroups,0.04860063683593097
PANDAS: Removing Index Values and Splitting in Excel the value in one cell to different rows,0.04860063683593097
How to split single large hex value row text file into columns using jupyter notebook,0.04860063683593097
how to split value into rows?,0.04860063683593097
Split column into multiple columns based on variable,0.04860063683593097
"Converting separate Series for year, month, day to a single datetime Series",0.04860063683593097
If statement to split date/time into periods,0.04860063683593097
Custom transformer that splits dates into new column,0.04860063683593097
how can I split variant information of VCF file (NGS) in a table?,0.04860063683593097
Split rows into columns in pandas,0.04860063683593097
How do I split a string and ignore the rest for all columns in pandas?,0.04860063683593097
Trying to split data with spaces into two different columns,0.04860063683593097
How can I merge split array into a new DataFrame?,0.04860063683593097
Need to split a dictionary,0.04860063683593097
add a column that can separate the numeric values into low median and high segments?,0.04860063683593097
How to split a dataframe using pandas?,0.04860063683593097
How to split a column twice using Pandas?,0.04860063683593097
Split dataframe of customers on whether they used a credit card at least once,0.04860063683593097
How to split a dataframe string column into three columns? x as 'delimiter',0.04860063683593097
"How am I able to separate a DataFrame into many DataFrames, based on a label and then do computation for each DataFrame?",0.04860063683593097
pandas str.split is giving me an unexpected syntax error,0.04860063683593097
How to split one row into multiple and apply datetime on dataframe column?,0.04860063683593097
Split data between values of a row,0.04860063683593097
Split string column based on values in list and add it to another column in Pandas DataFrame,0.04860063683593097
Separate pandas df by repeating range in a column,0.04860063683593097
How to split the column values of dataframe into multiple columns,0.04860063683593097
Rows are lost when reading this tab-separated file with pandas read_csv,0.04860063683593097
Python | Pandas how to split list inside column into multiple columns,0.04860063683593097
Some elements in a list have delimiter and need to be separated. Then the other values for that element need to be copied to new row. Advice?,0.04860063683593097
Pandas split one dataframe into multiple dataframes,0.04860063683593097
"How to select multiple elements in a string separated by "";"" and "","" in a DataFrame?",0.04860063683593097
Split large CSV to Multiple CSV containing each row,0.04860063683593097
Split dataframe column values into windows of size n with overlap and keep date information,0.04860063683593097
Pandas - split columns with default values if no delimiter present,0.04860063683593097
Python - How to remove duplicate sequence of letters from string (cannot split by spacing),0.04860063683593097
Pandas: How to split and read values,0.04860063683593097
How to split data set into subsets following some criterions?,0.04860063683593097
Python: Split Start and End Date into All Days Between Start and End Date,0.04860063683593097
python pandas - Split frame rows based on costume logic,0.04860063683593097
Split date index to yearly index and monthly columns,0.04860063683593097
Pandas DataFrame: programmatic rows split of a dataframe on multiple columns conditions,0.04860063683593097
Is it possible to split a function into multiple function and still have the continuity/original result,0.04860063683593097
rsplit() is not working to split columns using regex,0.04860063683593097
split a dataframe column into equal parts,0.04860063683593097
Split values in CSV that look like JSON,0.04860063683593097
function to split dataframe using for loop,0.04860063683593097
How can I separate a column in new columns,0.04860063683593097
"str.split(',', expand = True) is too too...slow, how to enhance the performance?",0.04860063683593097
What is the easiest way to split a string into a first name and last name?,0.04860063683593097
how to split one column in pandas based on value and create new columns?,0.04860063683593097
Split one string column to multiple columns Pandas,0.04860063683593097
how to split rows based on separator in csv file in pandas?,0.04860063683593097
Pandas Split by delimiter when last delimiter may not exist,0.04860063683593097
"Duplicating Pandas Dataframe rows based on string split, without iteration",0.04860063683593097
Float element are wrongly split when converting tuples to list in Pandas,0.04860063683593097
Pandas: Split columns having multiple values,0.04860063683593097
Split a DataFrame vertically based on delimiter,0.04860063683593097
Why I cannot split the column into two columns in pandas?,0.04860063683593097
How to split the values inside the Dataframe using python,0.04860063683593097
Split dataframe into several ones (not the same size) based on consecuvite zero values,0.04860063683593097
Cannot split pandas dataframe column due to NaN values,0.04860063683593097
Creating a new pandas dataframe by spliting rows,0.04860063683593097
Split table to small Python,0.04860063683593097
split string column in the brackets that contain only 4 digits and place those 4 digits in a different column,0.04860063683593097
Split and transfer into respective columns,0.04860063683593097
python - pandas - split text column with no delimiter in to multiple columns,0.04860063683593097
Split string into two different columns based on keyword in pandas?,0.04860063683593097
group by count and sum based on particular column in pandas dataframe in separate column along with other columns,0.04860063683593097
Python - How to split cell in a column to a new row based of a delmimeter,0.04860063683593097
Having trouble splitting a dataframe into fixed chunks (per row),0.04860063683593097
PANDAS: How to pd.read_csv and split 7 digits integers into 4 by 3 integers?,0.04860063683593097
How to split Data-Frame into train and validation data set (given below in image) based on the picking random list of 2 from column ['Seen_A'],0.04860063683593097
Split pandas dataframe in two if it has more than 10 rows,0.04860063683593097
Split into columns using pandas,0.04860063683593097
Split pandas df based on column name endings,0.04860063683593097
Split is producing an IndexError on one line while executing as expected on every other line when trying to rename columns in a dataframe,0.04860063683593097
Attribute error ::datetime.date obect has no attribute 'split',0.04860063683593097
