Title,Correlation Score
Pandas GroupBy query,0.03846153846153846
How to insert a row into a table in MS SQL using Python pandas,0.03846153846153846
convert categorical attribute into multiple attributes in python pandas,0.03846153846153846
How do I reproduce results from webgraphviz with python graphviz using 2 column pandas dataframe,0.03846153846153846
how to save a pandas dataframe into a sav file,0.03846153846153846
Pulling a json from url into a dataframe error,0.03846153846153846
How to efficiently index a Groupby object?,0.03846153846153846
Multi-index slicing (involving a time series / date range) does not work with DataFrame but does for Series,0.03846153846153846
splitting/grouping pandas dataframe column,0.03846153846153846
converting pd.Series of strings into ndarray,0.03846153846153846
How to speed up Dash App with Pandas Groupby,0.03846153846153846
Reading JSON file into Pandas for analysis,0.03846153846153846
Pandas Monthly/Yearly Cohort Analysis to Quarterly,0.03846153846153846
Python add 2 multidimensional numpy arrays,0.03846153846153846
DatetimeArray to dtype datetime64 in Linux but good in Windows,0.03846153846153846
Descriptive statistics in Python /with Pandas with std in parentheses,0.03846153846153846
Filtering data based on equal rows for certain columns in pandas dataframe,0.03846153846153846
Using R lm function in Python on pandas DataFrame,0.03846153846153846
sending date time stamps to elasticsearch through python,0.03846153846153846
python xml file to pandas dataframe,0.03846153846153846
Python Pandas - adding column names using For statement,0.03846153846153846
Fill values and shift column in pandas dataframe,0.03846153846153846
how to read multiple CSV files from folder into pandas with dataframe name as file name,0.03846153846153846
Parse Python List to Pandas DataFrame,0.03846153846153846
Slow datetime parsing in Pandas,0.03846153846153846
Changing df column that consists of list,0.03846153846153846
Convert Object type to Float type,0.03846153846153846
Multi-condition count: pandas dataframe,0.03846153846153846
Using DataFrame.plot to make a chart with subplots -- how to use ax parameter,0.03846153846153846
pandas read_table gives single column with JSON data,0.03846153846153846
pandas.read_sql with sqlite is extremly slow,0.03846153846153846
pandas simple loop with KeyError: 8167,0.03846153846153846
Transforming a series of tuples into a series of the nth element of each tuple,0.03846153846153846
Pandas: Filling column in dataset with data from another dataset based on matching columns in the two datasets,0.03846153846153846
sliding window traverses downward on column instead of rows,0.03846153846153846
Web Scraping with Selenium Python [Twitter + Instagram],0.03846153846153846
Find out last value of a hive table using pyspark,0.03846153846153846
Append numpy arrays with different dimensions,0.03846153846153846
Problem reading sqlite table as csv file in recommender system,0.03846153846153846
Plotting Date with Matplotlib and Pandas,0.03846153846153846
Execution failed on sql : insert dataframe to postgresql server,0.03846153846153846
Add multiple rows AND single column to Dataframe based on existing column,0.03846153846153846
Delete Rows prior to specific String in Pandas,0.03846153846153846
Union column values group by using pandas,0.03846153846153846
Compute annual rate using a DataFrame and pct_change(),0.03846153846153846
"How to find most frequent values per batch using ""rolling(window)""?",0.03846153846153846
Contaminating in CSV file. Comma in column with value of thousands,0.03846153846153846
Counting repeating sequences Pandas,0.03846153846153846
Plot Price as Horizontal Line for Non Zero Volume Values,0.03846153846153846
Why doesn't a quartic linear regression in statsmodels' OLS match LibreOffice Calc?,0.03846153846153846
Cannot install RAY,0.03846153846153846
"Pandas, replace NaNs with values from MultiIndex DataFrame",0.03846153846153846
How to import pandas into the Python COM object for VBA,0.03846153846153846
pandas read_csv incorrectly reading number of columns with sep=None,0.03846153846153846
Find missing values of datetime for every customer,0.03846153846153846
Why am I getting a HTTP 403 error with Pandas?,0.03846153846153846
Selecting/renaming/simplifying MultiIndex dataframes,0.03846153846153846
Counting column values based on values in other columns for Pandas dataframes,0.03846153846153846
Python / Pandas to SQLite - ascii encoding errors,0.03846153846153846
How can I handle errors inside of a for loop inside of a cx_Oracle connection?,0.03846153846153846
iterations over list in dataframe,0.03846153846153846
Pandas dataframe: Replace multiple rows based on values in another column,0.03846153846153846
Replace values in specified list of columns based on a condition,0.03846153846153846
python pandas groupby complex calculations,0.03846153846153846
Inplace operation on masked dataframe,0.03846153846153846
Python Pandas: Assign Last Value of DataFrame Group to All Entries of That Group,0.03846153846153846
Checking for a condition within a timeframe period in a dataframe. [Python] [Pandas],0.03846153846153846
Replace selected integer value with list of values with Pandas,0.03846153846153846
How to select several rows when reading a csv file using pandas?,0.03846153846153846
How to groupby and map by two columns pandas dataframe,0.03846153846153846
"Pandas Timedelta is negative where it should be positive, how to overcome the limitations",0.03846153846153846
np.nanmean not working within a Dataframe?,0.03846153846153846
Pandas converting df into matrix by conditions,0.03846153846153846
Apply pandas to_datetime to all date columns,0.03846153846153846
Conditional replace value in pandas dataframe with calculated value,0.03846153846153846
Trying to create a column in a dataframe based on slicing another dataframe,0.03846153846153846
create a dataframe using groupby based on condition,0.03846153846153846
"Pandas, Handling ""Out of bounds timestamp...""",0.03846153846153846
Create dataframe of fixed size with dummy variables for numerical values,0.03846153846153846
Python : Pandas how to skip bad lines with the 'python' engine,0.03846153846153846
Concatenate cross tab values with dataframe?,0.03846153846153846
How can i calculate percentage change of sum of two columns in dataframe pandas,0.03846153846153846
combining two different formats of datetime in pandas,0.03846153846153846
How to match values in a DataFrame with some conditions?,0.03846153846153846
Python pandas map CSV file,0.03846153846153846
Replace all but last occurrences of a character in a string with pandas,0.03846153846153846
Extrapolate a row by quantity in a pandas DataFrame,0.03846153846153846
Requiring pandas dataframe input has either two column pairs or error thrown,0.03846153846153846
Remove rows from dataframe based on condition,0.03846153846153846
How do pandas Rolling objects work?,0.03846153846153846
DataFrame.combine to Combine Multiple Frame,0.03846153846153846
Not getting expected output - Plotting Histograms in Pandas,0.03846153846153846
how to display matching row in pandas groupby,0.03846153846153846
Pandas: Remove null values from multiple columns less verbosely,0.03846153846153846
Pandas One by One Entry with Python,0.03846153846153846
combine rows into single cell,0.03846153846153846
How to find row which has the minimum overall distance from the other rows of the pandas dataframe,0.03846153846153846
Python : error tuple index out of range when plotting pandas columns X Vs Y,0.03846153846153846
what is the most efficient way to search for a string in a pandas column?,0.03846153846153846
How to take column of dataframe in pandas,0.03846153846153846
Reading csv with several subgroups,0.03846153846153846
Python convert StringIO to binary,0.03846153846153846
Getting information from dataframe after a groupby function,0.03846153846153846
"plotting against datetime when there are two indices, pandas, python",0.03846153846153846
Comparing the rows of two pandas data frames by the column values,0.03846153846153846
Seperate columns into list after applying df.groupby() in pandas,0.03846153846153846
the type of df.describe() result - python pandas,0.03846153846153846
Pandas: Dictionary of Dataframes,0.03846153846153846
Python/Pandas: How to combine data from multiple rows into one based on two columns,0.03846153846153846
Calculating geometric mean of elach element in series,0.03846153846153846
Easy way to distinguish between 0 and False in a dataframe with mixed values,0.03846153846153846
Must have equal len keys and value when setting with an iterable,0.03846153846153846
ValueError: invalid literal for float(): 2017-03-18 19:22:51-07:00,0.03846153846153846
Intersection of sets as columns in pandas,0.03846153846153846
Create a new column in a dataframe if the column contains a string from a column of another dataframe,0.03846153846153846
Pandas - Groupby - capture first value of a column - Wrong ouput,0.03846153846153846
Why does max() sometimes return nan and sometimes ignores it?,0.03846153846153846
Get group percentages in pandas dataframe,0.03846153846153846
Convert numpy array of Datetime objects to UTC strings,0.03846153846153846
How to create pandas dataframe from Twitter Search API?,0.03846153846153846
Pandas Dataframe resample on ms values,0.03846153846153846
Error reading .csv files,0.03846153846153846
Slice dataframe for each unique pair of columns,0.03846153846153846
Reading non uniform lines ascii data - Python,0.03846153846153846
Unexpected result from DataFrame.groupby() and max(),0.03846153846153846
what is an efficient way of applying a function to one column in a group from groupby object?,0.03846153846153846
Pandas transpose multiple rows into a single column,0.03846153846153846
How to select a particular csv file and plot the graph from the multiple csv files folder using browser button in python,0.03846153846153846
Group by and Sort with Pandas Python,0.03846153846153846
Output only certain portions of row in pandas,0.03846153846153846
Python - Pandas subtotals on groupby,0.03846153846153846
Trying to plot a pandas dataframe groupby with Bokeh,0.03846153846153846
Ensure adjacent column values using pandas pivot_table,0.03846153846153846
Convert Dictionary to Pandas in Python,0.03846153846153846
Pandas groupby indices behaving diferrently with 2 and 3 rows,0.03846153846153846
numpy different data type of multidimensional array,0.03846153846153846
How to find an intersection of a list of dataframes with exactly same columns and indexes but different values in pandas python?,0.03846153846153846
How to change dates in column?,0.03846153846153846
"Has ""na_values"" been changed in python 3",0.03846153846153846
Pandas: splitting dataframe into multiple dataframe based on threshold value,0.03846153846153846
How to extract value from a dataframe,0.03846153846153846
Using a list as a value in a pandas dataframe,0.03846153846153846
Python Pandas: get columns by values in row,0.03846153846153846
Pandas to get multiple column values when a variable matches another column value that is repeated,0.03846153846153846
How to feed array of user_ids to flickr.people.getInfo()?,0.03846153846153846
Filtering data-frame on multiple criteria,0.03846153846153846
Replace all None's in a Pandas data frame with a tuple of None's,0.03846153846153846
summarizing data in pandas by grouping data,0.03846153846153846
pandas.Timedelta with BusinessDay,0.03846153846153846
Excel Index and Match in Pandas,0.03846153846153846
File not found when reading Flask uploaded file into pandas dataframe,0.03846153846153846
Python script does not work unless run with sudo,0.03846153846153846
Alternative to for loop to iterate through dataframe sequentially,0.03846153846153846
Remove whole days from pandas hourly dataframe,0.03846153846153846
ValueError: cannot reindex from a duplicate axis -- no duplicate axis values,0.03846153846153846
Choropleth maps for Germany,0.03846153846153846
I'm trying modify a pandas data frame so that I will have 2 columns. A frequency column and a date column.,0.03846153846153846
add columns that are not in dataframe but present in another index,0.03846153846153846
Index find position for matching string,0.03846153846153846
"Groupby on one column of pandas dataframe, and train feature and target (X, y) of each group with a common sklearn pipeline using GridsearchCv",0.03846153846153846
how can I quickly convert in python an xlsx file into a csv file?,0.03846153846153846
Pandas dataframe.resample std on certain columns only?,0.03846153846153846
pandas CategoricalDtype: __new__() takes 1 positional argument but 2 were given,0.03846153846153846
Join and count number of values in each subcategory,0.03846153846153846
Match values to specific field of rows in Dataframe Python,0.03846153846153846
Pandas Dataframe Slice using iloc or ix,0.03846153846153846
Merge 2 excel files as they are using Python,0.03846153846153846
How to emulate SuperMongo's hacks on variables in Python?,0.03846153846153846
How do I get the data of other markets using Pandas?,0.03846153846153846
returning result of a function multiple times within the same function,0.03846153846153846
"Remove rows from pandas DataFrame if multiple columns contain the same data, but interchanged",0.03846153846153846
Combine multiple regex expressions in pandas.DataFrame.str.replace?,0.03846153846153846
"""the label [5] is not in the [index]"" while duplicating rows",0.03846153846153846
Converting a pandas dataframe to a list of entries,0.03846153846153846
loop through a list of dataframe,0.03846153846153846
Append pandas column values as new columns,0.03846153846153846
pandas: efficiently apply function that uses as input the whole dataframe,0.03846153846153846
Resample panda time series to have the end time stamp for the bin name?,0.03846153846153846
Pandas module in SPSS Modeler,0.03846153846153846
Applying if statements to replace data in 'Column Y' corresponding to different rows in 'Column X',0.03846153846153846
Dynamic dataframe column name in apply function,0.03846153846153846
Adding rows in pandas by matching,0.03846153846153846
writing a column data of a groupby object to another dataframe,0.03846153846153846
Search and return index of matching substring with pandas,0.03846153846153846
pct_change() not working on dataframe. str & str error,0.03846153846153846
Pandas get the most frequent values of a column,0.03846153846153846
Overriding 'default' number of fields when reading csv,0.03846153846153846
Reformatting an Excel file with Pandas,0.03846153846153846
AttributeError: 'str' object has no attribute 'strftime' when modifying pandas dataframe,0.03846153846153846
How can I add 1 column to df1 with values from df2 columns (df2.s2 or df2.s3) based on values of df1.c2?,0.03846153846153846
pandas: access MultiColumn values?,0.03846153846153846
Apply a function to all combinations of rows from one df and columns from another df,0.03846153846153846
Slicing specific rows of a column in pandas Dataframe,0.03846153846153846
Iterate Dataframe using list and groupby,0.03846153846153846
Best way to filter on multiple conditions?,0.03846153846153846
Pandas: Flag column if value in list exists anywhere in row,0.03846153846153846
pandas compare two column with different size,0.03846153846153846
Truncating a large csv-file in Python,0.03846153846153846
Python Pandas Multiindex Slicing/Indexing to obtain duplicate data,0.03846153846153846
Iterate over a CSV file multiple times using Pandas,0.03846153846153846
Pandas read_excel keep A:Z column names,0.03846153846153846
Deriving new dataframe from a dataframe in pandas,0.03846153846153846
How to index unique combination of values with pandas,0.03846153846153846
How to remove row containing array of NaN?,0.03846153846153846
Adding Hyperlink to Pandas DataFrame Makes it a Non Type Object instead of DataFrame,0.03846153846153846
using pandas to select a column as a condition for another column,0.03846153846153846
Python pandas plot TypeError,0.03846153846153846
"How convert timestamp, datatime to number before to apply DBSCAN",0.03846153846153846
sort dataframe alphabetically,0.03846153846153846
Problems with calculating linear regression for individual cells in a column in pandas,0.03846153846153846
Why is pandas time series resample raising IncompatibleFrequency error?,0.03846153846153846
How to filter my CSV results using Python,0.03846153846153846
"pandas ""where"" function does not appear to short-circuit",0.03846153846153846
How to set multilevel index in a dataframe with existing columns,0.03846153846153846
Sklearn: Surprising Behavior with TfidfVectorizer,0.03846153846153846
Is there a way to get correlation with string data and a numerical value in pandas?,0.03846153846153846
Mean of a series contained within a DataFrame,0.03846153846153846
Find if a specific (max) value is repeated in a row,0.03846153846153846
Slow csv writing with python3 compared to python2 with pandas to_csv,0.03846153846153846
grouping by values in another dataframe,0.03846153846153846
Imputer reduces the size of columns in my dataframe,0.03846153846153846
Python pandas read_csv - Loading tgz-zipped dataset in dataframe,0.03846153846153846
webscraping data and use pandas read_html to convert it to dataframe and merge the dataset together,0.03846153846153846
Change index col with pandas and read_excel,0.03846153846153846
joint probability with a condition,0.03846153846153846
Moving row values to other columns by value of another column,0.03846153846153846
Group data frame given that they have something in common,0.03846153846153846
Pandas Group by three columns but retain all other columns,0.03846153846153846
pd.read_csv - Disregard first N rows,0.03846153846153846
Map values of multiple dataframes and fill columns,0.03846153846153846
pandas resample timed events in DataFrame to precise time-bins,0.03846153846153846
Deleting row that is placed before the row of our matching condition,0.03846153846153846
Pandas: doing quantile normalization on a subset of a flattened dataset with replicates,0.03846153846153846
How to loop through the pandas dataframe columns using for loop to count the value based on the list given,0.03846153846153846
Python (Pandas) how to retrive number value from csv,0.03846153846153846
Add values to rows that don't exit,0.03846153846153846
merge multiple dataframe with specified suffix,0.03846153846153846
Fill in the column by comparing several columns of two dataframes in pandas,0.03846153846153846
KeyError: label not in index WHEN IT CLEARLY IS,0.03846153846153846
How to filter Pandas dataframe by a partial label,0.03846153846153846
Formatting Timestamp in Pandas dataframe,0.03846153846153846
How to set a name header for a lambda function within groupby in python,0.03846153846153846
.ffill() overwriting existing values,0.03846153846153846
Create a dataframe based on column values of another dataframe,0.03846153846153846
Generating a dictionary based on a condition among columns of a dataframe,0.03846153846153846
Taking the sum and mean of multiple columns and appending the result as a single row,0.03846153846153846
Pandas mapping columns from multiple dataframes,0.03846153846153846
Copy argument vs Series.Copy(),0.03846153846153846
Assigning a column to a SparseDataFrame,0.03846153846153846
Apply a function on all possible combination of columns in a dataframe in Python -- Better way,0.03846153846153846
Using df.query on MultiIndex gives UndefinedVariableError,0.03846153846153846
Reading Excel file to Python fails due to number formatted as text,0.03846153846153846
Selectively Delete White Space After String in Python,0.03846153846153846
What does squeeze = True do in groupby?,0.03846153846153846
Variable inflation factor not working with dataframes python,0.03846153846153846
How can I use a line in the header of a CSV file as the index in a dataframe?,0.03846153846153846
combining dataframes in python,0.03846153846153846
Check for a repeating sequence in a pandas dataframe,0.03846153846153846
Converting float to array in Python,0.03846153846153846
series of list to OHE,0.03846153846153846
Display sparse multi-index of dataframe in Pandas,0.03846153846153846
pandas: rapidly calculating sum of column with certain values,0.03846153846153846
creating histogram from 2d array python,0.03846153846153846
The mechanism of auto inserting in Pandas Dataframe when selecting rows by index,0.03846153846153846
constructing a date column from a relative time pd.df column,0.03846153846153846
Get Stock Ticker from Company Name (Non Standard) Pandas,0.03846153846153846
shifting pandas series for only some entries,0.03846153846153846
Overwrite values in a dataframe with values from other dataframe in pandas python,0.03846153846153846
Pandas time series index based on datetime.time,0.03846153846153846
Efficient data structure to keep dictionary-like observations keyed by time in Pandas?,0.03846153846153846
Error with Requests using Pandas/BeautifulSoup: requests.exceptions.TooManyRedirects: Exceeded 30 redirects,0.03846153846153846
how to split and categorize value in a column of a pandas dataframe,0.03846153846153846
Replace data starts with '...' with np.NaN,0.03846153846153846
"Querying timedelta column in pandas, and filtering rows",0.03846153846153846
Correctly Call __set__ in MongoEngine Document constructor,0.03846153846153846
Creating a new column based on the values of other columns,0.03846153846153846
How to fix END and START values when smoothing a dataframe?,0.03846153846153846
Combine lists in Pandas column where column name is in list,0.03846153846153846
Converting a Spark dataframe to Pandas dataframe converts timestamp to object,0.03846153846153846
Merging on non-unique column - pandas python,0.03846153846153846
Pyinstaller Executable is not working,0.03846153846153846
"pandas, set value for column y,z on condition of column x with outsource data",0.03846153846153846
Identify first non-zero element within a group in pandas,0.03846153846153846
how to get only value from formula cell in csv file using pandas dataframe or any other python library?,0.03846153846153846
"Bloomberg API, pybbg",0.03846153846153846
fill dataframe with NaN when multiple days data is missing,0.03846153846153846
How to format dataframe to look like this?,0.03846153846153846
Python 3.6: Find first occurance string(entire column value) from dataframe which starts with '$',0.03846153846153846
How to fix tqdm progress_apply for pandas in Jupyter?,0.03846153846153846
Slicing Pandas DataFrame according to groups properties,0.03846153846153846
Count the number of times multiple substrings appear in dataframe column,0.03846153846153846
How can I do a contour plot with date and time in the x-y axis?,0.03846153846153846
Add new column for next consecutive row in pandas dataframe,0.03846153846153846
Pandas KeyError: '[ 9000 31342 26296 25991 13449 1481 15566 15507 11247 18206] not in index',0.03846153846153846
Error while trying to use pandas to read a csv,0.03846153846153846
How to get only the relevant index values from a filtered DataFrame?,0.03846153846153846
"How to Group, Sort and then fetch second highest row in Pandas?",0.03846153846153846
How to look up values from another dataset with Tensorflow?,0.03846153846153846
Pivot Dataframe for to_sql,0.03846153846153846
How to apply groupby function to get previuos month count?,0.03846153846153846
Handling Replicate Data in Pandas,0.03846153846153846
How to replace column value based on another dataframe?,0.03846153846153846
for loop for calculations from dataframes,0.03846153846153846
How to deal with Pandas groupby choosing a different index type based on the data?,0.03846153846153846
Regex for Transformations (without using multiple statements),0.03846153846153846
Copy data from one multiindex dataframe to other multiindex in pandas,0.03846153846153846
How to flatten Pandas groupby DataFrame?,0.03846153846153846
Find mean based on a fixed time duration,0.03846153846153846
python pandas: split string into date and time in datetime format,0.03846153846153846
using pandas to read a csv file with whatever columns matchi with the column names given in a list,0.03846153846153846
How to slice the x-axis according to date,0.03846153846153846
Python - pandas - is it possible to read csv with multiple decimal marks,0.03846153846153846
filter dataframe by maximum element from groupby pair,0.03846153846153846
Nan values in columns in python,0.03846153846153846
Read CSV file with space as thousand-seperator using pandas.read_csv,0.03846153846153846
Bin in 10min samples,0.03846153846153846
How to combine date column and time column,0.03846153846153846
pandas algorithm slow: for loops and lambda,0.03846153846153846
How to merge two data frames while excluding the NaN value column?,0.03846153846153846
Pandas efficiency with multiple boolean masking,0.03846153846153846
Pandas Merge Multi DataFrame( relate DataFrame ),0.03846153846153846
How do I read a CSV from Secure FTP Server into a Pandas DataFrame,0.03846153846153846
string to pandas function conversion,0.03846153846153846
Python pandas map multilevel column heading df to another df,0.03846153846153846
Type-checking Pandas DataFrames,0.03846153846153846
Panda DataFrame reshaping,0.03846153846153846
Pandas - how do I make a matrix from a list?,0.03846153846153846
How do I read a single value from dataframe in Python?,0.03846153846153846
Unexpected Behavior with Pandas Datetime/ dt.date,0.03846153846153846
How to Union Intersecting Geometries in Same Geopandas Dataframe,0.03846153846153846
