Title,Correlation Score
Pandas groupby average after slicing over non-zero values across remaining groups,0.04860063683593097
Using a combination of isin/transform/merge/groupby/map for conditional populating of dataframe column,0.04860063683593097
Add a conditional rolling count when there's mixed column data in pandas,0.04860063683593097
generic function for conditional filtering in pandas dataframe,0.04860063683593097
Create monthly values between yearly data by smoothing over ranges between 2 consecutive years (pandas),0.04860063683593097
Running sums from one column conditional on values in another column,0.04860063683593097
Multiple conditional statement on a column,0.04860063683593097
How to perform Average,0.04860063683593097
Pandas apply conditional statement : compare x to the mean of the rolling window,0.04860063683593097
Calculate Simple Moving Averages as New Rows are Added to Dataframe or SQLite DB,0.04860063683593097
Conditional aggregation on pandas dataframe columns with combining 'n' rows into 1 row,0.04860063683593097
moving average with time offset pandas,0.04860063683593097
Python Pandas : Conditional rolling count,0.04860063683593097
Moving average on pandas.groupby object that respects time,0.04860063683593097
Pandas increasing column values conditional to another column,0.04860063683593097
How to create a new column in pandas and add value to that new column based on the conditional value from the existing column?,0.04860063683593097
How to do conditional date formatting in dataframe,0.04860063683593097
"Pandas/Python complex, conditional sum",0.04860063683593097
Cannot create a new Timestamp column in pandas based on a conditional w/np.where,0.04860063683593097
Generating average values on dictionary of dataframes,0.04860063683593097
Conditional summing of columns in pandas,0.04860063683593097
Summing rows based on conditional in Pandas,0.04860063683593097
How to add a column to a dataframe and assign conditional values?,0.04860063683593097
How can I have to conditional and two output in a single lambda?,0.04860063683593097
pandas - two-dimensional histogram and averages,0.04860063683593097
Extracting elements of a dataframe based on conditional of other dataframes,0.04860063683593097
Vectorization of pandas groupby using conditional filters,0.04860063683593097
How to calculate the average count per hour?,0.04860063683593097
How to create new column with conditional datetime using pandas,0.04860063683593097
Calculate Monthly Variability by Long-Term Average Pandas,0.04860063683593097
How to calculate average time for several runs in Python,0.04860063683593097
Panda dataframe conditional change,0.04860063683593097
Pandas DataFrame conditional selection query?,0.04860063683593097
Pandas Element-Wise Variability by Rows using Monthly Averages,0.04860063683593097
Why do I get nan from a new column consisting of the average of other columns?,0.04860063683593097
Find average using dictionary key,0.04860063683593097
Add new column to Pandas dataframe using conditional values from another column,0.04860063683593097
Pandas: cumulative sum with conditional subtraction,0.04860063683593097
Taking average values in column B if column A has the same date but different time,0.04860063683593097
Conditional merge of Pandas multi-index dataframes,0.04860063683593097
Check for conditional first occurrence in a dataframe values,0.04860063683593097
Calculating averages considering two columns,0.04860063683593097
How to combine two dataframes and average like values?,0.04860063683593097
How do I use conditional logic with Datetime columns in Pandas?,0.04860063683593097
Mean over one column based on time period + conditional of another column,0.04860063683593097
Find occurrences of conditional value from one column and count values from another column in a dataframe,0.04860063683593097
Can I take the average of a datetime function?,0.04860063683593097
Compute row average by another column in Python/Pandas,0.04860063683593097
Rolling Conditional Pandas DataFrame Column,0.04860063683593097
How to calculate the average of a column where the row meets a certain condition in Pandas,0.04860063683593097
How are these not equivalent ways of calculating a moving average,0.04860063683593097
Replicating case in numerator and denominator of weighted average calculation in pandas,0.04860063683593097
Python DataFrame select row 3 years,0.04860063683593097
How to perform a conditional grouping in pandas dataframe?,0.04860063683593097
Conditional Calculation of Pandas Dataframe columns,0.04860063683593097
Efficient way of conditional value setting,0.04860063683593097
Adding up the total of a car model from all years,0.04860063683593097
Selecting a column from a conditional loop on a pandas dataframe,0.04860063683593097
calculating the same moving average on a set of stocks,0.04860063683593097
Conditional merge of dataframes,0.04860063683593097
Conditional fill of columns in a pandas df,0.04860063683593097
Custom aggregation with conditional cumsum,0.04860063683593097
Conditional forward fill between integer values,0.04860063683593097
How can I have the average of columns indexed by datetime which are inside of a dictionary of dataframes?,0.04860063683593097
How can I compute the cumulative weighted average in new column?,0.04860063683593097
How to make conditional formatting work in pandas?,0.04860063683593097
"Pandas: Splitting datetime into weekday, month, hour columns",0.04860063683593097
Conditional filter multiple columns python,0.04860063683593097
calculate the average of two consecutive rows based on multiple conditions,0.04860063683593097
plot average value every 30 minutes,0.04860063683593097
xarray - Use groupby to group by every day over a year's climatological hourly netCDF data,0.04860063683593097
Pandas DataFrame Groupby two columns and add column for moving average,0.04860063683593097
Calculate weighted average with Pandas for decreasing cost,0.04860063683593097
Conditional column merging in pandas,0.04860063683593097
Python Pandas replacing nan's in one column conditional on observations in another column,0.04860063683593097
Conditional creation of a series from other series,0.04860063683593097
How to slice a pandas data frame based on a conditional if statement using df.iterrows and create new dataframe,0.04860063683593097
How to build a new column in Pandas from a Conditional (New Column should output strings),0.04860063683593097
"Python Pandas Dataframe Conditional If, Elif, Else",0.04860063683593097
Moving average 2 day span using Pandas,0.04860063683593097
Conditional Extraction of Data from Pandas Dataframe,0.04860063683593097
How can I average individual columns for hundreds of files in Python most efficiently without big data infrastructure?,0.04860063683593097
Conditional transformation of column in pandas Dataframe,0.04860063683593097
How to work out the average from a set of columns based on multiple conditions in pandas?,0.04860063683593097
How to perform distinct average in Pandas Groupby in Python?,0.04860063683593097
How to average rows of a data frame based the value in a particular column?,0.04860063683593097
"Conditional transformation of Pandas DataFrame into negative, zero, and positive with epsilon precision",0.04860063683593097
Pandas and Python Dataframes and Conditional Shift Function,0.04860063683593097
Multiple Conditional Statements in Pandas DataFrame,0.04860063683593097
How to resample pandas dataframe to model an average week?,0.04860063683593097
How do I get each answer for each row with this conditional,0.04860063683593097
Pandas dataframe conditional statement didn't give me what i expected,0.04860063683593097
Find the average of Quantity for last 30 days and 60 days in pandas groupby,0.04860063683593097
What is the Pythonic way to pull conditional cell value from pandas dataframe,0.04860063683593097
"Calculating the moving average of rows of a dataframe, 12 columns at a time, starting from the left most point",0.04860063683593097
Pandas - Get week average for each user,0.04860063683593097
Pandas: create a conditional column and return a value based on the values of 2 columns in another df.groupby,0.04860063683593097
Pandas: Conditional column creating,0.04860063683593097
weighted average based on a variable window in pandas,0.04860063683593097
Conditional searches on pandas Dataframe,0.04860063683593097
Why averaging selected columns in Pandas gives wrong result?,0.04860063683593097
Trailing or Moving Average with a Group By,0.04860063683593097
Using np.select to generate conditional column based off data from multiple other columns,0.04860063683593097
How to calculate a modified moving average for a Python pandas dataframe?,0.04860063683593097
Adding years to Date (d-m-y) column In Python,0.04860063683593097
How do I perform a moving average in panda with a column that needs to be unique?,0.04860063683593097
Function with conditional statement to pandas series,0.04860063683593097
How do I create a while loop for this df that has moving average in every stage?,0.04860063683593097
Invalid syntax when using apply with conditional lambda with pandas,0.04860063683593097
Finding average in pandas from a value in a dictionary?,0.04860063683593097
Picking up rows with conditional expression - Pandas Python,0.04860063683593097
Calculating mean and diff conditional to date values,0.04860063683593097
Conditional merge of other multiple Pandas DataFrames,0.04860063683593097
Compute moving average in pandas with a twist,0.04860063683593097
"How can I determine the average of a column up to this point, using groupby?",0.04860063683593097
"is it possible to use two conditional filters, without having to assign variable filter (fifa dataset)",0.04860063683593097
Apply function to column A if conditional of corresponding (same index point) column B holds,0.04860063683593097
Create column with some values from another columns - Conditional,0.04860063683593097
Pandas Group Weighted Average of Multiple Columns,0.04860063683593097
PyCharm hitting MemoryError when doing conditional .loc,0.04860063683593097
Create new Pandas columns based on conditional counts of all other columns,0.04860063683593097
Dividing Pandas column based on year,0.04860063683593097
Pandas dataframe conditional substitution and columnwise trimming,0.04860063683593097
python string replace conditional,0.04860063683593097
Pandas - Conditional Column Creation based on the Last working day of the week,0.04860063683593097
Python - Downsample using resample not using average/mean,0.04860063683593097
conditional cumsum in pandas,0.04860063683593097
Filtering dataframe based on conditional minimum/nadir values (python/pandas),0.04860063683593097
How to calculate average and most frequent values per group?,0.04860063683593097
find average/mean of specific column value string,0.04860063683593097
Compute row average in pandas,0.04860063683593097
How can I efficiently get the average of the data within the specified window from a large dataset?,0.04860063683593097
Get index and columns based on conditional,0.04860063683593097
Average values from multiple rows if a portion of associated ID matches,0.04860063683593097
averaging every five minutes data as one datapoint in pandas dataframe,0.04860063683593097
Conditional sum in Pandas,0.04860063683593097
"Python - Calculate the average of values starting after a condition (e.g., after first non-zero in another column)",0.04860063683593097
Pandas dataframe conditional interpolation,0.04860063683593097
"Conditional Statement with a ""wildcard""",0.04860063683593097
Conditional sums based on grouped columns,0.04860063683593097
Pandas conditional column returning the opposite?,0.04860063683593097
pandas dataframe conditional retrieval of value,0.04860063683593097
Adding a conditional column to a dataframe if the value is in a list,0.04860063683593097
How can add a new column in df1 called value that looks up the value from df2 based on the year column?,0.04860063683593097
Merge Two Dataframes by Taking Average without Id column,0.04860063683593097
Best way to merge datasets using pandas conditional to one column,0.04860063683593097
How to make conditional comparisions between a value with Date Differemce (DATETIME - DATETIME)?,0.04860063683593097
Pandas conditional formatting: Highlighting cells in one frame that are unequal to those in another,0.04860063683593097
Compute averages of column in list of pandas data frames and plot distribution,0.04860063683593097
"groupby, shift, and average a dataframe",0.04860063683593097
Find running average which equal,0.04860063683593097
How to include Moving Average with Pandas based on Values on other Columns,0.04860063683593097
Pandas: conditional merge/join data frames with duplicate ids,0.04860063683593097
Pandas - moving average for date with many measurements per date,0.04860063683593097
New DataFrame that is the average of each day,0.04860063683593097
Loop Python List : Conditional Value Change,0.04860063683593097
How to fill in the missing values by interpolating between the weighted averages to the left and to the righ?,0.04860063683593097
Conditional column calculation in pandas,0.04860063683593097
how to get the average of dataframe column values,0.04860063683593097
Applying a function to dataframe columns with multiple conditional statements,0.04860063683593097
create pandas column with conditionals,0.04860063683593097
calculating moving average in pandas,0.04860063683593097
Removing Duplicates conditional in Pandas based on all but on column?,0.04860063683593097
Is there a way to use conditionals on colors in a scatter plot in Python?,0.04860063683593097
conditional slicing based on values of 2 columns,0.04860063683593097
Insert Conditional Rows in Columns,0.04860063683593097
Averaging Slices of a Dataframe in Pandas,0.04860063683593097
Filtering with conditional conditions (pandas),0.04860063683593097
Conditional strip values left of delimiter pandas column,0.04860063683593097
"Python pandas, calculate average temperature sensor for 15 minutes before survey was filled in (match timestamps + add new column)",0.04860063683593097
How to use conditional if/else for multiple dataframe python,0.04860063683593097
How to change multiples columns with conditional function and other column receive the number 0,0.04860063683593097
duplicating pandas dataframe rows n times where n is conditional upon a cell value,0.04860063683593097
Specifying conditional expressions with pandas dataframes,0.04860063683593097
How do I get average of data in pandas including the blank cells?,0.04860063683593097
Pandas dataframe conditional interpolation on a specific variable,0.04860063683593097
adding a new conditional column in pandas based off different indexes,0.04860063683593097
Center a moving average on a Pandas timeseries object,0.04860063683593097
Conditional join large pandas dataframe,0.04860063683593097
Average number of actions per day of the week using pandas,0.04860063683593097
Pandas: merge two dataframes and make the average over one column,0.04860063683593097
Calculating simple moving averages using rolling() function with time-based data,0.04860063683593097
In pandas If we are re-sampling a 1-minute interval data to a 15-minute interval by averaging can we select how to re-sample and assiggn the data,0.04860063683593097
How to add a column with number of years to another column with dates with Pandas,0.04860063683593097
Shifting rolling average in groupby without transform?,0.04860063683593097
"In Titanic dataset , how many relatives on the board each passenger has on average has? Calculated and return Name and Number relatives columns",0.04860063683593097
Pandas get average time interval within groups,0.04860063683593097
rearrange dataframe based on day and month from another dataframe index,0.04860063683593097
Creating new DF column based on average values from specific columns identified in second DF,0.04860063683593097
How to calculate conditional probability of all possible pairs of columns?,0.04860063683593097
Mathplotlib pandas-Plotting average line to scatter plot?,0.04860063683593097
Efficient conditional rolling calculation Pandas,0.04860063683593097
Conditional styling of a DataFrame using another dataframe,0.04860063683593097
find average upto x number of rows of particular column in dataframe,0.04860063683593097
Conditional multi column matching (reviewed with new example),0.04860063683593097
Plotting time series data group by month per product,0.04860063683593097
Pandas conditional formatting not displaying background colors. (no errors),0.04860063683593097
Generate new column in pandas dataframe based on conditional statement,0.04860063683593097
filling data gaps with monthly averages (Python),0.04860063683593097
Conditional shift in pandas to create new columns,0.04860063683593097
conditional mean in rolling,0.04860063683593097
Calculate the average share of sales for each day of the week,0.04860063683593097
pandas: generate and plot average,0.04860063683593097
Conditional replace with pandas,0.04860063683593097
Find average in large csv file using pandas,0.04860063683593097
Moving average by id/group with a defined interval in python,0.04860063683593097
"Group by device name, and then take average",0.04860063683593097
"get sets of index values, grouped by column year",0.04860063683593097
How to retrieve a certain day of the month for each row based on a dataframe value?,0.04860063683593097
What is the pythonic way to convert day and month in string format to date in python,0.04860063683593097
Set value based on day in month in pandas timeseries,0.04860063683593097
Average value around a point with an arbitrary step,0.04860063683593097
Summarize Python Dataframe Using Annual Averages?,0.04860063683593097
Use pandas to calculate binned average with decimal increments,0.04860063683593097
Average of a time related datasets in Pandas with missing values,0.04860063683593097
Different index return value types for similar conditionals in pandas,0.04860063683593097
Efficient way to find the paths with highest average edge value between two points in a pandas dataframe?,0.04860063683593097
"Pandas Dataframe, creating average trends for grouped data, where there is only data point per observation",0.04860063683593097
Annual data to monthly data by averaging annual data and creating new rows,0.04860063683593097
Pandas rolling weighted average,0.04860063683593097
Going from monthly average dataframe to an interpolated daily timeseries,0.04860063683593097
How to add value to column conditional on other column,0.04860063683593097
New column in pandas DataFrame conditional on value of other columns,0.04860063683593097
Element wise averages across three pandas dataframes?,0.04860063683593097
Adding a rolling average to pandas dataframes in a loop takes forever,0.04860063683593097
How to loop through array while using agg and apply np.average,0.04860063683593097
Moving Average Pandas,0.04860063683593097
I want to compare values in a dataframe column and report the index for the value that satisfy a conditional argument?,0.04860063683593097
Average replicates in different rows based upon conditions in different columns,0.04860063683593097
Pandas create column conditional on others,0.04860063683593097
Combining np.where with conditional duplicate to assign column value,0.04860063683593097
Weighted average by another column in pandas,0.04860063683593097
How to compute conditionals (IF) in a column cell in pandas?,0.04860063683593097
Averaging along DataFrame columns with some missing rows,0.04860063683593097
Python Pandas: How do I average ONLY the data >1000 from several columns?,0.04860063683593097
iteratively transpoing and appending dataframe for conditional checking using python,0.04860063683593097
creating new column based on multiple conditional statements pandas dataframe,0.04860063683593097
Python PANDAS get averages across multiple slices of data,0.04860063683593097
Pandas- conditional information retrieval with on a date range,0.04860063683593097
Predicting match outcomes based on moving averages,0.04860063683593097
Python pandas conditional column dealing with None,0.04860063683593097
Write string conditional assigning into new column as one linear or in a more concise manner,0.04860063683593097
How to compare rows with iteration and conditional in a table - Python,0.04860063683593097
Calculating a rolling average over an entire dataframe,0.04860063683593097
Pandas find average for string occurrences,0.04860063683593097
Average time for datetime list,0.04860063683593097
Pandas add a new column based on conditional logic of many other columns,0.04860063683593097
Getting average of rows in dataframe greater than or equal to zero,0.04860063683593097
pandas dataframe conditional population of a new column,0.04860063683593097
How to use rolling function to predict a trend based on either Simple Moving Average or some other strategy,0.04860063683593097
How to reject a window containing an outlier with a condition during rolling average using python?,0.04860063683593097
pandas DataFrame: replace nan values with average of columns,0.04860063683593097
Getting average in pandas dataframe when there are NaN values,0.04860063683593097
Conditional values in a Pandas data frame based on dates,0.04860063683593097
Create a new Pandas Column with just the year of another column,0.04860063683593097
Elegent way of replacing multiple column by conditional,0.04860063683593097
How to calculate conditional percent change between rows in pandas?,0.04860063683593097
Python pandas - year into datetime error,0.04860063683593097
Pandas dataframe: group across years,0.04860063683593097
Get continuous dataframe in pandas by filling the missing month with 0,0.04860063683593097
Pandas: Count days in each month between given start and end date,0.04860063683593097
Conditional Statement based on whether values in two columns are similar or not (Pandas),0.04860063683593097
Conditional forward fill of bool values in Pandas Dataframe,0.04860063683593097
New column based on conditional selection from the values of 2 other columns in a Pandas DataFrame,0.04860063683593097
Averaging data from multiple data files in Python with pandas,0.04860063683593097
Year 1 timestamp in pandas,0.04860063683593097
Pandas: How to replace values in a dataframe based on a conditional,0.04860063683593097
Python dataframe conditional column population,0.04860063683593097
python dataframe new column based on another column with value of conditional min of dataframe,0.04860063683593097
"Converting irregularly time stamped measurements into equally spaced, time-weighted averages",0.04860063683593097
Combining conditional row data into new dataframe,0.04860063683593097
Create a column in pandas dataframes based on conditionals,0.04860063683593097
Conditional testing and comparison of two columns in a pandas dataframe,0.04860063683593097
Conditional replacement in pandas,0.04860063683593097
Calculate moving average of residuals iteratively in pandas,0.04860063683593097
Conditional filtering in a multiindex,0.04860063683593097
python pandas column conditional on two other column values,0.04860063683593097
pandas and groupby: how to calculate weighted averages within an agg,0.04860063683593097
How to export the Pandas conditional formatting to an Excel file,0.04860063683593097
how to conditionally average across columns in pandas,0.04860063683593097
How do I average out my data to flatten my plot?,0.04860063683593097
Error when trying to create new rolling average column based on another column using groupby of two other columns in pandas data frame,0.04860063683593097
How to get the average absolute frequency per hour for each group?,0.04860063683593097
Calculating weighted average using grouped .agg in pandas,0.04860063683593097
How do I place NaN when computing the average rating for each movie in a DataFrame?,0.04860063683593097
Pandas conditional check depending on row and column,0.04860063683593097
Conditional column in DataFrame: where's the mistake?,0.04860063683593097
How to add rows with the average values of selected rows into a data frame,0.04860063683593097
Conditional merge for CSV files using python (pandas),0.04860063683593097
Python/pandas conditional statement based on date_time index values,0.04860063683593097
pandas multiindex selection with conditionals on columns,0.04860063683593097
Weighted average grouping by date (in index) in pandas DataFrame,0.04860063683593097
Find average based upon two conditions; create column from these averages,0.04860063683593097
Timeseries average with python,0.04860063683593097
Sum columns based off conditionals - pandas,0.04860063683593097
Python: Netcdf: Is there a method to get the overall average from one variable where another variable overlaps with a unique value?,0.04860063683593097
pandas conditional fill binary,0.04860063683593097
plotting average by each genres; pandas,0.04860063683593097
Counting values by month with python pandas,0.04860063683593097
Pandas - moving average grouped by multiple columns,0.04860063683593097
subset df using conditionals - pandas,0.04860063683593097
pandas average relative elements from multi files,0.04860063683593097
Conditional grouping with mean and count,0.04860063683593097
Column-conditional merging of dataframes,0.04860063683593097
Conditional Dataframe Grouping,0.04860063683593097
Conditional Select on a dataframe column,0.04860063683593097
Draw a multi line chart of movie count by each genre for every year,0.04860063683593097
