Title,Correlation Score
Copying a file and uploading to another csv file with Pandas python,0.03846153846153846
Python Pandas get index of value from one column to apply to another in dataframe,0.03846153846153846
How to upload all files from a certain folder and store them as variables,0.03846153846153846
How to read XML with python ElementTree when there are multiple entries in each element,0.03846153846153846
Extracting text element from complex xml document with pandas,0.03846153846153846
pandas .plot.hist() with .groupby(),0.03846153846153846
Retrieve the count of the number of different values from a pandas DF based on condition,0.03846153846153846
How to split a dataframe row into multiple dataframe row if the condition is satisfied?,0.03846153846153846
How to find Intersecting and unique strings in specific groups in a pd.dataframe?,0.03846153846153846
How to convert SPSS file to Pandas CSV by retaining exact data?,0.03846153846153846
Scraping data from website using Beautiful Soup and Pandas,0.03846153846153846
Why does pandas Dataframe bfill or ffill yield random results when used with groupby?,0.03846153846153846
Strip Time From Pandas Datetime Excel DateOffset,0.03846153846153846
Get Column Names of Values that are not NaN as new column,0.03846153846153846
Compare consecutive rows and delete based on condition,0.03846153846153846
Pandas how to read_excel x to last column?,0.03846153846153846
Appending a list as a row in a Dataframe,0.03846153846153846
Python dataframe count the values in a row and add status to the another row,0.03846153846153846
Generate random sequences from dataframe information in python,0.03846153846153846
How to randomise a complete Data Frame with Normal Probability Distribution for Simulation in Python?,0.03846153846153846
Input data formatting problem for an array in a model,0.03846153846153846
How do I turn this data into a dataframe? (using pandas),0.03846153846153846
Removing extreme percentiles from pandas dataframe columns,0.03846153846153846
How to make pandas replace work like python default replace,0.03846153846153846
Sum function not displying sum in proper way in pandas,0.03846153846153846
Pandas dataframe rolling covariance calculation with min_periods applicable to only one column,0.03846153846153846
download multiply images to pc by python,0.03846153846153846
Is there an easy way to extract rows from pandas DataFrame from a boolean expression?,0.03846153846153846
Is it possible to manage colors of rows in pandas dataframe?,0.03846153846153846
Changing Value of adjacent column based on value of of another column,0.03846153846153846
"Aggregation and grouping, Key Error on Size",0.03846153846153846
How to plot multiple facet_col in pyhthon using plotly.express,0.03846153846153846
How to take only integer value in pandas dataframe,0.03846153846153846
Using pandas to open Excel files stored in GCS from command line,0.03846153846153846
Calculated column in Pandas Dataframe - calculating max of future values,0.03846153846153846
How to concatenate float to list?,0.03846153846153846
separating dataframe into 3 new dataframes,0.03846153846153846
"In Pandas, how to get multiple subset data frame based on groupby criteria?",0.03846153846153846
Apply xlsxwriter formatting to Excel file in AWS lambda function,0.03846153846153846
How to merge cells into one with pandas?,0.03846153846153846
Python duplicates date values for week number conversion in leap year,0.03846153846153846
Comparing multiple csv file names and group them accordingly,0.03846153846153846
how to categorize time values in pandas,0.03846153846153846
Exporting a csv of pandas dataframe with LARGE np.arrays,0.03846153846153846
Group by : condition and action on 2 different variable,0.03846153846153846
trying to create an elevation map but getting errors,0.03846153846153846
How do I get pandas str.contains() to correctly select the rows with 'Virginia' and 'West Virginia'?,0.03846153846153846
python pandas add new column with values grouped count,0.03846153846153846
Zero in Precision and Recall in ML model Random Forest in Python?,0.03846153846153846
How do I display more than one pandas describe() output in a single jupyter cell?,0.03846153846153846
date format convertion creates NaT in pandas,0.03846153846153846
How to make sure that the data in this PyTrends function comes out in YYYY-MM-DD format and not YYYY-MM-DD 00:00:00,0.03846153846153846
Hive/Bigsql pandas float cast to integer with nulls into parquet file with pyarrow,0.03846153846153846
look up a time if it falls within a time range and return the corresponding value in Pandas?,0.03846153846153846
fail install pandas in python in docker,0.03846153846153846
Count unique values over rolling window which meet a condition,0.03846153846153846
Search for different values in subsequent rows within a DataFrame -,0.03846153846153846
Replace an attribute with percentage of two attributes in Python,0.03846153846153846
Python automatically converting specific data to date format and losing data,0.03846153846153846
pandas/python: replacing categorical values in dataframe through iteration,0.03846153846153846
Pandas manipulation with GroupBy,0.03846153846153846
Plotting pandas vs matplotlib,0.03846153846153846
How do I filter categorical data in Pandas,0.03846153846153846
how to make data frame's list rows to string?,0.03846153846153846
Most efficient way to use resample on groupby with start and end datetime while preserving certain columns - and calculate statistics after that,0.03846153846153846
do numpy 1.19 work with python 3.6 and pandas 1.15 ? If not what version do I have to use?,0.03846153846153846
Applying more than one function to a pandas dataframe,0.03846153846153846
Replacing string by float in a dataframe according to their value in a different dataframe,0.03846153846153846
Selecting Specific columns in Pandas data frame Using iloc,0.03846153846153846
Sum series in pandas dataframe in two ways,0.03846153846153846
How to convert multiple pandas columns from string boolean to boolean?,0.03846153846153846
"Converting a string month day, year to mm/dd/yyyy",0.03846153846153846
pandas.dataframe.astype is not converting dtype,0.03846153846153846
How do I write this as a single for loop?,0.03846153846153846
Kernel dies with strange behavior,0.03846153846153846
Pandas add new column with groupby based on values in 3 different columns,0.03846153846153846
How to convert pandas dataframe to HEC DSS,0.03846153846153846
The truth value of a DataFrame is ambiguous while using for loop for some values in a dataframe,0.03846153846153846
Split column on condition in dataframe,0.03846153846153846
Group Pandas rows by ID and forward fill them to the right retaining NaN when it appears on all the rows with the same ID,0.03846153846153846
Is there any specific method to clean this kind of obj columns,0.03846153846153846
Getting Out of bounds nanosecond timestamp error while using fillna in python?,0.03846153846153846
Get Latitude and Longitude from a column in a dataframe,0.03846153846153846
merge two dataframe on a column with duplicate entries,0.03846153846153846
str object has no attribute str,0.03846153846153846
How to match leading and trailing hyphen,0.03846153846153846
"dateTtimeZ to date, time",0.03846153846153846
"Standalone Jupyter install - Pandas, tabnine not found, installed to wrong directory",0.03846153846153846
Iterate over results of value_counts() on a groupby object,0.03846153846153846
"how to count, how often values from one column have a value in common in another column",0.03846153846153846
Access substring in a dataframe column to create a new column,0.03846153846153846
Combine Multiple Column Values in a Single Column,0.03846153846153846
write a python function that takes a list and one column of a dataframe and adds a new column based on that list,0.03846153846153846
How to multiply specific value in pandas dataframe according to condition?,0.03846153846153846
Perform a calculation on one column based on two other columns in pandas,0.03846153846153846
Fail to use pandas to extract the web ALL table content,0.03846153846153846
"read text based(bed) files, add new column to them save in csv file",0.03846153846153846
Python - How many passengers over 20 had siblings onboard - Titanic Dataset,0.03846153846153846
Column Name Shift using read_csv in Dask,0.03846153846153846
How to add the name of the nearest point?,0.03846153846153846
"Pandas: Applying function f(c1, c2) to all pairwise combinations of columns",0.03846153846153846
Use a loop to plot n charts and variable the title Python,0.03846153846153846
Replace NaN inside masked dataframe,0.03846153846153846
Parse JSON into Dataframe,0.03846153846153846
pandas combine row and column to single column,0.03846153846153846
How can we know the source of csv from github link,0.03846153846153846
How to melt multiple index,0.03846153846153846
set the value of a dataframe by the minimum of a subgroup,0.03846153846153846
How to sort row values in by letter in python using pandas,0.03846153846153846
I need to concate statements from three columns for each group condition,0.03846153846153846
apply group by on one column based on the condition of other column,0.03846153846153846
Merge two values and remove duplicates,0.03846153846153846
"Pandas Dataframe from ""messy"" list in Python",0.03846153846153846
Condition if customer_id is in list,0.03846153846153846
Install Python Pandas in an other folder,0.03846153846153846
Add the string from one dataframe in a new column of a second dataframe while comparing values,0.03846153846153846
How to convert pandas DataFrame to specific annotated csv-like format (described inside),0.03846153846153846
Python: Compare data against the 95th percentile of a running window dataset,0.03846153846153846
"Convert time to datatime format, keeping ""AM/PM""",0.03846153846153846
Formatting Excel to DataFrame,0.03846153846153846
Rebinning pandas dataframe with datetime and categories,0.03846153846153846
How to remove duplicate rows and get percentage value of 3 most popular elements in column?,0.03846153846153846
How to create dataframe from different txt files in python?,0.03846153846153846
How to divide 24 hours into 96 quarters?,0.03846153846153846
how to put just a couple label to a swarm plot?,0.03846153846153846
Numbers being read as NaN with pandas.read_csv; how do I fix this problem?,0.03846153846153846
Partial string replacement using pandas replace,0.03846153846153846
Is there an easy way to skip any errors when converting objects to int in a dataframe?,0.03846153846153846
pandas : create a datetime index from list and forloop,0.03846153846153846
Loop for xlsxwriter,0.03846153846153846
How to convert jsonreader object to Python Dataframe?,0.03846153846153846
change row values with list comprehension,0.03846153846153846
How can I group a time series according to the seasons using pandas?,0.03846153846153846
Create ID column in a pandas dataframe,0.03846153846153846
How to calculate the accumulated time of a groupby function using pandas?,0.03846153846153846
How to plot the grouped data?,0.03846153846153846
reshape dataframe time series,0.03846153846153846
Pandas - rolling sum of last N elements with condition,0.03846153846153846
"How can I ffill a pandas dataframe based on id and ""original date"" range?",0.03846153846153846
Python make a pandas dataframe from user input(),0.03846153846153846
"Selenium, pandas writing same table to multiple CSVs",0.03846153846153846
pandas for loop duplicating rows,0.03846153846153846
Is there a function in Python or Pandas that allows you to consolidate multiple different row values into one using a wildcard?,0.03846153846153846
Find N similar records from pandas DataFrame,0.03846153846153846
Reshape data in Pandas - Python 3,0.03846153846153846
Annotate text in facetgrid of sns relplot in python,0.03846153846153846
Python dataframe vectorizing for loop,0.03846153846153846
convert df to list of list,0.03846153846153846
panda query with double quotation python,0.03846153846153846
Is there a python function to run a count where a specific variable has a certain value?,0.03846153846153846
How to avoid loops for specifying limits for Pandas Dataframe filtering?,0.03846153846153846
is there any function to filter dataset based on rows?,0.03846153846153846
How to find pandas dataframe rows satisfing a particular combinaison of values stored in a list?,0.03846153846153846
How to get the size of groups as well as other aggregations in pandas?,0.03846153846153846
Searching and downloading pdf files contained in a pandas df column of links,0.03846153846153846
Plot specific data from pandas dataframe with matplotlib,0.03846153846153846
Pandas dates wrong when writing to drive,0.03846153846153846
Python Pandas improving calculation time for large datasets currently taking ~400 mins to run,0.03846153846153846
Reading a CSV from a particular line,0.03846153846153846
Pandas groupby to return sum and latest date,0.03846153846153846
Convert a dictionary of list to a dataframe in a specific format,0.03846153846153846
replace value if string ends with certain value pandas dataframe,0.03846153846153846
Python giving me datetime Value Error from CSV,0.03846153846153846
Tkinter Scale to input values to pandas dataframe.head,0.03846153846153846
Combine values of columns and state condition in Pandas Dataframe,0.03846153846153846
is there a way to convert a single row to a column in pandas,0.03846153846153846
Pandas dataframe returns False even if the values are equal,0.03846153846153846
Grouping Values and Summing & New Data Frame - Using Pandas,0.03846153846153846
Percentage column with Groupby,0.03846153846153846
Trying to set pandas column with 2D data,0.03846153846153846
Append multiple time-series data in for-loop in Python,0.03846153846153846
Scraping data parallel + batch processing,0.03846153846153846
Reading tables with Pandas and Selenium,0.03846153846153846
Pandas Attribute error: Nonetype has no attribute rename,0.03846153846153846
Pandas plot data column on x axis,0.03846153846153846
Replicate/Duplicate row by index row Pandas/Numpy,0.03846153846153846
"How to get mean, median, mode from unique values in Python 3",0.03846153846153846
"Object of type int64 is not JSON serializable, POST data from SQL Server using Pandas Dataframes",0.03846153846153846
"Identify duplicate records in python dataframe based on groupby concept, skipping first 2 occurences",0.03846153846153846
Data preprocessing with json data using python (Jupyter notebook),0.03846153846153846
Find closest number in a column and output the index number in Pandas DataFrame Python,0.03846153846153846
How to replace all backslashes in a dataframe column / pandas series,0.03846153846153846
Populating JSON data from API in Python pandas DataFrame - TypeError and IndexError,0.03846153846153846
Setting value in very first cell in pandas dataframe,0.03846153846153846
Pandas column formatting,0.03846153846153846
Get index of row within a sub-DataFrame with pandas apply,0.03846153846153846
How can I turn a date into the day of the week (as an integer)?,0.03846153846153846
pandas mask change value where condition true and false,0.03846153846153846
Loop which every iteration will replace one column from a dataframe with zeros,0.03846153846153846
Dataframe Index row comparison and removal,0.03846153846153846
Loop where the condition for the first entry in a column is different from the remaining column entries?,0.03846153846153846
How do I extract mixed elements from a long list in pandas/ python,0.03846153846153846
A Regular expression to find second occurence in DataFrame,0.03846153846153846
error in expression evaluation with float() conversion,0.03846153846153846
Machine Learning Sololearn's Coach Problem about Coulmn data etc,0.03846153846153846
Python/Pandas: assign a value to a column based on multiple column/row values,0.03846153846153846
Dask dataframe crashes,0.03846153846153846
How can I rearrange a Pandas DataFrame containing a list of coordinates into a table?,0.03846153846153846
Pandas. How to delete a row if value include some letters,0.03846153846153846
add dense rank in python dataframe where all the columns are in string,0.03846153846153846
"classic ""ValueError: Truth value of a series is ambiguous""",0.03846153846153846
Getting from a long list of strings to Pandas DataFrame,0.03846153846153846
Remove erroneous values from column in Pandas,0.03846153846153846
How to delete the duplicates and keep the first row only when these rows are next to each other,0.03846153846153846
How to speed up this for loop by replace the append function,0.03846153846153846
Python - splitting sentences dataframe into multiple columns,0.03846153846153846
how do i replace set of values in a dataframe column with values from another dataframe?,0.03846153846153846
GroupBy Function Not Applying,0.03846153846153846
Merging rows in a pandas dataframe based on mutiple values,0.03846153846153846
Can I avoid that the join column of the right data frame in a pandas merge appears in the output?,0.03846153846153846
rename column names while merging dataframs,0.03846153846153846
Python Pandas Dataframe: How to get Trend Lines data from existing dataframe columns?,0.03846153846153846
Adding a column to the dataframe in pandas,0.03846153846153846
Merge returns nan in Pandas,0.03846153846153846
"In each row of pandas, starting at the first non-NaN a window of X values remains untouched while all other values are NaN",0.03846153846153846
How can I append a Series to an existing DataFrame row with pandas?,0.03846153846153846
How to make a summed row into a column,0.03846153846153846
Compare a dataframe with a groupby one and find missing entries,0.03846153846153846
TypeError: '<=' not supported between instances of 'Timestamp' and 'bool',0.03846153846153846
Reconstructing DataFrame,0.03846153846153846
How to consolidate multiple CSV files with similar and different columns into 1 using Python and Pandas?,0.03846153846153846
Combine rows in Dataframe column based on condition,0.03846153846153846
How to write a pandas dataframe to_json() to s3 in json format,0.03846153846153846
Problem with calculation od days from date in DataFrame in Python Pandas,0.03846153846153846
df.dropna() not dropping rows with na,0.03846153846153846
How to calculate day max for time series along with relevant hour?,0.03846153846153846
How to get a file integrity error with pandas?,0.03846153846153846
How to turn a dataframe index which only contains zeros into a sequential one?,0.03846153846153846
Python - getting 0 in all rows in the first column of the dataframe,0.03846153846153846
Problem in elemintaing the brackets () and post processing the dataframe using Pandas in Python,0.03846153846153846
"Of a column, get the indices of first and last occurrences in certain context",0.03846153846153846
Extracting data from CSV to create xml,0.03846153846153846
"Generating multiple pandas data frames within a loop, with variable variable names",0.03846153846153846
Compute returns from data frame,0.03846153846153846
How to insert -1 to every 11-th position in the dataframe?,0.03846153846153846
Loading Python libraries in SQL Server is slow,0.03846153846153846
pandas groupby and map list of values,0.03846153846153846
Change value according to match in another tab in pandas,0.03846153846153846
How to drop Duplicates for each unique row value in Pandas?,0.03846153846153846
Pandas df.to_excel for multiple dfs?,0.03846153846153846
Pandas groupby multiple aggregations with exclusion of the focal group,0.03846153846153846
How to combine multiple csvs using Python and include filename as entry in column?,0.03846153846153846
indexing pandas data frame with multiindex,0.03846153846153846
Merge two data frame by comparing values but not the column name,0.03846153846153846
Cleaning sales data for market stall in Pandas; splitting rows,0.03846153846153846
Python Converting a List into an Array,0.03846153846153846
How can I find number of GROUP of consecutive 1s in a binary number,0.03846153846153846
Map a dataframe to a column of cartesian products by column name,0.03846153846153846
How can I slice elements of one Pandas dataframe column by different values?,0.03846153846153846
Pandas read_sql with sqlite is very slows on simple queries is this expected?,0.03846153846153846
Dask list index out of range reading JSON files from S3,0.03846153846153846
pandas sum up a column during merge,0.03846153846153846
Plotting two data frames (x and y) that do not have the same dimensionality?,0.03846153846153846
How to get sum of k consecutive rows in pandas dataframe?,0.03846153846153846
Conditional groupby in python,0.03846153846153846
Is there a way to extract part of a dataframe using pandas (or other library) in Python?,0.03846153846153846
"How to add additional data to Excel file, so existing data won't be erased?",0.03846153846153846
get pandas dataframe column datetime format,0.03846153846153846
Filter data in dataframes,0.03846153846153846
Pandas json_normalize returns KeyError,0.03846153846153846
how to quickly calculate distance with pandas longitudes and latitudes data?,0.03846153846153846
Compare two Excel files that have a different number of rows using Python Pandas,0.03846153846153846
Detemining Odd and Even values with Pandas in Python,0.03846153846153846
Pandas: Appending a row of boolean values to df using `loc` changes to `int`,0.03846153846153846
"Time series Analysis ,checking for stationarity using Kwiatkowski??hillips??chmidt??hin (KPSS)",0.03846153846153846
how to get percentage of columns to sum of row in python,0.03846153846153846
Pandas can't print untruncated dataframe even with pd.set_option(),0.03846153846153846
KeyError exception with pandas dataframe colunm,0.03846153846153846
Pandas dataframe covert wide to long multiple columns with name from column Name,0.03846153846153846
Efficient way to search string contains in multiple columns using pandas,0.03846153846153846
Pandas routine to modify Dataframe,0.03846153846153846
How to Append data in existing postgres table with incrementing primary key using python df._topostgis?,0.03846153846153846
Transform a pandas dataFrame column values to rows diagonal matrix,0.03846153846153846
How To Run Matplotlib with CSV file containing headings,0.03846153846153846
Pandas dataframe date not able to convert to datetime format,0.03846153846153846
Getting the date from a comparison of values within two columns through time,0.03846153846153846
How do I transform df using pandas,0.03846153846153846
Create weighted mean per column in pandas,0.03846153846153846
Normalization Of single Column Of Dataframe,0.03846153846153846
Python Dump API Output into DataFrame Cell,0.03846153846153846
Extracting ColumnNames with a specific String using Regular Expression,0.03846153846153846
How to replace the names of rows in a dataframe using to_replace and regex in Python?,0.03846153846153846
check data type of rows in a big pandas dataframe,0.03846153846153846
Python Machine Learning Error: expecting integer,0.03846153846153846
Pandas Series.replace replaces the entire series even in an iterative loop?,0.03846153846153846
How to filter a pandas dataframe using an operator as a variable being called in a for loop,0.03846153846153846
How do I plot in matplotlib a Pandas DataSeries with index Date?,0.03846153846153846
Problems reading a large PostgreSQL table into a Pandas dataframe,0.03846153846153846
Pandas Min and Max Across Rows,0.03846153846153846
How to list a row values and add as a new column in a DataFrame?,0.03846153846153846
Changing a dataframe so that strings in each column get sliced and placed into new rows,0.03846153846153846
Forward fill to a specific datetime index - if the datetime index occurs in other list,0.03846153846153846
How to name a pandas Series column title?,0.03846153846153846
"TypeError: expected string or bytes-like object""",0.03846153846153846
import 2 dataframes from a function in a different python file,0.03846153846153846
Computing percentage over a column depending on grouping,0.03846153846153846
How to remove outliers before using Silhouette metric?,0.03846153846153846
Using Spotipy API to Loop Through a DataFrame - Help Needed,0.03846153846153846
How to optimize the conversion of DateTimeIndex to a certain column of a DataFrame in a specific format?,0.03846153846153846
comparing groupby with column (pandas),0.03846153846153846
How do I manipulate a Dataframe with Pivot_Table in Python,0.03846153846153846
fill column values based on row values from another dataframe using pandas,0.03846153846153846
Small python programme taking 15 minutes to run,0.03846153846153846
How do I keep the column used as groupby criteria (column 0)?,0.03846153846153846
"How to Incrementally Increase from a Starting Value to a Target Value, by Group, Over a Number of Periods, in a Pandas DataFrame?",0.03846153846153846
calculate the correlation between two columns in pandas for each pair,0.03846153846153846
Extract the end of a value and place this in a new column based on certain criteria,0.03846153846153846
How to append two columns with pandas?,0.03846153846153846
Convert pandas dataframe to json,0.03846153846153846
extract keyword from a column to a new column,0.03846153846153846
I hit a regex roadblock while exploring a dataset of exported WhatsApp chats,0.03846153846153846
Compare columnA to columnB and get percentage of specific column,0.03846153846153846
Merge list of results into a single variable with Python,0.03846153846153846
