Title,Correlation Score
How to correctly write out a TSV file from a series in Pandas?,0.03846153846153846
Pandas DataFrame naming only 1 column,0.03846153846153846
Remove nth row in groupby,0.03846153846153846
How to reindex a pandas DataFrame after concatenation,0.03846153846153846
How do I subset this hacked together pandas dataframe?,0.03846153846153846
Python 2.7: How to identify unique string from string in pandas dataframe and print designated value in a specified column based on the result?,0.03846153846153846
Access HDF files stored on s3 in pandas,0.03846153846153846
Traversing multiple dataframes simultaneously,0.03846153846153846
Merging multiple .txt files into a csv,0.03846153846153846
Group dataframe by two columns and then shift values of other columns up by 1,0.03846153846153846
Reading CSV file in WinPython,0.03846153846153846
Reshaping MultiIndex to separate,0.03846153846153846
How do I remove rows from a dataframe?,0.03846153846153846
Using python or pandas to merge many files,0.03846153846153846
Conversion of pandas dataframe to sparse key-item matrix with composite key,0.03846153846153846
pandas version of numpy's ones_like,0.03846153846153846
Pandas: Add a new column in a data frame based on a value in another data frame,0.03846153846153846
Dynamic comparison with pandas AND,0.03846153846153846
How to round dataframe columns properly?,0.03846153846153846
finding the earliest occurrence in Python,0.03846153846153846
scrape webpage and save as CSV with BS4 and Pandas,0.03846153846153846
"Pandas - 2 dataframes, add Index column of df1 to df2 on second column",0.03846153846153846
how to convert monthly data to quarterly in pandas,0.03846153846153846
SettingWithCopyWarning in pandas when combining assignments,0.03846153846153846
Why is scipy.stats.ttest_ind throwing a new RuntimeWarning when comparing nans?,0.03846153846153846
"Count where Column is True, Grouped By Another in Pandas",0.03846153846153846
DataFrame combination,0.03846153846153846
Python Pandas DataFrames: Compare rows two by two recusively.,0.03846153846153846
Pandas parser CParseError,0.03846153846153846
Compare two group results,0.03846153846153846
How to get current and next value in Pandas DataFrame?,0.03846153846153846
Changing the colors of each hist facet on facetgrid?,0.03846153846153846
How do I define a Dataframe in Python?,0.03846153846153846
How to adjust the specific data in rows or in columns?,0.03846153846153846
Attributing multidimensional KDTree output in pandas,0.03846153846153846
Python pandas: Find values in one column that fall within range in another column,0.03846153846153846
Pandas Pivot Table - Add New line with Melt Function,0.03846153846153846
Pandas Multiindex Groupby on Columns,0.03846153846153846
How to create a new column in Pandas using two existing columns *and* position the new column in a certain position in the data frame,0.03846153846153846
Creating a Dataframe with special special format,0.03846153846153846
How to search for a value in a pandas matrix and give the column names?,0.03846153846153846
Stratified samples from Pandas,0.03846153846153846
python append error index 1 is out of bounds for axis 0 with size 1,0.03846153846153846
Create column in a pandas DataFrame based on whether value exists in a different DataFrame column,0.03846153846153846
Pandas: use a timeseries as a mask for selection,0.03846153846153846
pandas pivot_table giving IndexError,0.03846153846153846
drop NaN in pandas python,0.03846153846153846
pandas column values merge,0.03846153846153846
Assigning values from grouping in pandas,0.03846153846153846
plug all values from a pandas dataframe column into a function,0.03846153846153846
Splitting dataframe rows into multiple rows when column has a multiple values for a cell,0.03846153846153846
Find values of data frame in another dataframe in python,0.03846153846153846
Matching on basis of a pair of columns in pandas,0.03846153846153846
KeyError using `dask.merge()`,0.03846153846153846
"Set y-axis scale for pandas Dataframe Boxplot(), 3 Deviations?",0.03846153846153846
Upsampling Dataframe in Pandas with Index + Column,0.03846153846153846
TypeError when trying to add CSV entry into Spreadsheet using Pandas and XLSXwriter,0.03846153846153846
How to retrieve row and column names from data frame?,0.03846153846153846
Excel equivalent of arrays using in Python pandas,0.03846153846153846
Add a date column in pandas df using constant value in str,0.03846153846153846
Add a new column in Pandas as Max of existing column,0.03846153846153846
max number across rows in pandas python,0.03846153846153846
How to correct shape misalignment when multiplying pandas dataframe with a vector for dot product?,0.03846153846153846
"Calculate for each combination of ORIGIN, DEST and DAY_OF_WEEK the median value of ARR_DELA",0.03846153846153846
EmptyDataError while writing and reading from temporary file in Python,0.03846153846153846
Append based on condition using pandas,0.03846153846153846
Cumulative Monthly YTD Based on Threshold,0.03846153846153846
using geopy for finding a great circle distance,0.03846153846153846
How to install packages/modules in IronPython,0.03846153846153846
Error on if condition in pandas,0.03846153846153846
Convert decimal separator,0.03846153846153846
Finding the consecutive pairs of the values in a row and then operating on them in python,0.03846153846153846
Calculate MRR in Python Pandas dataframe,0.03846153846153846
pandas - not in index,0.03846153846153846
HDF5 min_itemsize error: ValueError: Trying to store a string with len [##] in [y] column but this column has a limit of [##]!,0.03846153846153846
"parse multiple xml file from multiple folder, having same format and store specific node's text in a variable",0.03846153846153846
How do I apply a regex substitution in a string column,0.03846153846153846
Sort lists in a Pandas Dataframe column,0.03846153846153846
How to run non-linear regression in python,0.03846153846153846
Modifying a pandas dataframe that may be a view,0.03846153846153846
Pandas reorder data,0.03846153846153846
Remove punctuations in pandas,0.03846153846153846
"TypeError: Signature mismatch. Keys must be dtype <dtype: 'string'>, got <dtype:'int64'>",0.03846153846153846
"rolling_window in pandas 19, using custom shapes",0.03846153846153846
Getting percentages after binning pandas dataframe,0.03846153846153846
how to index np.nan in a DataFrame,0.03846153846153846
Pandas DataFrame with date and time from JSON format,0.03846153846153846
subset a data frame based on date range,0.03846153846153846
Need to create a Pandas dataframe by reading csv file with random columns,0.03846153846153846
Loop over groups Pandas Dataframe and get sum/count,0.03846153846153846
Pandas HDF5 append time series fails,0.03846153846153846
What is the best way to represent or shape data with >700 features for classification?,0.03846153846153846
Create a 2D plot pixel grid based on a pandas series of lists,0.03846153846153846
Cumulative Set in PANDAS,0.03846153846153846
np reshape within pandas apply,0.03846153846153846
Setting pandas.DataFrame string dtype (not file based),0.03846153846153846
extract files inside zip sub folders with python zipfile,0.03846153846153846
How to execute a multi-threaded `merge()` with dask? How to use multiples cores via qsub?,0.03846153846153846
python pandas countifs using multiple criteria AND multiple data frames,0.03846153846153846
Pandas slow on data frame replace,0.03846153846153846
Can tqdm be used with Database Reads?,0.03846153846153846
Pandas: skip_footer and iteration,0.03846153846153846
How do I incrementally add rows in Pandas Dataframe?,0.03846153846153846
Pandas append float to column in for loop,0.03846153846153846
python linear regression predict by date,0.03846153846153846
Create a pandas dataframe with null columns,0.03846153846153846
Create dataframe from excel by reading sheet names python pandas,0.03846153846153846
turning pandas to pyspark expression,0.03846153846153846
building a dataframe from grouped data in pandas,0.03846153846153846
Pandas Dataframe Data Type Conversion or Isomap Transformation,0.03846153846153846
how to slice and combine specific row values in a Pandas groupby?,0.03846153846153846
Add prefix to specific columns of Dataframe,0.03846153846153846
Quick way to find the duplicate cell in a certain column of data frame in python-pandas?,0.03846153846153846
Problems with querying multiindex table in HDF when using data_columns,0.03846153846153846
Removing DataFrame rows in Pandas based on column type,0.03846153846153846
How to sum values grouped by a categorical column in pandas?,0.03846153846153846
Pandas groupby aggregate not giving the expected number of rows,0.03846153846153846
Why is pandas map slower than list comprehension,0.03846153846153846
remove control character whitespaces from dataframe,0.03846153846153846
Pandas: Create another column while splitting each row from the first column,0.03846153846153846
pandas Dataframe columns doing algorithm,0.03846153846153846
Change 1*140 dataframe to 7*20 dataframe in python pandas,0.03846153846153846
deleting pandas dataframe column,0.03846153846153846
How to merge two DataFrames into single matching the column values,0.03846153846153846
Replace values in pandas Series with dictionary,0.03846153846153846
Scatter and Hist in one subplot in Python,0.03846153846153846
Left-most column not recognised when transposed - Yahoo finance pandas,0.03846153846153846
Pandas - Category variable and group by - is this a bug?,0.03846153846153846
AssertionError: Number of Block dimensions (1) must equal number of axes (2),0.03846153846153846
pandas DataFrame and Yahoo Finance API,0.03846153846153846
How is pandas.json.dumps implemented?,0.03846153846153846
summing up certain rows in a panda dataframe,0.03846153846153846
Pandas : Merge two dataframe where the keys are different,0.03846153846153846
What are the possible reasons for your statement to return 'false' when you know it's true?,0.03846153846153846
In-place version of pandas truncate?,0.03846153846153846
pandas dataframe slice rows based on date indexes,0.03846153846153846
How to retrieve individual value from DataFrame,0.03846153846153846
Python Pandas CSV remove all strings from certain column,0.03846153846153846
How do I remove the accompanying feature numbers?,0.03846153846153846
Load .xlsx into pandas as string,0.03846153846153846
"Conditionally create an ""Other"" category in categorical column",0.03846153846153846
How do I take rows in Pandas Dataframe and transform into values for a Column?,0.03846153846153846
Splitting dataframe python,0.03846153846153846
Overlaying one dataframe with another and keeping only new or changed rows,0.03846153846153846
Why doesn't the pd.Series replicate the time column?,0.03846153846153846
Pandas read_table with multiple column definitions,0.03846153846153846
pandas How to find all zeros in a column,0.03846153846153846
Make pandas.read_csv() ignore junk at the start of the csv files?,0.03846153846153846
GroupBy in pandas divided by date range,0.03846153846153846
Edit column values based on other column values,0.03846153846153846
Error in GLM model,0.03846153846153846
How do i find the iloc of a row in pandas dataframe?,0.03846153846153846
Sampling from MultiIndex DataFrame,0.03846153846153846
Pandas read_csv adding a leading 0,0.03846153846153846
align timeseries in pandas,0.03846153846153846
converting daily stock data to weekly-based via pandas in Python,0.03846153846153846
HTML IDs for rows of a Pandas Dataframe.to_html() output,0.03846153846153846
"Python: In DataFrame, add value in a new column for row with highest value in another column and string identical in a third one",0.03846153846153846
Calculating cumulative returns with pandas dataframe,0.03846153846153846
Python pandas plotting shift x-axis if twinx two y-axes,0.03846153846153846
Multiindex only some of columns in Pandas,0.03846153846153846
Complex case of filling NaNs in Pandas,0.03846153846153846
Split pandas dataframe index,0.03846153846153846
str_replace_all() r equivalent in python,0.03846153846153846
Python - Pandas - Options,0.03846153846153846
Hierarchical grouping in pandas,0.03846153846153846
"pandas printing `tput: unknown terminal ""emacs""`",0.03846153846153846
A dataframe with two index to json in pandas,0.03846153846153846
Extract dictionary value from column in data frame,0.03846153846153846
Reshaping non-numeric values in pandas dataframe,0.03846153846153846
Sort grouped dataframe based on the time variable colum,0.03846153846153846
Pandas read_csv keeps returning null columns,0.03846153846153846
Python Pandas - Searching two dataframes for matching strings within a specific column,0.03846153846153846
Adding rows to Pandas dataframe,0.03846153846153846
pandas dataframe string formatting with nested arguments (access specified column),0.03846153846153846
Convert string into datetime value using pandas,0.03846153846153846
Multiple aggregation in group by in Pandas Dataframe,0.03846153846153846
why python pandas round results in object,0.03846153846153846
Creating a unique value per row in pandas?,0.03846153846153846
convert yyyy.mm.dd time.stamp to yyyy.mm time stamp in pandas python,0.03846153846153846
Loading Json into Pandas dataframe,0.03846153846153846
Utilize multiple cores for Pandas,0.03846153846153846
how to pick out individual columns of numerical values from Datareader pandas?,0.03846153846153846
Resample withing a specified interval in Pandas?,0.03846153846153846
Analysing Json file in Python using pandas,0.03846153846153846
Pandas error while reading 14 GB csv file on 200 GB RAM workstation,0.03846153846153846
Using pandas TimeStamp with scikit-learn,0.03846153846153846
Pandas DataFrame Window Function,0.03846153846153846
Cohort group condition,0.03846153846153846
pandas.cut with enumerated bins,0.03846153846153846
"python dataframe, get list of start and end of events",0.03846153846153846
Pandas read scientific notation and change,0.03846153846153846
Pandas' pivot_table: Adding % and running % as aggfunc,0.03846153846153846
Python pandas resampling,0.03846153846153846
Pandas dataframes reindex on the union of their respective datetime timestamp indexes,0.03846153846153846
How do I combine two columns within a dataframe in Pandas?,0.03846153846153846
Row wise outlier detection in python,0.03846153846153846
establish begin/end dates via groupby,0.03846153846153846
Pandas DataFrame substring match not working,0.03846153846153846
Collapsing a Multiindex DataFrame for Regression,0.03846153846153846
Pandas reshaping the dataframe,0.03846153846153846
Filtering dataframes in pandas : use a list of conditions,0.03846153846153846
Reindexing Pandas Timeseries by group,0.03846153846153846
Stacked Histograms of Grouped Data In pandas,0.03846153846153846
Counter according to other data and a range,0.03846153846153846
pandas.concat forgets column names,0.03846153846153846
Pandas: Create new column in DataFrame based on other column in DataFrame,0.03846153846153846
numpy equivalent of pandas,0.03846153846153846
how to avoid writing a gross for-loop on a pandas dataframe,0.03846153846153846
how to slice a dataframe having date field as index?,0.03846153846153846
Querying dataframe based on numerical similarities between rows,0.03846153846153846
Pandas groupping values to column,0.03846153846153846
How to get boxplot data for matplotlib boxplots,0.03846153846153846
how to add a value to the next cell with python pandas,0.03846153846153846
How does pandas.shift really work?,0.03846153846153846
How to not sort the index in pandas,0.03846153846153846
python pandas : how to get the primary key after unstack(),0.03846153846153846
xlswriter formatting a range,0.03846153846153846
Reorder Columns Based on a Dictionary,0.03846153846153846
Why does Pandas give me only one SettingWithCopyWarning?,0.03846153846153846
Slow Data analysis using pandas,0.03846153846153846
Python Pandas Compare 2 Large DataFrames of Text for Similarity,0.03846153846153846
Create open bounds indicators from pandas get_dummies on discretized numerical,0.03846153846153846
Accessing data from cartesian list of files,0.03846153846153846
Pandas: read head and middle of a file,0.03846153846153846
Pandas - remove duplicate rows except the one with highest value from another column,0.03846153846153846
"Build stand-alone but composeable ""atomic"" filter functions for a SQL database/Pandas dataframe?",0.03846153846153846
"pandas dataframes merge with same column names, give priority to one",0.03846153846153846
"Pandas pandas.to_datetime(), incorrect parsing",0.03846153846153846
Python AttributeError: 'str' object has no attribute 'DataFrame',0.03846153846153846
Turning a column of strings into a column of integers in Pandas,0.03846153846153846
"In Pandas, how to apply a customized function using Group mean on Groupby Object",0.03846153846153846
Binning pandas dataframe and converting to a JSON,0.03846153846153846
"prediction plots for statsmodels OLS fit, taking out categorical effects",0.03846153846153846
How to convert list to DataFrame?,0.03846153846153846
How can I check the ID of a pandas data frame in another data frame in Python?,0.03846153846153846
Python - Add a column to each dataframe of a Pandas Panel,0.03846153846153846
Filter rows of pandas dataframe whose values are lower than 0,0.03846153846153846
Pandas replace nan with mean value for a given grouping,0.03846153846153846
count unique lists in dataframe,0.03846153846153846
Python Matrix Factorization,0.03846153846153846
networkx graph drawing and connection making,0.03846153846153846
Pandas scatterplot not working as intended,0.03846153846153846
Finding unique elements in cells of pandas DF and expanding DF to include columns with the names of those unique elements,0.03846153846153846
Linear regression from data with missing values and taking their time into account while ploting,0.03846153846153846
Beautifulsoup span id tags to pandas,0.03846153846153846
How to use one date-indexed pandas DataFrame to map over another one?,0.03846153846153846
Errors accessing MultiIndex in DataFrame from spreadsheet,0.03846153846153846
Manual Histogram plot in python,0.03846153846153846
pandas: how to call read_gbq() with non-verbose output,0.03846153846153846
creating DataFramr From list object,0.03846153846153846
Access the row number by its index,0.03846153846153846
why does pandas rolling use single dimension ndarray,0.03846153846153846
Python parse dataframe element,0.03846153846153846
Converting list in panda dataframe into columns,0.03846153846153846
pandas: append new column of row subtotals,0.03846153846153846
How to do a simple groupby in pandas?,0.03846153846153846
split integers in a series by forward slash,0.03846153846153846
Deleting pandas dataframe rows if value in given column not contained in a list,0.03846153846153846
How to find which cells couldn't be converted to float?,0.03846153846153846
Selecting rows from pandas dataframe based on cKDTree indices,0.03846153846153846
How to properly apply a lambda function into a pandas data frame column,0.03846153846153846
Building a numpy array (matrix) from several dataframes,0.03846153846153846
How to parse all the values in a column of a DataFrame?,0.03846153846153846
Using DataFrame.apply with a lambda function to assign returned tuple/list to multiple columns,0.03846153846153846
Group by using Pandas,0.03846153846153846
Plot specific rows of a pandas dataframe,0.03846153846153846
Grouping by multiple parameters using Pandas dataframe,0.03846153846153846
Pandas Multi-Index - Can't convert non-uniquely indexed DataFrame to Panel,0.03846153846153846
Retrieve column names from HDF5 store using Pytables,0.03846153846153846
What would be an elegant solution to managing and getting data from multiple excel files,0.03846153846153846
Changing range of numbers in Python,0.03846153846153846
Dealing with duplicate indexes in pandas DF,0.03846153846153846
axhline affecting plot axis,0.03846153846153846
Getting index from resample in Pandas,0.03846153846153846
How to use pandas isin() to test values on a range of columns in a dataframe,0.03846153846153846
How to sort data frame by column values?,0.03846153846153846
Python Pandas Identify Duplicated rows with Additional Column,0.03846153846153846
Using Python & Pandas to turn flat list into matrix,0.03846153846153846
getting unique date from python dataframe,0.03846153846153846
newlines in double quotes in reading CSV in python,0.03846153846153846
Python - How to Compare a column value of one row with value in next row,0.03846153846153846
Pandas dataframe and to_numeric: select column by index,0.03846153846153846
Python PyTd teradata Query Into Pandas DataFrame,0.03846153846153846
Pattern search in pandas.dataframe.query(),0.03846153846153846
Pandas Series: Log Normalize,0.03846153846153846
The best way to perform time gap analysis with Pandas?,0.03846153846153846
Does adding column to a DataFrame involve copying data?,0.03846153846153846
Adding an extra index to Pandas DataFrame,0.03846153846153846
filter two dataframes according to their common index,0.03846153846153846
Python - IF for a column in panda dataframe,0.03846153846153846
Fit a curve to the boundary of a scatterplot,0.03846153846153846
How to get rows of a tsv file with common values in one of the columns using pandas?,0.03846153846153846
Pandas .asfreq is giving a repeated index error,0.03846153846153846
Python/Pandas Dataframe replace 0 with median value,0.03846153846153846
How to force dtype to integer in dataframe,0.03846153846153846
selecting row with multi index,0.03846153846153846
Drop row pandas with a list of argument,0.03846153846153846
python For loop to add lines of code at run time based on cells in a csv,0.03846153846153846
Pandas read_fwf ignores columns,0.03846153846153846
dictionary returns none when there should be a value python,0.03846153846153846
Remove spikes from signal in Python,0.03846153846153846
Selecting csv row with the highest column value among rows with the same value of another column in python,0.03846153846153846
How to create a new column using values from existing column in a daframe,0.03846153846153846
Python: Replace dataframe values row by row,0.03846153846153846
Backtesting with Data,0.03846153846153846
Pandas read_csv dtype specify all columns but one,0.03846153846153846
How to compare multiple rows from same column in DataFrame,0.03846153846153846
Python Pandas: Find index based on value in DataFrame,0.03846153846153846
Cleaning date and time records in python pandas,0.03846153846153846
Plotting Multiple Data Frames on one axis,0.03846153846153846
Load large data without iterators or chunks,0.03846153846153846
Python pandas apply date_range onto two columns,0.03846153846153846
Equivalent for str.join in pandas,0.03846153846153846
convert numeric sas date to datetime in Pandas,0.03846153846153846
Pandas concat dictionary to dataframe,0.03846153846153846
How to convert an excel file data into numpy array using pandas?,0.03846153846153846
Pandas indexing confusion,0.03846153846153846
How to combine multiple rows into a single row with pandas,0.03846153846153846
Organizing DataFrame Columns into MultiIndex,0.03846153846153846
How to make assignment to hierarchical column of pandas dataframe using boolean mask?,0.03846153846153846
Splitting lists into columns,0.03846153846153846
Python: data frame error from lambda expression,0.03846153846153846
"How do I add an hour ""column"" to a datetime series with only minutes and seconds",0.03846153846153846
Pandas modify column with groupby results while ignoring some values,0.03846153846153846
Efficient replace value by value in other column,0.03846153846153846
"mysql,how to back up data to another machine",0.03846153846153846
Inconsistent Immutability of Python Index,0.03846153846153846
PyInstaller and Pandas error: pyi_rth_qt4plugins returned -1,0.03846153846153846
parallel processing in pandas python,0.03846153846153846
How to increment dataframe with pandas?,0.03846153846153846
Applying a function to a pandas col,0.03846153846153846
pandas data and scikit learn,0.03846153846153846
Coordinates from UTM to Latitude and Longitude in pandas,0.03846153846153846
Python Normalising a list of numbers failing/Pandas normalise row by row,0.03846153846153846
"Iterate through Pandas DataFrame, use condition and add column",0.03846153846153846
Python Pandas Shift Dataframe Column Down Into Rows (reset index on column?),0.03846153846153846
Get business days between consecutive rows pandas,0.03846153846153846
Syntax error in pandas - referring column with space and parenthesis,0.03846153846153846
Pandas pivot table with mean,0.03846153846153846
Operating on pandas dataframes that may or may not be multiIndex,0.03846153846153846
Pandas dataframe groupby,0.03846153846153846
NameError name 'var' not defined in IF statement,0.03846153846153846
How to apply a pre-condition to GroupBy or how to ignore groups with one record in GroupBy,0.03846153846153846
Identify intersection of multiple lists using multiple files from an input,0.03846153846153846
Apply two filter conditions on python pandas dataframe groupby,0.03846153846153846
read data having a column with more than 1 entry,0.03846153846153846
Getting my def function to apply.() to my stocks,0.03846153846153846
Performance of custom function while using .apply on Pandas Dataframes,0.03846153846153846
how i can fetching data in this array and if condition for make it be an cluster with minimum distance in python?,0.03846153846153846
