Title,Correlation Score
How do I resample a long time series of months and years to a single average (probably non existing) year with monthly averages?,0.07799145299145299
Conditional imputation with average of non-missing columns with pandas toolbox,0.07330703484549637
Averaging list of pandas dataframes where which rows should be averaged depend on condition,0.07330703484549637
pandas concat inner join: a join with an empty DataFrame does not yield an empty DataFrame,0.07264957264957263
How can I find the average of every next 4 values in a single column (Dataframe) and put every average found in a column in a dataframe?,0.07117028270874423
How to add columns with the average percent and average count to the dataframe?,0.07117028270874423
Column in pandas conditional on average of other columns,0.07117028270874423
How to separate a numpy array into separate columns in pandas,0.07059195948084834
Average of aggregated value by month and boxplot average differs on pandas data frame,0.06982744718593772
Pandas: How to calculate average one value to after another (succeeding average),0.0690335305719921
"sklearn train_test_split: where to add average=None when we get: ""Target is multiclass but average='binary'... error?",0.0690335305719921
"pandas dataframe: finding average of weight for average age samples, group them by gender",0.0690335305719921
Conditional Count over Columns with average calculations over results,0.0690335305719921
How get Conditional average on date in DataFraem?,0.0690335305719921
Get average of a list of times and compare average to a goal time,0.0690335305719921
"Pandas DataFrame- create a 14 day moving average, but show simple averages for the first 14 days of data?",0.06773101112723752
"Tradingview pinescript's RMA (Moving average used in RSI. It is the exponentially weighted moving average with alpha = 1 / length) in python, pandas",0.06773101112723752
Hourly average for each week/month in dataframe (moving average),0.06773101112723752
Conditional Sum/Average/etc... CSV file in Python,0.06689677843523997
"How to choose two rows in a dataframe, calculate the average of both values in each columns and add the new row with the averages in the dataframe",0.06689677843523997
Averaging values across rows and columns conditional on values in other columns with pandas,0.06689677843523997
Pandas Average If in Python : Combining groupby mean with conditional statement,0.06689677843523997
"Calculate average of a column in two dataframes, then plot the averages of each dataframe in a barplot with a specific label?",0.06689677843523997
"Conditional average of values in a row, depending on data qualifiers",0.06689677843523997
"Python How to compute multiple averages from a single column, selecting the rows to average based on values in another column",0.06689677843523997
Python - Storing the average of from files in loop; and then finding global average outside of loop?,0.06689677843523997
mplfinance moving average gaps and exponential moving averages,0.06689677843523997
How to get the average of average of a column of list of lists as string data type?,0.06689677843523997
how to do Backward moving average and Simple Moving average?,0.06689677843523997
Pandas Series Groupby Month and Day Average for All Years,0.06563457506853732
Pandas Conditional Aggregation and Non Conditional Aggregation together,0.06476002629848784
Moving average conditional to other column,0.06476002629848784
"In a pandas DataFrame with readings for multiple systems, how can I calculate daily averages and select the most recent average for each system",0.06476002629848784
How can I generate a conditional rolling average?,0.06476002629848784
Pandas Three Month Moving Average with nulls,0.06476002629848784
Pandas conditional average by groups,0.06476002629848784
"Try and give a grouped (by two variables) average, and if not possible give column average in python pandas",0.06476002629848784
How to take average first 10 150 rows of column and use average value as first value of column and second value of column start from row 151,0.06476002629848784
How to calculate the average while containg np.nan using np.average? (While using groupby),0.06476002629848784
"Average of up to X values, in turn averaged with the last value?",0.06476002629848784
"Moving average by column / year - python, pandas",0.06476002629848782
How to compare average value from recent 2 weeks to average of previous 6 weeks by group,0.06353813900983711
Get average of months over years,0.06353813900983711
moving average on previous calculated moving average,0.06353813900983711
How to draw a bar plot which shows average daily values for each month grouped by year?,0.06324786324786323
Finding the average of values in a column and create a new dataframe that distributes the average,0.0626232741617357
pandas - create new columns based on existing columns / conditional average,0.0626232741617357
Average values in same month python,0.06262327416173569
Average of each day over multiple years,0.06262327416173569
Calculate the average between the same month in a time series,0.0614417029511369
Average of daily count of records per month in a Pandas DataFrame,0.06048652202498356
Create a column that is a conditional smoothed moving average of another column in python,0.06048652202498356
Replace future months forecast with moving average python,0.06048652202498356
How to forecast future data based off 5 year average?,0.06048652202498356
Pandas dataframe average for each row conditional on dates,0.06048652202498356
To find average of data of month end date only using pandas,0.06048652202498356
Average True Range and Exponential Moving Average Functions on PandasDataSeries needed,0.06048652202498356
Finding historical seasonal average for given month in a monthly series in a dataframe time-series,0.06048652202498356
Retrieving the average of averages in Python DataFrame,0.06048652202498356
Calculate average for each quarter given month columns,0.06048652202498356
How to get the average of a group every 9 years,0.06048652202498355
use pandas to get 3 years average in the same row,0.06048652202498355
Pandas Groupby Season and Year Average Column,0.06048652202498355
"Iterate over each day, calculate average price of first and last 3 hours and take difference of those averages in Python",0.06030389363722696
Python - produce conditional average of variable 1 based on variable 2 with numpy?,0.05934526689243669
Pandas: Combine and average data in a column based on length of month,0.05934526689243669
"Add data with conditional INNER JOIN, but add conditional",0.05934526689243669
Conditional Moving Average,0.05834976988823143
Pandas: Finding average values of dataframe by hour & month,0.05834976988823141
"Get average data based on date, week, month",0.05834976988823141
How to calculate moving average using pandas for a daily frequency over 3 years,0.05834976988823141
Python Pandas Average by Location and Date/Month,0.05834976988823141
How to plot average of values for a year,0.05834976988823141
Getting the average of a certain hour on weekdays over several years in a pandas dataframe,0.05834976988823141
How to find a 10 year average of a column in a data frame?,0.05834976988823141
Time average of a given hourly period over months,0.05834976988823141
finding average for the same date in different years,0.05834976988823141
How to plot average value per month?,0.05834976988823141
"Rolling Average last 28 days, but return data for yesterday",0.05731523378582205
How to perform rolling average on a dataframe in python?,0.05731523378582205
Calculate average of n number of days from reference date,0.05731523378582205
Rolling averages on groups,0.05731523378582205
Exception thrown while calculating Exponential moving average using pandas,0.05731523378582205
Taking the average of values from a range of rows in a pandas dataframe,0.05731523378582205
Average of certain hours,0.05731523378582205
"Python max. 3 values, average and ploting",0.05731523378582205
Conditional Calculation in pandas,0.05731523378582205
calculating average distance of nearest neighbours in pandas dataframe,0.05731523378582205
Exponentially weighted running mean (moving average) using Pandas,0.05731523378582205
Conditional counting across a row in pandas when matching a string,0.05731523378582205
Fill NaN values in a column w/ column average,0.05731523378582205
Combine two pandas dataframes with two conditionals,0.05731523378582205
how to find exponential weighted moving average using dataframe.ewma?,0.05731523378582205
How do I sum and average rows for a panel dataset in Pandas?,0.05731523378582205
How to obtain the lagged monthly average value in pandas,0.05731523378582205
Pandas computer hourly average and set at middle of interval,0.05731523378582205
Need Moving Average Height in OHLC data without creating additional column,0.05731523378582205
"Python Pandas : group by in groups by and average, count, median",0.05731523378582205
Plot average on subplots (pandas),0.05731523378582205
"GroupBy functions in Python Pandas like SUM(col_1*col_2), weighted average etc",0.05731523378582205
How to make this conditional column in pandas?,0.05731523378582205
how to calculate row average in panda data frame?,0.05731523378582205
How to optimize conditional cumsum of multiple column,0.05731523378582205
Pandas - Find rolling average of past 3 days,0.05731523378582205
"How would I take a row-wise average values for certain columns, while retaining other in my dataframe?",0.05731523378582205
How to add conditional columns to pandas df,0.05731523378582205
Finding the average time of pandas column,0.05731523378582205
Find The Moving Average for Amount of Last 30 Days for each user Pandas Dataframe,0.05731523378582205
Calculate average based on available data points,0.05731523378582205
Averaging by one column that has NaNs,0.05731523378582205
Add new column to dataframe based on an average,0.05731523378582205
Wrong result with moving average cross over,0.05731523378582205
Resampling a timeseries data forward average pandas,0.05731523378582205
"How to write the internal layers 1 & 2 with their respective average absolute error percentage for a adding model, into a CSV file",0.05731523378582205
Pandas DataFrame compute average across groups,0.05731523378582205
weighted moving average in pandas - having trouble implementing,0.05731523378582205
calculate duplicate average python,0.05731523378582205
Windowed average in pandas,0.05731523378582205
Pandas - Averaging entries in specific row and column,0.05731523378582205
"python, pandas, find average prices of the top four brands, dataframe",0.05731523378582205
Python: Creating New Column Based on Conditional Function of Another Column and Row,0.05731523378582205
Pandas Grouping by Hostname. Average of Sessions(on host) by Hour,0.05731523378582205
Yearly summations and monthly averages with Pandas,0.05731523378582205
Average of two timestamps in python,0.05731523378582205
Pandas: Resample data by taking a weighted average of the top nth percentile of data within the resample window,0.05731523378582205
Average in dataframes with subsets of rows - Python,0.05731523378582205
Binning Pandas column values by standard deviation centered on average?,0.05731523378582205
For Loop to determine weighted average python,0.05731523378582205
Calculate average of two columns based on the availability data (missing or NaN value of those columns) in pandas,0.05731523378582205
Pandas : finding the average of values within a particular limit in a column,0.05731523378582205
Need help comparing datetime objects derived from a dateframe in a conditional statement,0.05731523378582205
Plot moving average with data,0.05731523378582205
Generating Average based on user interactions in pandas dataframe,0.05731523378582205
How to replace NaN values in a column A with respect to average value that is related to column B?,0.05731523378582205
Sum df columns for weighted average,0.05731523378582205
Pandas cumulative conditional sum by dates,0.05731523378582205
Create columns for certain names with the average for each day,0.05731523378582205
Average Data in all Rows that Meet a Condition for every X Rows in a Pandas Dataframe,0.05731523378582205
Adding simple moving average as an additional column to python DataFrame,0.05731523378582205
Python Pandas - Comparing average mean values on a column based in answers in another column,0.05731523378582205
Python Optimization Moving Average,0.05731523378582205
Conditional extraction of a substring from a string,0.05731523378582205
Using Pandas to calculate December-January-February average,0.05731523378582205
Calculate weighted average based on 2 columns using a pandas/dataframe,0.05731523378582205
pandas element wise conditional return index,0.05731523378582205
Pandas Moving Average on Date,0.05731523378582205
Weighted average with condition,0.05731523378582205
"How to say ""if elements in the same column are the same, then calculate the average of corresponding values"" in pandas",0.05731523378582205
Pandas groupby multiple columns take average of another based on condition,0.05731523378582205
Separate out weeks in a year and calculate averages in a dataframe,0.05724883083373648
Take the difference in dates in months and Average in Python,0.05724883083373648
How to take moving average of streaming data and take difference of consecutive moving average in python,0.05724883083373648
How to get moving average of past months in Pandas,0.05621301775147929
"Replacing Nan values and blank cells with ""0"" in excel. my code also replaced text with ""0""",0.05621301775147929
Pandas Groupby Consistent levels even if empty,0.05621301775147929
"Python pandas.readexcel(filepath, header=[0,1]) fails when row 3 has data longer than header length. Any suggestion of fix is welcome",0.05621301775147929
"ValueError: The truth value of a Series is ambiguous. Use a.empty, a.bool(), a.item(), a.any() or a.all",0.05621301775147929
Load tables from excel sheets with both multilevel column data frames and single level column data frames,0.05621301775147929
How to count the number of upper case words more than 1 character long in series,0.05621301775147929
Aggregate based on each item in a special character seperated column in Pandas,0.05621301775147929
"Why my code to plot is not showing the output with the titles, xlabel and ylabel?",0.05621301775147929
Why is the code running so slow that I use for loop in it. Is there a faster way?,0.05621301775147929
"Error The truth value of a DataFrame is ambiguous. Use a.empty, a.bool(), a.item(), a.any() or a.all()",0.05621301775147929
In Python remove all stop words bad characters from my pandas dataframe,0.05621301775147929
Get average number of days per year greater than a daily mean value with Pandas/Python,0.05621301775147929
Averaging over specific months in pandas,0.05621301775147929
Why can all dataframe columns be accessed in the series passed to the aggregating function when using DataFrameGroupBy.agg?,0.05621301775147929
Passing a variable through URL using a list in Excel,0.05621301775147929
Faster way to remove punctuations and special characters in pandas dataframe column,0.05621301775147929
Conditional average of columns based on two dataframes,0.05621301775147929
Pivottable (2 levels) NaN not showing,0.05621301775147929
How to import csv with multi level column index,0.05621301775147929
Sort dataframe by string length,0.05621301775147929
sorting pandas dataframe by column alphabetically after first 4 characters,0.05621301775147929
convert a dict to sorted dict in python,0.05621301775147929
average value of transactions per month,0.05621301775147929
"Using ""and"" operation on duplicate method in Pandas Dataframe",0.05621301775147929
Is there a way to remove invalid characters in Excel?,0.05621301775147929
Appending lists of words or characters from all rows in a dataframe,0.05621301775147929
Pandas sorting by group aggregate,0.05621301775147929
How to remove illegal characters so a dataframe can write to Excel,0.05621301775147929
Average hourly week profile for a year excluding weekend days and holidays,0.05621301775147929
How to calculate the average values of a year from quarterly data?,0.05621301775147929
Web-scraping w/ Python: make my web scraping code faster?,0.05621301775147929
Determine average for different years in one dataset,0.05621301775147929
"Value Error : The truth value of a Series is ambiguous. Use a.empty, a.bool(), a.item(), a.any() or a.all()",0.05621301775147929
Visual Studio Code runs extremely slow when I import any library such as Pandas,0.05621301775147929
"Python, x-axis title is overlapping the tick labels in matplotlib",0.05621301775147929
Removing special characters from column headers,0.05621301775147929
How to make Dash app run faster if its slowed by large data imported,0.05621301775147929
Error when using Pandas to read dates from Excel file and sort them,0.05621301775147929
What is happening when one provides a pandas Series object as an index to another pandas Series object?,0.05621301775147929
Removing multiple headers in a single excel sheet,0.05621301775147929
How to improve performance with looping dict.items() python pandas?,0.05621301775147929
matplotlib error : loop of ufunc does not support argument 0 of type float which has no callable rint method,0.05621301775147929
how to apply moving average functions for multivariate time series models,0.05621301775147929
How to pass list of custom functions to pandas.Dataframe.aggregate,0.05621301775147929
Writing multiple data frames to multiple excel sheets but they turn up empty,0.05621301775147929
how can I upload a 4 multi index level row hierarchy from excel into a pandas dataframe?,0.05621301775147929
Pandas: Reshape OneHot-Encoded arrays into same length,0.05621301775147929
Skip columns pandas/multiple empty lists separated by comma,0.05621301775147929
How to use Pandas to take multi year average in Python,0.05621301775147929
Panda Dataframe from Dict with different length value,0.05621301775147929
Reading multiple row headers in a excel using Pandas,0.05621301775147929
How to get unique values from pandas series using aggregate method?,0.05621301775147929
Python spider show row elements of data frame while write empty line on file,0.05621301775147929
calculate average with same month at time n-1 over several dataframe with unequal indexing size,0.05621301775147929
"The truth value of a Series is ambiguous. Use a.empty, a.bool(), a.item(), a.any() or a.all(). - rolling sum, using & does not resolve it",0.05621301775147929
"if condition resulting in The truth value of a Series is ambiguous. Use a.empty, a.bool(), a.item(), a.any() or a.all()",0.05621301775147929
"How to Include empty values to list, that can be used (not losing its length) for a dataframe?",0.05621301775147929
Have to map a list of lists to another list that has same length and write to excel in python,0.05621301775147929
Creating a Pandas DataFrame from list of dictionaries? Each dictionary as row in DataFrame?,0.05621301775147929
ValueError: Item wrong length 0 instead of 150. while extracting the values from dataframe,0.05621301775147929
How to extract all ints within x characters of a word?,0.05621301775147929
"How to aggregate pandas dataframe timestamps columns from days to years, calculating weighted average",0.05621301775147928
Python Employee heirarchy recursive function Error: # construct an ordered dict to store the result,0.05621301775147928
Why is Jupyter showing charts twice?,0.05621301775147928
Ascending order sorting in Dataframe-Pandas after GroupBy,0.05621301775147928
Pandas DataFrame.unstack() Changes Order of Row and Column Headers,0.05621301775147928
"Sort a dataframe by day, but excluding the year",0.05621301775147928
Average of last 13 months for each record in pandas,0.05621301775147928
Calculate average of previous records without using 'for' loops in python data frame,0.05621301775147928
"For each NAME, calculate the average SNOW for each month",0.05621301775147928
Numpy Average with condition Syntax error,0.05621301775147928
Multiindex data.frame from two data.frames join by column headers,0.05621301775147928
12 month moving average from python,0.05621301775147928
Grouping and sorting by Month in a dataframe,0.05621301775147928
Weighted average grouped by country and year,0.05621301775147928
How can I execute a full outer join on two DataFrames and still preserve the relative order of the elements?,0.05621301775147928
"How to use ordered categorical columns in keras (""could not convert string to float: 'CATEGORY'"")",0.05621301775147928
Sorting Pandas Dataframe by order of another index,0.05621301775147928
Can someone explain this piece of code for identifying difference between two dataframes?,0.05621301775147928
Conditionally sort a single column in ascending and descending order in Pandas,0.05621301775147928
Sorting a pandas DataFrame by one level of a MultiIndex,0.05621301775147928
"find mean batting average (""Ave"") and total number of centuries by country but only including records for which starting year is 2010 or later",0.05621301775147928
Pandas: Fill missing values in multiple time-series by the weighted average of previous time steps,0.05621301775147928
Get the average mean of entries per month with datetime in Pandas,0.05621301775147928
"Sorting two columns of a dataframe in Python/pandas, one in reverse order",0.05621301775147928
AWS Lambda Deployment Package minute code change need every time update,0.05621301775147928
Calculating daily average from irregular time series using pandas,0.05621301775147928
How to place pandas data frame header names in a specific order?,0.05621301775147928
Year to date average in dataframe,0.05621301775147928
How to join/merge/concat an filled dataframe with an empty dataframe by index and columns?,0.05621301775147928
"Filter grouped Pandas data frame by column aggregate, when groups are from a MultiIndex level",0.05621301775147928
Crate and append rows based on average of previous rows and condition columns,0.05621301775147928
How to make the horizontal axis of a chart show dates,0.05621301775147928
"How to group a dataframe by multiple columns, sum and sort the totals in descending order?",0.05621301775147928
Python: read an Excel file using Pandas when the file has special characters in column headers,0.05515239477503629
Pandas - Importing multiple worksheets from one excel file with header in one worksheet,0.05515239477503629
split dataframe by empty row and reshape by headers,0.05515239477503629
Renaming special characters in column headers after pivoting,0.05515239477503627
Use Pandas to take Monthly Averages of data in a .csv file and save by Year in new .csv file,0.05515239477503627
remove an item form levels of pivot data frame at pandas,0.05515239477503627
How to 'split' a pandas df column based on conditional and pivot the df,0.05515239477503627
"How to pause Python code and constantly check a specific Excel cell, and when it is non-empty then continue with rest of code",0.05515239477503627
Change Order on X-Axis for Matplotlib chart,0.05515239477503627
Calculating average for each row of a filtered dataframe,0.05513658454834928
How to incrementally take average in Oracle SQL Or Python,0.05513658454834928
How to fill age with average age according to sex in Titanic data set?,0.05513658454834928
Getting the average from a dataframe consisting of pandas timestamp,0.05513658454834928
Pandas: How to average rows with two columns having similar id's?,0.05513658454834928
Taking average between two values in pandas Data frame,0.05513658454834928
How to do conditional compare in pandas like this?,0.05513658454834928
Using conditional rolling count with a group by in python,0.05513658454834928
How to calculate cumulative sum and average on file data in python,0.05513658454834928
conditional fill in pandas dataframe,0.05513658454834928
"Pandas: Dataframe Calculation - New Rows with Division, New Columns with Sums and Averages",0.05513658454834928
How to calculate average values of columns by bins?,0.05513658454834928
Python to get average oh hourly data,0.05513658454834928
Average function excluding value for each row in Pandas DataFrame,0.05513658454834928
Python EWM(Expential Weighted Moving Average) with filtered condition in pandas,0.05513658454834928
Pandas replace zero as the nearest average non-zero value,0.05513658454834928
How to find customized average which is based on weightage including handling of nan value in pandas?,0.05513658454834928
How to calculate moving average incrementally with daily data added to data frame in pandas?,0.05513658454834928
How do you take a dataframe of daily data and merge it with a dataframe of weekly/monthly/yearly averages?,0.05513658454834928
Average Pandas Dataframe by Date,0.05513658454834928
how do I calculate average value of columns of a file in Python?,0.05513658454834928
Conditional change value in cell in pandas dataframe,0.05513658454834928
How to find values below (or above) average,0.05513658454834928
pandas weighted average using .resample() and .groupby() problems,0.05513658454834928
Rolling Average Home and Away,0.05513658454834928
Average Dataframe using Summary Information,0.05513658454834928
"TypeError: No loop matching the specified signature and casting was found for ufunc add, when using np.average",0.05513658454834928
how to fill missing values with average of each column,0.05513658454834928
How to fill in average of a column given condition in row,0.05513658454834928
How can I predict next value using moving average/rolling mean,0.05513658454834928
