Title,Correlation Score
Pandas Converting columns to different dtypes,0.03846153846153846
"Pandas-ipython, how to create new data frames with drill down capabilities",0.03846153846153846
Scikit-learn balanced subsampling,0.03846153846153846
Keyerror in Pandas 0.13.1 and python 2.7.6,0.03846153846153846
Python pandas to_json() invalid format,0.03846153846153846
Pandas merge 2 databases based on 2 keys,0.03846153846153846
Python pandas - particular merge/replacement,0.03846153846153846
Python bcolz how to merge two ctables,0.03846153846153846
How to select range in Pandas using a row,0.03846153846153846
Calling Pandas Data Frames Created with globals() Inside For Loop,0.03846153846153846
Binning in Pandas,0.03846153846153846
PANDAS: Extracting values from a column by applying a condition on other columnns,0.03846153846153846
DataFrame constructor not properly called! error,0.03846153846153846
Multi column join in pandas from groupby,0.03846153846153846
Combined multiple Indicator Columns,0.03846153846153846
How to read data in paragraph form in python/pandas?,0.03846153846153846
Python Pandas Append List of Dataframes,0.03846153846153846
"Python 3.4, error when creating a DataFrame with panda",0.03846153846153846
Why can't I freeze_panes on the xlsxwriter object pandas is creating for me?,0.03846153846153846
What happens when you compare 2 pandas Series,0.03846153846153846
python pandas: groupby apply function looks at prior rows,0.03846153846153846
ValueError: Unknown format code 'f' for object of type 'str' - why do I get this the second time but not the first time?,0.03846153846153846
Merge two DataFrames with some equal columns,0.03846153846153846
Conditional NaN Filling,0.03846153846153846
dataframe boolean selection along columns instead of row,0.03846153846153846
How to get the firs row from each group-by object of pandas also for columns containing strings?,0.03846153846153846
"Read csv with ""^"" + character delimiter with the C engine",0.03846153846153846
Non-reducing variant of the ANY() function that respects NaN,0.03846153846153846
shift columns of a dataframe without looping?,0.03846153846153846
Performance reading large SPSS file in pandas dataframe on Windows 7 (x64),0.03846153846153846
Sort DataFrame index that has a string and number,0.03846153846153846
Fill pandas Panel object with data,0.03846153846153846
Append sum to a DataFrame,0.03846153846153846
python pandas not reading first column from csv file,0.03846153846153846
Pandas DataFrame group by value and get column & row indexes,0.03846153846153846
pandas bdate_range doesn't recognize Memorial day as a holiday,0.03846153846153846
Pandas Dataframe display on a webpage,0.03846153846153846
Python: Round time to the nearest second and minute,0.03846153846153846
"How to group data by each two (3,7) hours groups in pandas?",0.03846153846153846
Pandas append filtered row to another DataFrame,0.03846153846153846
Can Pandas export a .csv with column-specific quoting?,0.03846153846153846
how to forward fill non-null values in a pandas dataframe based on a set condition,0.03846153846153846
Adding row to pandas DataFrame changes dtype,0.03846153846153846
how to append/insert an item at the beginning of a series?,0.03846153846153846
creating multiple excel worksheets using data in a pandas dataframe,0.03846153846153846
safest way to read missing dates with pandas read_csv--given blank space turns in today's date bug,0.03846153846153846
All Pandas Data Types,0.03846153846153846
How can I use apply with pandas rolling_corr(),0.03846153846153846
Python plotting points on a city map,0.03846153846153846
Pandas DataFrame ApplyMap method,0.03846153846153846
How to get ranked values of a pandas column without gaps?,0.03846153846153846
Getting the names of all the columns and number of rows in a data frame with Python Pandas,0.03846153846153846
"Data being read as one dimensional but is not - ""ValueError: need more than 1 value to unpack""",0.03846153846153846
Remove phrase from some elements in pandas data frame,0.03846153846153846
Selecting data from an HDFStore by floating-point data_column,0.03846153846153846
Group by value of sum of columns with Pandas,0.03846153846153846
Neat inter-row calculations within pandas DataFrame with MultiIndex,0.03846153846153846
Resolving Reindexing only valid with uniquely valued Index objects,0.03846153846153846
Python Pandas Strange Groupby Behavior depending on boolean criteria and merging,0.03846153846153846
"Counting observations after grouping by dates in pandas, when dates are non-unique",0.03846153846153846
Distributing a pandas DataFrame feature at random,0.03846153846153846
Expand a column holding iterables into rows,0.03846153846153846
why does pandas.to_csv write floats for integers?,0.03846153846153846
Selection in Multi-Indexed DataFrame when key does not exists,0.03846153846153846
Simple boolean indexing gives AssertionError: Cannot create BlockManager,0.03846153846153846
Unexpected behavior in pandas mad() with groupby(),0.03846153846153846
Pandas: Plot data against lagged variable,0.03846153846153846
Pandas error with basemap/proj for map plotting,0.03846153846153846
View A Pandas Cell If A Different Cell Is X,0.03846153846153846
Pandas memory error,0.03846153846153846
Pandas - select values from a groupby object,0.03846153846153846
Set value multiindex Pandas,0.03846153846153846
How to write DataFrame to postgres table?,0.03846153846153846
Pandas: copy structure and set all elements,0.03846153846153846
Dataframe creation with weekdays or adding week days,0.03846153846153846
Pandas to sum and group by date index,0.03846153846153846
How to deal with SettingWithCopyWarning in this case,0.03846153846153846
Pause Python program on the fly (and resume),0.03846153846153846
Annotating gracefully pandas plot with texts that do not overlap,0.03846153846153846
how to selectively filter elements in pandas group,0.03846153846153846
Pandas: how to write csv file using data from a dataframe as part of path/filename,0.03846153846153846
Pandas converting String object to lower case and checking for string,0.03846153846153846
How to check if there exists a row with a certain column value in pandas dataframe,0.03846153846153846
pandas.read_sql processing speed,0.03846153846153846
Exception Handling in Pandas .apply() function,0.03846153846153846
"Pandas long to wide reshape, by two variables",0.03846153846153846
Get maximum of value_counts after groupby,0.03846153846153846
Finding the category with highest proportion meeting a criterion in Pandas,0.03846153846153846
vlookup with a condiition in pandas,0.03846153846153846
python pandas create dataframe and force multiple column types,0.03846153846153846
Convert Pandas Column to DateTime II,0.03846153846153846
Python pandas multiple conditions,0.03846153846153846
Trying to iterate and join Pandas DFs: AttributeError: 'Series' object has no attribute 'join',0.03846153846153846
I'm retrieving a pandas data using pd.read_csv to csv.writer and its giving errors,0.03846153846153846
Jupyter notebook display two pandas tables side by side,0.03846153846153846
Tensorflow error: Invalid argument: shape must be a vector,0.03846153846153846
Groupby with conditions in pandas,0.03846153846153846
Averaging pandas dataframes from certain columns,0.03846153846153846
Drop all rows before first occurrence of a value,0.03846153846153846
plot multiple columns on one axis python,0.03846153846153846
Decided the order of the groupby output?,0.03846153846153846
Strange results from timedelta with pandas,0.03846153846153846
Pandas: filtering rows from data based on multiple criteria using ~mask,0.03846153846153846
plotting histograms in pandas,0.03846153846153846
How to feature-ize timeseries data in Pandas?,0.03846153846153846
"what does "" ...:"" mean in Ipython console anaconda?",0.03846153846153846
"Pandas + SQLite ""cannot use index"" error",0.03846153846153846
Python pandas make new column from data in existing column and from another dataframe,0.03846153846153846
HDFStore: Select if column is in array,0.03846153846153846
Highlight specific points in matplotlib scatterplot,0.03846153846153846
Multi-indexing - accessing the last time in every day,0.03846153846153846
Extracting tables from website,0.03846153846153846
Writing large Pandas Dataframes to CSV file in chunks,0.03846153846153846
Counting number of links for each row and adding the counts as a new column,0.03846153846153846
Pandas: replace values in dataframe,0.03846153846153846
Detecting events in a pandas data frame,0.03846153846153846
Pandas changing cell values based on another cell,0.03846153846153846
Select rows from a pandas dataframe where two columns match list of pairs,0.03846153846153846
Pandas Seaborn Heatmap Error,0.03846153846153846
"Pandas dataframe .stack() ""cannot reindex from a duplicate axis""",0.03846153846153846
Set Union in pandas,0.03846153846153846
Pandas: Create dataframe column based on other dataframe,0.03846153846153846
Adding new columns to data frame based on the values of multiple columns,0.03846153846153846
Pandas: df.mul vs df.rmul,0.03846153846153846
Unable to merge multiIndexed pandas dataframes,0.03846153846153846
"""CSV file does not exist"" for a filename with embedded quotes",0.03846153846153846
Error converting Pandas Dataframe to Spark Dataframe,0.03846153846153846
How do I apply the decay factor in VaR (Value at Risk) using pandas,0.03846153846153846
Extracting information from multiple JSON files to single CSV file in python,0.03846153846153846
Pandas: change values in column,0.03846153846153846
Convert '%m/%d/%Y' string index into pandas datetime index,0.03846153846153846
Dynamically Splitting Rows in dataframe,0.03846153846153846
incorrect date format when writing df to csv pandas,0.03846153846153846
Using slices in Python,0.03846153846153846
How to change multiple Pandas DF columns to categorical without a loop,0.03846153846153846
Stacking a pair of columns by looking at the first column,0.03846153846153846
alpha & beta (for linear regression) calculations output nan?,0.03846153846153846
Python - Count consecutive frequencies by group,0.03846153846153846
"slice df where column looks like [(A, 3), (-A, 1), (-C, 4)] using criteria like all rows such that A>5 etc",0.03846153846153846
How to modify cells in a pandas DataFrame?,0.03846153846153846
Removing rows with non-unique values across the columns in Pandas,0.03846153846153846
Pandas bin and count,0.03846153846153846
"Binning by value, except last bin",0.03846153846153846
Ascending/Resetting Integer Values from MultiIndex Pandas,0.03846153846153846
pandas column selection: non commutative bitwise OR when selecting on str and NaN,0.03846153846153846
Exporting list of pandas dataframes to csv with list comprehension,0.03846153846153846
Box plots in pandas - beginner's difficulty,0.03846153846153846
"How do I stack rows in a Pandas data frame to get one ""long row""?",0.03846153846153846
Append dataframe in for loop,0.03846153846153846
Pandas: Rolling sum with multiple indexes (i.e. panel data),0.03846153846153846
Reading binary file with specific sequence in Python,0.03846153846153846
DataFrame in list boolean?,0.03846153846153846
Pandas to_sql to sqlite returns 'Engine' object has no attribute 'cursor',0.03846153846153846
pandas get index of highest dot product,0.03846153846153846
pandas groupby resample unexpected result,0.03846153846153846
Pandas Dataframe - Isolating values,0.03846153846153846
Merging Two Pandas Data-frames where two sets of criteria are met (VLOOKUP EQUIVALENT),0.03846153846153846
How to manipulate this Dataframe in pandas,0.03846153846153846
Pandas: Create a new Data Frame using multiple GroupBy results,0.03846153846153846
Plotting based on groupby,0.03846153846153846
Xlsxwriter different formats to different cells in same column,0.03846153846153846
Memory error in pandas,0.03846153846153846
Fill nulls in columns with non-null values from other columns,0.03846153846153846
Pandas Dataframe: Splitting a list of predictions into dataframe columns,0.03846153846153846
Error when try writing to excel,0.03846153846153846
exporting Python model results,0.03846153846153846
Calculating cosine similarity across column in pandas,0.03846153846153846
Get by condition column values,0.03846153846153846
Calling agg without first calling groupby,0.03846153846153846
Combine multiple .csv files with python from different directory paths,0.03846153846153846
General Script to Concatenate Series of DataFrames,0.03846153846153846
Unable to install pandas in python 3.5.1 in command prompt,0.03846153846153846
How to remove % symbol for particular column in dataframeusing python pandas?,0.03846153846153846
compare dataframes by values,0.03846153846153846
How to read text file with uneven number of columns with python-pandas?,0.03846153846153846
dealing with multiple values in a column using python,0.03846153846153846
"Pandas two rows have the same index, how to change them",0.03846153846153846
get pandas value by another file python pandas,0.03846153846153846
Changing values in a pandas dataframe multiindex,0.03846153846153846
How do I do extract information from two different indices in two different data frames in Python?,0.03846153846153846
Selecting rows from a pandas DataFrame with an arbitrary number of conditions,0.03846153846153846
Applying same calcuation to each element of dataframe in python,0.03846153846153846
Row sum of a dataframe returns zero. (when there are N/As in only a few rows),0.03846153846153846
Converting object to datetime format in python,0.03846153846153846
How to store list of Pandas data frame for easy access,0.03846153846153846
How to get unique from dataframe using pandas?,0.03846153846153846
"Converting pandas df containing rownames, columnnames and frequency to Term Document Matrix",0.03846153846153846
python pandas binning numerical range,0.03846153846153846
Pandas: Add new column to df with condition,0.03846153846153846
Pandas duplicate indexes to dataframe,0.03846153846153846
Replacing data from dataframe with data from another dataframe,0.03846153846153846
Rearrange the columns of a pandas DataFrame so that the column with highest total is first,0.03846153846153846
"Display merged values using a condition, while including NaN values",0.03846153846153846
Delete string from dataframe with condition using pandas,0.03846153846153846
Splitting DataFrame rows with pandas,0.03846153846153846
Pandas parse date and set index- weird behavior,0.03846153846153846
pandas read_hdf with large set of conditions,0.03846153846153846
Create a column based on condition pertaining to 2 other columns,0.03846153846153846
pandas dataframe convert columns as rows,0.03846153846153846
Python pandas loop that deletes csv rows until a string appears,0.03846153846153846
Pandas calculate np.var() for each column,0.03846153846153846
Use Apply on a SeriesGroupBy Object where conditions are met,0.03846153846153846
How to plot age distribution with pandas,0.03846153846153846
How to create a dataframe from dictionary with auto-increment index,0.03846153846153846
How to count occurrence of elements in a single column of Pandas Dataframe,0.03846153846153846
Calculate z_score for a column grouped by another column,0.03846153846153846
How do I convert csv string to list in pandas?,0.03846153846153846
cumsum pandas up to specific value - python pandas,0.03846153846153846
Pandas: Join dataframes on selected columns,0.03846153846153846
Python sampling a dataframe,0.03846153846153846
dynamically rename data frame in Python,0.03846153846153846
"create a pandas frame of shape (x**0.5,x**0.5) from a array of size x python",0.03846153846153846
Pandas: Get the only value of a series or nan if it does not exist,0.03846153846153846
python pandas dtypes detection from sql,0.03846153846153846
"After using groupby and unstack on Titanic dataset, can't graph a series of countplots",0.03846153846153846
Replace specific values in a dataframe column using Pandas,0.03846153846153846
How do I iterate through a pandas group and check to see if a string is in each group?,0.03846153846153846
How do you map a Series to a dictionary?,0.03846153846153846
Combine Dataframe rows on conditions,0.03846153846153846
Safe label-based selection in DataFrame,0.03846153846153846
Strange error when trying to randomize a dataset,0.03846153846153846
Set value for a selected cell in pandas DataFrame,0.03846153846153846
Using functions from modules in pandas dataframe,0.03846153846153846
Different colors for points on a 2D plot based on value in 3rd column,0.03846153846153846
Deleting DataFrame row in Pandas where column value in list,0.03846153846153846
read excel and convert index to datatimeindex pandas,0.03846153846153846
How to set cell alignment in pandas dataframe.to_html(),0.03846153846153846
Wild NaNs appear when adding pandas Series as a column to DataFrame,0.03846153846153846
unhashable type 'list' error,0.03846153846153846
pandas - write file with multiple separators. slow string concatenation,0.03846153846153846
fuzzy match between 2 columns (Python),0.03846153846153846
Control dtype of aggregation results,0.03846153846153846
"Display values that does not end with "".0"" Python Pandas",0.03846153846153846
PYQT4 not able to write into excelwriter,0.03846153846153846
Integer matrix to stochastic matrix normalization,0.03846153846153846
"Python Pandas: Read specific columns from cdv, then reorder",0.03846153846153846
kronecker product pandas dataframes,0.03846153846153846
What is the most efficient way to compare 45 Million rows of Text File to about 200k rows text file and produce non matches from the smaller file?,0.03846153846153846
some misunderstanding about `pandas.series.drop()`,0.03846153846153846
Get column names for max values over a certain row in a pandas DataFrame,0.03846153846153846
Pandas Apply returns matrix instead of single column,0.03846153846153846
Python Change String(date) format of specific column in csv file,0.03846153846153846
Twice-ran behavior of a try-catch-raise exception clause in Python,0.03846153846153846
Appending links to new rows in pandas df after using beautifulsoup,0.03846153846153846
Nested groupby in DataFrame and aggregate multiple columns,0.03846153846153846
Orange3 in 64bit and pandas,0.03846153846153846
How can I sample equally from a dataframe?,0.03846153846153846
natsort with pandas dataframe,0.03846153846153846
pandas get_dummies with identical/ same column names,0.03846153846153846
How will be better to set up data?,0.03846153846153846
Parse multiple columns from a dictionary column in python pandas dataframe,0.03846153846153846
Pandas Dataframe to HTML remove index,0.03846153846153846
How to use dataFrame to find the mean of a group of data?,0.03846153846153846
How do I delete time values from Pandas DateTime Index?,0.03846153846153846
Pandas groupby and correct with median in new column,0.03846153846153846
How to sum the nlargest() integers in groupby,0.03846153846153846
Pandas - 'Series' object has no attribute 'colNames' when using apply(),0.03846153846153846
What's a better way to clean data before a merge?,0.03846153846153846
How to split elements of a pandas series and put them into JSON format?,0.03846153846153846
Adding a column with a count,0.03846153846153846
Use Spreadsheet Names as Variables in Pandas,0.03846153846153846
Subplots with two y axes (each) - plotly and python/pandas,0.03846153846153846
"How to change the shape of a Pandas Dataframe (row number with an ""L"")?",0.03846153846153846
pandas convert text feature to numeric value,0.03846153846153846
df.append() not adding rows to dataframe in pandas,0.03846153846153846
Output Differ in Linux and Windows?,0.03846153846153846
Python: convert elem to list,0.03846153846153846
Using Functions on cells in a dataframe,0.03846153846153846
How to update the value of DatetimeIndex of a single row in a pandas DataFrame?,0.03846153846153846
"""No driver name specified"" writing pandas data frame into SQL Server table",0.03846153846153846
"logistic regression ValueError: Found input variables with inconsistent numbers of samples: [699,",0.03846153846153846
Create a DTM from large corpus,0.03846153846153846
digest of a pandas Index,0.03846153846153846
multiple columns from a file into a single column of lists in pandas,0.03846153846153846
Changing values in column selectively. Python Pandas,0.03846153846153846
Parse Pandas Column to date from string with dashes,0.03846153846153846
Panda how to groupby rows into different time buckets?,0.03846153846153846
Pandas keep only index with values in both columns,0.03846153846153846
Looping over pandas data frame applying formula to each value,0.03846153846153846
Calculate a new column with Pandas,0.03846153846153846
Python Pandas: Reuse stored means correctly to replace nan,0.03846153846153846
AttributeError: module 'mypandas' has no attribute 'print_pandas_df',0.03846153846153846
Pandas: write condition to filter in dataframe,0.03846153846153846
Part II: Counting how many times in a row the result of a sum is positive (or negative),0.03846153846153846
Using set_index within a custom function,0.03846153846153846
sklearn SVM performing awfully poor,0.03846153846153846
Need to edit subset of rows from MySQL table using Pandas Dataframe,0.03846153846153846
Pandas series.rename gives TypeError: 'str' object is not callable error,0.03846153846153846
combining two pandas dataframes as single json output,0.03846153846153846
conversion of np.array(dtype='str') in an np.array(dtype='datetime'),0.03846153846153846
"I want to slice my pandas data frame with a variable that contains a pd.date_range, but it is returning Nan for my data",0.03846153846153846
Jupyter notebook and QT Console are calling different version of pandas,0.03846153846153846
Insert rows and add missing data,0.03846153846153846
How to read strange csv files in Pandas?,0.03846153846153846
Aligning pandas DataFrames that don't have a common index,0.03846153846153846
Pandas python: Create function to merge two dataframes based on defined list of columns,0.03846153846153846
rolling mean with increasing window,0.03846153846153846
Pandas aggregate list in resample/groupby,0.03846153846153846
How to reconstruct a Dataframe from a groupby object?,0.03846153846153846
"Pandas DataFrame, smart apply of a complex function to groupby result",0.03846153846153846
Fill NaN values,0.03846153846153846
Pandas return column value if other column value is equal,0.03846153846153846
Setting a row index on and querying a pandas dataframe with multi-index columns,0.03846153846153846
Using Python to Recognize Fixed Width Text,0.03846153846153846
pandas: get the value of the index for a row?,0.03846153846153846
Import Pandas on apache server causes timeout error,0.03846153846153846
Filtering syntax for pandas dataframe groupby with logic condition,0.03846153846153846
creating pandas multiindex based on CustomBusinessHour start,0.03846153846153846
Pandas merging 2 DataFrames into one graph,0.03846153846153846
"Python: Pandas, Text File to DataFrame",0.03846153846153846
Plot each column of Pandas dataframe pairwise against one column,0.03846153846153846
How to look up rows in certain condition,0.03846153846153846
How to create a DataFrame series as a sub-string of a DataFrame Index?,0.03846153846153846
Pandas HDF file size differ dramatically between read and write,0.03846153846153846
Pandas: building a column with self-referencing past values,0.03846153846153846
Reading csv from url and pushing it in DB through pandas,0.03846153846153846
adding data from different rows in a csv belonging to a common variable,0.03846153846153846
Python Pandas: Group by and count distinct value over all columns?,0.03846153846153846
Find the location that occurs most in every cluster in DBSCAN,0.03846153846153846
"Create custom date range, 22 hours a day python",0.03846153846153846
Convert string based NaN's to numpy NaN's,0.03846153846153846
Pandas reading from csv file and filling missing values for datetime index,0.03846153846153846
Why does `set_index` create an index label for the column name?,0.03846153846153846
join/search/sum in Pandas Python,0.03846153846153846
Filter data frame with a boolean vector based on one column,0.03846153846153846
Restructuring Pandas DataFrame,0.03846153846153846
Pandas cast all object columns to category,0.03846153846153846
Pandas - Self reference of instances in column,0.03846153846153846
How does one populate a row in pandas python,0.03846153846153846
Defining functions for multiple data sets,0.03846153846153846
How to change rows to columns by date in pandas?,0.03846153846153846
Comparing dates of two pandas Dataframes and adding values if dates are similar?,0.03846153846153846
Elegant way to use map for a scoring discrete variable,0.03846153846153846
How to display grouped by barchart and raw data line with pandas?,0.03846153846153846
Display progress of lambda function,0.03846153846153846
Values missing: Overlaying points on boxplot subplots from a pandas dataframe,0.03846153846153846
"When I shuffle a copy of a DataFrame, why the original DataFrame is also shuffled?",0.03846153846153846
setting both pandas.read_table field & record separators,0.03846153846153846
"pandas df.ix[number, column] accesses different scalar type than df[column].ix[number]",0.03846153846153846
Pandas: How to groupby and get a count of uniques in a given column?,0.03846153846153846
Conditionally and interatively calculate column based on value of three columns,0.03846153846153846
