Title,Correlation Score
Use KFolds to split dataframe: I want the rows to be split but the columns are getting split instead,0.08030962747943877
how to separate the whole number and decimal numbers in a separate columns using python csv?,0.0754437869822485
Pandas return separate column value in current index if two separate columns match,0.0754437869822485
how to split 'number' to separate columns in pandas DataFrame,0.0754437869822485
How to separate Parts of Speech tags from Sentences and make them into two separate columns one with the raw sentence and one with only the POS tags,0.07330703484549637
How to split comma separated cell values in a list in pandas?,0.07330703484549637
how to split two columns finding a string value from a CSV in python using re.split,0.07330703484549637
"Pandas: extract values from column, according to value of another column, and separate into separate dataframes",0.07330703484549637
Convert numpy array from space separated to comma separated in python,0.07330703484549637
Pandas How to compare the comma separated column values with comma separated column values,0.07330703484549637
Python / Pandas: Split Dollar Values in a Single Column to Separate Columns,0.07330703484549637
Python pandas.read_csv split column into multiple new columns using comma to separate,0.07330703484549637
Split different entries into separate rows allowing only certain combinations,0.07330703484549637
Importing a tab-separated table from a url to produce a pandas dataframe with each column correctly put into separate columns,0.07192388324463796
Python - Iterate through excel column values to split up into separate sheets,0.07192388324463794
Split a list into separate words,0.07192388324463794
Split datetime column into separate date and time columns,0.07117028270874423
Split pandas dataframe string into separate rows,0.07117028270874423
split strings from a column in separate columns,0.07117028270874423
Unable to separate text data in csv. (Separate text with @ so that it becomes two columns),0.07117028270874423
Separate and fill values between a Hyphen in a cell using Pandas into separate rows,0.07117028270874423
How do I separate a time stamp into separate columns with pandas?,0.07117028270874423
split a cell with multiline data into separate rows per ID Pandas,0.07117028270874423
How to explode numbers separated by comma and bring the separated number to the next row using pandas?,0.07117028270874423
How to split a values inside the round square brackets in two separate new columns in a python dataframe?,0.07117028270874423
"Pandas split comma-separated string column into two separate columns, and explode rows down",0.07117028270874423
How to split values which are lists in pandas DataFrame into separate rows?,0.07117028270874423
Python Pandas Split Column String Values into Separate Columns,0.07117028270874423
Split pandas dataframe column string with multiple values into separate rows,0.07117028270874423
Is it possible to split a Pandas dataframe using groupby and merge each group with separate dataframes,0.07117028270874423
How to split a column into two separate ones in a DataFrame with Pandas,0.07117028270874423
Split a pandas column into multiple separate columns depending on number of values,0.07117028270874423
Split Data From One Column Into Separate Columns Based On Value,0.07117028270874423
How can I split a string and take only one from the separated string in Python?,0.07117028270874423
How to split dataframe with multiple types of information into separate dataframes based on string?,0.07117028270874423
How to split data of single column to separate columns in pairs,0.07117028270874423
pandas split column values into separate columns,0.07117028270874423
Find nlargest(2) of a column and split the result into separate columns,0.07117028270874423
How can we split the contents of a whole column into separate columns within the same table?,0.07117028270874423
How to Split pandas data frame string entry to separate rows?,0.07117028270874423
"Split column into multiple columns or separate ""tables"" in pandas",0.07117028270874423
How to read separate Excel sheets into separate DataFrames?,0.07117028270874423
How can I split a python dictionary with multiple text-list values to have separate dictionaries of keys that have the same values?,0.07059195948084837
How to separate a list item in to separate variables,0.06982744718593774
How to separate nested comma separated column values in pandas data frame using python?,0.06982744718593774
How to split by range of characters pandas dataframe string into separate rows,0.06982744718593774
How to split the data frame by column and save to separate files as csv?,0.06982744718593774
"How is a pandas column of rows containing variable length and comma separated strings of values, stacked into separate values?",0.06982744718593774
Split column in pandas of comma separated values but maintining the order,0.06982744718593772
How to split string and numbers separated by : in text file into rows and columns in python,0.0690335305719921
Splitting a comma separated value into separate rows in Pandas,0.0690335305719921
I have to split the following date in separate columns using python,0.0690335305719921
Split column into separate columns based on separator strings,0.0690335305719921
"Split pandas column into multiple rows, where splitting is on the value of another column",0.0690335305719921
Split a list with different number of elements into separate columns in a dataframe,0.0690335305719921
Python Pandas. Date object split by separate columns.,0.0690335305719921
Split a column of values delimited by a space into separate columns for each value in python,0.0690335305719921
Split column with list into separate columns using comma separator without specifying column names,0.0690335305719921
Pandas: Parse xml column and split into separate rows,0.0690335305719921
Split row into multiple rows based on string separate in pandas,0.0690335305719921
How to split data of different types in a row into separate columns using pandas,0.0690335305719921
split contents of a column in a python pandas Dataframe and create a new Dataframe with the newly separated list of strings,0.0690335305719921
Split the distinct values in a list separated by a comma,0.0690335305719921
Python Pandas: Split slash separated strings in two or more columns into multiple rows,0.0690335305719921
Pandas won't separate columns in my comma separated .txt file,0.0690335305719921
Split the index of a Pandas Dataframe into separate columns,0.0690335305719921
How to separate rows in CSV file into two separate files where IDs match certain condition,0.0690335305719921
Split a column of a dataframe into two separate columns,0.0690335305719921
pandas: Split dataframe columns into separate rows,0.0690335305719921
"Pandas DataFrame [cell=(label,value)], split into 2 separate dataframes",0.0690335305719921
Pandas split lists in cells into separate columns,0.0690335305719921
How to Parse XY Coordinate Tuples and Split Them Into Separate X and Y Lists,0.0690335305719921
"How to split string with variables values separated by ""/"" and "","" into different columns in Python",0.0690335305719921
Separate strings in columns in a dataframe with delimiter and adding sub-strings in to separate columns,0.0690335305719921
split several columns with tuples into separate columns,0.0690335305719921
Split a pandas dataframe using unique; Render as separate tables in Jinja2,0.0690335305719921
How to split a pandas dataframe of different column sizes into separate dataframes?,0.0690335305719921
How to read tab separated values that contain strings which are tab separated?,0.0690335305719921
How to split a pandas column with a list of dicts into separate columns for each key,0.06773101112723753
How do I separate the dictionary list into separate columns?,0.06773101112723753
Using Pandas str.split with varying lengths of comma separated strings,0.06773101112723752
Separate comma-separated values within individual cells of Pandas Series using regex,0.06773101112723752
Use loop to concatenate subset files in separate files from separate links,0.06773101112723752
spliting a data frame and then saving them into two separate dfs in python,0.06773101112723752
Split the index into separate columns in pandas,0.06689677843523997
How to stop a pandas dataframe splitting columns onto separate lines?,0.06689677843523997
Pandas how can I split rows with multiple entries into separate rows?,0.06689677843523997
Take column of string data in pandas dataframe and split into separate columns,0.06689677843523997
Is there a way to split row values into separate columns with Pandas?,0.06689677843523997
How to split multiple values from a dataframe column into separate columns,0.06689677843523997
"pandas column containing list of objects, split this column based upon keynames and store values as comma separated values",0.06689677843523997
"Split a string with , and split a string even no , present in a dataframe column",0.06689677843523997
groupby on multiple columns and filter and split into separate dataframes,0.06689677843523997
How to Assign muitiple coma separated values in a pandas data frame single column to separate but related columns,0.06689677843523997
split a string into separate columns in pandas,0.06689677843523997
How to separate a dictionary in a column into two separate columns with list of keys in one and list of values in another in python,0.06689677843523997
Split a Pandas DataFrame where one factor column is evenly distributed among the splits,0.06689677843523997
Split a column of strings into 3 separate columns with Pandas,0.06689677843523997
Split List of Sentences in a Pandas Dataframe Column into Separate Columns,0.06689677843523997
Separate list in different columns and split the rows afterwards in a dataframe,0.06689677843523997
Python code to split my excel column value based on delimiter & write 1st split value to same column and 2nd to new column created next to that,0.06689677843523997
Split multiple columns of lists into separate rows,0.06689677843523997
How to extract/split columns that are lists in a data frame to separate unique columns?,0.06689677843523997
Pandas - How to separate and group by comma separated strings,0.06689677843523997
Split on train and test separating by group,0.06689677843523997
"How to split a date index into separate day , month ,year column in pandas",0.06647673314339977
"How to split a nested list inside a Pandas Dataframe coloumn vertically,ie, into separate rows",0.06563457506853733
"Pandas: Reverse operation of ""split string to separate rows""",0.06563457506853733
Efficient way to split string where individual words are separated by capitalizations or numbers and apply this to entire dataframe column,0.06563457506853733
Separating multiple time series from a single column to separate columns for each series?,0.06563457506853732
"Trying to split a column of object datatype to create a separate column in a DataFrame. Getting the error: ""'float object is not subscriptable""",0.06563457506853732
pandas: Split separated values in a DataFrame column (one Series) into multiple Columns. Elegant solutions?,0.06563457506853732
"How to iterate through dataframe rows, split data to separate dataframes based on column?",0.06563457506853732
"pandas dataframe with comma separated string entries, change to unique comma separated entries",0.06476002629848784
How do I split a Dataframe column in two but taking into account that sometimes there is nothing to split and the value belongs to the second column?,0.06476002629848784
how to split date and time and create separate columns,0.06476002629848784
split column of space-separated values ??n dataframe in python,0.06476002629848784
"How to split a column of strings, and create rows from the separate elements?",0.06476002629848784
Python: Split a String Field into 3 Separate Fields using Lambda,0.06476002629848784
How to split a Info column in my Dataframe to 6 separate columns?,0.06476002629848784
how to split a string in python using DF.split,0.06476002629848784
How to split dataframe column into separate columns based on condition,0.06476002629848784
Pandas split list inside a column into separate columns,0.06476002629848784
Split / Separate Column By Two Delimiters With Conditions - Python,0.06476002629848784
"Using a Pandas Dataframe, how can I split the strings in a specific column and then replace that string with the first index of the split?",0.06476002629848784
"From .csv, read only or split into sections separated by ""<string>""",0.06476002629848784
how to split rows into columns separated by pipe in Pandas,0.06476002629848784
Python split one column into multiple columns and reattach the split columns into original dataframe,0.06476002629848784
Force the number of columns when splitting one column with str.split (panda),0.06476002629848784
"How to explode/split a nested list, inside a list inside a pandas dataframe column and make separate columns out of them?",0.06353813900983712
Split a string of space separated words into multiple rows,0.06353813900983712
Split at duplicate 0 in Data frame index and save data frames as separate CSVS,0.06353813900983712
"Iterate multiple dat files, update and save in a separate directory as separate files",0.06324786324786323
Separate adjacent values in a column to split them [Python - Pandas],0.0626232741617357
Pandas str.split without stripping split pattern,0.0626232741617357
Pandas: Split a Dataframe into separate Dataframes based on certain Column's string values,0.0626232741617357
Split column at uppercase letters into separate columns,0.0626232741617357
How to Convert String Dictionary to Dictionary and the split into separate columns,0.0626232741617357
I want to create a new column 'Assign' and assign value : Prefix 'Check' column value and Suffix as '-SPLIT' to ITEM_TYPE. EX.'TRUE-AB-SPLIT',0.0626232741617357
Split pandas column and create new columns that count the split values,0.0626232741617357
"Python,using dataframes how to split the value of a string in a column and then add a new column with the value from the split",0.0626232741617357
Split columns and write to separate output file,0.0626232741617357
Python pandas: Split string into multiple columns and extract data for column from split parameter,0.0626232741617357
Can I split python dictionary values into separate dataframes with a dataframe name equal to the key name of the values it contains?,0.06144170295113691
Pandas - Split by Numbers and Letters and save last split,0.06144170295113691
Separate out comma separated items in a data frame column and get individual counts,0.06144170295113691
Dynamically create splits in dataframe using numpy.split?,0.0614417029511369
Split Dataframe column on delimiter when number of strings to split is not definite,0.06048652202498356
AttributeError: 'NoneType' object has no attribute 'split' when trying to split a column data,0.06048652202498356
Unable to split due to int object has no attribute 'split',0.06048652202498356
split record columns of the form win-lose-draw and sometimes NC into 4 separate columns,0.06048652202498356
Column split into two separate columns,0.06048652202498356
Split Columns in pandas with str.split and keep values,0.06048652202498356
using split() to split values in an entire column in a python dataframe,0.06048652202498356
Split Pandas Dataframe into separate pieces based on column values,0.05834976988823143
"Split the list by every 4th element if 5th element is ""Name"" or split by 5th element if 5th element is Address",0.05834976988823143
Split data set with multiple entries of same subject into train/val/test with predefined proportions and no same subjects in split,0.05834976988823143
Split column of text into column of lists in Pandas dataframe with no unambiguous split sequence,0.05834976988823143
"With Pandas, how do I split out row values into separate columns, and use their value?",0.05834976988823143
Pandas Series Histogram - How make subplots show up on separate graphs?,0.05834976988823143
"Separating out \t, but keeping the 'e+06' or whatever power",0.05731523378582205
How to Find Distance b/w Geographic Locations w/ Geodesic w/ Coordinates Separated Into 4 Different Columns To Create a Distance Column--ValueError,0.05731523378582205
separate text and numbers and convert to dataframe in python,0.05731523378582205
Find where three separate DataFrames overlap and create a new DataFrame,0.05731523378582205
Extracting only object type columns in a separate list from a data-frame in pandas,0.05731523378582205
how to separate int and str from a list in python,0.05731523378582205
How to randomly split a DataFrame into several smaller DataFrames?,0.05731523378582205
"pandas read csv does not separating columns, too many columns?",0.05731523378582205
How do I maintain my column pattern during a df split?,0.05731523378582205
Loop through a list of tickers with separate outputs,0.05731523378582205
How to explode a list inside a Dataframe cell into separate rows,0.05731523378582205
How to create a new row for each comma separated value in pandas,0.05731523378582205
To merge multiple columns into one column and count the repetition of unique values and maintain a separate column for each count in pandas dataframe,0.05731523378582205
Multiplying columns in separate pandas dataframe based on similar column values,0.05731523378582205
splitting list in dataframe columns to separate columns,0.05731523378582205
Split a group in two based on lowest possible travel distance,0.05731523378582205
Separating column value into a new field in a dataframe,0.05731523378582205
Creating separate columns based on string value in python,0.05731523378582205
"Pandas Time series: find gaps in sessions, and name each session/gap with separate ID",0.05731523378582205
"Separating floats, ints, negatives and strings that contain letters and numbers and .'s in python",0.05731523378582205
str.contains search in a pandas column for multiple strings separated by a comma,0.05731523378582205
Python 3: pandas group multiindex and mean of 2 separate columns per multiindex,0.05731523378582205
Pandas dataframe from generator where each line is a tab-separated row,0.05731523378582205
"Split pandas series of '_'-separated string into variable number of fields, filling missing fields",0.05731523378582205
pandas string match in a column containing multiple values separated by a '|',0.05731523378582205
Separating data in a column by grouping,0.05731523378582205
Pandas grouping by column one and adding comma separated entries from column two,0.05731523378582205
Map values to separate column - pandas,0.05731523378582205
Separate street name strings with street number and letter python,0.05731523378582205
how to split a dataframe to form a multiple dataframe in a single context in django python,0.05731523378582205
"Pandas split rows, divide and auto assign date without using explode()",0.05731523378582205
Pandas read csv not separating columns,0.05731523378582205
Extract String Data From DataFrame Column To Separate Columns,0.05731523378582205
Creating a list of composite names separated by underscore given a data frame,0.05731523378582205
separate alphabet combination into columns with single alphabet value python pandas,0.05731523378582205
Python pandas give comma separated values new column,0.05731523378582205
Python Pandas: split and change the date format(one with eg:(aug 2018 - nov 2018)) and other with only one?,0.05731523378582205
Separate a name into first and last name using Pandas,0.05731523378582205
Why pandas places index name in a separate row,0.05731523378582205
How do I find repeated names in dataset and put them in separate column?,0.05731523378582205
"converting comma separated data of excel file into new line using python, pandas",0.05731523378582205
Break a grouped dataframe into separate dataframes,0.05731523378582205
How to transpose rows separated with blank (Nan) data to multi-column in python/pandas?,0.05731523378582205
Union of DBSCAN Clusters from Two Separate Models,0.05731523378582205
How to divide a column containing int and string values separated by a semicolon,0.05731523378582205
Getting the same stat values when I split dataframe,0.05731523378582205
Split column of strings by list of possible substrings,0.05731523378582205
separate a column by groups,0.05731523378582205
Merging Latitude and Longitude from separate columns in a Dataframe then use haversine for distance,0.05731523378582205
Appending rows from two separate pandas dataframes onto one dataframe based on certain conditions,0.05731523378582205
Cumulative max/min based on criteria in separate column pandas,0.05731523378582205
How to split a list's value into two lists,0.05731523378582205
filter multiple separate rows in a DataFrame that meet the condition in another DataFrame with pandas?,0.05731523378582205
How to split two kind of values in the column and count the number of occurrence?,0.05731523378582205
creating a separate column for each condition,0.05731523378582205
Creating an event number column based on records separated by certain events,0.05731523378582205
How do I make separate columns from one column that contains null and multiple values?,0.05731523378582205
How to separate data based on null values in two different CSV files in python,0.05731523378582205
How to create three separate columns conditionally from three other existing columns?,0.05731523378582205
Removing duplication sub-strings separated by semicolon from the string,0.05731523378582205
Parsing a tab separated file using python,0.05731523378582205
Separate certain columns for two different dataframes?,0.05731523378582205
How can I export each row from a pandas (Python) DataFrame to separate .txt files?,0.05731523378582205
A column Genre in movies data set have multiple categories in each row. How can I separate all the categories from each other?,0.05731523378582205
"Post deleting specific line, convert .txt to .csv with tab separated columns in Python",0.05731523378582205
Accumulate counts of a column's data values as separate columns,0.05731523378582205
How do you combine like column names into separate rows in Pandas,0.05731523378582205
Most efficient way to split and perform function on pandas data frame,0.05731523378582205
Converting a full column of integer into string with thousands separated using comma in pandas,0.05731523378582205
Extracting digits from column and splitting each into separate column,0.05731523378582205
Break up a data-set into separate excel files based on a certain row value in a given column in Pandas?,0.05731523378582205
How to load space separate file into pandas dataframe?,0.05731523378582205
Load dtypes into Python via a separate mapping table that can be linked to the primary dataframe to specify the dtypes by column,0.05731523378582205
cannot separate .txt file by commas using pd.read_fwf(),0.05731523378582205
Separate string from numeric in single Pandas Dataframe column and create two new columns,0.05731523378582205
Pandas move list of titles and currency to separate columns,0.05731523378582205
Converting from group by output to separate columns in pandas,0.05731523378582205
Split rows in multiple rows based on variable time condition,0.05731523378582205
"Import Tab Separated File Into sqlite - OperationalError Near "")""",0.05731523378582205
Space separated csv with spaces in column names and values,0.05731523378582205
Pandas implode Dataframe with values separated by char,0.05731523378582205
my csv percentage count is split equal though i know its not,0.05731523378582205
How to separate one column into multiple columns in python?,0.05731523378582205
Need to convert column values of data frame into separate columns and populate count values for each cell using panda,0.05731523378582205
Retrieve certain value located in dataframe in any row or column and keep it in separate column without forloop,0.05731523378582205
Pandas read_csv does not separate values after comma,0.05731523378582205
Error in loading a csv with pandas which is space separated,0.05731523378582205
How to convert separated values into one-hot encoded columns?,0.05731523378582205
How to export csv row into separate .txt file,0.05731523378582205
Python Web-Scraping text separated by comma,0.05731523378582205
separate parameter to different rows,0.05731523378582205
duplicating rows by splitting comma separated multiple values in another column pandas,0.05731523378582205
Creating separate columns for single values in pandas,0.05731523378582205
How to divide the maximum value of two separate df columns in pandas within a multi-layer groupby?,0.05731523378582205
How to separate specific strings from a text and add them as column names?,0.05731523378582205
Splitting a CSV into separate columns by the semicolons,0.05731523378582205
how to split multiple valued single row into multiple individual rows,0.05731523378582205
How to extract comma separated values to individual rows in pandas?,0.05731523378582205
How do I rank values of Pandas row into separate dataframe?,0.05731523378582205
"Python DataFrame, unable to separate attributes",0.05731523378582205
Pandas - how often each string in comma separated rows is present within dataframe,0.05731523378582205
Extract and put the three largest values to separate columns,0.05731523378582205
Python - separate dataframes by groups,0.05731523378582205
Better way to split column by value into new columns?,0.05731523378582205
