Title,Correlation Score
Change values in Pandas cells based on value_counts() condition,0.03846153846153846
plotting pandas data frame with unequal data set,0.03846153846153846
How to select window_length and polyorder in scipy.signal.savgol_filter for a daily data,0.03846153846153846
Getting Max across 3 columns in C# Deedle Dataframe,0.03846153846153846
Extract columns by file name from Pandas dataframe,0.03846153846153846
Pandas insert row into dataframe with timezone-aware index,0.03846153846153846
How to add a list of strings to a new column in Pandas?,0.03846153846153846
How to efficiently create a matrix of index and column names combinations in python/pandas,0.03846153846153846
python pandas | replacing the date and time string with only time,0.03846153846153846
pandas dataframe iterate over cell value that is a list and compare each element to other cell,0.03846153846153846
Make list after groupby in pandas using apply() function,0.03846153846153846
How does one check if all rows in a dataframe match another dataframe?,0.03846153846153846
How to exclude a category from a mask,0.03846153846153846
How to get XMI File into pandas dataframe,0.03846153846153846
Python messing with a string,0.03846153846153846
Opposite of melt in python pandas,0.03846153846153846
Even after install the panadas I am unable to use it,0.03846153846153846
TypeError: 'method' object is not subscriptable in function,0.03846153846153846
Excluding pandas rows based on a String value,0.03846153846153846
"First, Last, Next ordering in exporting CSV, Python",0.03846153846153846
Flipping a python dictionary obtained from python dataframe,0.03846153846153846
Reading data from CSV using pandas,0.03846153846153846
How to execute my if loop only once in a streaming dataframe,0.03846153846153846
How to create a dataframe from csv file without the index column (using python pandas)?,0.03846153846153846
How to query stored PostGIS Raster data from within the IPython Notebook,0.03846153846153846
pandas dataframe - increase values of a subset of a timeframe on a multi-index dataframe,0.03846153846153846
Show hyperlink title inside table tags html in python,0.03846153846153846
Add rows if missing recent data,0.03846153846153846
DataFrame shape value error specifying columns,0.03846153846153846
Count the frequency that a value occurs in a dataframe column,0.03846153846153846
"How do I remove this ""index"" text from a Pandas DataFrame HTML Table?",0.03846153846153846
How to refer to Excel index using Python Pandas ILOC?,0.03846153846153846
unique() in python doesn't print all values?,0.03846153846153846
Values of the column with space in the name became NULL when uploaded in Snowflake through pandas to_sql,0.03846153846153846
How to make Clickable hyperlink on a PDF using Python,0.03846153846153846
Apply SequenceMatcher to DataFrame,0.03846153846153846
Pandas add one day to column,0.03846153846153846
Highligh the max and min value in a column pandas,0.03846153846153846
"Extract columns using ""genfromtxt""",0.03846153846153846
split-apply-combine on pandas timedelta column,0.03846153846153846
How to create a csv file to record pwm data on raspberry pi,0.03846153846153846
"filtering a column, specify case sensitivity",0.03846153846153846
"Why does pandas use (&, |) instead of the normal, pythonic (and, or)?",0.03846153846153846
What's the best way to convert a feather file to a parquet file?,0.03846153846153846
memory leak in creating a buffer with pandas?,0.03846153846153846
datetime columns losts time information after convertion to datetime,0.03846153846153846
To add double quotes to the values in a columns wherever the values have quotes within a dataframe,0.03846153846153846
Filling column of dataframe based on 'groups' of values of another column,0.03846153846153846
Creating two lists derived from an analysed dataframe,0.03846153846153846
How to create a new row in pandas dataframe by dividing values in a specific column between two rows and keeping other columns intact?,0.03846153846153846
Map a row index back to the original indexed dataframe,0.03846153846153846
Naming or extracting segments from polygons,0.03846153846153846
Stacking dataframes using pandas,0.03846153846153846
Formatting a dataframe in Pandas,0.03846153846153846
How to replace a value in python pandas using a for loop,0.03846153846153846
How to filter using > operator and then apply groupby concept to a dataframe,0.03846153846153846
Using df.divide on preceding column total,0.03846153846153846
Pandas: Overlapping time count,0.03846153846153846
How to create a lagged data structure using pandas dataframe,0.03846153846153846
Getting top 3 rows that have biggest sum of columns in `pandas.DataFrame`?,0.03846153846153846
Make a Pandas MultiIndex from a product of iterables?,0.03846153846153846
change all values in a dataframe with other values from another dataframe,0.03846153846153846
Pandas: Dataframe with start & end date to daily data,0.03846153846153846
"Writing small numbers to CSV without ""E-X""",0.03846153846153846
Pandas df.replace with regex group,0.03846153846153846
Adding a Row in a dataset.csv file through using pandas in python,0.03846153846153846
Convert two columns of a dataframe into a Multi-Index,0.03846153846153846
Check if a value exist in a column and change in another Pandas,0.03846153846153846
Pandas: Add columns by values of another dataframe,0.03846153846153846
new column which is min of two other columns if condition is True,0.03846153846153846
How I can print the start and end dates of a data frame?,0.03846153846153846
How to get the closest the column value by the bin Multiindex?,0.03846153846153846
pandas duplicate rows and add column,0.03846153846153846
Transform pandas dataframe as per the image below,0.03846153846153846
FillNaN with multiple conditions and using n-1 and n+2 values with Pandas,0.03846153846153846
"In Python, the complier throws a Key Error for the datetimeIndex function even though the key is present",0.03846153846153846
Conditional grouped iteration over a Pandas DataFrame,0.03846153846153846
Appending Column to Frame of HDF File in Pandas,0.03846153846153846
Creating a Pandas DataFrame with a single vector column from a 2-d numpy array,0.03846153846153846
Got problem to access pandas dataframe acrossing multi-class,0.03846153846153846
Python Pandas DataReader vs get_data_yahoo which is better?,0.03846153846153846
use spesific rows from a dataframe,0.03846153846153846
"Pandas; transform column with MM:SS,decimals into number of seconds",0.03846153846153846
How to read only one row from an ods table using Python?,0.03846153846153846
Pandas: Creating a new column based on if part of a string is anywhere in another column,0.03846153846153846
Pandas force reindex duplicate axis,0.03846153846153846
Reshape a pandas Dataframe based on column information,0.03846153846153846
Combine 2 dataframes when the dataframes have different size,0.03846153846153846
Pandas: Column generation on groupby and max,0.03846153846153846
Read flat file to DataFrames using Pandas with field specifiers in-line,0.03846153846153846
Extract row from a data frame and make it a new data frame,0.03846153846153846
Split String dynamic using Python,0.03846153846153846
Check if a string in a list is between two other strings in a list?,0.03846153846153846
How to parse a Pandas DataFrame string in Unreal C++?,0.03846153846153846
Replace a record in a table when looking up that record in another table with python,0.03846153846153846
counting values in missing categories after groupby with Python and Pandas,0.03846153846153846
How to use AND condition in pandas when dealing with value_counts?,0.03846153846153846
how to apply best model based on MAPE on a given data set dynamically,0.03846153846153846
Split date column into YYYY.MM.DD,0.03846153846153846
Pandas (python) conditional row selection,0.03846153846153846
Append extracted column to list without index: Pandas,0.03846153846153846
Display multiple output tables in IPython notebook using Pandas,0.03846153846153846
Looking for a better way to do some calculation over pandas dataframe,0.03846153846153846
Forward fill ones for x days in python binary DataFrame,0.03846153846153846
Hungarian Algorithm Constraint using Python,0.03846153846153846
How to convert xlsx into utf-8 csv in python,0.03846153846153846
How to apply a command to multiple column elements?,0.03846153846153846
Pandas: how to write a groupby plus an aggregation that can group by one or many columns?,0.03846153846153846
How can I ensure unique rows in a large HDF5,0.03846153846153846
Create 'correlation matrix' for two lists to check if the values have something in common,0.03846153846153846
Need assistance with multi column If Statement/For Loop,0.03846153846153846
Monthly alignment of multiple daily time series,0.03846153846153846
Multiple data in scatter matrix,0.03846153846153846
How to read parquet file partitioned by date folder to dataframe from s3 using python?,0.03846153846153846
I need to split data in a csv database using pandas in python and write it to and xlsx file with multiple sheets as well as creating an additional col,0.03846153846153846
Rescale a drawing made of SVGs,0.03846153846153846
Pandas group by will not work,0.03846153846153846
Selecting columns based on their column name containing a substring and row of a column meets a condition,0.03846153846153846
Add filters dropdown to line plot based on a pandas dataframe,0.03846153846153846
How to change the size of the dots on sns.scatterplot?,0.03846153846153846
How do I display a grouped graph using a CSV file,0.03846153846153846
Pandas read_sql_query with comprehension in params,0.03846153846153846
Pandas: Element-wise sum-product of data frame of values using a another data frame containing row weights,0.03846153846153846
groupby.filter works on series instead of dataframes? (Pandas),0.03846153846153846
astype(int) converts 4 to 3,0.03846153846153846
How to transform pandas df containing boolean columns into a heatmap compatible table?,0.03846153846153846
Using scipy pdist on pandas data frames (and) lists,0.03846153846153846
Plotly Choropleth in pandas,0.03846153846153846
(Re) Weighting Random CSV samples in Python,0.03846153846153846
Replace two column values in another df for corresponding column values in pandas,0.03846153846153846
Using read_excel() i've got an Index in one file and a columna of the file as Index in another file on the same path,0.03846153846153846
Covert multiple rows into single column Pandas,0.03846153846153846
Pandas plot() without a legend,0.03846153846153846
Slice string colum in pandas,0.03846153846153846
Create dictionary based on two dataframes with keys in rows and columns,0.03846153846153846
Finding closest point from a dataframe without repetition,0.03846153846153846
Cant create index with dataframe columns,0.03846153846153846
"Is there a way to change the color of a bar graph based on the data provided from a csv file, using the matplotlib/pandas module in Python?",0.03846153846153846
"Why does 'rmagic' %R cause an error when reading a file, while %%R does not?",0.03846153846153846
Pandas groupby columns without multiindex,0.03846153846153846
How to find mean of a column in Python based on multiple columns with Boolean values,0.03846153846153846
pandas three-way joining multiple dataframes on columns,0.03846153846153846
Removing columns selectively from multilevel index dataframe,0.03846153846153846
Removing \n from dataframe in python,0.03846153846153846
"Change frequency timeseries in Pandas Series with tolerance, but keep original dates, removing duplicated new frequency dates with same values",0.03846153846153846
Efficiently calculate creation rate during window in pandas,0.03846153846153846
File Browser and Plotting in same Window,0.03846153846153846
How to slice a pandas dataframe (get a subset)?,0.03846153846153846
Concat two columns and keep unique values if repeating,0.03846153846153846
Adding/inserting values in pandas dataframe based on 1 or more columns,0.03846153846153846
Find indices where df is null,0.03846153846153846
KeyError trying to create a new column that sums other columns,0.03846153846153846
How to compare values on panda series,0.03846153846153846
Installing pandas with dockerfile for ARM/V7 architecture gets stuck,0.03846153846153846
How to parse excel data into dataframe with particular format?,0.03846153846153846
Have a for loop return a dataframe when it produces a string,0.03846153846153846
How to export dataframes from dictionary to Excel,0.03846153846153846
pandas and Stata 13 files,0.03846153846153846
Text file to a excel file (tab delimited) with python,0.03846153846153846
How do I shift the contents in the first column into column names in Pandas,0.03846153846153846
Combine two row datas into one based on Condition using Pandas,0.03846153846153846
What causes pandas pivot_table to fail?,0.03846153846153846
Pandas VariableOffsetWindowIndexer seems to do something else than what is to be expected,0.03846153846153846
Group columns from column to column,0.03846153846153846
How to read excel data starting from specific col,0.03846153846153846
How can I reverse cumsum within groups to a specific row with pandas?,0.03846153846153846
Ranking last row of dataframe by entire column,0.03846153846153846
Pandas series: how to compute daily cumulative sum of a column,0.03846153846153846
Create edge table using pyspark (translate from pandas),0.03846153846153846
Linear interpolation within groups,0.03846153846153846
figsize() function in pandas tutorial,0.03846153846153846
Python SQL Query Execution,0.03846153846153846
transpose multiple datas in pandas,0.03846153846153846
Pandas Dataframe Invalid Key,0.03846153846153846
Plotting profile hitstograms in python,0.03846153846153846
How to access the nominal values and uncertainties in a Pandas DataFrame?,0.03846153846153846
Pandas truncates a column width when using read_csv,0.03846153846153846
How to bin data and create an extra bin for values outside the prescribed range,0.03846153846153846
Parallelize for loop in pd.concat,0.03846153846153846
Python Pandas figsize not defined,0.03846153846153846
Return sm.Logit parameter for column in DataFrame,0.03846153846153846
Converting .csv file into scientific notation with pandas,0.03846153846153846
pandas - take last N rows from one subgroup,0.03846153846153846
How to deal with data that is not ints in sklearn,0.03846153846153846
Pandas long to wide with desired output,0.03846153846153846
Writing to csv Pandas,0.03846153846153846
How to create a summarize new row from a pandas Dataframe and add it back to the same Dataframe for only specific columns,0.03846153846153846
pandas groupby with condition depending on same column,0.03846153846153846
object information for pandas dataframe default to head(),0.03846153846153846
Merge csv files by columns,0.03846153846153846
Using shutil with pandas df to generate files,0.03846153846153846
How to unstack the Period column,0.03846153846153846
Combine rows in pandas with multi-index,0.03846153846153846
Pandas: Dataframe itertuples boolean series groupby optimization,0.03846153846153846
rolling windows defined by backward cumulative sums,0.03846153846153846
Pandas : Datetimeindex and Intervalindex intersection,0.03846153846153846
Give weights to rows of dataframe,0.03846153846153846
How to improve the speed of getting request content via the request module,0.03846153846153846
Add confguration for type casting in pyodbc driver,0.03846153846153846
How do I create a new col3 in a dataframe that checks for multiple values if they are in col1 and also check for values in col2,0.03846153846153846
How can I read this csv data?,0.03846153846153846
Pandas & Timeseries: Get last date for max rolling window,0.03846153846153846
Create new dataframe column from a shifted existing column,0.03846153846153846
How to sort a FASTA file based on date?,0.03846153846153846
Can pandas work with multiple result sets?,0.03846153846153846
Native method to skip Nans in a lambda function?,0.03846153846153846
Is it possible to append to dataframe through iteration?,0.03846153846153846
Pandas Read Multiple CSVs & Use Filename in Rows with Single Data Column,0.03846153846153846
"How to get city, state, and country from a list of latitude and longitude coordinates?",0.03846153846153846
Using np.busday_count with NaT values,0.03846153846153846
Roll up categorical values into second variable Python,0.03846153846153846
Write single pytables table into HDF5 file from pandas,0.03846153846153846
"failing simple groupby example from ""Python for Data Analysis"" text",0.03846153846153846
How to read data from url to pandas dataframe,0.03846153846153846
Pandas: add columns through shifting on MultiIndexed DataFrame,0.03846153846153846
loop through pandas columns inside function,0.03846153846153846
merge the describe method output in pandas,0.03846153846153846
Selecting first n columns and last n columns with pandas,0.03846153846153846
Replace values grouping by column in a Pandas dataframe,0.03846153846153846
How to sample from a pandas without changing indexes and keep the remaining samples,0.03846153846153846
access an element inside another element serie and index,0.03846153846153846
Using .loc with a MultiIndex in pandas,0.03846153846153846
Pandas - convert dataframe multi-index to datetime object,0.03846153846153846
"Scikit-Learn ColumnTransformer gives ""TypeError: zip argument #1 must support iteration""",0.03846153846153846
Pandas change column values from dictionary,0.03846153846153846
Find matching column interval in pandas,0.03846153846153846
No module named 'pandas.compat',0.03846153846153846
Pandas dataframe to Snowflake is not working on DATE datatypes,0.03846153846153846
Shuffling rows in Pandas DataFrame every 14 rows,0.03846153846153846
Efficient way to combine multiple csv,0.03846153846153846
Multi-index column dataframe - extra column added at the end for read_excel,0.03846153846153846
<ValueError: Sheet already exists and if_sheet_exists is set to 'error'> on one machine but not on another,0.03846153846153846
Pandas Comparision of dataframe wherever zero in the one dataframe make zero on other,0.03846153846153846
Trouble resampling Pandas timeseries data on Python timedelta objects,0.03846153846153846
How do I calculate a new column in Pandas based a on trignometric function?,0.03846153846153846
Find the max value(s) for specific columns in every row and match the corresponding column values to the values of another column,0.03846153846153846
'NA' value lost after using Python Pandas,0.03846153846153846
How to determine if two rows are identical (similar) if row 2 contains part of the info from row 1?,0.03846153846153846
Pandas (with def and np.where): error with values in a dataframe row conditioned on another dataframe row,0.03846153846153846
Convert a pandas df to defaultdict and look for matching positive and negative numbers,0.03846153846153846
How to preview rows after using .groupby() on a Pandas df/series,0.03846153846153846
Maximum consecutive row for an id using Pandas?,0.03846153846153846
How to merge two datasets with different shape (pandas),0.03846153846153846
"In pandas, why does tz_convert change the timezone used from EST to LMT?",0.03846153846153846
AttributeError: 'NoneType' object has no attribute 'assign' | Dataframe Python using Pandas,0.03846153846153846
django: how to read and manipulate .csv file from View.py,0.03846153846153846
Pandas dataframe: count consecutive True / False values,0.03846153846153846
"How can I find the max sum of 5 values in this dataframe, but no values can be in the same row or column?",0.03846153846153846
Count occurrences of specific value in column based on categories of another column,0.03846153846153846
Sort a pandas datetime index,0.03846153846153846
Pandas - Get value from second dataframe based on combination of multiple columns,0.03846153846153846
how to convert csv to dictionary using pandas,0.03846153846153846
create a dataframe using headings and text,0.03846153846153846
List pages (with links) from website by Python,0.03846153846153846
Create a new panda columns based of a condition on two columns,0.03846153846153846
Replace 0 with NaN for selected columns only if all values are 0 in Pandas,0.03846153846153846
Python Jupyter _NameError: name 'data' is not defined_ Even tho data is defined,0.03846153846153846
Understanding principal component analysis with k-means clustering,0.03846153846153846
How to create a dataframe based on list containing column names?,0.03846153846153846
Pandas: Filtering and Shifting on a DateTimeIndex,0.03846153846153846
Pandas Dataframe - copy multiple column values and paste them to other two columns based on a condition,0.03846153846153846
Combining multiple data types in pandas DataFrame,0.03846153846153846
Pandas merge not working,0.03846153846153846
Creation of a matrix m x u from two data frames movies and users,0.03846153846153846
Is it possible to write an accessor for pandas GroupBy objects?,0.03846153846153846
How to add more rows of random values to an existing column in my dataset - pandas?,0.03846153846153846
Python Groupby with Conditions,0.03846153846153846
How to rename a column in a pandas dataframe using a prompted user input without reformatting the dataframe,0.03846153846153846
Find t confidence interval across rows in dataframe,0.03846153846153846
How to add a pd column as _id for nosql collection?,0.03846153846153846
python SQL like operator needs to return match from list of SQLs,0.03846153846153846
Python Pandas - turn absolute periods into relative periods,0.03846153846153846
pandas: remove row where value is equal to zero,0.03846153846153846
pandas apply filter for boolean type,0.03846153846153846
"How to refer to column headers as if they were lowercase, but not actually change them",0.03846153846153846
parse json as part of pd.read_sql,0.03846153846153846
Not able to perform mean aggregation on group by DataFrame in Panda,0.03846153846153846
Why correlation matrix's column is smaller than pandas Dataframe's,0.03846153846153846
Alternative to apply function for applying a function to each row in Pandas DataFrame,0.03846153846153846
Merge multiple rows in pandas Dataframe based on multiple column values,0.03846153846153846
Fill in missing values in pandas dataframe,0.03846153846153846
function to create new column with defined parameters,0.03846153846153846
How to unpack a Series of tuples in Pandas?,0.03846153846153846
Loop function for missing data,0.03846153846153846
Running multiple columns through a function,0.03846153846153846
Unpack an indexed object of tuples,0.03846153846153846
Get index that has max column value on a multi index groupped by dataframe,0.03846153846153846
Python datetime - fixing a 18 hour day,0.03846153846153846
Expanding and filling the dataframe for missing dates by each group,0.03846153846153846
Python: How to loop through hierarchical columns?,0.03846153846153846
How to combine data from one row in dataframe?,0.03846153846153846
Converting between datetime and Pandas Timestamp objects,0.03846153846153846
getting specific attribute name and it's value from xml to csv via python and pandas,0.03846153846153846
Pandas Series to json and back,0.03846153846153846
Pandas unhashable type:list while I'm using a string,0.03846153846153846
error accessing the columns of a json output using pandas,0.03846153846153846
CSV/Pickle Files Too Large to Commit to GitHub Repo,0.03846153846153846
Concurrent Conflicts,0.03846153846153846
How do I consolidate this dataframe removing the duplicates while adding a sum column?,0.03846153846153846
Creating a new column by applying a arithmetic function in an existing column,0.03846153846153846
Attribute error: 'numpy.ndarray' object has no attribute 'value_counts',0.03846153846153846
How to detect if consumer was already in dataframe?,0.03846153846153846
Verbose debug output with pandas Series,0.03846153846153846
Computing the first non-missing value from each column in a DataFrame,0.03846153846153846
invalid literal for int() with base 10: '3906.00',0.03846153846153846
Pandas groupby count returns wrong count,0.03846153846153846
Getting feature names in addition to values - SciKitLearn+Pandas,0.03846153846153846
Python pandas df iloc error: IndexError: positional indexers are out-of-bounds,0.03846153846153846
Calculate initial values based on day-over-day's pct_change in Python,0.03846153846153846
Assigning custom colors to Plotly legend,0.03846153846153846
How can I loop correctly a pandas dataframe?,0.03846153846153846
FigureCanvasAgg' object has no attribute 'invalidate' ? python plotting,0.03846153846153846
Merging specific column from one table to another in pandas,0.03846153846153846
Add to a column in dataframe string value from another dataframe,0.03846153846153846
Feature Engineering: Scaling for different distributions,0.03846153846153846
Rename pandas Dataframe Column With Data Under it,0.03846153846153846
pandas.to_datetime -> ValueError: unconverted data remains: 01,0.03846153846153846
Finding unique values of one column for specific column values,0.03846153846153846
xtick max value setup with panda and matplotlib,0.03846153846153846
How to count values in group by with condition?,0.03846153846153846
how to transfer a pandas column to lists by row and make a dictionary base on one column by row,0.03846153846153846
How to get column names of all nonnull row values?,0.03846153846153846
Creating new Columns and fill them based on another columns values,0.03846153846153846
