Title,Correlation Score
Custom datetimeparsing to combine date and time after reading csv - Pandas,0.03846153846153846
Bokeh - How to properly set & control xaxis for datetime - possible bug?,0.03846153846153846
"In pandas, how to query for a list?",0.03846153846153846
Application of different functions to Pandas columns via Groupby,0.03846153846153846
group and filter pandas dataframe,0.03846153846153846
How to add a bolean series to a new column in df2 IF multiple conditions in df1 are met (incl. DATETIME)?,0.03846153846153846
Search for certain files with specific condition and copy all files in another folder python,0.03846153846153846
Pandas creates new columns with append,0.03846153846153846
For Loop Error in Tweepy IDs of followers for multiple users,0.03846153846153846
Python Transpose Data with observation,0.03846153846153846
Inserting columns in pandas dataframe,0.03846153846153846
Pandas: Combining Two DataFrames Horizontally,0.03846153846153846
Pandas DataFrame merge resets index,0.03846153846153846
Resampling a pandas dataframe with multi-index containing timeseries,0.03846153846153846
How to get the maximum value of the whole dataframe in pandas,0.03846153846153846
pandas rows to columns,0.03846153846153846
Pandas Groupby apply is evaluated many times,0.03846153846153846
Unable to understand the prediction algorithm in pandas,0.03846153846153846
Pandas: find groups by index if consecutively numbered,0.03846153846153846
Converting JSON response with various list of fields into Pandas dataframe,0.03846153846153846
How to transpose dataframe columns into rows in pandas,0.03846153846153846
Replicating Excel's IndexMatch in Python with Pandas,0.03846153846153846
Calculate rarity of multi-label data in Pandas data frame and create sample_weights respective to occurrence,0.03846153846153846
CSV file gets lost between Python function calls,0.03846153846153846
Pandas: How to fill null values with mean of a groupby?,0.03846153846153846
applying several functions in transform in pandas,0.03846153846153846
Python O365 Sending Email,0.03846153846153846
How can I convert pandas date time xticks to readable format?,0.03846153846153846
Checking which groups in pandas group by meet a certain condition,0.03846153846153846
python - stumped by pandas conditionals and/or boolean indexing,0.03846153846153846
Pandas change from flat file to column format,0.03846153846153846
python to R compatibility in feather with strings,0.03846153846153846
Transform vs. aggregate in Pandas,0.03846153846153846
Normalize a Data frame in Python excluding nan,0.03846153846153846
Python - Subset data between two datetime,0.03846153846153846
why does function work on element but not array?,0.03846153846153846
How can I select out columns where the first values are NaN?,0.03846153846153846
Python - Apply changes to entire column,0.03846153846153846
How to randomly select some pandas dataframe rows?,0.03846153846153846
"Python pandas refer to column with ""/""",0.03846153846153846
Get all rows that are the same and put into own dataframe,0.03846153846153846
Select rows if combination of columns are from other data frame in Python Pandas,0.03846153846153846
Is there a way to have a dictionary as an entry of a pandas Dataframe in python?,0.03846153846153846
how to find the three largest values in a data frame?,0.03846153846153846
Interpolate a missing values using rows and columns values,0.03846153846153846
Interactive boxplot with pandas and Jupyter notebook,0.03846153846153846
Performance of creating new DataFrame,0.03846153846153846
Merging two pandas dataframes,0.03846153846153846
Find maximum and minimum values of three columns in a python,0.03846153846153846
to_csv in pandas // bad output of string column which is like int column,0.03846153846153846
Remove group rows,0.03846153846153846
Pandas - Selecting over multiple columns,0.03846153846153846
convert pandas pd to numpy array and back,0.03846153846153846
Select rows in Pandas which does not contain a specific character,0.03846153846153846
python pandas groupby then count rows satisfying condition,0.03846153846153846
Merge two pandas series based on missing data,0.03846153846153846
Pandas element wise if/else (IIF),0.03846153846153846
Pandas intersection of groups,0.03846153846153846
Make a pandas Boolean column that depends on two other Boolean columns,0.03846153846153846
How to load an excel sheet and clean the data in python?,0.03846153846153846
Add Pandas column values in a for loop?,0.03846153846153846
Selecting data from large MySQL database where value of one column is found in a large list of values,0.03846153846153846
"In pandas, how do I perform filtering on a DataframeGroupBy object?",0.03846153846153846
Openpyxl: 'Worksheet' object has no attribute 'values',0.03846153846153846
Convert object to string in pandas,0.03846153846153846
How to use if statement with pd.Series object in pandas agg function,0.03846153846153846
Dividing pandas dataframe column into n buckets,0.03846153846153846
Scatter plot of Multiindex GroupBy(),0.03846153846153846
Dataframe from CSV gives AttributeError when accessing column,0.03846153846153846
Return values from a column not included in a groupby,0.03846153846153846
Pandas Dataframe NaN values replace by no values,0.03846153846153846
how to take floor and capping for removing outliers,0.03846153846153846
Using reindex with fill_value for categorical and continuous features in same dataframe,0.03846153846153846
Wrangling a 2x2 DataFrame into a 4x1 Series (Pandas),0.03846153846153846
convert a dataframe to multiple index dataframe,0.03846153846153846
"Pandas map to a new column, SettingWithCopyWarning",0.03846153846153846
Binary Image Dataframe to Euclidean coordinates,0.03846153846153846
"Pandas read csv ignore commas, one column per line",0.03846153846153846
Python pandas: remove everything after a delimiter in a string,0.03846153846153846
Renaming multiple DataFrame columns with a for loop in Pandas,0.03846153846153846
Reset index with two values,0.03846153846153846
"Python Pandas - Groupby and Mean, but keep column name",0.03846153846153846
Python MySQL connector returns bytearray instead of regular string value,0.03846153846153846
vectorize percentile value of column B of column A (for groups),0.03846153846153846
How to compare one DataFrame with another one-row DataFrame and color or modify cells accordingly?,0.03846153846153846
pandas dataframe compare first and last row from each group,0.03846153846153846
sexmachine reporting None for all lines,0.03846153846153846
How to consolidate n columns to 1 row in Pandas,0.03846153846153846
AttributeError: 'numpy.ndarray' object has no attribute 'exog' in statsmodel logit model,0.03846153846153846
one-hot encoding single sample pandas,0.03846153846153846
Missing '%I:%M %p' data in Pandas dataframe - Python,0.03846153846153846
Format numbers in a Python pandas DataFrame as currency in thousands or millions,0.03846153846153846
Normalize data in pandas dataframe,0.03846153846153846
sort_by broken in pandas >= 0.18.0?,0.03846153846153846
Stumped by how my code is modifying something that shouldn't be modified,0.03846153846153846
Couldn't load full data into data frame from json files,0.03846153846153846
Reducing the Sparsity of a One-Hot Encoded dataset,0.03846153846153846
How to .value_count() rows while taking into account other columns?,0.03846153846153846
sqlalchemy saving my df values as text type and i want varchar,0.03846153846153846
Grouping Multiple columns and sum of count in pandas df,0.03846153846153846
python pandas: name-value pair to single row,0.03846153846153846
Write Pandas Dataframe via SQLAlchemy in MySQL database,0.03846153846153846
Subsampling pandas dataframe with float index - ValueError,0.03846153846153846
how to update multiple columns of pandas dataframe inplace and in single instance,0.03846153846153846
"I am getting the ""no module named pandas:"" error after pandas being installed",0.03846153846153846
Pandas Groupby.sum() avoid Duplicates,0.03846153846153846
Filter values out when plotting with Pandas,0.03846153846153846
Efficient way to join a dataframe with an Oracle table without writing right,0.03846153846153846
Replace NaN values in a dataframe with values in a series python,0.03846153846153846
Convert numpy array to DMatrix in xgboost,0.03846153846153846
Applying a seperate function to my Dataframe while also summing specific columns,0.03846153846153846
using the pandas library with influxdb database how do you choose which columns are measurements tags fields etc,0.03846153846153846
How do I print entire number in Python from describe() function?,0.03846153846153846
Method that calculates sum of a column in python using pandas,0.03846153846153846
How to group numeric values by hours?,0.03846153846153846
"Prevent pandas from reading ""NA"" as NaN",0.03846153846153846
How to Read .txt in Pandas,0.03846153846153846
"Python Pandas: for a multi-indexed dataframe, how to interchange row and one indexed column?",0.03846153846153846
Remove duplicates values on one column in a data frame using conditions,0.03846153846153846
Python: Creating New Column in Dataframe based on Start and End Dates in Another Dataframe,0.03846153846153846
How to swap a group of column headings with their values in Pandas,0.03846153846153846
checkin if char in dataframe,0.03846153846153846
Pandas NameError: name 'df' is not defined,0.03846153846153846
Fill polygon with pattern instead of color Geopandas,0.03846153846153846
"Pandas Dataframe, aggregate and put the data in the next column",0.03846153846153846
"Python(Pandas), append new column for each new file",0.03846153846153846
Unable to insert clean unicode text back into DataFrame in pandas,0.03846153846153846
Merge pandas dataframe on time and another column,0.03846153846153846
Get Pandas Dataframe Column names from Numpy Array,0.03846153846153846
Select 2 ranges of columns to load - read_csv in pandas,0.03846153846153846
ImportError: No module named data_io,0.03846153846153846
Why do I get nan when assigning with loc,0.03846153846153846
pandas :pd.date_range output error,0.03846153846153846
Writing a Pandas DataFrame object as MongoDB collection using a user defined function,0.03846153846153846
Statistics of dataframe grouped by two elements,0.03846153846153846
Extracting a list from inside a cell in a dataframe,0.03846153846153846
Removing rows from a dataframe by identifying rows to keep,0.03846153846153846
Rolling windows in Multi-index Pandas Dataframe,0.03846153846153846
how can i get mean of values of entire column for pandas dataframe using index of the column,0.03846153846153846
Take first 6 digits of Pandas Column,0.03846153846153846
"DataFrame: if value in a cell, copy value to cells below it",0.03846153846153846
Extract rows with upper limit by referring to another dataframe,0.03846153846153846
Efficiently serialising timestamps,0.03846153846153846
Box Plot Pandas of a vector within columns fields,0.03846153846153846
Pandas: how do I group a Data Frame by a set of ordinal values?,0.03846153846153846
melt pandas dataframe and divide two rows based on column,0.03846153846153846
Using pandas' groupby with shifting,0.03846153846153846
how to delete row for a given date index value,0.03846153846153846
Pandas - Duplicate Rows at Iteration,0.03846153846153846
How to label pandas rows by values within some bin size?,0.03846153846153846
Upsample non-time data,0.03846153846153846
Combine rows by id,0.03846153846153846
Pandas TimeGrouper & Merge on datetimeindex,0.03846153846153846
pandas resample with BM,0.03846153846153846
Python json add multiple keys and iterate,0.03846153846153846
pandas rename index values,0.03846153846153846
How do I make the width of the title box span the entire plot?,0.03846153846153846
Add multiple rows for each datetime in pandas dataframe,0.03846153846153846
How to merge in python based on condition?,0.03846153846153846
Creating new columns in pandas based on conditions satisfied by the columns using functions,0.03846153846153846
Combining FacetGrid and dual Y-axis in Pandas,0.03846153846153846
Python - multiply range of column by last column,0.03846153846153846
Pandas.read_csv() MemoryError,0.03846153846153846
Problematic values,0.03846153846153846
Sequentially read huge CSV file in python,0.03846153846153846
How to record bad lines skipped by pandas,0.03846153846153846
Problems with parsing to pandas datatime,0.03846153846153846
"TypeError: float() argument must be a string or a number, not 'Period'",0.03846153846153846
Count sequence by date in Python using Pandas,0.03846153846153846
Resampling Dataframe Time series where column equals value,0.03846153846153846
"Pandas apply function to groups, and filter the original dataframe",0.03846153846153846
Using multiple custom classes with Pipeline sklearn (Python),0.03846153846153846
Reading CSV with pandas in parallel creates huge memory leak / process zombies,0.03846153846153846
"How to create a pandas DataFrame column based on the existence of values in a subset of columns, by row?",0.03846153846153846
String matching and assignment between data frames,0.03846153846153846
How to get values from Dtype object in a dataframe,0.03846153846153846
Installing Pandas on Termux throws error: Broken toolchain,0.03846153846153846
pandas: replace NaN with the last non-NaN value in column,0.03846153846153846
Pandas Dataframe Groupby Apply Lambda Function With Multiple Column Returns,0.03846153846153846
Using Scipy Percentileofscore on a groupby dataframe,0.03846153846153846
How to I convert multiple Pandas DFs into a single Spark DF?,0.03846153846153846
Pandas: Count Distinct Combinations of two columns and add to Same Dataframe,0.03846153846153846
"python / pandas - reading csv with text before data, to dataframe",0.03846153846153846
Pandas: append column values as new rows,0.03846153846153846
How to reorder/sort dataframe indexes with Pandas?,0.03846153846153846
Converting string to datetime object in pandas,0.03846153846153846
Appending non-DataFrame to pandas csv,0.03846153846153846
How to prepare a .txt file to enable pandas to encode ? symbol,0.03846153846153846
How to convert dictionary into multilevel dataframe?,0.03846153846153846
How to apply different functions to different columns on pandas dataframe,0.03846153846153846
How to subtract times in python,0.03846153846153846
"Hide axis label only, not entire axis, in Pandas plot",0.03846153846153846
error in model fit in titanic dataset using TFLEARN,0.03846153846153846
"Python ""TypeError: unhashable type: 'slice'"" for encoding categorical data",0.03846153846153846
Python Pandas - vectorize custom function instead of apply,0.03846153846153846
My JSON is parsing incorrectly. What am I doing wrong?,0.03846153846153846
Subtract the union of two data frames,0.03846153846153846
Python Pandas frequency string comparisons,0.03846153846153846
Pandas timestamp difference in groupby transform,0.03846153846153846
How to extract every possible date within a text?,0.03846153846153846
Slicing a DataFrame in pandas?,0.03846153846153846
Writing pandas df to a (csv) file in a complicated format,0.03846153846153846
Python/Pandas: How to Match List of Strings with a DataFrame column,0.03846153846153846
Pandas interpolate with new time scale,0.03846153846153846
new dataframe based on column from existing python pandas,0.03846153846153846
Python Pandas - Structuring my Data,0.03846153846153846
"expected string, int found While using pandas dataframe on a large file",0.03846153846153846
How to read a table and Sql query from Oracle in Pandas?,0.03846153846153846
Incremental id based on another column's value,0.03846153846153846
How to group by date range,0.03846153846153846
Replace a value within for loop with the value of the cell of the following row of a data frame,0.03846153846153846
Remap values in a dataframe where the key is one column and the value to be replaced is another column,0.03846153846153846
Choosing a line delimiter in Pandas,0.03846153846153846
How to select pandas Series values start with a specific text?,0.03846153846153846
Printing all contents without ellipsis,0.03846153846153846
Create new column depending on other columns: DRY and go functional,0.03846153846153846
How to find weighted covariance matrix of Excel rows?,0.03846153846153846
Multiplying columns with a constant value in pandas. Type Error,0.03846153846153846
Pandas: sum strings with condition,0.03846153846153846
"csv column no filtering, no error",0.03846153846153846
pandas dataframe contains list,0.03846153846153846
How to un-merge all cells when writing a Pandas dateframe to Excel,0.03846153846153846
How to use pandas dataframes from user input,0.03846153846153846
map US state name to two letter acronyms that was given in dictionary separately,0.03846153846153846
python dataframe matrix of Euclidean distance,0.03846153846153846
using time zone in pandas to_datetime,0.03846153846153846
Can'n setup WHL: not find a version that satisfies the requirement,0.03846153846153846
How to find out members of a group and group of a member from a table of group changes,0.03846153846153846
Map to same dataframe column in pandas,0.03846153846153846
Create a row for a categorical values from categorical columns,0.03846153846153846
Pandas Unable to find file on Windows 10,0.03846153846153846
Python Pandas Dataframes comparison on 2 columns (with where clause),0.03846153846153846
"Logistic regression with pandas and sklearn: Input contains NaN, infinity or a value too large for dtype('float64')",0.03846153846153846
Using pandas apply function on multilevel DataFrame,0.03846153846153846
Combine two columns of numbers in dataframe into single column using pandas/python,0.03846153846153846
How to get dummies and groupby,0.03846153846153846
Read url as pandas dataframe with column names (python3),0.03846153846153846
Extract a part of values from a column,0.03846153846153846
Get help in constructing a pandas dataframe in Python,0.03846153846153846
Python Scatter_Matrix Issue : 'matrix' object has no attribute '_get_numeric_data',0.03846153846153846
Return DataFrame using ipywidgets Button,0.03846153846153846
Convert pandas multiindex to datetime format,0.03846153846153846
Removing HTML tags from Python DataFrame,0.03846153846153846
pandas get mapping of categories to integer value,0.03846153846153846
Call a function with values in another dataframe,0.03846153846153846
"""DataFrame"" object has no attribute 'reshape'",0.03846153846153846
How to read excel files from online zip link in pandas,0.03846153846153846
How to shift several rows in a pandas DataFrame?,0.03846153846153846
Getting a list of arrays into a Pandas dataframe,0.03846153846153846
Parameterized pandas data frame names,0.03846153846153846
Return max value for dynamic rolling from pandas DataFrame column,0.03846153846153846
Locating timessteps with a non-succesive value,0.03846153846153846
Remove rows having same value in all columns,0.03846153846153846
assign one line to the other line in pandas,0.03846153846153846
How to read a space delimited file into pandas?,0.03846153846153846
How to read two columns using python,0.03846153846153846
How to Use vectorize or Apply instead of iterrows on pandas dataframe in python,0.03846153846153846
pandas.io.common.CParserError: Error tokenizing data. C error: out of memory,0.03846153846153846
iterate over Dataframe row by index value and find max,0.03846153846153846
Plot frequency of contact id in channel for a Pandas DF,0.03846153846153846
Find consecutive Nans in pandas dataframe,0.03846153846153846
Calculating Interest Rates Python Dataframe,0.03846153846153846
Pandas: Calculate remaining time in grouping,0.03846153846153846
converting pandas dataframe to contain a list,0.03846153846153846
Python looping error counter,0.03846153846153846
Python pandas dataframe group mean filtered by condition,0.03846153846153846
Regression with Date variable (python),0.03846153846153846
Ranking missing edges in df1 w.r.t df2 based on score matrix,0.03846153846153846
Pandas- correct way to create a new column based on the sum of rows of another column (value trying to be set on a copy)?,0.03846153846153846
Pandas - Can't Match Strings that contain a **,0.03846153846153846
convert dataframe to the heatmap matrix?,0.03846153846153846
How to obtain the percentage of each value from a pandas table?,0.03846153846153846
new pandas dataframe row based on existing data frame?,0.03846153846153846
Why do I get a Graph when I specify create_using=nx.DiGraph,0.03846153846153846
Parse timestamp having hour beyond 23 in python,0.03846153846153846
Binarize a float64 Pandas Dataframe in Python,0.03846153846153846
Marking certain days in date indexed pandas dataframes,0.03846153846153846
Problems converting HDF5 files to .CSV Pandas,0.03846153846153846
How to conduct iterative steps with multiple data frames in python ?,0.03846153846153846
Pandas dynamic column modification,0.03846153846153846
pandas matching row by grouping,0.03846153846153846
Interpolate polar/circular data with Pandas,0.03846153846153846
Pandas Dataframe indexing error,0.03846153846153846
Parse only Hour:Minute:Second using pandas,0.03846153846153846
How to make a Loop over this,0.03846153846153846
Replacing values in dataframe with 0s and 1s based on conditions,0.03846153846153846
pandas datetime format conversion,0.03846153846153846
Python Pandas format,0.03846153846153846
Expand dataFrame in pandas,0.03846153846153846
Generating missing consecutive dates between dates,0.03846153846153846
"sample pandas, keeping collected records together",0.03846153846153846
pandas create a new column by comparing two dataframes,0.03846153846153846
Mark specific value in Boxplot using Pandas,0.03846153846153846
Python Pandas Groupby: How to Condense For Loop in a One Liner,0.03846153846153846
Restrict values in DataFrame to specified range,0.03846153846153846
How to correctly modify timestamps on streaming data to create unique indexes,0.03846153846153846
How use pandas concat in loop to merge large numbers of subCSVs,0.03846153846153846
How to connect points to draw a line segment and also make a parallel line w.r.t. line segment?,0.03846153846153846
Python pandas: Select columns where a specific row satisfies a condition,0.03846153846153846
Reduce the memory used loading huge pandas dataframe from MongoDB,0.03846153846153846
multiple conditions for np.where python pandas,0.03846153846153846
Finding the min (or max) of a class in Pandas,0.03846153846153846
Plot line from pandas dataframe in Python,0.03846153846153846
Create new database from chunk reader in pandas,0.03846153846153846
How to quickly check if a value exists in pandas DataFrame index?,0.03846153846153846
Out of bounds nanosecond timestamp,0.03846153846153846
Pandas send multiple DataFrames to_csv,0.03846153846153846
US date for Australian data downloaded from Yahoo using pandas web data reader,0.03846153846153846
Pandas for inserting a columns as index,0.03846153846153846
pd.read_sas error: ufunc add cannot use operands with types dtype('O') and dtype('<m8[ns]'),0.03846153846153846
python dataframe std deviation of a column/row containing all Nan values except one element,0.03846153846153846
How to divide the sum with the size in a pandas groupby,0.03846153846153846
Pandas iterrows get row string as list,0.03846153846153846
Python/Sklearn - IndexError - Index out of bounds,0.03846153846153846
read only certain columns,0.03846153846153846
merge two pandas data frame and skip common columns of right,0.03846153846153846
tflearn linear regression ValueError : Cannot feed value of shape,0.03846153846153846
feather data storage library for python 'module' object has no attribute 'write_dataframe' error,0.03846153846153846
Deleting rows with unwanted values in a Dataframe in python,0.03846153846153846
how to convert pandas dataframe into the following format,0.03846153846153846
Pandas multi index Dataframe - Select and remove,0.03846153846153846
Why do I need to use .str when I want to get an element of a list of strings in Python/Pandas?,0.03846153846153846
How to append multiple pandas DataFrames in a loop?,0.03846153846153846
"Pandas to_datetime for two dataframes, want same date format",0.03846153846153846
"Python/Scrapy handle missing table data, list index out of range",0.03846153846153846
Pandas DataFrame: resampling along integer index / grouping by groups of n elements,0.03846153846153846
Python pandas plot linechart with data points,0.03846153846153846
Python pandas | how to assign keywords extracted from a column to another column?,0.03846153846153846
Scatter plot from index column against another column of a Pandas DataFrame,0.03846153846153846
Filter Pandas Dataframe for Rows with Certain Value for Column,0.03846153846153846
Finding top n correlated features(based on Pearson cofficient) with class attribute Python scikit learn,0.03846153846153846
Python/Pandas - count last duplicate rows in succession,0.03846153846153846
matching values between two dataframes with a condition in pandas,0.03846153846153846
MemoryError when I merge two Pandas data frames,0.03846153846153846
How to extract the regression coefficient from statsmodels.api?,0.03846153846153846
How to assign the oldest columns in python,0.03846153846153846
Apply function to every column value of each row using pandas,0.03846153846153846
Django - store excel file in a variable during an entire session,0.03846153846153846
Pandas Dataframe Check if column value is in column list,0.03846153846153846
Strange groupby behaviour in pandas,0.03846153846153846
